whisky_name_raw,review_text,score,review_date,source_url,dedupe_hash
"Ben Nevis 10 yo (46%, OB, +/-2016)","Ben Nevis 10 yo (46%, OB, +/-2016) Long time not tried this baby, if I’m not mistaken. The packaging is so reassuringly unchanged (when did Pétrus or Yquem last change their packaging?) but I remember older bottlings were rather ridden with caramel. It’s not always the case that you may ‘feel’ caramel, but in the latter case, you really could. But… Colour: gold. Earlier BN10 were really dark. Nose: fusel oil, paraffin, iron, and green walnuts, what’s not to enjoy? And then, eucalyptus, coal smoke, and raw malt, plus a touch of passion fruit that I had never found before. In Ben Nevis 10, that is. Mouth: what’s the distance between Fort Williams and Campbeltown? Because there is a Springbankness to this, these fatty oils and waxes, this metallic leafiness, the coal tar… Now what’s not in Springbank are these curious chocolaty lemon biscuits and the triple-sec. All that makes this a singular malt whisky. Loud applause please! Finish: rather long, and rather orange-forward. Comments: I’m pretty amazed, Ben Nevis 10 is becoming a star! Let’s just hope they won’t do any silly rebranding/repackaging. SGP:551 - 87 points.",87,2016-11-07,https://www.whiskyfun.com/archivenovember16-1-Balblair-Benriach-Laphroaig-Bowmore.html,3332a35fdca2eacca37676b5cb6804d278e311e914ca332f66f40943396f0f1f
"Ben Nevis 10 yo 2006/2016 (51.3%, Le Gus’t, Selection VI, sherry, cask #3, 763 bottles)","Ben Nevis 10 yo 2006/2016 (51.3%, Le Gus’t, Selection VI, sherry, cask #3, 763 bottles) 763 bottles? That’s a butt! Colour: amber/caramel. Nose: used gunpowder and walnut wine. You see what I mean. Then cigars and burnt bread. With water: umami, soy sauce, more walnuts. And even more walnuts. Mouth (neat): quite a bomb! Erm, so to speak. Gunpowder and rather bitter oranges this time, artichoke liqueur, more old walnuts, cream oloroso (you may still find bottles at flea markets), and spinach cooked in beef sauce. Not quite Marmite, but… With water: careful, don’t add too much water, not all sherry monsters like water anyway, that can make them lose their stride. Gets very dry, very oloroso. Finish: rather long, with oranges and cloves now. Another touch of leather in the aftertaste. Comments: this is funny, this baby reminds me of many an old official Ben Nevis. I mean, the sherry bombs. Classic and very good – if you like this style, of course. I do. Same high level as the OB. SGP:361 - 87 points.",87,2016-11-07,https://www.whiskyfun.com/archivenovember16-1-Balblair-Benriach-Laphroaig-Bowmore.html,eb42bf92f87f5411b6c1503923e68310305355b3abcb6d6d042f9a50647b1d0d
"Ben Nevis 18 yo 1996/2015 (48.9%, Bar du Nord, refill hogshead, 150 bottles)","Ben Nevis 18 yo 1996/2015 (48.9%, Bar du Nord, refill hogshead, 150 bottles) This by some crazy Swiss. Not sure I get everything on the label, but I’m finding it rather Plonk & Replonk-ish. Check them out, I’m a fan! Colour: white wine (uh-oh)… Nose: there, this Springbanky metallic minerality again. There’s even some lapsang souchong tea and quite some coal, new engine, sunflower oil… And behind that, greengages and other ‘shy’ plums. Mouth: splendid naked westerner. I’ve got a disease, I can’t avoid thinking of Campbeltown today! Orange zests, oils aplenty, silver spoon, black pepper, even horseradish, bitter chocolate, raw rhubarb… And even a salty touch, mind you. Finish: medium, dry, mineral, saline, and even smoky… Comments: nonante points in my book. A very great dry/austere Ben Nevis. SGP:362 - 90 points.",90,2016-11-07,https://www.whiskyfun.com/archivenovember16-1-Balblair-Benriach-Laphroaig-Bowmore.html,a8e1c9764f6810c04160dd3f8893e0acc32b5e10c288777fd1e9164ec7a0601c
"Ben Nevis 19 yo 1996/2015 (50.1%, Whisky-Fässle)","Ben Nevis 19 yo 1996/2015 (50.1%, Whisky-Fässle) Fair prices, excellent selection, cool people, and great passion. What could go wrong? Colour: bronze. Nose: it’s rather got this kind of tropical transmutation (my god my English is bad), around metallic tropical fruits mingled with engine-y notes. A blend of passion fruit juice with engine oil and mint sauce, perhaps? Apologies… And flints. With water: swims like a champ. Savagnin and damp black earth. Mouth: characterful and very spicy/chocolaty. Sour cream, sour fruits (not too ripe mangos?) and chicken soup. There’s always something happening with Ben Nevis, and while I’m sure some whisky orthodoxes would find a few flaws, I find this as funny as an Italian softporn movie from the late 1960s. With water: gets very leathery. Extreme walnuts as well. Totally oloroso-ish, which the colour had not quite suggested. Finish: quite long, as long as you don’t add too much water. Comments: only minor flaw with these styles, you wouldn’t quaff more than one glass at a time, because they can get a little tiring, in my opinion. Totally non-commercial whisky (but you should buy a bottle!) SGP:362 - 89 points.",89,2016-11-07,https://www.whiskyfun.com/archivenovember16-1-Balblair-Benriach-Laphroaig-Bowmore.html,ea0d7f9a2243a771ee1a0ded8eb44fbfdb6ca6aa9ae22f48b43be5353209d864
"Léopold Gourmel ‘Bio Attitude’ (40%, OB, cognac, +/-2015)","Léopold Gourmel ‘Bio Attitude’ (40%, OB, cognac, +/-2015) A young Fins Bois VSOP that’s totally organic. And of course, there are no additives, no caramel, no boisé… Colour: straw. Nose: it’s got a feeling of young fine, which is fine (oh c’mon, S.), with some apples and a touch of citron, then rather kiwis and plums. Almost forgot to mention the usual yellow peaches (and vine peaches). Mouth: I find it a notch yeasty and beerish at first, like if it was a young ex-refill Speysider. I’d even swear I’m finding barley! Then rather apples and nectarines, with a wee touch of earth. A little rough and, dare I say, immature. Finish: medium, and even more young Speyside-like. Comments: I’ve had some ex-hogshead 8yo Aberlour was not dissimilar. May need ice. SGP:451 - 76 points.",76,2016-11-06,https://www.whiskyfun.com/archivenovember16-1-Balblair-Benriach-Laphroaig-Bowmore.html,93ff0c670ed6a536a0a498ef50805e15745cd5d4d9eee6ef6b6d126fe92b959c
"Maxime Trijol 2000/2016 (44,3%, OB for La Maison du Whisky, Through The Grapevine)","Maxime Trijol 2000/2016 (44,3%, OB for La Maison du Whisky, Through The Grapevine) This is cask strength Grande Champagne from one of the best small Cognac houses. I have little doubt that more and more indie bottlers from all over the world will further push many kinds of malternatives in the coming years. Arrogance is never good on the long run (I know what I mean). Colour: dark gold. Nose: some good rubber and sulphur at first nosing, which suggests a rather fat spirit, then green apples and some unexpected phenolic and sappy notes. Earth and tobacco, green tea, gooseberries, plantains… The opposite of a full-blown fruity and exuberant cognac. So yeah, it’s rather dry. Mouth: aggressive in a good way, vibrant in an even better way, and becoming fruitier and fruitier, all around tropical fruits and, guess what? Peaches! I’ve rarely found this much guavas and papayas in one cognac. No caramely notes and no toasted oak this time. Finish: long, pleasantly sharp and fruity, with a perfect freshness. A wee rawness that makes it very ‘artisan’. Yeah, craft. Comments: totally and plainly malternative. SGP:651 - 86 points.",86,2016-11-06,https://www.whiskyfun.com/archivenovember16-1-Balblair-Benriach-Laphroaig-Bowmore.html,b5979dc2bbce6c74eeec06d3c18ef585ea8b32ef517e8f32411d795e33ae8ac7
"Coutanseaux Ainé ‘Hors d’Âge’ (40%, OB, cognac, +/-2015?)","Coutanseaux Ainé ‘Hors d’Âge’ (40%, OB, cognac, +/-2015?) This one’s a Grande Champagne. It’s difficult to find some information about the house Coutanseaux, but it seems that’s it got a super-high reputation and what’s more, I’ve seen that the Wellesley Hotel in London was pouring a 1767 Coutanseaux for around £9,000 a measure. Too bad it’s not a 1776, our American friends would have loved it. Colour: amber. Nose: epic and sublime. Walnuts, honeydew, cigar tobacco, fresh pollen, dried figs, dates, orange blossom, bergamots, maraschino, natural marzipan, genuine gingerbread (like containing 50% honey or more)… A truly amazing nose, this should be old and contain quite some ‘pardise’ cognac. Mouth: in keeping with the nose, with dates and figs, raisins, honey cake, pecans, a tobacco-like rancio, old oloroso, more walnuts… It’s all becoming drier, towards bone-dry Madeira, which is the kind of development I just cherish. Finish: medium and dry, on more oloroso, tobacco, bitter chocolate… While some lighter touches of marmalade are lifting the aftertaste. And raisins! Comments: this one’s quite extraordinary, I have to say. To think that I had never heard of Coutanseaux before… SGP:651 - 91 points.",91,2016-11-06,https://www.whiskyfun.com/archivenovember16-1-Balblair-Benriach-Laphroaig-Bowmore.html,2d9bf8f925427955ccc9968e90556746d95ba9f38242f8fc239cbedda3a9acd9
"Petite Champagne 1958 (40%, Jean Grosperrin, cognac, lot No 146, 100 litres, +/-2008)","Petite Champagne 1958 (40%, Jean Grosperrin, cognac, lot No 146, 100 litres, +/-2008) The Grosperrin family are simply the kings of indie single cask cognac. They are extremely hard to beat! Colour: amber. Nose: a style close to that of the Coutanseaux, only with a little more freshness, and more fresh fruits, and consequently, less dried ones. Amazing oranges and raisins, cigarette tobacco, plums, lemon honey, then leather polish, a touch of camphor, a fabulous coastal side, with even ‘ideas’ of oysters, and perhaps wee touches of latex. Drops of Corsican citron liqueur, totally love that. Pace e salute! Mouth: you would never guess this was reduced and bottled at 40%. Starts superbly grassy and even tannic (green apples), and unfolds on dried bananas, raisins, peaches of course, and a touch of tobacco, just like on the nose. Isn’t it great when a palate just mirrors the nose? Provided the nose was great, you’re right. Finish: medium, just a wee tad tannic, but otherwise just perfect. Orange zests dipped into bitter chocolate. Oranges again in the aftertaste, which, once again, lifts the spirit. Comments: I believe we should not be so haughty as to declare that one was better than the other. SGP:551 - 91 points.",91,2016-11-06,https://www.whiskyfun.com/archivenovember16-1-Balblair-Benriach-Laphroaig-Bowmore.html,a912d6c41aa86f151fd9fd4621c92711a5ae661b4cd81cc70d04e5d1660d46c9
"Vallein-Tercinier ‘Très Vieux Cognac Fins Bois’ (47%, OB, cognac, 2016)","Vallein-Tercinier ‘Très Vieux Cognac Fins Bois’ (47%, OB, cognac, 2016) A marriage of Fins Bois distilled between 1938 and 1941 and kept in wood since back then. Isn’t it great that you-know-who did not quaff it all between November 1942 and August 1944? As you probably know, Fins Bois represents the largest part of the cognac appellation, so around 45% of the region. Colour: deep gold. Nose: not big, not very immediate, and in that sense a little shier than both the Coutanseaux and the Grosperrin. On the other hand, it’s rather subtler, with some sunflower oil, candle wax, fresh almonds and hazelnuts, whiffs of hay and farm earth, perhaps a tiny bit of beetroot… It’s not too ‘rancioté’ (I don’t know if there’s a word in English, rancioted, perhaps? Rancioated?) Raisins and other dried fruits only make it after a good five minutes, but the whole remains grassier and drier than the others’. Mouth: surprisingly fresh and fruity, and even rather pungent after around 75 years in wood. It roars and even bites, even if the rather high ABV helps in that respect. Green tea, fruit peelings, marmalade, nutmeg, cinnamon, then the expected dried fruits (sliced pears, dried apricots), and quite a bag of cocoa powder. Yet, it never becomes dying, strictly speaking. Finish: longer and rougher than the others. Cider, chocolate, bitter oranges, peppermint. That’s the oak. Comments: a living miracle! It’s probably not totally perfect – how could it be after 75 years – but we’re amazingly close. I mean, to perfection. Oh and I’m happy to report that we’ll have more Valleins next week, so stay tuned. SGP:461 - 89 points.",89,2016-11-06,https://www.whiskyfun.com/archivenovember16-1-Balblair-Benriach-Laphroaig-Bowmore.html,b712aaf1a7b893949ee790ea1faa52aa9e3086cecc42c40756c24b1f785e5fad
"Glenallachie 1999/2015 (46%, Gordon & MacPhail, Connoisseurs Choice, refill bourbon)","Glenallachie 1999/2015 (46%, Gordon & MacPhail, Connoisseurs Choice, refill bourbon) Colour: white wine. Nose: typical easy fruity unsherried Speysider. Not a lot to say, except that it’s very nice, easy, and fruity. Apples, barley syrup, pear cake, cherries, light honey (acacia), and only a drop of custard… Mouth: simply very good, flawless, middle-aged Speysiders, with orchard fruits, sweet barley, and honey. All that is perfectly balanced, and I would happily have a few cls for breakfast. On weekends! Finish: a little short but clean, barleyish, and lightly honeyed. A limony side in the aftertaste, always welcome. Comments: this one doesn’t need a lot of literature, it’s all pleasure and simplicity, without the caramelly background that can be found in large –volume brands stemming from the same region. Why do you always need names? ;-) Excellent and recommended. SGP:541 - 85 points.",85,2016-11-04,https://www.whiskyfun.com/archivenovember16-1-Balblair-Benriach-Laphroaig-Bowmore.html,efd6eb3d5b07d8040eed7e6b9e93a4b58004d1ecfa0484176d403444804f5f05
"Craigellachie 1997/2014 (46%, Gordon & MacPhail, Connoisseurs Choice, refill bourbon)","Craigellachie 1997/2014 (46%, Gordon & MacPhail, Connoisseurs Choice, refill bourbon) Colour: pale white wine. Nose: it’s rather less immediate, and less fruity than the ‘achie, and rather more herbal and grassy, as well as slightly earthy. So a tad more ‘Highlands’, while the ‘achie was a notch more ‘Speyside’. Almonds, cut flowers, agaves, and a wee rooty side, which I always adore. Between turnips and gentian roots, I’d say. Mouth: its smoky and coastal, which suggests that the previous fill was some kind of Islayer. One cask is enough to impart this kind of smokiness, even in a rather large batch. Now do I like this? Sure I do, but the Glenallachie was more immaculate, and perhaps more terroiry (please don’t shoot). Finish: medium, smoky, with a little fried bacon. No good for our arteries… Comments: seriously, this is very good stuff again. Drinks very well, and it’s got these funny ‘asperities’. I still liked the Glenallachie a little better. SGP:452 - 84 points.",84,2016-11-04,https://www.whiskyfun.com/archivenovember16-1-Balblair-Benriach-Laphroaig-Bowmore.html,0b53f7ff10d68804ad22b4620d3d83299debebd0b0ecaf83a589a7cd88671047
"Lp7 (52.8%, Specialty Drinks, Elements of Islay, 2016, 50cl)","Lp7 (52.8%, Specialty Drinks, Elements of Islay, 2016, 50cl) Indeed, we have no proof whatsoever that this is Laphroaig, but we know that the bottlers’ mind is clean, and that this couldn’t be some, say, some Lagavulin Palo. Colour: pale gold. Nose: ultra-very simple. Laphroaig and rather active oak. So peat, antiseptic, seawater, and ginger. I’m all for Japanese-Finnish minimalism, but we may be touching the limits of malty simplicity. Let’s see… With water: peat. Really very minimal . Mouth (neat): elementary indeed. The problem is that while there aren’t many different flavours in this wee ‘phroaig, what it does, it does it to perfection. Lemon juice, seawater, smoked water. You know the stuff they use on supermarket so-called ‘smoked’ fish or charcuterie. With water: more sweetness. Sweet apricots? Something reminds me of the peatiest Ardmores. Finish: indeed. Smoked almonds, ashes, and limoncello. Marzipan galore in the aftertaste. Comments: millimetric spirit, so much for imperial measures. I so hate it that I like such a simple malt whisky so much! SGP:458 - 89 points.",89,2016-11-03,https://www.whiskyfun.com/archivenovember16-1-Balblair-Benriach-Laphroaig-Bowmore.html,b99b70406f73ec51331c15e7064df3afa7366502f27dfb006ea01d0681e2eef0
"Laphroaig 19 yo 1995/2015 (46%, High Spirits, Life is a circus)","Laphroaig 19 yo 1995/2015 (46%, High Spirits, Life is a circus) The ever elegant and true pioneer of whisky Nadi Fiori, of Intertrade fame, keeps bottling some wonders every once in a while. Let’s check this newish one… Oh and Nadi, assuming life is a circus indeed, let’s hope it’s a circus maximus! Colour: white wine. Nose: smoked almonds and burnt papers at first sniffings, then the most subtle combination of medicinal aromas with kind-of-smoked-vegetables. Salsify? Wee artichokes? Some green pepper for sure, a little greenish ginger, Fernet-Branca… Mouth: excellentissimo, smoother than modern Laphroaigs, so rather leaning towards the great old ones, with some smoked fish, smoked almonds, and some dry citrus fruits. Forgot to mention oysters. Finish: medium for Laphroaig, but oh-so elegant. Smoked fish, lemon, and drops of maraschino. Wonderful dry aftertaste, bordering Château-Chalon quality. Comments: Laphroaig rather à l’ancienne, still one of the complex vintages. SGP:567 - 90 points.",90,2016-11-03,https://www.whiskyfun.com/archivenovember16-1-Balblair-Benriach-Laphroaig-Bowmore.html,624865c7d15e87c9974bf4e804fda2656a9f7078a283210967df97923af8445c
"Laphroaig 17 yo 1998/2016 (52.6%, The Single Malts of Scotland, cask #122010, 287 bottles)","Laphroaig 17 yo 1998/2016 (52.6%, The Single Malts of Scotland, cask #122010, 287 bottles) Colour: pale gold. Nose: tobacco, leather, gingerbread, and bags and bags of nutmeg. Where does all this nutmeg come from? May we meet the cask? With water: I’ll tell it like I feel it, this is an official bottling done by some indies. Wood up, spirit down. Mouth (neat): bold and big, dominant, on sweet lemon, ginger-and-nutmeg, and all the usual smoked/medicinal areopagus. Thick mouth feel. With water: really, it feels official. Lemon, wood spices, burnt bread, wood smoke, mercurochrome. Finish: same, for a rather long time. Comments: I do not know what to think. Love everything, the people, the distillery, and even this wee Laphroaig. It’s just lacking… magic. Feels industrial, which is totally surprising. Or is it me? To think that I enjoyed the much younger (in theory) Lp7 so much better! SGP:557 - 80 points.",80,2016-11-03,https://www.whiskyfun.com/archivenovember16-1-Balblair-Benriach-Laphroaig-Bowmore.html,426dbc38d4273a87b33d36dd57013b2b9840c049e3279d2de28b4ea8379e18a5
"Laphroaig 18 yo 1997/2016 (52.2%, Berry Bros for LMdW’s 60th anniversary)","Laphroaig 18 yo 1997/2016 (52.2%, Berry Bros for LMdW’s 60th anniversary) **** them. Some friends said this baby was the best Scotch whisky of Whisky Live Paris 2016. **** them! Good, I used to agree, but I only tried it ‘casually’, until today. Time to get more official. ****** ****! Colour: straw. Nose: some kind of Nepalese specialty. Butter and smoked and burnt herbs, plus lemongrass and burning coal. Plus geranium flowers. Oh *** ***! With water: I mean, ****! Eucalyptus wood smoke, a night in Courchevel, and a day on Islay. I mean, on Islay, not just at the ******* distilleries. Mouth (neat): immaculate, pristine, chiselled by Michelangelo himself, peaty/smoky/salty Laphroaigness. This is Laphroaig for ******* purists. Count me in. With water: when almonds come in, we’re up for a treat. One of the best kind-of-recent ******* Laphroaigs I could try. Finish: lace and whisky. Hold on, wasn’t that an Alice Cooper LP? And one of the badder ones? Comments: I’ve heard that they’ve hired staff from Patek Philiipe to distil and mature this. No, seriously, I’ve seen that on Weibo, so must be true. Oh **** them all. SGP:357 - 92 points.",92,2016-11-03,https://www.whiskyfun.com/archivenovember16-1-Balblair-Benriach-Laphroaig-Bowmore.html,e98d5dd22bf86287fc36b9bc16d749ff8aef1da3bbe27e5cf69b6fd5d40e5417
"Laphroaig 16 yo 1999/2016 ‘An apothecary shop on the shore’ (52.3%, Scotch Malt Whisky Society, #29.180, 264 bottles)","Laphroaig 16 yo 1999/2016 ‘An apothecary shop on the shore’ (52.3%, Scotch Malt Whisky Society, #29.180, 264 bottles) I’ve heard the god people at the honourable SMWS were smoking the same cigarettes as those of Wemyss. Colour: white wine. Nose: it is more on grass and wood smoke than on peat smoke, and I find it rather oak-driven, with butter and vanilla touches. Isn’t it a little shy? It’s getting hard after the f***tastic BBR… With water: not many changes. Metallic almonds? Mouth (neat): still simple, but more assertive, easy/sweet, and then very medicinal. Ashes, lemon, ashes, lemon, ashes, lemon… and cough syrup. Pepper and chillies in the background. With water: no quibbles, this is very good, especially since some tropical fruits are coming out. Sweeter oranges? Also gingery spices. Finish: long, with more spices from the wood. Saltier aftertaste. Comments: tastes rather ‘official’. Perhaps a wee tad, say, hollow? Modern? SGP:467 - 85 points.",85,2016-11-03,https://www.whiskyfun.com/archivenovember16-1-Balblair-Benriach-Laphroaig-Bowmore.html,93e037a1d458a8960c55306d948ea3d61cc3d60820e0b688c385ab76bf2d0c11
"Laphroaig 18 yo 1998/2016 (55.9%, Cadenhead, Authentic Collection, bourbon hogshead, 204 bottles)","Laphroaig 18 yo 1998/2016 (55.9%, Cadenhead, Authentic Collection, bourbon hogshead, 204 bottles) Colour: white wine. Nose: well, it has a few pencil shavings at first nosing, then brine and smoked oils. Sesame? Then embrocations, Vicks VapoRub, seawater, and green olives. Green olives work in any spirit, and by the way, I’m planning to rechristen this terrible website as ‘greenolivefun.com’. With water: ooh! Those wet dogs (how much do we owe you, dogs?) and these woolly scents… Old floor cloth? Mouth (neat): terribly good, disappointingly unusual (caraway and aniseed in Laphroaig?) and incorrectly vegetal. Someone may have added gherkins to the mash. All that gives this little Laphroaig a mezcaly side that we can only applaud. Hey hombre! With water: impressed. Gherkin brine, limejuice, kippers, ashes, repeat. Finish: long and angular. That’s enough. Comments: pub whisky, as Dr Feelgood used to play pub rock. The saltiness is immense and almost philosophical… salt of life… SGP:358 - 91 points.",91,2016-11-03,https://www.whiskyfun.com/archivenovember16-1-Balblair-Benriach-Laphroaig-Bowmore.html,02fe360ecac12d169abe6424369c1796d54f3348c440703c4858837e513bfa6b
"Bowmore 25 yo 1963/1989 (43%, Hart Bros, Auxil, France, 75cl)","Bowmore 25 yo 1963/1989 (43%, Hart Bros, Auxil, France, 75cl) I’m having this ultra-rare oldie first because I’ve already tried it (informally) and because I know it’s pretty fragile. I didn’t say weak. Colour: gold. Nose: ah well, it’s like most Bowmores from the 1960s, they are ugly when the bottle was just opened, and will need quite a few days to open up. But then, well… In fact, this one reminds of when my excellent friend Krishna had brought some Indian mangos to Europe. So, mangos. Not mangos that ripened (supposedly) in containers on a ship. And maracujas, pink grapefruits, concrete dust, beach sand, and the tiniest bit of pineapple. In fact, this is no very complex whisky, but any mango lover will just adore it. Are you a mango lover? Mouth: yeah, indeed, the bottle had just got opened when I first tried it, but now that it could breathe for a few weeks, it simply became splendid. Mangos, as you guessed it, more passion fruits, citrons, blood oranges, mandarins, lavender honey (which does not taste like lavender mind you), Timut pepper (ever tried that Nepalese pepper? It’s incredibly fruity), a touch of tamarind perhaps, a little strawberry jam… What an amazing fruitiness! Finish: short to medium, just a tad more on tobacco, but otherwise, it’s still a whole tropical fruit salad. Comments: excuse me? Peat? No, no peat in this old Bowmore. I guess it got all transmuted into all those tropical fruits. Oops, forgot to ask you to call the anti-maltoporn brigade again. SGP:741 - 93 points.",93,2016-11-02,https://www.whiskyfun.com/archivenovember16-1-Balblair-Benriach-Laphroaig-Bowmore.html,a4ce022e319f13f053a9751bc4d4d3c4fad4298c0c6c94e9df118fd15844be1a
