whisky_name_raw,review_text,score,review_date,source_url,dedupe_hash
"Bowmore 21 yo ‘500 Years of Scotch Whisky’ (43%, OB, Islay blended Scotch whisky, 6000 bottles, 1994)","Bowmore 21 yo ‘500 Years of Scotch Whisky’ (43%, OB, Islay blended Scotch whisky, 6000 bottles, 1994) A rather intriguing bottle, as it clearly says that it’s a blend, while the Bowmore brand and other parts of the whole marketing shebang (silkscreened design…) have been used. What’s sure is that if it’s a blend indeed, or even a blended malt, they couldn’t do this anymore. Now rumour has it that it is Bowmore, with just a few litres of Auchentoshan and Glen Garioch thrown in. Colour: gold. Nose: intriguing indeed, since it’s not typically Bowmore. For instance, there’s little tropicalness, and rather a combination of honey, chocolate, praline, and cakes. Some green tea as well, earl grey, green tobacco, a wee bit of rusty tin, then rather some oldish leather, old polished furniture, a touch of camphor… It’s quite complex indeed, and while I do not find any Auchentoshan, there could well be some early 1970s Glen Garioch. Not bad news! Mouth: hesitates for a few seconds, just before a peppery and smoky blast occurs. It’s to be remembered that Glen Garioch was peaty back then! So rather not a Bowmorian peat here, rather a combination of farmy and coastal peats. Yeah. Also Glen Garioch’s leathery side, and Bowmore’s tropical fruits. I have to say it loses you a bit, but it’s certainly very good. Perhaps a little too much paraffin? Finish: rather long, and rather more both tropical and topical. So Bowmorian. Mango chutney and milk chocolate. Sadly, the aftertaste is a little soapy. Comments: a strange dram, really. You can’t help trying to analyse it, while you just shouldn’t and rather enjoy it ‘for itself’. Or, they could have called it ‘The Jolly Old Fellows’ 21 Years Old Blend’ instead of ‘Bowmore’. Oh well… SGP:552 - 84 points.",84,2016-11-02,https://www.whiskyfun.com/archivenovember16-1-Balblair-Benriach-Laphroaig-Bowmore.html,de20f3ed4a4cbfa021343d3b93c3d1f0370892e773ec626b9297afeb20a9dd4b
"Bowmore 13 yo 2002/2016 (51.5%, Hart Bros)","Bowmore 13 yo 2002/2016 (51.5%, Hart Bros) This should be fiery… Colour: gold. Nose: home! Perfect modern Bowmore without any excessive carpentery (I’m sure you see what I mean), no obvious wood, and no obvious wine. Amazing medicinal smokiness, bandages, camphor, seawater, dried kelp, and all that. And no vanilla/coconut that get in the way. Mouth: we all know Bowmore are making one the very best malt spirits out there since around twenty years. When the bottlers let that malt sing, and do not use silly wood, you’re in for a fantastic serenade. What’s more, some of the 1960s’ tropical fruits are back since around the year 2000, and this baby’s another very fine example. You got it, I quite like this wee bottle. Finish: very long, peaty, with grapefruits and oranges, plus more pepper in the aftertaste. Comments: crikey, forgot to add water once again. Never mind, this is pretty brilliant when naked, in my opinion. After 25 years since you bottled that first Bowmore, you did extremely well again, Hart Brothers! SGP:557 - 90 points.",90,2016-11-02,https://www.whiskyfun.com/archivenovember16-1-Balblair-Benriach-Laphroaig-Bowmore.html,0481f71c432d0572eae562699679b490813156bf84707b83bc551b549a5e0fc7
"Bowmore 25 yo 1990/2016 ‘Pagliacci’ (49.6%, Silver Seal)","Bowmore 25 yo 1990/2016 ‘Pagliacci’ (49.6%, Silver Seal) Our very good friends at Silver Seal are going on with their musical series, this time with Leoncavallo’s I Pagliacci. I can’t wait to see which malt they’ll choose for Stockhausen or Frank Zappa. Yeah or Pixie Lott. To the whisky connoisseur, 1990 was the vintage when things started to improve again at Bowmore, after the very embarrassing 1980s. Colour: straw. Nose: strange. I mean, I don’t quite know. We’re at some crossroads, with a slightly soapy, perfumy, and rotting-orange-y side, as well as a more straightforward, peaty, coastal, and ‘pure’ side. It’s as if someone had vatted together a cask of 1982 and a cask of 2002. Really. And that created something like, say some new leather polished with some Christian Dior hand cream. Mouth: phew! This palate looks on the brighter side, with some lemony seawater and then an avalanche of citrus (won’t quote them all, we’re running on a small budget) Plus many peppers. Great palate, sharp, zesty, and excellently well-chiselled. Finish: long, and lace-y. Carved in peat and sea salt. Drizzles of lemon in the aftertaste. Comments: let’s be honest, I did not care too much for the nose – even if it tended to improve while breathing – but the palate was just entrancing. Oh well, just don’t nose and drink twice. SGP:755 - 88 points.",88,2016-11-02,https://www.whiskyfun.com/archivenovember16-1-Balblair-Benriach-Laphroaig-Bowmore.html,41b10172c5f0206a70d21298c8f18d7952bb61c8d8c13e772c8a56d0e77bcdfc
"Bowmore 1989/2016 ‘Barbecue Mango Salsa’ (46%, Wemyss Malts, hogshead, 234 bottles)","Bowmore 1989/2016 ‘Barbecue Mango Salsa’ (46%, Wemyss Malts, hogshead, 234 bottles) Barbecue mango salsa? I’d like to know what brand of cigarettes they’re smoking at Wemyss’ marketing department. Oh no, you don’t tell me that’s rather gin-and-tonic, like everywhere else in the whisky industry! Anyway, let’s try this 1989 – and I need lights and sirens! Colour: straw. Nose: smoky marzipan, hand cream, beach sand, old seaweed, paraffin, fusel oil, carbon paper, damp magazines. Mixed feelings, but we weren’t expecting this much… Mouth: it’s okay, it’s okay! We’re on the good side, the perfumy ( you thought whore-ish, I didn’t) notes are kept to the minimum, and the almondy, salty, lemony and coastal ones prevail. Let’s not forget the epitomical kippers and smoked salmons. Finish: medium, unexpectedly clean and, well, clean, with good peat and good white pepper. And grapefruits. Almond paste in the aftertaste. Comments: nothing to complain about, this is a 1989 that is rather leaning towards the 1990s. Like! Now, where is this barbecue mango salsa?... Where?... And what is barbecue mango salsa, by the way? SGP:554 - 86 points.",86,2016-11-02,https://www.whiskyfun.com/archivenovember16-1-Balblair-Benriach-Laphroaig-Bowmore.html,b7bdcc379d25d595efa1e13b17c6999df2812daeb8fee197c01e9976e07c3a93
"Glen Spey 2004/2013 (46%, Gordon & MacPhail, Connoisseurs Choice, refill sherry hogshead)","Glen Spey 2004/2013 (46%, Gordon & MacPhail, Connoisseurs Choice, refill sherry hogshead) Colour: white wine. Nose: ultra-discreet, with touches of ripe apples, whiffs of lager, and hints of light green tea. Or rather green tea leaves. Perhaps a little fresh mint as well, but other than that, it’s most possibly one of the shiest malts I’ve tried this year. But yeah, the year isn’t over. Mouth: the mint returns, the green tea as well, and they would come with touches of green pepper. Everything’s quite green indeed, but there’s something fruity as well. Wait, kiwis? The body’s relatively thin, but that’s no problem at all, it’s just a style. Finish: medium, with rather more coconut and pepper. That’s the casks. Comments: not quite earth-shattering, as they say, and probably quite humble, but it’s got a refreshing side that’s most pleasant. Haven’t got a Glen Spey in your cabinet? You may add this one to your stash. SGP:441 - 80 points.",80,2016-11-30,https://www.whiskyfun.com/archivenovember16-2-Inchgower-Highland-Park-Bowmore-Glenrothes.html,8fbc6c07ee5031b26901847620e9ce5e6da0cc9ce82ed9f14e0d2e289ed84758
"Glen Spey 18 yo 1997/2016 (48.4%, Douglas Laing, Old Particular, cask #DL 11336, 328 bottles)","Glen Spey 18 yo 1997/2016 (48.4%, Douglas Laing, Old Particular, cask #DL 11336, 328 bottles) Whether this is both old and particular, I don’t quite know, let’s see… Colour: white wine. Nose: well, its almost the same whisky as G&M’s 2004. Apples, green tea, cider, fern, moss, even lichen under the rain… All things green and grassy. And that’s not unpleasant at all. Mouth: good kirsch! And gooseberries, rhubarb, all that… Fresh green acidic fruits, with a lime-y side that does not quite translate into plain lime. What’s sure is that it’s some very fresh malt whisky. Finish: rather long, with added hints of fennel and dill. Very fresh aftertaste, with some pepper and some lettuce. The cask was a notch more active than that of the 2004. Okay, maybe that’s the older age, you’re right. Comments: whenever you need a second bottle of Glen Spey for your bar… SGP:541 - 81 points.",81,2016-11-30,https://www.whiskyfun.com/archivenovember16-2-Inchgower-Highland-Park-Bowmore-Glenrothes.html,8593af0c533057aee0b373a7d7baac430c6e30e440e86e8613ed3d7d41090ece
"Glentauchers 21 yo 1992/2014 (52.7%, Duncan Taylor, Dimensions, cask #6045, 283 bottles)","Glentauchers 21 yo 1992/2014 (52.7%, Duncan Taylor, Dimensions, cask #6045, 283 bottles) Colour: white wine. Nose: a rather chalky and mineral profile, with grapefruits and moist clay, as well as kiwis and grass. Clearly tense and quite acidulated. It’s a style that I enjoy. With water: more clay, and rather maracujas this time. Sharp, slightly unripe ones. Mouth (neat): hyper-lemony and chalky, this bites you properly and for good. Concentrated Muscadet? There’s even a feeling of lees indeed. With water: full of orange and grapefruit drops, on a bed of grass. Finish: medium, sharp, very lemony, with a salty touch in the aftertaste. Comments: very blade-y. SGP:561 - 84 points.",84,2016-11-28,https://www.whiskyfun.com/archivenovember16-2-Inchgower-Highland-Park-Bowmore-Glenrothes.html,71d070b253cd6adc64f2d8d039693a1930b125d4d46d2379093f00810fb483f7
"Glentauchers 18 yo 1996/2014 (48.8%, Chapter 7, cask #3609, bourbon, 173 bottles)","Glentauchers 18 yo 1996/2014 (48.8%, Chapter 7, cask #3609, bourbon, 173 bottles) Colour: deep gold. Nose: same kind of profile, only with more oak presence, vanilla, and mango cream. Let’s say it’s more ‘tropical’. Some tobacco too. Mouth: same ultra-zesty style, this time with even a little antiseptic and tincture of iodine. Something slightly metallic, but that goes well with the mangos. Finish: long, with litres of limejuice. Comments: a very tart one, quite spectacular. More fulfilling than the 1992. SGP:651 - 87 points.",87,2016-11-28,https://www.whiskyfun.com/archivenovember16-2-Inchgower-Highland-Park-Bowmore-Glenrothes.html,9493d6c0df20806c8d192164a9d0813d21105f20f84d4c150396db4de64966ab
"Glentauchers 18 yo 1996/2014 (51.9%, Whisky-Fässle, bourbon)","Glentauchers 18 yo 1996/2014 (51.9%, Whisky-Fässle, bourbon) Colour: gold. Nose: much fruitier, with more bubblegum, and less acidic notes. So gentler and rounder, and less spectacular than the Chapter 7. With water: a little more earth, mushrooms, moss… Nothing abnormal after reduction. Mouth (neat): typical easy fruity and citrusy Glentauchers again. Many oranges, some grapefruit, a little barley sugar, and half a marshmallow. With water: same. Bonbons aplenty. Finish: medium, very fruity. Haribo’s jelly babies – yeah or crocodiles, as you like. Comments: easy and very good, as expected. SGP:651 - 85 points.",85,2016-11-28,https://www.whiskyfun.com/archivenovember16-2-Inchgower-Highland-Park-Bowmore-Glenrothes.html,0b19ee0a278592622b93f22d0182aac9c3852986174c165bb84fda13d61ea074
"Glentauchers 19 yo 1996/2016 (47.2%, Le Gus’t, first fill bourbon, cask #4869105 bottles)","Glentauchers 19 yo 1996/2016 (47.2%, Le Gus’t, first fill bourbon, cask #4869105 bottles) Colour: pale gold. Nose: more in the style of the Chapter 7 again, that is to say earthier, rather deeper, and more tertiary, with some tobacco. Perhaps more bananas too. Very very nice. Mouth: super-zesty, this is almost some distilled white Sancerre. Bananas and soft pepper in the background, as well as hints of blackberries. A very peppery citrusness. Finish: rather long, ueber-sharp and angular. For lovers of cool climate white wine. Comments: a great bottle if you enjoy this ‘chiselled’ profile. SGP:651 - 87 points.",87,2016-11-28,https://www.whiskyfun.com/archivenovember16-2-Inchgower-Highland-Park-Bowmore-Glenrothes.html,7db172d5935d0a48d4bf5ec352f571810c9be886ce85d1ed00f16566d9be8509
"Glentauchers 1994/2012 (43%, Gordon & MacPhail, licensed bottling)","Glentauchers 1994/2012 (43%, Gordon & MacPhail, licensed bottling) Colour: straw. Nose: rather more ‘mainstream’ than the others, and that’s not only the lower strength. Barley, cigarettes, pine cones, assorted nuts, then indeed touches of oranges and passion fruits. Autumn leaves. This is a rather subtle and delicate nose. Mouth: more in the style of the others, that is to say more tropical, citrusy, fresh, but this time there’s also a little eucalyptus. And, perhaps, even a little myrtle. This little baby has got things to say! Finish: medium, a little spicier. Pepper and always a lovely mossy side. Some caraway as well. Comments: I had forgotten how good this line was. And the price is/was very fair! Excellent value. SGP:561 - 86 points.",86,2016-11-28,https://www.whiskyfun.com/archivenovember16-2-Inchgower-Highland-Park-Bowmore-Glenrothes.html,4f55f5b0ac874505f222e93777ecf5c65a8d8a4a964ec352a2a97968b0b2a9ab
"Glentauchers 8 yo 2008/2016 (50%, The Whisky Barrel, Burns Malt, butt, cask # #900184)","Glentauchers 8 yo 2008/2016 (50%, The Whisky Barrel, Burns Malt, butt, cask # #900184) Colour: amber bronze. Nose: a rather lovely metallic and tobacco-ish sherry, with whiffs of an old engine, roasted chestnuts, quality bacon (not Calmac’s ;-)), and dry cocoa powder. Then rather mulberries, prunes, and very wee hints of orange squash. With water: some coal and some old tools, long forgotten in the basement. Saltpetre, musty walls… Mouth (neat): rather perfect, pleasantly sour and gingery, with, well, sour fruits, sloe, rowan berries… And some walnutty chocolate. With water: becomes easier. A lot of Seville oranges, plus pepper and ginger. Very nice combination. Finish: long and a little more citric. It’s the zestiness that already was in all the others that’s starting to talk. Comments: as they say, one can go far without having lived long. SGP:462 - 87 points.",87,2016-11-28,https://www.whiskyfun.com/archivenovember16-2-Inchgower-Highland-Park-Bowmore-Glenrothes.html,a93e285e542886eb9f8903422ee56b013632bc7b8145ff58915d695d05c0272f
"Château Guynot ‘Napoléon Héritage’ (40%, OB, blend, +/-2016)","Château Guynot ‘Napoléon Héritage’ (40%, OB, blend, +/-2016) Some family-owned single estate Cognac located in Tesson, right between the cities of Cognac and Royan. And they also grow kiwis! I think this Napoléon is around 20-25 years of age. Colour: gold. Nose: starts very rounded yet fresh, with bags and bags of juicy golden raisins, then this quince jelly that we enjoy so much, then quite a lot of Sauternes from a good château, with apricots and mirabelles. Not one ounce of caramel or oak extracts, so quite far from many large-volume brands. Mouth: very good, quite tense, and even if this low strength remains a little problematic to the modern whisky enthusiasts (that’s us my friend), it’s got an excellent structure, with a grassy/liquoricy foundation, and plenty of yellow fruits, both in syrup and stewed. And yellow peaches. Very good. Finish: unexpectedly long, still rather grassy, but never quite grapey. Violet sweets in the aftertaste. Comments: really very good. I’m sure these excellent small châteaux will soon start to bottle at higher strengths, which should give them much more exposure. SGP:651 - 85 points.",85,2016-11-27,https://www.whiskyfun.com/archivenovember16-2-Inchgower-Highland-Park-Bowmore-Glenrothes.html,6fc5ac9b46aadf783745ced2550ea9adf3777b9b5583e22f9b6ce584a5c50954
"Folle Blanche 2003 (42.3%, Jean Grosperrin, Grande Champagne, lot No.422, 385 litres, +/-2015)","Folle Blanche 2003 (42.3%, Jean Grosperrin, Grande Champagne, lot No.422, 385 litres, +/-2015) Some pure folle blanche! As you know, that’s Cognac’s original grape from before the phylloxera. Today, only around 1% of all winemakers in Cognac still grow folle blanche, which is more common in Armagnac having said that. Colour: deep gold. Nose: this one’s very unusual, as it rather starts on wheelbarrows of mangos, including the own smell of the wheelbarrows (wood, iron and grease). And then there’s rather ripe pears and apples, and some time you’d think it’s Domfrontais Calvados. Also touches of tinned litchis. Mouth: more ‘Cognac’, much more Cognac. Excellent arrival, on liquorice and marzipan, then a long development on ripe peaches and melons. Always a wee metallic side in the background, which actually adds depth. Finish: long and even more liquoricy. Even a little salt in the aftertaste, ala Bowmore. Comments: utterly malternative. I’m not knowledgeable enough to tell you if this was typically folle blanche, but if it was, let’s go hunt folle blanche (mad white in English)! SGP:452 - 87 points.",87,2016-11-27,https://www.whiskyfun.com/archivenovember16-2-Inchgower-Highland-Park-Bowmore-Glenrothes.html,e62f4d360eecf79bd837a6092e94fa94cc5222c31f4ca6bbe64975a6ccc1b22a
"Comandon 1977/2016 (59.7%, Through The Grapevine, LMDW)","Comandon 1977/2016 (59.7%, Through The Grapevine, LMDW) Some almost forty years old estate Cognac from the Borderies at a rarely seen strength, this should be something. Crazy crazy Maison du Whisky… Colour: orange wine ;-). Seriously, it’s slightly pink, where does that come from? Nose: starts with geranium flowers and obvious notes of old fortified wine (perhaps Rivesaltes or Banyuls), then we get quite a lot of orange/praline-filled chocolates, and then the same kind of slightly metallic side that we had found in the Grosperrin. Could this be folle blanche again? Redcurrant jelly, heather honey, a touch of cider… With water: some varnish from the oak, then autumn leaves and green tobacco. Even more artisan cider. Really not a silky old Cognac, even when reduced. Mouth (neat): rather rough, and rather Calvadosy (if I may). Gritty apples, green tea, gentian, perhaps turnips. And it’s rather hot! With water: we’re more in whisky territories. Bitter apples, ginger, artichoke, bitter chocolate… Really not an easy old thing for ‘the club’. Finish: long, with a little more oranges, but it keeps biting you a bit. Mentholy and pinesappy aftertaste. Comments: rather hard and rough Cognac, as in hard rock. Perhaps for more experienced Cognac tasters? SGP:471 - 79 points.",79,2016-11-27,https://www.whiskyfun.com/archivenovember16-2-Inchgower-Highland-Park-Bowmore-Glenrothes.html,2777a680fca804ce882bd900ea67454a8437e4110035ba0bd07074139d140d8c
"Bache Gabrielsen ‘Sainte-Lheurine’ (54.8%, OB, Pure & Rustic, +/-2013)","Bache Gabrielsen ‘Sainte-Lheurine’ (54.8%, OB, Pure & Rustic, +/-2013) Some single estate ‘artisan’ Cognac that was distilled in the early 1980s and bottled by Bache. This should rock… Colour: deep gold. Nose: rustic? Not at all! This is pure pineapple juice, really. Add oranges, add a little sandalwood. With water: gets grassy. That’s the rustic part, I suppose. Leaves, a touch of leaven, a little mud. In a way, it got maltier. Some orange-flavoured marzipan. Mouth (neat): blood oranges and tart peaches. Perhaps a little monolithic indeed, but immensely fresh. Rosebank, come out of this Cognac! With water: rather more on apples, which makes it go nearer the Comandon, but it remains much fruitier in general. Really nice fresh oranges. Finish: long, a little more tannic, with hints of marc rather than fine. That’s rather rustic indeed. Comments: gets rustic once water’s been added, while you would have thought the opposite would have happened. SGP:561 - 84 points.",84,2016-11-27,https://www.whiskyfun.com/archivenovember16-2-Inchgower-Highland-Park-Bowmore-Glenrothes.html,0accf3a089a05561c2b128e73b0fd2cd1895c7e84e3fd666e940d97adfa27d5d
"Château Guynot ‘Impérial’ (40%, OB, +/-2016)","Château Guynot ‘Impérial’ (40%, OB, +/-2016) This one was distilled 60 years ago, was kept in wood for 58 years, and then transferred to demijohns two years ago. As often happens with Cognac, it’s quite sad that it would have been reduced to 40% vol., really. How many hectolitres of fabulous old Cognacs have been murdered throughout the centuries? Now of course, some are doing fine at 40% vol… Colour: dark amber. Nose: rosewood, sandalwood, incense, rose petals, raisins, dried figs. Bags of dried figs, you know, those small ones that are so good and that they produce in Turkey. You know our usual lamento, why 40%, why 40%! This is such a perfect nose… Would you add water to your Chambertin? Mouth: it’s an exceptional old Cognac. Marvellous Corinth raisins, heather honey, dried apricots, Seville oranges, rhubarb pie… I even find a little Ovaltine. 1940s Macallan, anyone? Finish: O rage! O despair! O old enemy! Why 40%? This very short finish is so disappointing, while anyone would feel that the juice is just out of this world. Great minty side, but it really whispers too low, as Benny Golson would have said. Comments: go score this. Sure they may bottle Courvoisier V.S. at 40%, but this magnificent old juice? They should be brought to court! I’m joking, they are great and friendly people… SGP:651 - 89 points.",89,2016-11-27,https://www.whiskyfun.com/archivenovember16-2-Inchgower-Highland-Park-Bowmore-Glenrothes.html,f991155d1b465e19a3d6c0f90c3acbce16ec537f8b1a6d3305d809cc5b4bd2cf
"Glen Flagler 5 yo (40%, OB, half-gallon bottle, +/-1980)","Glen Flagler 5 yo (40%, OB, half-gallon bottle, +/-1980) There also was an NAS version, which never quite convinced me (WF 72). This particular fiver came in a large 200cl bottle. Colour: pale gold. Nose: wood smoke, old magazines, old nuts, and more ink. It’s a rather dry, pretty unsexy style, far from those of any other Lowlanders, but I do enjoy this discreet earthiness that arises, around coal dust and garden peat. I even find rose petals after a few minutes, but it remains a little shy. Mouth: starts a little ‘Canadian’ (we’re talking old Crown Royal), with a sweetish/sugary background, but it tends to become almost Rosebanky, which is obviously nicer. Pink grapefruits, cranberries, Turkish delights… Not too sure those lovely flavour were there in the first place, though, they may have come with good bottle aging. Now the body’s a little thin, but I wouldn’t call it weak. An excellent surprise. Finish: short, but clean and very pleasantly citrusy. There are even touches of passion fruits hidden in the background. Comments: I’d never have guessed this humble Glen Flagler (well, not from a collector’s point of view) would be this good. With whisky, you always keep learning! SGP:641 - 86 points.",86,2016-11-25,https://www.whiskyfun.com/archivenovember16-2-Inchgower-Highland-Park-Bowmore-Glenrothes.html,3eaca8d958c44b1b9c235ce080625f8d3950fc26e596b91e0bd1c0402e455e7d
"Glenrothes 19 yo 1997/2016 (53.7%, Claxton’s, sherry butt)","Glenrothes 19 yo 1997/2016 (53.7%, Claxton’s, sherry butt) Colour: deep amber. Nose: chocolate cream and crystallised oranges, plus stewed peaches and a leather/tobacco combination that hints at some cognacs. It’s also certainly quite earthy. With water: the kind of development I enjoy, on more earth and teas. Such as Pu-erh. Mouth (neat): a salty, rather bouillony arrival, with a lot of pepper and ginger, as well as some mint sauce. And then, chocolate as expected. It is very, very sherried. With water: could you cook bacon in liquorice sauce? Answers on a postcard. Finish: long, liquoricy. Perfect salty aftertaste. Comments: this is what we call a sherry monster, but it’s a balanced monster. I find it extremely good. SGP:451 - 87 points.",87,2016-11-24,https://www.whiskyfun.com/archivenovember16-2-Inchgower-Highland-Park-Bowmore-Glenrothes.html,85c125ce60f96af82037a32876242c0a09878625faf672cf6658bb0e12282f96
"Glenrothes-Glenlivet 1990/2002 (59.8%, Cadenhead, Authentic Collection, sherry butt, 666 bottles)","Glenrothes-Glenlivet 1990/2002 (59.8%, Cadenhead, Authentic Collection, sherry butt, 666 bottles) I agree, 666 bottles, that’s scary. Colour: dark amber. Nose: a much cleaner, perhaps simpler kind of sherry monster, more on black raisins and prunes, with liquorice and menthol in the back. I have to say all this menthol tends to come to the front, which makes it rather Vicks-VapoRubby. Ha. With water: Cuban tobacco and black tea. A drop of soy sauce. Mouth (neat): simple yet perfect, and extremely armagnacqy this time (yes, Armagnacky in English). Many raisins of various kinds, plus dried figs and once again some mint. Crème de Menthe. With water: oranges joining in the dancing. Finish: long, rather oily, creamy, and yet kind of fresh. That’s the oranges’ work. Comments: a little gem of an armagna… I mean, a malt. I almost went for 90. SGP:551 - 89 points.",89,2016-11-24,https://www.whiskyfun.com/archivenovember16-2-Inchgower-Highland-Park-Bowmore-Glenrothes.html,6eaf2bc690428ea9b69d1aedb8138a22c4e6c92dd11b3a28a4fd02f98b1b6f1f
