whisky_name_raw,review_text,score,review_date,source_url,dedupe_hash
"Tormore 28 yo 1984/2013 (52.5%, The Nectar of the Daily Drams)","Bonus: Tormore 28 yo 1984/2013 (52.5%, The Nectar of the Daily Drams) Colour: straw. Nose: as usual with the indies, this is closer to the spirit, with more fruits (greengages, plums in general, Seville oranges) and waxes and rather less nuts, coffee and toasted bread. It's very malty, though, and after ten minutes these notes of putty and chlorophyll do emerge, together with a little menthol, capsicum, white pepper... We're getting closer to the official 16 but this older one's more complex and less 'straightly malty'. With water: more oranges, zests, 'ideas' of plasticine. Mouth (neat): we're frankly above the officials, this one has more body and starts with playful notes of coconut and vanilla plus spices from the oak, around ginger and nutmeg. Very nice kumquats and then even more spices and bitter chocolate. With water: excellent. Calvados, ginger and cinnamon cake. Finish: long, with more zests and cinnamon. Mint-flavoured tea. Comments: a big spicy Tormore that really likes water. Excellent selection. SGP:561 - 87 points.",87,2013-10-08,https://www.whiskyfun.com/archiveoctober13-1.html,f241013ad47592a4576777f7a5ae7a71d5e2b2a3abd06777ca8feaee03232706
"Isle of Jura 9 yo 2003/2013 (46%, Douglas Laing, Provenance, cask #9305)","Isle of Jura 9 yo 2003/2013 (46%, Douglas Laing, Provenance, cask #9305) Another one from this series of ultra-young malts. Should we expect more pears and porridge? Colour: pale white wine. Nose: indeed. Apples, pears, some bitterish grass and a good deal of porridge and other boiled cereals. Also bubblegum and liquorice allsorts as well as very distant whiffs of coal smoke. Near-newmake, but I find this pleasant. Mouth: it's almost barley eau-de-vie, with a good fruitiness and a little pepper from the oak. All that works pretty well, it's a good distillate. Simple malty pleasures... Finish: not that short, now with touches of lemon. Sweet barley and pepper in the aftertaste. Comments: good baby malt whisky, a kind of vodka with more depth and body. Very distillery-driven, obviously. SGP:631 - 79 points.",79,2013-10-07,https://www.whiskyfun.com/archiveoctober13-1.html,0d6dfc1d4004cf910ff2770ee9a57b815ddb8b5b7fb08e3423c029c0ab61fa4f
"Jura 18 yo 1995/2013 (52.8%, The First Editions, refill hogshead, 288 bottles)","Jura 18 yo 1995/2013 (52.8%, The First Editions, refill hogshead, 288 bottles) I already had a sip of this new baby at Whisky & More Lausanne and loved it. Colour: white wine. Nose: very similar to the 2003 but it's much more mature, obviously. It's got this old-Highlands profile that's so loveable, with a little soot and smoke beyond the grassy fruitiness, then many herbs and some high-end green tea. Fresh mint, also some warm brioche and bread. Pretty complex! With water: bread and porridge coming through. After all, this is distilled grain ;-). Baker's yeast, leaven... It's all very natural. Mouth (neat): lovely arrival, wonderfully fruity, with also some wax and peppercorns. A lot happening, I especially like the big notes of oranges, green apples and quinces, as well as the saltiness that plays with your tongue. Wonderful body! With water: excellent, pure barley, salted caramel (Werther's) and hazelnut liqueur. Finish: long, grassier. Liquorice in the aftertaste. Comments: absolutely excellent 'eau-de-vie d'orge'. SGP:541 - 89 points.",89,2013-10-07,https://www.whiskyfun.com/archiveoctober13-1.html,df5958514340b0e4277b30e9b3d8adcb88370fe7026513d30fa4b5e914b0282c
"Jura 23 yo 1989/2013 'Heavily Peated' (56.5%, Signatory Vintage, bourbon barrel, casks #30706+30709, 211 bottles)","Jura 23 yo 1989/2013 'Heavily Peated' (56.5%, Signatory Vintage, bourbon barrel, casks #30706+30709, 211 bottles) I don't think Jura used to make peated malt in those years but I may be mistaken. Now, quite a few ex-Islay casks used to be re-filled at Jura and could impart some pretty heavy smoky/peaty tones to the gentler Jura. These two casks may have been some of these. Colour: straw. Nose: it's not quite 'heavily' peated in my opinion, but peated it is. So yes, peat smoke, then a little wet cardboard, newspapers, soot, cider apples and just a few strawberries that do 'lift' the whole. Maybe also peaches? There's something funnily Ardmore-ish. With water: some camphor and eucalyptus, then wee notes of Swiss cheese. Mouth (neat): ah yes, it's really peaty. There could be a good 30 litres of Laphroaig in this vatting since it's quite medicinal as well as very spicy. A feeling of black pepper and mercurochrome, then lemon and grapefruit. This should be very tricky at any blind tasting session! With water: Jura's big barleyness is more obvious and manages to tame the peaty components. Maybe a little ink. Finish: long and much grassier, almost astringent. Loses one or two points here. Comments: a funny beast. I really liked it despite the harder finish. SGP:364 - 86 points.",86,2013-10-07,https://www.whiskyfun.com/archiveoctober13-1.html,94a1dd43ad3538dc716ef4e9aea5318e3278c03469af330d500cf5c53df4e32a
"Jura 30 yo 'Camas an Staca' (44%, OB, 2,500 bottles, 2013)","Jura 30 yo 'Camas an Staca' (44%, OB, 2,500 bottles, 2013) This is the brand new official. Colour: amber. Nose: shy and very complex after the big ones. You have to let it unfold, but then this baby's very rewarding, all around 'old leather', precious wood, herbal teas and tobacco. Just a few examples: rosehip tea, sandalwood, orange liqueur, mead, milk chocolate, old-style Camel cigarettes and cough syrup. Tends do become a little more herbal over time, with chamomile, hay, green cigars... It's all very complex. Mouth: excellent! Starts salty and tobacco-like, maybe just a notch too dry, but the development is quite splendid, with some black tea, more tobacco, walnuts, maybe a little mustard and curry, some slightly acidic coffee, touches of salted liquorice, orange blossom water, more salt... Finish: quite long and even saltier. As salty as the best manzanillas! More smoke in the aftertaste. Smoked salmon, tobacco, walnut liqueur. Comments: and it's not even that 'expensive'. Well, it is at +/-500 Euros, but W&M seem to have shown restraint here. I find this baby excellent. SGP:462 - 91 points.",91,2013-10-07,https://www.whiskyfun.com/archiveoctober13-1.html,144f9606a9260a75ef86bf36fbb73215db8d1d315400b5afaaac1072ca915ffa
"Isle of Jura 35 yo 1976/2012 (51.3%, Jack Wiebers, Gentle Noses, cask #60006, 120 bottles)","Isle of Jura 35 yo 1976/2012 (51.3%, Jack Wiebers, Gentle Noses, cask #60006, 120 bottles) Colour: gold. Nose: it's grassier, maltier and less sherried than the new official. Above all, it's much more medicinal. Camphor, eucalyptus, Kools (menthol cigarettes - but you knew that) and a pack of salmiak. After fifteen minutes, it's almost pure cough syrup. With water: more wood, as often, and more menthol as well. Maybe cannabis? Kumquats, orange liqueurs, baklavas... Mouth (neat): heavy and wonderful. Maybe a notch too extractive but what it has extracted is great, all around menthol and affiliated flavours. Pinesap, salmiak, citrons, Indian green mint sauce, resins... With water: careful with water! It could become a little drying. Finish: the oranges fight back, for a long time. After Eight thin mints. Now, the aftertaste's a little too dry for my taste. Comments: really, you'd think they've added cannabis to this cask. Nah, seriously, this is a good example of an excellent heavily mentholated malt whisky. Good 'heavy' wood. SGP:372 - 89 points.",89,2013-10-07,https://www.whiskyfun.com/archiveoctober13-1.html,6f46c841c548ce721fbef5a3a8f34c0d70a755667f756b0bf5273e79feb12eb2
"Glen Scotia 18 yo 1992/2010 (46%, Mo Òr Collection, first fill sherry butt, cask #6, 1076 bottles)","Glen Scotia 18 yo 1992/2010 (46%, Mo Òr Collection, first fill sherry butt, cask #6, 1076 bottles) 46% is always perfect to start any session. They're big enough to stand the heavier cask strength versions that usually follow and do not make for a weak start. Colour: gold. Nose: oh yes it's a dirty one, and the sherry's meatiness does not make it any cleaner. There's this mustiness, all this leather, the Spanish ham (Iberico), old tools, metal polish, coal smoke, old cellar, exhaust fumes (if you're old enough, you may remember the two-stokes Kawasakis, H2 and such), old humidor... There are alos a few burnt matches but nothing serious. It's a very entertaining nose... Provided the palate is a little straighter! Let's check that... Mouth: yeah well, we have more or less the same. A lot of leather, it's like eating a whole brand new perfecto, I imagine. Also many bitter nuts, walnuts and almonds first, then we have hints of artichoke liqueur, chocolate, acidic coffee and lots of ashes. Extreme and strange but very funny. I cannot not think of some extreme bone dry Manzanilla. Finish: long, bitter, very walnutty. A coastal, salty side is growing in the aftertaste. Some cardboard too, perhaps. Comments: fun, very whacky stuff. SGP:362 - 83 points.",83,2013-10-04,https://www.whiskyfun.com/archiveoctober13-1.html,55d3ffd4ee1a33b4538707817676d4757d60f56d115a54d1d5112c68d49710da
"Glen Scotia 21 yo 1992/2013 (52.2%, Cadenhead, Authentic Collection, bourbon hogshead, 240 bottles)","Glen Scotia 21 yo 1992/2013 (52.2%, Cadenhead, Authentic Collection, bourbon hogshead, 240 bottles) This one came out last month. Colour: pale gold. Nose: as often, it's more blocked because of the higher strength. Not that it's mute, and some aromas that were to be found in the Mo Or are here too (leather and coal), but it's relatively shy for Glen Scotia. Quite some beer, though, ales and stouts. With water: paraffin, ink and lemon curd. A growing smokiness too (rather Suzuki this time, hehe). Mouth (neat): cough, cough... How bitter! This time its even bigger - more expressive, if you will - than the Mo Or but its very difficult whisky. Didn't they fill the cask with unsweetened Jaegermeister at full strength? Also a lot of bitter oranges. With water: I can tell because I had quite a few in the last weeks, it tastes like some smoky, grassy mezcal. Finish: same for a long time. Comments: what a beast! It's a little cleaner than the Mo Or because it isn't ex-sherry, but still... Very segmenting, I must say, and I won't score it too highly because of that. But, well, I like it. SGP:272 - 80 points.",80,2013-10-04,https://www.whiskyfun.com/archiveoctober13-1.html,607037f341d4b64a826e2f03a4123bb25ff36ace1f061e362fc10e691f9b9c3b
"Glen Scotia 21 yo 1992/2013 (51.5%, Douglas Laing, Old Particular, refill barrel, ref DL9903, 240 bottles)","Glen Scotia 21 yo 1992/2013 (51.5%, Douglas Laing, Old Particular, refill barrel, ref DL9903, 240 bottles) Since the Old Malt Cask range has gone with brother Stewart, the Old Particular is Fred Laing's new series that replaces it. I have to say I find the new retro design very smart. Colour: light gold. Nose: it's rather a fruitier, sleeker version of Glen Scotia, without much breadish notes. Well, there is a little ale but that's rather an asset. Oranges, cider apples, touches of tobacco, kumquats, some nice green/blue tea (wu-long)... All very nice. With water: more menthol comes out, as well as wilder earthy tones. Wet wool (right, sheep). Mouth (neat): starts like a good Chablis, I'd say. Something mineral and very pleasantly sharpish (green tea again), then a little chartreuse and bitter oranges. Oily mouth feel. With water: it's the barley that speaks out now, as well as more orange zests and custard. A touch of smoke. Finish: quite long, with a little more bitter almonds and dark chocolate. Comments: I'm impressed, this barrel had a lot to tell us. SGP:552 - 88 points.",88,2013-10-04,https://www.whiskyfun.com/archiveoctober13-1.html,00a90b00321c8ca65bd39c88c976f3630461da27bc1ffff8cdac433322a86d67
"Tullamore Dew 'Phoenix' (55%, OB, 2013)","Tullamore Dew 'Phoenix' (55%, OB, 2013) According to the label this new baby was 'enriched in pot still' (not too sure about what that means, probably that it contains some pot still whiskey) and finished in 'old oloroso sherry cask'. It's a blend, said to be around 8 years old. Colour: full gold. Nose: starts with rather heavy notes of toasted oak before more fruits come through, as well as a little bubblegum. Raspberries, perhaps from the sherry, as well as touches of bananas and then overripe apples and pears. With water: the pot still character comes more to the front. Something slightly (and pleasantly) metallic. Mouth (neat): very sweet, all on a mix of apple juice, pears and vanilla fudge at first sips. A little more sweet sherry than in the nose, around raisins, then a light spiciness, with maybe a little sweet curry and cinnamon. Also tangerines. With water: becomes rounder and softer but the profile remains the same. Maybe a little more raisiny. Finish: not very long but these notes of sultanas are very pleasant. A little toasted oak again in the aftertaste. Comments: I think it's more or less Tullamore Dew 'Black' with more power. Now, I enjoy Tullamore Dew 'Black'. And excellent surprise, I think new owners William Grant are doing a great job with this old brand. SGP:551 - 85 points.",85,2013-10-03,https://www.whiskyfun.com/archiveoctober13-1.html,9417bc4f8679a6922b65ff5e07d3b390b7d139dd200ee3a8ebdcb3df36dcec62
"Redbreast 21 yo (46%, OB, single pot still, 2013)","Redbreast 21 yo (46%, OB, single pot still, 2013) This new Redbreast, the oldest ever, does not come cheap at approx 180 €. Colour: full gold. Nose: typically Redbreast, with an avalanche of 'tropical Irish fruits'. Mainly mangos, passion fruits and pineapples, then golden sultanas. It remained very fresh despite the older age and displays neither too much spiciness nor an excessively vanilla-ed profile. Touches of toasted oak and pinesap come through as well but they remain discreet. Mouth: excellent, creamy, starting with a combination of marzipan and blood oranges, which works very well and is quite unusual. Goes on with a little mango chutney, dried figs, honeydew and a few slices of dried coconut but it never becomes 'pina-colada-ish', which isn't bad news. I also enjoy very much the hints of verbena and wormwood that keep it fresh and 'light'. Finish: medium length, rather smooth, never tea-ish despite the older age. The oranges are still there. Comments: I really enjoy the fact that there isn't too much oak, and the global freshness. Supplants the 12 CS as my favourite Redbreast and bizarrely, I find this 21 rather less oaky than the 15. SGP:641 - 89 points.",89,2013-10-03,https://www.whiskyfun.com/archiveoctober13-1.html,cf47ffaf159ab474ca059aadd5a6893eda3ee2325c68683ecb2d320e1dbfdc66
"Bowmore 13 yo 2000/2013 (54.1%, Signatory Vintage for Whisky Live Paris 10th Anniversary, hogshead, cask #1429, 286 bottles)","Bowmore 13 yo 2000/2013 (54.1%, Signatory Vintage for Whisky Live Paris 10th Anniversary, hogshead, cask #1429, 286 bottles) Colour: white wine. Nose: ultra-chiselled! 'Opening your bedroom's windows early in the morning on the shores of the isle of Islay.' Or something like that. Seawater, lemon juice and peat smoke in equal amounts. Nothing more, but you can't beat this. With water: as almost always with Bowmore, there's more humus, damp earth, farmyard... Mouth (neat): just 'yes!' Exactly right, on the same infernal trio, brine, lemon juice and a fairly ashy peat smoke. With water: citrus up, it becomes smoother. From lemon to pink grapefruits. Finish: good length, still chiselled. Comments: distillate-forward, my favourite way. Perfect statemental choice (what?) SGP:557 - 90 points.",90,2013-10-02,https://www.whiskyfun.com/archiveoctober13-1.html,d08e4fdf1c23d7c23675ad62612532b1611bbc4d1a99f5e3d2177ce6dadd0eb6
"Bowmore 10 yo 'The Devil's Cask' (56.9%, OB, first fill sherry, 2013)","Bowmore 10 yo 'The Devil's Cask' (56.9%, OB, first fill sherry, 2013) Colour: reddish amber. Nose: the opposite of the 2000 and yet it remains very 'Bowmore'. The combination of the sherry with a very smoky late-period Bowmore creates a feeling of gunflints, tobacco and zwetschke jam (plums) that's very peculiar. Then it becomes meatier, with quite some bacon and ham as well as a little strawberry jam. We're far from 'old style' sherry, this is more multilayered than 'integrated'. With water: more spices, around ginger, a little thuja wood, molecules ending with -ol, tar... Mouth (neat): devilish indeed, massively ashy and tarry, it's almost like a blend of strong lapsang souchong with plum juice. With water: more tar, more ashes, more smoke, less plums. Finish: long and very tarry. The wine's fruits have been defeated. A little ginger again in the aftertaste, hinting at European oak but it may well not be European oak. Comments: as a 'Bowmore', I feel it's got a little too much sweet sherry. As a variant, I think that worked very, very well. Quite spectacular. SGP:657 - 88 points.",88,2013-10-02,https://www.whiskyfun.com/archiveoctober13-1.html,7f632b2a6ca9098dee71164e83f9550091db75fe5b6e570aa31b26e2226f6345
"Bowmore 23 yo 1989/2013 'Port Cask Matured' (50.8%, OB)","Bowmore 23 yo 1989/2013 'Port Cask Matured' (50.8%, OB) Colour: orangey amber. Nose: this baby's having a little trouble after the previous ones, the smoke being more discreet. We're actually much more on red fruits, plums, cherries, raspberries... In the background, more farmy (hints of cowstable) elements but very little lavender or violets if any. Mellower than expected. With water: once again it's struggling a bit after the big young ones. I seem to find a little geranium water, maybe rosehip or hawthorn. Mouth (neat): does smoked mulled wine exist? Or smoked fruitcake? Oranges, sweet wine, blackberries, more plums, cinnamon, cloves, star anise... With water: Seville oranges and more honey now. Orange blossom honey? Finish: medium length. More and more oranges, a little pepper, more cinnamon... Mulled wine indeed. Comments: a good one but maybe only for Christmas time. I liked the younger ones better. SGP:555 - 85 points.",85,2013-10-02,https://www.whiskyfun.com/archiveoctober13-1.html,0ff6ae85292a11cdff583742ec8918a6f137774fc530317ca1c2a0817e4eecc3
"Tormore 14 yo 1998/2013 (50%, Gordon & MacPhail, Exclusive for the Whisky Mercenary, first fill bourbon barrel, cask #1586, 277 bottles)","Tormore 14 yo 1998/2013 (50%, Gordon & MacPhail, Exclusive for the Whisky Mercenary, first fill bourbon barrel, cask #1586, 277 bottles) Colour: straw. Nose: indeed, it's one of these relatively fatty/waxy Tormores, while at the fruit department we find a lot of apples of all kinds. Behind that, some hay, paraffin, waxed papers, and a very pleasant greenness, maybe from newish oak. Between green tea and wormwood. There's some vanilla and a little pineapple too but it does not scream 'hey, I'm here!' as much as in other modern 1st fill bottlings. With water: it's the fresh fruitiness that becomes louder. Fruit salad with a little honey and quite some oranges. Also roses. Mouth (neat): a bit of biting oak in the arrival (quite some white pepper), then apples unfolding - so to speak - both acidic and sweet. It's powerful whisky! Then more grapefruits, tonic water and, again, green tea. With water: some tropical fruits emerging. This baby swims like a champ. Finish: clean and quite long. A fruit salad with a little cinnamon. Comments: I was afraid water would let the oak come out more, it's the opposite that happens. SGP:651 - 87 points.",87,2013-10-01,https://www.whiskyfun.com/archiveoctober13-1.html,36fef0d7b0ff64e4b383ff9323cf2979b464a836648af88d17130d7a2be22307
"Tormore 1988/2012 (55.4%, Malts of Scotland, sherry butt, cask #MoS 12043)","Tormore 1988/2012 (55.4%, Malts of Scotland, sherry butt, cask #MoS 12043) I liked sister cask #12041 quite a lot (WF 87). Colour: amber. Nose: well, this baby's got nothing to do with the 1998, it's much more tertiary and herbal/gamy. I find a lot of lovage and liquorice, tobacco (including a newly opened pack of menthol cigarettes - as far as I can remember) and then rather dry kinds of raisins, not too sweet or aromatic. With water: unusual. A lot of balsamic vinegar and maybe sage and bay-leaves. Loud chamomile as well, maybe a little church incense. Mouth (neat): very rich, oily, with bags of pepper and raisins, then caramelised apples and a little tobacco again (coming out of an untipped Gauloise!) Maybe a little pastis too. With water: more tobacco, this time with dark chocolate. Maybe black cherries too? Finish: long and pleasantly dry. Reminds me what some used to call 'dry' oloroso. Walnut wine and bitter herbal liqueurs in the aftertaste. Comments: not just the average sherry monster, this one's pleasantly different and, above everything, perfectly balanced. Not all sherry monsters are. Same score as the bourbon for me and, bizarrely, same SGP. SGP:651 - 87 points.",87,2013-10-01,https://www.whiskyfun.com/archiveoctober13-1.html,9256697d20552150fd7a527e1a563a014baea77edf8a47147f3a9cba710a558a
"Aberfeldy 16 yo 1997/2013 (56.1%, Cadenhead, Wine Cask, Château 'Lafitte')","Aberfeldy 16 yo 1997/2013 (56.1%, Cadenhead, Wine Cask, Château 'Lafitte') LOL, and yet some other bottlers who'd spell Lafite Lafitte. After Barollo and Sauterne, this is becoming really funny. Unless, of course, our friends in Campbeltown have sourced the Lafite cask from China, or maybe it's not the well-known Lafite in Pauillac and rather a 'cheaper' little château that's spelled Lafitte? Not too sure this is very important... What's more, I don't think it says so but it's probably a finishing. Having said that, I remember a Miltonduff in the same series that I found truly excellent (WF 90). Colour: apricot. Nose: apricot. Serious. Well, not only apricots, also oranges, flints, mandarine liqueur, orange blossom and a little honey. It's quite amazing that there are so much oranges, that's not very Lafite, is it? With water: same. Oriental pastries. Mouth (neat): sweet juicyfruit (Wrigley's) and quite a bit of bitterish rubber, leaf tea (cherry? cassis?) and grass. It's quite big but if it's a genuine Lafite cask, and as the château is only using first fill French oak, it was obviously a very active cask. With water: less grassy tones, more... oranges, especially bitter ones. Strong tea, typical European oak. Finish: this time it's very grassy again, apple peelings, more malt, some ginger... Medium length. Comments: another finishing that sort of worked. I'd love to know how much time the whisky spent in Bordeaux wood. SGP:461 - 80 points.",80,2013-10-31,https://www.whiskyfun.com/archiveoctober13-2.html,46b7bfe80700f2654f69fff92d58ea818e2077c70aa1047a40682d8b0c6dc63c
"Benriach 8 yo 2005/2013 (58,1%, OB, batch 10, virgin American oak finish, cask #3782, 310 bottles)","Benriach 8 yo 2005/2013 (58,1%, OB, batch 10, virgin American oak finish, cask #3782, 310 bottles) Colour: gold. Nose: peat! And vanilla... I find it very 'modern Ardbeg' I have to say, had I tried this baby blind, I'd have said 'young first fill bb Ardbeg'. Too young, in fact, even if peat and virgin oak do probably mask the rough edges of youth. Ultra-simple. With water: same style, a notch sweeter and rounder. Maybe pineapples as well as hints of antiseptic. Mouth (neat): no, the virgin oak kills it in my opinion. We're experiencing the same problem as with other newish VOs (such as Morrison-Bowmore's), it's more a decoction than some mature spirit. Bubblegum, vanilla, ashes and cinnamon. With water: same. Kind of asynchronous between the peat and the very sweet and spicy oak. Finish: quite long but acrid and peppery. Too much young oak. Comments: it's obviously not my business, but I find it troubling that some very well reputed distilleries would propose such variants. Do they do that just because they can? Or because they know they have so many other utterly brilliant bottlings? Bah, they all have one or two lame ducks, after all... SGP:665 - 72 points.",72,2013-10-31,https://www.whiskyfun.com/archiveoctober13-2.html,6af05036fde94522640acc14bd58adf3b0351a76677dd73c42432e63ec2e5225
"Benriach 27 yo 1985/2013 (48.9%, OB, batch 10, virgin American oak finish, cask #7188, 257 bottles)","Benriach 27 yo 1985/2013 (48.9%, OB, batch 10, virgin American oak finish, cask #7188, 257 bottles) Colour: deep amber. Nose: another world. There isn't much peat, rather some notes of old rum (old Zacapa, perhaps) and dried figs, pears, peaches and dates. Also some hay and tobacco, quality old wood varnish and a little cough mixture. Lovely nose, kind of the opposite of the 2005. Mouth: indeed, this is excellent despite an oak that's very obvious and even green and drying. The thing is that the spirit behind all that does stand it and remains rich and complex. Mind you, despite all the peat and all the new oak, even the original tropical fruits manage to shine through. Mangos? Finish: long. A kind of blend of chartreuse, tar liqueur and Grand-Marnier. And why not? Comments: phew! I'm happy. Today's little session hasn't been the easiest ever. SGP:653 - 87 points.",87,2013-10-31,https://www.whiskyfun.com/archiveoctober13-2.html,a5671381ae7e9db4a98ca78f903542934e90e7cd70ee01198bb0f13734767de5
