whisky_name_raw,review_text,score,review_date,source_url,dedupe_hash
"Caol Ila 10 yo 2011/2022 (57.58%, Whisky Nerds, sherry hogshead, cask #5846, 326 bottles) Who remembers chalkboards at school? They were much more reliable than iPads, if you ask me.","Caol Ila 10 yo 2011/2022 (57.58%, Whisky Nerds, sherry hogshead, cask #5846, 326 bottles) Who remembers chalkboards at school? They were much more reliable than iPads, if you ask me. Colour: gold. Nose: whiffs of flints, limestone, even sulphur stone at first, then sour wine, preserved artichokes, sauvignon blanc (which I often find very Coal Ila), then the flintier-and-yet-fat Meursault you could think of. With water: raisins, barbecue lighting fluid, even lighter fluid (or ol' Zippo), more flints… Mouth (neat): once again it would start with a little sulphur, let's say leathery raisins, then open up with some cigarette tobacco and hoisin sauce. Then we have even more raisins. With water: good fun with this pretty mineral and yet very raisiny sherry cask. Finish: long, more on tobacco and tarry tea. Sooty aftertaste, with also notes of eggplant. Comments: probably not for everyone, but there were only 326 bottles anyway. A tiny notch deviant, perhaps. SGP:566 - 84 points.",84,2022-11-22,https://www.whiskyfun.com/archivenovember22-2-Chichibu-Strathmill.html,bc4d09c8cadecd9fbb06835d6d7c2d75a4290e29136cab0313608d48526458ea
"Caol Ila 2010/2022 (57%, Swell de Spirits, Wonders of the World, rum cask finish, cask #1902, 360 bottles) Caol Ila and rum, clash or not clash, what do you think? Let's see…","Caol Ila 2010/2022 (57%, Swell de Spirits, Wonders of the World, rum cask finish, cask #1902, 360 bottles) Caol Ila and rum, clash or not clash, what do you think? Let's see… Colour: white wine. Nose: earth, humus, seashells, olive oil, new blue jean, musty old wine cellar, fresh plaster… Well, no clash this far, on the contrary… With water: well, it does 'nose' like if the rum was a Jamaican, or a Trinidadian, perhaps. Which means that there couldn't be any clashes, both profiles being kind of close, in a way. Earth and smoke and brine and olives, you know. Mouth (neat): a wee soapiness at first but that was very fleeting, then rather salty lemons and smoky capers. Did anyone ever try to smoke capers? Not even in Italy? With water: citrus and wool, samphires... Finish: long, very briney, tight, much more vertical than I had thought when I did read 'rum cask finish'. Comments: very smart duet. SGP:466 - 87 points.",87,2022-11-22,https://www.whiskyfun.com/archivenovember22-2-Chichibu-Strathmill.html,6d7445a1f2570e75c8b3051ddc41aa09cf0e6754158e4137a2bd5a7231fcab93
"Caol Ila 9 yo 2010/2020 (50%, Hunter Laing, Old Malt Cask, refill hogshead, cask #HL16013, 240 bottles) Can you call it an 'Old Malt Cask' when the malt's this young? Right, I suppose the cask itself was old…","Caol Ila 9 yo 2010/2020 (50%, Hunter Laing, Old Malt Cask, refill hogshead, cask #HL16013, 240 bottles) Can you call it an 'Old Malt Cask' when the malt's this young? Right, I suppose the cask itself was old… Colour: very pale white wine. Nose: immaculate, with new kirschwasser, whelks again, clams, seawater, linseed oil, new tyres. What's not to like? With water: new sweater, rainwater, wool… Mouth (neat): very fresh, millimetric, lemony, salty, ashy. Gherkin brine. With water: excellent, with lemons jumping into your glass. Other than that, we have more chalk. Finish: medium, saltier. One oyster in the aftertaste. Comments: young fresh untouched Caol Ila (as nature intended, shall we add). They're very good too. SGP:556 - 86 points.",86,2022-11-22,https://www.whiskyfun.com/archivenovember22-2-Chichibu-Strathmill.html,56b482f916859bf3db712ef415d045a77ed42460ffbda687c751bfd53bc5b388
"Caol Ila 11 yo 2010/2022 (56.9%, Scotch Malt Whisky Society, for LMDW, refill bourbon hogshead, #53.410, 'Smoked Sea Salted Liquorice', 270 bottles) That The Society would do such exclusive bottlings is new to me, but all powers to La Maison Du Whisky here.","Caol Ila 11 yo 2010/2022 (56.9%, Scotch Malt Whisky Society, for LMDW, refill bourbon hogshead, #53.410, 'Smoked Sea Salted Liquorice', 270 bottles) That The Society would do such exclusive bottlings is new to me, but all powers to La Maison Du Whisky here. Colour: pale white wine. Nose: crystal clear sweet smoky nose full of ripe apples, lapsang souchong, smoky custard and marzipan. Rather feels like 15, if you ask me. I mean 15 years old. With water: pure wool, chalk, ashes, lime and oysters. This is extremely 'Caol Ila'. Mouth (neat): very close to the OBs, with more citrus this time, more freshness, some fennel seeds, wasabi, seawater, brine… And green olives. Hoppla, as we say over there. With water: winner. Iodine and medicinal stuff. Finish: one that cuts you into two halves, as we sometimes say. Totally bladey. Comments: high-definition Caol Ila, as in 'Caol Ila'. No prisoners. SGP:457 - 88 points.",88,2022-11-22,https://www.whiskyfun.com/archivenovember22-2-Chichibu-Strathmill.html,abfa53555e31bdfde1afe047dc6b83fcb9bc72840b4591fbcc015acdeb5a7698
"Carùpano 12 yo 'Reserva Exclusiva' (40%, OB, Venezuela, +/-2022) We've only ever tried Carùpano 6 yo, which was a Reserva 'Especial' rather than 'Exclusiva'. Adjectives are the salt of marketing. Now that 6 was rather cheapish (WF 70).","Carùpano 12 yo 'Reserva Exclusiva' (40%, OB, Venezuela, +/-2022) We've only ever tried Carùpano 6 yo, which was a Reserva 'Especial' rather than 'Exclusiva'. Adjectives are the salt of marketing. Now that 6 was rather cheapish (WF 70). Colour: dark gold. Nose: no wait, this is very all right, very rounded, chocolaty, with some rum baba, bananas flambéed, raisins, fresh-crushed cane juice, fudge and caramel, and just Rowntree's best. Mouth: really, it's kind of okay, you do find the cane, bananas, pineapples, light molasses, cappuccino, Viennese coffee… There is some sugar for sure, but it's been done with moderation. Finish: a tad short, rather honeyed, with some more cane juice and candy sugar. That's it, they've used candy sugar. Comments: no quibbles, it's rather fine sweet rum, just a little wobbly in the knees, if you see what I mean. SGP:630 - 77 points.",77,2022-11-20,https://www.whiskyfun.com/archivenovember22-2-Chichibu-Strathmill.html,18c72e54fcfc19433ba73eb5b8667cf42b1f403cb0621ee0fb44627a1095c85e
"Mauritius 12 yo 2010/2022 (53.4%, The Nectar of the Daily Drams, Port cask) This stems from Grays Distillerie, a name that I had bever heard of before (which doesn't mean much, I agree). Now that Port thing is scary.","Mauritius 12 yo 2010/2022 (53.4%, The Nectar of the Daily Drams, Port cask) This stems from Grays Distillerie, a name that I had bever heard of before (which doesn't mean much, I agree). Now that Port thing is scary. Colour: Port. No really, Port red. Ruby, if you like. Nose: huge Port, even if this isn't pure touriga nacional. It is some in-cask blend of rum with Port, simple as that. Not saying that doesn't work, having said that, both drinks even seem to tango well together. Peonies, raspberry liqueur, blackberry jam, ganache, Mon Cheri, molasses, strawberries stewed in Demerara syrup, guignolet, Nuits-St-Georges… With water: even more sweet red wine. Towards amarone at times. Mouth (neat): cherry jam with indeed some muscovado, cinnamon, star anise, more raspberries and blackberries, Port, pinot noir… With water: there's even this gamey side of Pinot Noir. Yeah I know Port is not made out of Pinot Noir. Finish: long, sweet, Port-like. Cherry stems and leaves in the aftertaste. Clafoutis. Comments: the Romans were having it right when they called the drink 'vinum'. In my book the Port was louder than the rum. Good fun, we just need to find a name for these in-cask premixes. Seriously, it worked. SGP:740 - 82 points. Update : Grays is New Grove, thanks Rowald",82,2022-11-20,https://www.whiskyfun.com/archivenovember22-2-Chichibu-Strathmill.html,7d6cd18d70b11f004eb094d7ad53b29f6c1364b656d3a58ec65eb2fd5912b0cb
"Travellers 2007/2022 (64.6%, l'Esprit, Belize, cask #BB 19, 258 bottles) Long time no Travellers from Belize on little WF. The honourable bottlers remind us that this is single-estate rum. That's a proper origin!","Travellers 2007/2022 (64.6%, l'Esprit, Belize, cask #BB 19, 258 bottles) Long time no Travellers from Belize on little WF. The honourable bottlers remind us that this is single-estate rum. That's a proper origin! Colour: amber. Nose: fudge and nougat at cask strength ;-). Scones, cane juice, biscuits, pumpernickel, shortbread, toffee… With water: a very delicate rubber coming out, some leaves and hay, dried flowers, tangerines, beeswax… It is all delicate indeed, elegant, you would have said 'feminine' back in 1995… Mouth (neat): oranges and caramel… These Travellers are reminiscent of Foursquare, they're just a notch lighter. But no further chances taken at almost 65% vol. With water: very good! A velvet hand in an iron glove, would we say. Delicate cakes, ginger biscuits, madeleines, Jaffa cakes, some tangerine marmalade… Finish: medium, rather on nougat and Bailey's (apologies). I would guess you could make some kind of Alexander out of this Travellers, no? Comments: take your time, don't rush it, be ready for murmurs and subtleties, and it'll grow on you. I think I forgot to mention puréed chestnuts (with vanilla, whipped cream and meringue). SGP:441 - 88 points.",88,2022-11-20,https://www.whiskyfun.com/archivenovember22-2-Chichibu-Strathmill.html,a2f2a1cb8cd107368d0cd5a34e70f2ebf3f4f090916668b085d492738857b532
"Foursquare 2002/2022 (52%, l'Esprit, Barbados, cask #BB 8, 198 bottles)","Foursquare 2002/2022 (52%, l'Esprit, Barbados, cask #BB 8, 198 bottles) Colour: light gold. Nose: boy was I wrong, but that's because this is a Foursquare that's giving pride of place to its ex-pot still component. Green oranges, capers and olives, gentian, varnish, fermenting bananas, linseed oil, cigar smoke… Well, we love it but it is simply not a prototypical Foursquare. Un-self-blended Foursquare, or simply a higher proportion of pot still? With water: plastics and waxes, new sneakers, new iPhone (fool!)… Mouth (neat): yeah right, a Jamaican Foursquare. Pure pot still, with tar, olives, liquorice, rotten, ach, well, rotting fruits, varnish, sake and shochu, even baijiu… Tell me about a spirit of the world! With water: smoked bananas, olives macerated in coal tar, pickled bits of grapefruit… Finish: long. Takes water extremely well. Comments: we've been fooled. This is like trying Port Charlotte while thinking it was Bruichladdich, see what I mean? They'll get a letter… SGP:553 - 90 points.",90,2022-11-20,https://www.whiskyfun.com/archivenovember22-2-Chichibu-Strathmill.html,c3ed8ba37c4fa872d0f9766d1fb6c90bd658fa6ef0ae5b1ce8f8a435772c07f3
"T.D.L. 22 yo 2000/2022 (57.5%, Swell de Spirits, Private Garden n°1, Clos des Spiritueux, Trinidad, 356 bottles) 15 years in Trinidad, then 7 years in the UK (so most under Boris). T.D.L. means Trinidad Distillers Limited, so pretty much Angostura.","T.D.L. 22 yo 2000/2022 (57.5%, Swell de Spirits, Private Garden n°1, Clos des Spiritueux, Trinidad, 356 bottles) 15 years in Trinidad, then 7 years in the UK (so most under Boris). T.D.L. means Trinidad Distillers Limited, so pretty much Angostura. Colour: full gold. Nose: not bold, but very floral and honeyed. Rum made by bees, in other words. Some pomegranates and prickly pears, pink bananas, clover honey, dandelions, wisteria, bits of mango, and first and foremost, preserved peaches, which would lead to… fresh old cognac. This is rather fascinating, to tell you the truth. You travel fast with this one. With water: feeling even more obvious. Glorious. This simply cannot only be TDL, let alone Angostura under another name. Im-pos-si-ble. Mouth (neat): very intriguing. Some sorcerer may have blended away various spirits, perhaps Rosebank plus TDL indeed, plus a fruity Bons Bois, plus a drop of Ténarèze to add oomph and knack. Smart work (but hey officer, this is fiction!) With water: I say no more. Some cane reminds us that there's rum in there. Finish: medium, jammy, complex, floral (floral finishes are uncommon)… Peaches in honey are dancing in the aftertaste. Comments: Mr Swell, we need to talk. This is not only a joke ;-). SGP:641 - 90 points.",90,2022-11-20,https://www.whiskyfun.com/archivenovember22-2-Chichibu-Strathmill.html,35d1986f1d56a754b2fc6355f3a14d7d07b1e57788d4921b256517711f200a66
"Fiji 21 yo 2001/2022 (62.2%, La Maison du Whisky, Antipodes, cask #51, 213 bottles) Love LMDW's conceptualisation every year, in 2022 it is all about 'antipodes'. Well, Fiji sure lies in the antipodes of France. Excellent rugby, by the way, while this should stem from the very good South Pacific Distillery, in Lautoka. High hopes here, Fiji sure is the Jamaica of the… antipodes.","Fiji 21 yo 2001/2022 (62.2%, La Maison du Whisky, Antipodes, cask #51, 213 bottles) Love LMDW's conceptualisation every year, in 2022 it is all about 'antipodes'. Well, Fiji sure lies in the antipodes of France. Excellent rugby, by the way, while this should stem from the very good South Pacific Distillery, in Lautoka. High hopes here, Fiji sure is the Jamaica of the… antipodes. Colour: amber. Nose: when patchouli and tar meet, together with olives and liquorice. A bit strong, to say the least, but you would believe you're in Monymusk/Clarendon. With water: ink, damp magazines, coal dust, turpentine, varnishes, and of course olives. Smoked olives. Mouth (neat): excellent glue, varnish, very heavy pine resin and something reminiscent of nail polish (with strawberry flavour). With water: anchovies and peaches chiming in. Finish: long. Comments: we've heard whenever the Fijian rugby players would catch and kill an enemy, they would then dump him into the Distillery's muck pit. Or is that only rumours? Great, great estery rum nonetheless, one of the best in the world. SGP:563 - 89 points.",89,2022-11-20,https://www.whiskyfun.com/archivenovember22-2-Chichibu-Strathmill.html,fa62edd1155cc19d74222aa79389471e0928ba81d7f4cecfad7586bf48137fd8
"Worthy Park 'Select' (40%, OB, Jamaica, +/-2022) Never forget that Worthy Park is single-estate rum. Who else is truly single-estate in rum? And in whisky? (pff, ROTFALOL…) This WP is the simplest expression of WP there is, but WP is WP. Right, enough acronyms, let's just hope Worthy Park Select has nothing to do with Laphroaig Select…","Worthy Park 'Select' (40%, OB, Jamaica, +/-2022) Never forget that Worthy Park is single-estate rum. Who else is truly single-estate in rum? And in whisky? (pff, ROTFALOL…) This WP is the simplest expression of WP there is, but WP is WP. Right, enough acronyms, let's just hope Worthy Park Select has nothing to do with Laphroaig Select… Colour: gold. Nose: we would have loved more oomph, but they sell this for way less than 30€. Lovely notes of linoleum, ink, brine, olives, paint… While indeed, and that was what I've been feeling in the first place, it is very similar to the Fijian (and conversely). Mouth: just very good, not even light, oily and olive-y, with good grittiness, overripe bananas, a feeling of diesel oil, nutmeg and pepper, very salty oysters (of open sea), olive oil… Finish: perhaps not exactly the best part, but that's more than normal at 40% and with this kind of profile. Just ask Laphroaig Select. The aftertaste is a little hazy and out of sorts, but there. Comments: class, this cheapish entry-level WP, just take another sip before the finish. SGP:362 - 85 points.",85,2022-11-20,https://www.whiskyfun.com/archivenovember22-2-Chichibu-Strathmill.html,873382bf9dbfb35fd10c26b9e1e0e3ec5438a9ecc1904893c558599d7a3d914e
