whisky_name_raw,review_text,score,review_date,source_url,dedupe_hash
"Pittyvaich 28 yo 1979/2007 (54%, Duncan Taylor, Rarest of the Rare, cask #5636, 175 bottles)","Pittyvaich 28 yo 1979/2007 (54%, Duncan Taylor, Rarest of the Rare, cask #5636, 175 bottles) We’ve had sister casks, they’ve been a little bizarre, perhaps. Colour: gold. Nose: do you like fresh paint and ink? And burnt grass? Paraffin? Leatherette? Mineral sulphur? Cooked beer? With water: dust, chalk, wet clothes, and a faint meatiness. Grisons meat, perhaps (dried beef). Mouth (neat): very unlikely indeed. Burnt cake, orange squash, raw eau-de-vie (tutti frutti), a curious feeling of lemon powder… Perhaps more malt whisky ‘for research’? With water: a little more to my liking, a little fruitier and fresher, on oranges. Saves it. Finish: quite long, bitterish. Bitter oranges, cardboard. Comments: really, more for researchers. A style, as they say. SGP:362 - 78 points.",78,2015-11-12,https://www.whiskyfun.com/archivenovember15-1-Armagnac-Brora-Clynelish-Caol-Ila.html,0515ea258d7d128296bff946034845acde7b852e0ab7d815c46fc95dd8109917
"Pittyvaich 25 yo 1989/2015 (49.9%, OB, Special Release)","Pittyvaich 25 yo 1989/2015 (49.9%, OB, Special Release) Like the minimalistic design. Let’s hope the whisky won’t be in keeping with this style. Colour: straw. Nose: the style is there again, with some ink and chalk, but this time it’s cleaner, without any feinty/yeasty or bitter notes. Leather and porridge, candle wax, then something very ‘funny’, Provence herbs. Rosemary, thyme, bay leaves, even pine needles. And a little ham in the background. Mouth: really funny indeed, quite pungent, grassy, waxy, with a fizzy side (lemonade) and then pine needles again. Basil liqueur. Yes, that exists. Finish: medium, always ‘funny’, between lemon and fresh mentholated herbs, as well as a little dill or fennel. Comments: did I tell you I found this baby funny? A forgotten style, I don’t know of any other distillery that still makes it like this. I even find it really good, but its ‘unlikeliness’ may be part of that judgement. SGP:361 - 85 points.",85,2015-11-12,https://www.whiskyfun.com/archivenovember15-1-Armagnac-Brora-Clynelish-Caol-Ila.html,602bc344f27c0b03950422d3e79a35b3a4f1051cd84ea863fcc102952e7ac41b
"Pittyvaich 14 yo (54.5%, James MacArthur, Fine Malt Selection, 75cl, +/-1990)","Pittyvaich 14 yo (54.5%, James MacArthur, Fine Malt Selection, 75cl, +/-1990) No vintage on this older bottling, but it’s probably mid-1970s. Colour: straw. Nose: well in the style of the SR, only tighter, and rather smokier. That would be coal smoke. Other than that, same whiffs of a forest in Provence, pinesap, thyme… All that. And ink. With water: it’s the chalk that comes out. Mouth (neat): a bit extreme, very grassy, herbal, lemony, and chalky, always with this bitter background. Very oily mouth feel, some very characterful malt whisky. With water: orange drops! But also a discreet chemical/sulphury touch. Very old school, I can see why some blenders would choose this to add body and texture to some otherwise dullish blend. Finish: quite long. Waxes, oranges, chalk, a drop of turpentine. Comments: it’s Bell’s that used to operate Pittyvaich, not sure if it was ‘top dressing’, though. A whisky worth trying, for sure, and I really enjoyed some parts of it, hence my good score. SGP:371 - 82 points.",82,2015-11-12,https://www.whiskyfun.com/archivenovember15-1-Armagnac-Brora-Clynelish-Caol-Ila.html,fe5d7597b76cfc3e044507f6cfcc268a52134b8501f4edea48bc246a458303dc
"Togouchi 18 yo (43%, OB, world blend, +/2014)","Togouchi 18 yo (43%, OB, world blend, +/2014) Whisky by Chugoku-Jozo Distillery but it seems, according to reliable sources, that this is actually a blend of Scottish malt and Canadian grain. So, only the bottle’s very ‘Japanese’. We first had Togouchi a few years back, and found it relatively good but a little unlikely (WF 78). Colour: gold. Nose: some grassy oak, some apples, and a touch of cinnamon. Perhaps peaches as well, but not too sure, then a curious feeling of cooked vegetables plus almonds. Some porridge. Mouth: not bad at all, it seems that they improved the recipe. A little dusty/oaky, perhaps, with more cooked apples, then cake, malt, marzipan, and grass. More and more green oak and green tea. Finish: rather short, with a discreet saltiness. Salted porridge and green apples. Comments: pretty okay, too bad it’s so expensive here in France (more than 100€, ahem). I like it rather better than earlier batches. SGP:351 - 79 points.",79,2015-11-11,https://www.whiskyfun.com/archivenovember15-1-Armagnac-Brora-Clynelish-Caol-Ila.html,d169c5d1bab6bf9de70edeca25e40b2321d595d1ef9f0e24072f3cf56c32534c
"Yoichi (43%, OB, Japan, +/-2015)","Yoichi (43%, OB, Japan, +/-2015) No age, 50cl., great packaging, hefty price. Welcome to malt whisky 2.0. Colour: deep gold. Nose: warm, nutty, vanilla-ed, custardy, malty, oaky. Sponge cake, plum jam, sweet oak, honey. It’s simple, of course well made, and certainly not unpleasant. Let’s only hope this is no oak liqueur on the palate… Mouth: yeah well, the oak feels a bit, with a drying leafiness rather than ‘vanilla-ed pina colada’ as seen elsewhere, while the body’s a little thin. Toasted oak, green tea, white pepper, a little cardboard, and little fruits. Finish: a little short, oaky, with a touch of salt, smoke, and more sawdust in the aftertaste. Comments: the oakiness is a little surprising. That they would have tried to speed-up ageing using new or rejuvenated oak would make sense, but then we’d have found more vanilla, I suppose. A little mysterious. Acceptable. The nose was nice. SGP:361 - 77 points.",77,2015-11-11,https://www.whiskyfun.com/archivenovember15-1-Armagnac-Brora-Clynelish-Caol-Ila.html,a97d5b28b587b670549a598ba8b7123c228633f382c2562738644fef8eaead8c
"Suntory 'Royal' (43%, OB, Japanese blend, +/-2015)","Suntory 'Royal' (43%, OB, Japanese blend, +/-2015) Our friends at TWE call this ‘a superb entry-level Japanese whisky’. Well, at £90 a bottle, I certainly hope it’s not too ‘entry-level’. BTW older batches of Suntory Royal were said to be full of old Bowmore, but that may have changed. Colour: orangey gold. Nose: this is troubling, there is quite some peat. Bowmore or Hakushu? This is actually a rather great nose, a bit ala old Highland Park, with depth and complexity. Waxy oranges, leather, sea air, heather honey, tobacco, earth… Mouth: totally old-style blend. Leafy, grassy, rather smoky indeed, leathery, with Seville oranges, a little brine, liquorice, gentian (hurray), a mineral side, some soot… And green bananas. I’ve seen here and there that some good people were thinking this is light whisky. Certainly not! But perhaps is that a matter of batches?... Finish: okay, it’s not long, but this mineral and malty grassiness works very well. Very old school. Some salt in the aftertaste. Comments: an excellent blend, I think. And to tell you the truth, a surprise. SGP:362 - 84 points.",84,2015-11-11,https://www.whiskyfun.com/archivenovember15-1-Armagnac-Brora-Clynelish-Caol-Ila.html,b98ac692bfbf6d9e3810c0aac77d374541a80cdf543f0d1b7af4ab4712cc532b
"Shinshu Mars 3 yo 2011/2014 'Komagatake' (57%, OB, Japanese malt, 5200 bottles)","Shinshu Mars 3 yo 2011/2014 'Komagatake' (57%, OB, Japanese malt, 5200 bottles) This baby ex-sherry cask and American white oak cask. Absolutely love it that they proudly state ‘aged 3 years’ on the label. I must add that the ‘Revival’ version ad been much to my liking in April this year (WF 85). Colour: deep gold. Nose: of course it’s young, and of course the casks have done a large part of the job, but if you’re not firmly against custard, you’ll enjoy this. White chocolate, praline, vanilla, malt bar, honey, maple syrup, cake. You see what I mean. With water: raw malt, lilies, perhaps a touch of cooked cabbage (I’m not saying sulphur, not all), a pleasant mustiness… Smells a bit of spent lees at times. Dead yeast? Mouth (neat): yes. There’s an honest youth in this, some café latte, some buttered popcorn, some Virginia tobacco, some salted butter caramel (in Breton fashion), and an oaky grassiness in the background that puts it straighter – or it would have become too smooth/rounded. With water: very good. Earthy, grassy, pleasantly beerish, with a little mandarin to add pleasures… Finish: long, and really salty. Where does this salt come from? From the oak? Comments: only one word, smart. SGP:552 - 86 points.",86,2015-11-11,https://www.whiskyfun.com/archivenovember15-1-Armagnac-Brora-Clynelish-Caol-Ila.html,96bcbbcd5f9b7b81bb4d352c42739560236e61a580980e1cc79f9c3e4e648dc7
"Chichibu 2010/2014 'Chibi Daru' (53.5%, OB, Japanese malt, 6200 bottles)","Chichibu 2010/2014 'Chibi Daru' (53.5%, OB, Japanese malt, 6200 bottles) Ex-quarter casks. Hope the oak won’t dominate this baby, but I do trust these makers… Colour: full gold. Nose: hold on, we aren’t far from the Mars at all. This Chicihibu’s just a little more floral, and a little less grassy. Perhaps. A notch rounder, better polished, and then a little more mentholy. Patchouli, incense… In a way, it’s a little more ‘Japanese’. With water: pink grapefruits aplenty. Love pink grapefruits. Mouth (neat): excellent. Full, immediate, very satisfying, all on sweet barley and ‘moderate’ tropical fruits. Guavas, for example, and tinned pineapples. I find this extremely good. With water: becomes creamy, fruity, with, once again, pink grapefruits. Finish: quite long, oily, syrupy (but that’s good syrup). Pink grapefruits, really. And green tea. Comments: the result of a lot of care, and of little marketing. Marketing 101: make the best product you can. Then, market it. But who am I? No, seriously, it’s like at winegrowers’, the ones who make the best are the stars. Simple. All the rest is utter codswallop, and no army of brand ambassadors (love you lasses and lads) will manage to alter that simple equation. In the short run, perhaps, but in the long run, never. Ooh I need a last dram… And let’s make it that new Karuizawa I was talking about… SGP:561 - 87 points.",87,2015-11-11,https://www.whiskyfun.com/archivenovember15-1-Armagnac-Brora-Clynelish-Caol-Ila.html,7f4d1d2e648e7249b949cfb5e177d7f5a1061c41948062aadbb887cfda2910c5
"Karuizawa 1980/2015 (61.6%, OB, The Whisky Show)","Karuizawa 1980/2015 (61.6%, OB, The Whisky Show) Picture of a mock-up bottle. It does look a bit ‘Kim Jong-il’, doesn’t it. Colour: mahogany. Nose: never has any whisky been this close to an old cognac at cask strength. Raisins, peaches, rancio. And then, rather a mineral/medicinal development, with some tiger balm, bandages, and antiseptic (touches). Which you can find in old cognac too. We all know that old spirits converge, don’t we. With water: Vicks Vaporub! Not the first time we’re finding this in Karuizawa. That means menthol and eucalyptus galore, plus lemongrass. Mouth (neat): starts clean, on oranges and flints, and gets then more mineral/medicinal again. Drinking mercurochrome and liquid clay. That’s meant to be good for your stomach, mind you. I mean, liquid clay, not whisky at 61.6% vol.! Numbs your lips a bit. With water: becomes very mentholy. Crème de menthe, salted liquorice, menthol snuff… You need to be acquainted with this style. The problem might be that it does not swim too well, while it’s really too hot when undiluted. Or maybe buy an electronic pipette? Finish: very long, salty and mentholy, really extreme. Drinking a blend of seawater and mint eau-de-vie. Or perhaps overcooked manzanilla. Comments: love it because it’s so extreme. Extreme whiskies are any taster’s joys, because they’re anything but boring. On the other hand, as far as organoleptical science is concerned, this is almost pure heresy. You’ll find in this one any compound that ends with –ol. SGP:373 - 85 points.",85,2015-11-11,https://www.whiskyfun.com/archivenovember15-1-Armagnac-Brora-Clynelish-Caol-Ila.html,0976b8deb805c696e0dca1d08833ae6414e377c32e949bb0778ffebb31dbbc62
"Glenlivet 15 yo (57%, Gordon & MacPhail, licensed bottling, +/-1990)","Glenlivet 15 yo (57%, Gordon & MacPhail, licensed bottling, +/-1990) An all-time classic at 100°proof (UK). Colour: gold. Nose: you don’t even need to bring your glass to your nostrils to smell a lot of overripe apples. Harvesting apples in an orchard. In the background, a little clay. Other than that, yeah, apples and apples. I like apples, but I doubt this little Glenlivet will keep the doctor away… With water: a funny medicinal touch. Effervescent aspirin tablets, perhaps. Mouth (neat): amazing, even more apples, with oranges added into the basket. A little maple syrup, a touch of vanilla and caramel… In fact, this is liquid tarte tatin, not something that’s unusual with Glenlivet. With water: gets a little more honeyed, but there’s also more cider. We’re far from Calvados, though. Finish: medium, always on apples. Green apples. Cider apples… Comments: one of these very fine whiskies that made many whisky drinkers discover the pleasures of high strength. SGP:551 - 82 points.",82,2015-11-10,https://www.whiskyfun.com/archivenovember15-1-Armagnac-Brora-Clynelish-Caol-Ila.html,9d45092e99427a97a3f933768c3fb0cab5c06fcb3b6c82896a17b193bebc6b5d
"Glenlivet 16 yo 1988/2005 (58.1%, OB, Chivas Bros., Batch #GL 16 004, 50cl)","Glenlivet 16 yo 1988/2005 (58.1%, OB, Chivas Bros., Batch #GL 16 004, 50cl) Colour: pale gold. Nose: it’s amazing how close we are to the G&M. Same feeling of cut apples, plus a touch of chalk. Not much else I’m afraid, but this works. A kind of unpolished Glenlivet. With water: same slightly medicinal notes as in the G&M. Concrete, aspirin. Mouth (neat): quite raw, strong, with again apples, cider, young Calvados, a touch of caramel, and some grass. Roughish. With water: smoother of course, more honeyed. Stewed apples, tarte tatin, chalk, a little white pepper, a touch of orange. Finish: medium, on, guess what? Apples! Comments: a tad rougher than the G&M. Needs water. SGP:551 - 81 points.",81,2015-11-10,https://www.whiskyfun.com/archivenovember15-1-Armagnac-Brora-Clynelish-Caol-Ila.html,e367d6d0b820822d6076d8fec93f87c5ce862891968a3803563e1d68fddb6f1c
"Glenlivet 19 yo 'Tom a Voan' (54.1%, OB, single cask edition, cask #42705, 2015)","Glenlivet 19 yo 'Tom a Voan' (54.1%, OB, single cask edition, cask #42705, 2015) A single cask with an age but no vintage, that’s a bit bizarre… Colour: deep gold. Nose: this seems to be a case of a newer bottling being nicer than its older siblings, which doesn’t happen every day. Very pleasant honeyed freshness, some fudge and malt, light raisins, apples (of course), maple syrup, then cigarette tobacco and ‘sweet’ leather. Something floral as well (lime tree). Very nice! With water: really very nice. Orange blossom, earl grey, artisan apple pie, honeydew… Mouth (neat): really very good, sweet and softly sherried, very honeyed, with raisins and a touch of mentholy earth. Perhaps a touch of rancio as well, then more grassy, chlorophilly notes. With water: a little praline and chocolate, and also more grassy tea. Swims very well. Finish: medium, as almost always with Glenlivet (when it’s not heavily sherried). Drinking earl grey while eating apple cake (with your old auntie). Comments: classic and classy Glenlivet, and it’s very ‘Glenlivet’. SGP:651 - 88 points.",88,2015-11-10,https://www.whiskyfun.com/archivenovember15-1-Armagnac-Brora-Clynelish-Caol-Ila.html,d60f372892fe3f38742e8bc68bdc8924b337d410f0d5d2a7c8f898171c43bc4c
"Glenlivet 18 yo 1996/2015 (46%, Signatory Vintage, Un-Chillfiltered Collection, first fill sherry butt, cask #83266)","Glenlivet 18 yo 1996/2015 (46%, Signatory Vintage, Un-Chillfiltered Collection, first fill sherry butt, cask #83266) This one should have more sherry, that’s why we’re having it now. Colour: dark amber. Nose: not my first lovely middle-aged sherried Glenlivet by Signatory Vintage. This one’s moderately gamy/meaty, but it’s got tobacco and smoked teas, plus a molassy rumness and a touch of mint. A Jamaican-Andalusian Glenlivet? Sort of. Really like the oranges and the toffee-ed raisins. Mouth: perfect. Pipe tobacco, orange liqueur, drops of Demerara rum, overripe apples, then more drying chocolate. Van Houten’s old cocoa powder. Nice grassy tropical fruits. Mango skin, perhaps? Finish: medium, a wee tad drying, but the grassy/orangey freshness works well. A touch of ham and drying oak in the aftertaste. Comments: excellent, as expected. Only the slightly drying finish didn’t please me as much. SGP:462 - 86 points.",86,2015-11-10,https://www.whiskyfun.com/archivenovember15-1-Armagnac-Brora-Clynelish-Caol-Ila.html,55ba67f74a3ba3618a9f5b2a1c43d76862074d688493694bd85eab4df6f0a26d
"Glenlivet 19 yo 1995/2015 (58.1%, Signatory Vintage, Cask Strength, sherry butt, cask #166951, 526 bottles)","Glenlivet 19 yo 1995/2015 (58.1%, Signatory Vintage, Cask Strength, sherry butt, cask #166951, 526 bottles) Colour: dark amber. Nose: this one hasn’t quite got the cleanliness of the 1995, but it’s got many grasses and herbal teas. Hay, dog rose, hawthorn, orange blossom… All that on a bed of prunes and raisins that make it a little armagnacky. Plus chalk and fresh cement. After a few minutes, loads and loads of chocolate. With water: tobacco, as almost always. Water very often brings tobacco out of heavy sherried whiskies, in my experience. Mouth (neat): rich, very chocolaty, orangey, with a rather old-school sherry influence, and a salty tartness in the background. A salted Mars bar or something, minus all this deadly sugar. With water: hurray! Fresher, with more orange juice and marmalade. A mineral touch as well, between gunflints and chalk. Finish: quite long, leathery and chocolaty. Leaves your palate relatively clean, which can’t be said all the time. Comments: probably first fill. High quality. SGP:552 - 88 points.",88,2015-11-10,https://www.whiskyfun.com/archivenovember15-1-Armagnac-Brora-Clynelish-Caol-Ila.html,179985892dc8eec12f30079c8a7ab76a4a77bf1030b0d488c126486c9b3e279f
"Glenlivet 33 yo 1981/2015 (52.2%, Signatory Vintage, for The Whisky Exchange, refill sherry, cask #9468, 154 bottles)","Glenlivet 33 yo 1981/2015 (52.2%, Signatory Vintage, for The Whisky Exchange, refill sherry, cask #9468, 154 bottles) Older and refill, this might work. Previous sister casks had been excellent, and rather fairly priced, which is the case again by today’s standards (£199). Colour: gold. Nose: smells official. I know, a rather stupid comment, but I mean it. Apples and chalk, raisins and clay. Not much else to say. With water: a little humus and mushrooms, which I always love in my whisky. Chives? Mouth (neat): love it. Apples, cigarette tobacco, tea, leather, walnuts from the sherry, some cinnamon… Balance is achieved, the strength is perfect, it goes down well, it’s quite complex… We’re approaching the 90-mark in my book. Water will decide… With water: check. Honey, ripe apples, oranges… Finish: medium, clean, fresh, complex. Custard, honey, apple cake, earl grey, wulong…. Comments: it’s the balance that’s impressive. Some sherry, but not too much sherry, and the Glenlivetness that’s still there. The wonders of refill sherry! SGP:451 - 90 points.",90,2015-11-10,https://www.whiskyfun.com/archivenovember15-1-Armagnac-Brora-Clynelish-Caol-Ila.html,49fee4b91293a5e8cbf0ed8461517d85105012c713d9134f1f9c13b16bf4fade
"Glenlivet 18 yo ‘Hand-Filled’ (50.7%, OB, cask #2, 2014)","Glenlivet 18 yo ‘Hand-Filled’ (50.7%, OB, cask #2, 2014) A bottle filled at the distillery by my friend Tomislav. You can’t beat the taste of friendship. Colour: gold. Nose: this one reminds us that Glenlivet doesn’t always need sherry. Sunflower oil, apples, acacia honey, dandelions, malted barley, custard, pollen… It’s well-aged Glenlivet au naturel, in all its glory. With water: perfect! Ex-bourbon soft fruits and cakes and honeys. Very soft, delicate, and well, perfect. Mouth (neat): coating and vanilled, then fruitier than fruits, with a feeling of Haribo’s best and all kinds of tinned fruits. Even litchis. With water: grape pie, acacia honey, custard, lemon curd, Danish pastries, sunflower oil, pollen… Spring is here! (did it occur to you that we’re in the midst of November, S.?) Finish: medium, soft, elegant, honeyed, fruity… Tea in the aftertaste, both green and black. Comments: we’re bordering perfection. Thank you, Tomislav! SGP:551 - 88 points.",88,2015-11-10,https://www.whiskyfun.com/archivenovember15-1-Armagnac-Brora-Clynelish-Caol-Ila.html,c36429205645bc99033a044ae559bf00d77264be68ae65077e7b7c602a8692c2
"Dailuaine 16 yo 1997/2013 (46%, Signatory Vintage, Un-chillfiltered Collection, casks #10178-10179, 739 bottles)","Dailuaine 16 yo 1997/2013 (46%, Signatory Vintage, Un-chillfiltered Collection, casks #10178-10179, 739 bottles) I’ve tried a pretty good 15 yo in the same series. Colour: white wine. Nose: totally on malted barley, with also sweets and sweet ale, plus tinned pears. Whiffs of baker’s yeast, and a faint waxiness that makes it rather fatter than others. Mouth: a feeling of quaffing concentrated ale, and I cannot not not think of Brewdog’s famous cold-distilled beer. Slight prickliness, something burnt/malty, bitter oranges. Not a light and easy one! Some cloves as well, cinnamon cake, nutmeg… Finish: rather long, very malty, slightly burnt. Comments: I find this one good, for sure, but a tad difficult because of this feeling of very strong beer. Unless, of course, you love very strong beer. SGP:461 - 78 points.",78,2015-11-09,https://www.whiskyfun.com/archivenovember15-1-Armagnac-Brora-Clynelish-Caol-Ila.html,5f67e5274ea2db7cba3546eb6de8448ce9e88ca9c02dc9b782d216cd7f3e3333
"Dailuaine 17 yo 1996/2014 (51.9%, Archives, hogshead, cask #10607)","Dailuaine 17 yo 1996/2014 (51.9%, Archives, hogshead, cask #10607) Colour: white wine. Nose: very same style as that of the Signatory, with just a little more citrus and more vanilla. Other than that, same-ish waxiness, malt, and notes of fruity hops. Well, Californian IPA. A little lemongrass. As they say in whisky blogging, ‘nice!’ With water: some linseed oil, grapefruit juice, and muesli. Swims well. Notes of fresh brioche, near-yeasty. Mouth (neat): it hasn’t got this burnt malt, it’s rather got oranges and honey, plus tangerines. And, indeed, sweet malt. Pleasant fatness on your tongue, it’s pretty oily malt whisky. With water: a touch of coffee-schnapps. Choose your coffee, choose your schnapps. Finish: rather long, malty, a wee tad burnt just like the Signatory. Oranges are back in the aftertaste. Comments: all fine. Excuse me, all nice. SGP:551 - 83 points.",83,2015-11-09,https://www.whiskyfun.com/archivenovember15-1-Armagnac-Brora-Clynelish-Caol-Ila.html,b94679c76354fa5af6d7274a3555ed87438e5e413aee0da201f0fec30735ec1c
"Dailuaine 34 yo 1980/2015 (50.9%, OB, Special Release, 2952 bottles)","Dailuaine 34 yo 1980/2015 (50.9%, OB, Special Release, 2952 bottles) This baby ex-refill American oak. BTW, these came with a magnificent little black book full of trivia, and I’ve just learned that Dailuaine welcomed the very first pagoda roofs in Scotland, in 1889. Knowledge is power! Colour: gold. Nose: yessss, a beehive! I’m not sure why or when these very obvious notes of beeswax, pollen, nectar and ‘delicate pinewood’ do occur, but I just love them. What’s sure is that they’re never to be found in young whiskies – let alone NAS, ha-ha. So plenty of honeyed notes, honeydew, pinesap, mead, overripe pears, then rather tangerines, a touch of cardamom, rosehip… I’m all for this! With water: more towards Seville oranges, a little ginger, some polished wood, and Alsatian bredala (Christmas cookies). Rather less beehivy notes. Mouth (neat): a touch of fizzy wood, with lime, pepper and ginger, then a honeyed development, rather around eucalyptus honey, and perhaps a drop of mojito. Really. The honey really coats all this. With water: once again, water makes it spicier and rather less honeyed. Ratafia, orange cordial, ginger cookies… Finish: medium, with spices and a return on sweet barley. Comments: impeccable old Dailuaine. SGP:561 - 89 points.",89,2015-11-09,https://www.whiskyfun.com/archivenovember15-1-Armagnac-Brora-Clynelish-Caol-Ila.html,5c682a58ffda815a238875d748a4cf74d619ef1916f395089303a30be6c7c88d
"Espero 'Reserva Exclusiva' (40%, OB, Dominican Republic, +/-2015)","Espero 'Reserva Exclusiva' (40%, OB, Dominican Republic, +/-2015) Ouch, the Dom Rep… I’ve had one with a different label (orange instead of green). That one wasn’t bad. Colour: gold. Nose: not much. Smells sweet, with bananas, corn syrup, light honey, tinned fruits, sweet mouthwash for kids, strawberry jam… Mouth: a liqueurish rum. It’s not that it’s bad, it’s just that anyone will notice that this isn’t a straight spirit. Very syrupy, full of sugar, with notes of Fanta and Wrigley’s Juicy Fruit. Dissolved jelly babies. Now, I find it better than Don Papa (which ain’t that hard to do if you ask me). Finish: medium, extremely sweet and syrupy. Feels flavoured, but there are flavours of sugarcane. I know, that’s the i. Comments: there’s much worse, but as a possible malternative, it’s very lousy. And unbalanced. SGP:720 - 68 points.",68,2015-11-08,https://www.whiskyfun.com/archivenovember15-1-Armagnac-Brora-Clynelish-Caol-Ila.html,373d1a8debdb527b500d9935672208934bb3c76270b67112a17d913887f542b5
