whisky_name_raw,review_text,score,review_date,source_url,dedupe_hash
"Caol Ila 25 yo 1990/2015 (54.3%, Wilson & Morgan, Barrel Selection, oloroso finish, casks #4707-4708, 408 bottles)","Caol Ila 25 yo 1990/2015 (54.3%, Wilson & Morgan, Barrel Selection, oloroso finish, casks #4707-4708, 408 bottles) A five-year finishing, that’s a little more than a finishing, while not quite being a double maturation. Shouldn’t we call this a finuration? Nah, not particularly proud of that one. Colour: amber. Nose: sherry plus peat is a hit or miss combination. This would rather be hit, but that’s no surprise, since W&M have already had quite a few great oloroso-ed Caol Ilas. So, roasted nuts, bitter chocolate, gunpowder (not in a sulphury way at all), old coal stove, and just ‘a gun’. With water: whacky, in a great way. Swiss cheese, Havana cigars, soot. Mouth (neat): oh, excellent! It hasn’t lost its sharpish peatiness, but it’s gained this leathery chocolatiness from the sherry. It’s also got citrus and salt, all for the better. With water: perfect. Smoky hot chocolate and orange liqueur. Finish: medium to long, with added notes of benzine and burnt cigars. Herbal liqueur in the aftertaste. There, Unicum! Comments: very well done. Wilson e Morgan are becoming masters of this style – not that they weren’t already quite good. SGP:466 - 90 points.",90,2015-11-04,https://www.whiskyfun.com/archivenovember15-1-Armagnac-Brora-Clynelish-Caol-Ila.html,ff5ffe74d4c70c31374da645b293d83dcb3bd41f59d77e7c6ca57e363b471079
"Caol Ila 30 yo 1984/2015 (50.5%, La Maison du Whisky, Artist #5, hogshead, 205 bottles)","Caol Ila 30 yo 1984/2015 (50.5%, La Maison du Whisky, Artist #5, hogshead, 205 bottles) New stuff by the good people at Signatory Vintage bottled for the good people at LMDW in Paris. Now 1984 was a very lousy vintage in Bordeaux… (WTF?) Colour: gold. Nose: that’s the problem with well-aged Caol Ilas, they’re unsurprisingly nice. Seashells, lemon liqueur, resinous peat (putty-like), marzipan, almond oil, carbon paper, old books, a touch of rubber (new wellies)… With water: younger! So not a grandma at all, all it needed was a little water (and not cream sherry…) Mouth (neat): just bloody good, as they say on Islay. Big, peaty, salty, citrusy, oily, a tad sappy, getting grassier (green walnuts)… It’s quite youthful given its age. Could as well have been 15 years old. Finish: ooh, lemons and citrons come out, together with more sharpy almondy aromas. Barley water, putty, linseed oil, all that. The peaty remains heavy. Comments: thirty years, do you mean, fifteen plus fifteen? Because this is bright and youthful. And absolutely excellent. Loved the almondy side. Almost a peat monster. SGP:457 - 90 points.",90,2015-11-04,https://www.whiskyfun.com/archivenovember15-1-Armagnac-Brora-Clynelish-Caol-Ila.html,296b7835051c9df9806b03c0688dead9a1b1cfd0ed8226bf6ddcc29594eb2399
"Port Askaig 30 yo (45.8%, Specialty Drinks, +/-2015)","Port Askaig 30 yo (45.8%, Specialty Drinks, +/-2015) Loved the one at 51.1% (WF 90) and loved and earlier one at 45.8%, circa 2009 (WF 90). So this might get a tad boring… Colour: pale gold. Nose: an under-Ardbeg, not meaning it’s inferior, not at all (and hey, do Ardbeg have 30 yo whisky these days anyway?) but this combination that involves citrus, sap, almonds, and anything coastal and medicinal, is just irresistible. In fact, a great green tea from Yunnan (single wild tree et al) could nose just like this. But great teas are more expensive, mind you. Mouth: great, grassy, smoky, salty, a little green and gritty. Green apples and fresh walnuts. The nose made me think I could go up to 91, but I’m afraid this relatively rough palate will prevent me from doing so. But it’s great. Finish: indeed it’s great. Lemon, sap, hessian, soot, salmiak… Comments: Caol Ila ages gracefully, like an actress. I mean, it can taste younger than it is, and this is another fine example. SGP:467 - 90 points (I agree, bo-ring).",90,2015-11-04,https://www.whiskyfun.com/archivenovember15-1-Armagnac-Brora-Clynelish-Caol-Ila.html,d13b7149d9b3892441b33ede8ec12d5cf62f9d954b0b6300513e8db4d81cacb2
"Caol Ila 31 yo 1983/2015 (48.1%, Signatory Vintage for The Whisky Exchange, cask #5294, 255 bottles)","Caol Ila 31 yo 1983/2015 (48.1%, Signatory Vintage for The Whisky Exchange, cask #5294, 255 bottles) Colour: gold. Nose: old herbal liqueurs, old papers, long-forgotten herbal liqueurs (I insist), mouth wash, cactus, chlorophyll, today’s newspapers, fresh paint, parsley… It’s a rather herbal one, apparently. Also chicken soup, and not much smoke. But do we really need smoke? Mouth: yeah well. It’s young, it’s fresh, it’s even kind of immature, with herbs and grasses and green spices. On the other hand, there’s this feeling of fresh putty and paint that’s so lovely. Let’s call it ‘resinous’. Finish: medium, leafy, sappy, herbal. Comments: if I say I like the Port Askaig 30 a little better, are they going to shoot me around Borough Market? Could I still have this funny ale they’re pouring over there (the name escapes me)? SGP:456 - 88 points.",88,2015-11-04,https://www.whiskyfun.com/archivenovember15-1-Armagnac-Brora-Clynelish-Caol-Ila.html,2827d672d7c46487b6cc1b3a891395a365803a9b089300c647696937cf289a0b
"Caol Ila 2003/2015 (57.4%, Gordon & MacPhail, for Ramseyer, first fill bourbon, cask #302237)","Caol Ila 2003/2015 (57.4%, Gordon & MacPhail, for Ramseyer, first fill bourbon, cask #302237) To be honest, there are young Caol Ilas that taste older than older ones. And the other way ‘round (ooh my head). Probably a matter of cask. Colour: straw. Nose: raw, vegetal, with potato peelings and a lot of muesli and porridge. Mashed potatoes. At least, we remember that there’s grain inside. With water: wet textile, wool, and dogs. Don’t care about you dogs, I prefer cats. Mouth (neat): pears and earth, plus tobacco and ginger, plus plasticine and smoked almonds. Sometimes, youth is an asset. With water: pears coming out, brine, apple and lemon juices… Finish: very fine, but you just can’t avoid the feeling that there are hundreds of thousands of such casks sleeping over there in Scotland, however good. Salty aftertaste. Comments: good. Many are good. It’s an industry, ya know. No offense, I hope. SGP:466 - 83 points.",83,2015-11-04,https://www.whiskyfun.com/archivenovember15-1-Armagnac-Brora-Clynelish-Caol-Ila.html,067cd7bbd2d632f0465511603dede9e927de383be20e835d1dfa8d6885849c7c
"Caol Ila 5 yo 2008/2014 (46%, Douglas of Drumlanrig, refill hogshead, cask #10569, 409 bottles)","Caol Ila 5 yo 2008/2014 (46%, Douglas of Drumlanrig, refill hogshead, cask #10569, 409 bottles) They’ll soon sell us barley plus yeast ;-). Colour: white wine. Nose: pure, clean, immaculate. Totally Caol Ila. Ashes, almonds, smoke, crabs, seaweed, white peaches, barley. Mouth: embarrassingly perfect. I’m dead sure this is too young, but the zesty peatiness manages to offset the (probable) feinty notes that must be there, but that you just won’t detect. I mean, I imagine. Perhaps touches of bananas? I some way, it reminds me of the 5yo Taliskers by the same bottlers (in other series). The purity does the job – and who needs complexity in that case? Finish: medium, sweet. Can you smoke sugar? Limy and mentholy aftertaste. Comments: I do not think a 5 years old whisky can get better than this. SGP:456 - 84 points.",84,2015-11-03,https://www.whiskyfun.com/archivenovember15-1-Armagnac-Brora-Clynelish-Caol-Ila.html,b634410d5e727dcae07cd69efb4a0421e48390ce53e5aa2cb04cf687be0d9682
"Caol Ila 12 yo (43%, OB, +/- 2015)","Caol Ila 12 yo (43%, OB, +/- 2015) Another one that we’re trying to follow almost every year. Colour: pale straw. Nose: a longer ageing seems to have imparted more mineral notes, as well as a ‘wider’ coastalness. Iodine, seaweed, bandages, fresh baguette (dough), then rather citrus, as expected. Lemons, grapefruits, a little wet chalk. Bonfire on the beach. Mouth: hey, this burst and roars, and it’s not afraid of the stronger 5yo at all. In fact I find more smoke, more ashes, and more medicinal notes, and while re-reading my notes for last year’s version, indeed I just cannot understand why some folks would call this a ‘lighter peaty Islay’. Agreed, it’s not extremely fat on your palate, but it’s shock-full of peaty/ashy flavours. Even at 43% vol. Finish: long, with a perfect balance between coastal smoke and zesty fruitiness. The aftertaste is very ashy. Comments: up one point. Bargain. SGP:356 - 85 points.",85,2015-11-03,https://www.whiskyfun.com/archivenovember15-1-Armagnac-Brora-Clynelish-Caol-Ila.html,23ee612a2ff485dac90887490628c456d73ce5a12e5759d66a41648ca5315e5d
"Caol Ila 'Moch' (43%, OB, +/-2015)","Caol Ila 'Moch' (43%, OB, +/-2015) I’m really wondering if they’re selling much of this in France, or in French-speaking Belgium, Canada, or Switzerland. Because as I may have written before, moch/moche means ugly or awful in French. But I haven’t found it moche when I first tried it a few years ago (WF 83). Colour: straw. Nose: I’m glad we’ve had the 5yo before, because this is so similar that they’re almost undistinguishable. This Moch is perhaps a tad ashier, and a notch less fruity. But after two minutes, it’s the other way ‘round. Mouth: indeed. Somewhere between the 12 and the 5yo. Ashes, smoke… The smoke’s a tad acrid, perhaps, but I guess that was the plan. Plenty of soot. Finish: medium, sooty, ashy, with a little lemon liqueur in the background. Comments: perhaps a tad monolithic after the lovely 12, but it does the job. But wouldn’t it be possible to name it ‘Joli’ for France? ;-) SGP:346 - 83 points.",83,2015-11-03,https://www.whiskyfun.com/archivenovember15-1-Armagnac-Brora-Clynelish-Caol-Ila.html,2b59eadbe63027c827f1ed1a78d7dfff9728be8621b2d262de2a9be60cddaf8a
"Port Askaig 16 yo (45.8%, Specialty Drinks, 2015)","Port Askaig 16 yo (45.8%, Specialty Drinks, 2015) A vatting of sherry and bourbon casks. Obviously, we have no proof that this is Caol Ila. Neither should the strength suggest this is Talisker. Colour: gold. Nose: ‘when I smell green olives, I’m happy’ used to say a Provençal writer of noble London descent. The fact is that this nose is superb, with something antiquated that would hint at the 1970s on Islay. New scuba diving suit, ink, garden bonfire, smoked fish… And olives! Mouth: perfect. All of the above plus a touch of mocha, maybe from the sherry casks. Extremely well composed. Finish: long, both elegant and full. Salty marzipan, brine, coffee toffee. Sadly, no more olives. Assertive (as they used to say in Palo Alto), very ashy. Comments: an impressive composition, true to the distillery. Loved the oily profile, some parts remind me of the first Ten that Ardbeg had after Glenmo had bought the distillery. You know, ‘introducing Ten years old’… SGP:447 - 89 points.",89,2015-11-03,https://www.whiskyfun.com/archivenovember15-1-Armagnac-Brora-Clynelish-Caol-Ila.html,5ad3a3a6e38c2b68e9875494e8ed2a684188991327783799f5f33dc83155ebea
"Caol Ila 17 yo 'Unpeated Style' (55.9%, OB, Special Release, 2015)","Caol Ila 17 yo 'Unpeated Style' (55.9%, OB, Special Release, 2015) This is the brand new unpeated-but-still-a-little-peated ‘Highlands Caol Ila’. More ‘less peated than normal’ than unpeated according to previous batches, but let’s see… If there’s no peat at all, it’ll die anyway after the Port Askaig. Colour: gold. Nose: indeed, this is rather lightly peated. I’d love to hear Diageo’s blenders on when they first got these batches. So, this is getting rather complex, with herbal teas, eucalyptus, damp earth and leaves, a touch of liquorice wood, old boughs… It’s only after a good three minutes that lighter and fruitier notes come through Around barbecued marshmallows, perhaps. With water: gets herbal and rather mentholy. I find it grassier than the earlier 14, for example. Now I love these waxy tones, the paraffin, the linseed oil… Mouth (neat): really tastes like some Glenkinchie into which someone would have poured a little ‘regular’ Caol Ila. Herbs, mint, banana sweets, pineapple drops, melissa… With water: not at all, S. Fatter, more ‘Highlands’, and much more on citrus. Some salt coming through. Takes water very well. Finish: medium, with an unexpected smoky return. More salt in the aftertaste. Perhaps ‘ideas’ of bay leaves. Comments: very very good, just a little hard to follow. That’s me, obviously. A malt unlike any other. SGP:652 - 85 points.",85,2015-11-03,https://www.whiskyfun.com/archivenovember15-1-Armagnac-Brora-Clynelish-Caol-Ila.html,cf9af0329dc6010d8d1fb2beca66d9a4feb71d759f2ac247b6dbd521c2aabf76
"Caol Ila 12 yo 2003/2015 (58.1%, Adelphi, cask #301266, 285 bottles)","Caol Ila 12 yo 2003/2015 (58.1%, Adelphi, cask #301266, 285 bottles) Adelphi had a great sister cask in 2013 (#301261, WF 88). Colour: gold. Nose: it’s an almondy one, which I love. Opening a pack of smoked almonds. Plus seawater, citrons, ‘good’ rubber, green tobacco, and flints. With water: some green oak coming out. Not too sure… Noses a bit like some ‘craft’ Caol Ila made by some mad craft American distiller (between two trials, haha). All these spices… Mouth (neat): a leafy sucrosity and plenty of green spices. This is not for everyone, if I may, there’s a lot of spicy oak extracts in there. Cardamom, nutmeg, ginger, bitter almonds, walnuts… You have to like this. With water: definitely, it’s about to lose its Caol-Ilaness. A cask that was more active than Lady Gaga on acid. Finish: long, with green tannins and spices. Comments: Adelphi often like to offer monstrous whiskies – in a good way. This is one of them, and it really is spectacular. As if they’ve used new octaves. It’s just not very Caol Ila anymore, in my very humble opinion. SGP:476 - 78 points.",78,2015-11-03,https://www.whiskyfun.com/archivenovember15-1-Armagnac-Brora-Clynelish-Caol-Ila.html,789f8a8892e557fb60641bc846815469a3a99259f26b09d3915b4fb16c47e9a7
"Brora 1978/2013 (46% Gordon & MacPhail, Rare Old, lot #RO/13/05)","Brora 1978/2013 (46% Gordon & MacPhail, Rare Old, lot #RO/13/05) Last year’s Special Release, a 35 years old, was a 1978. It was just fab (WF 93). But this one’s been reduced – strange habit – so things may be a little different. Colour: bronze amber. Nose: whaaat? But his is perfect! Immediately tertiary, with no primary or secondary notes at all (malt, oak, sherry…), rather an avalanche of greases and waxes for starters, then a lot of tobacco, teas, engine oil, old chartreuse, old car engine (Bakelite, old rubber) and the largest collection of mushrooms ever. Our dear old pu-erh tea, and it’s flying high. Impressed, despite a very moderate smokiness. Mouth: the oak’s perhaps a little more noticeable, and this is not your usual Brora (as far as Brora can be usual), since all what we’re getting in the arrival is a lot of smoked meat and ham. So this Brora is very bacony, before more oranges and tar take the lead. Some salt, some chocolate, a sooty side... We’re not very far from G&M’s 1982s, but I like this one better (but maybe less than G&M’s stunning 1972s!) Perfect mouth feel, 46% vol.’s never been a bad strength, in fact. Finish: quite long, very chocolaty, with touches of prunes, some salt, and more oranges and bacon. Probably sherry casks! Perhaps refill… Comments: I have to confess I was a bit scared, but this is absolutely terrific. SGP:454 - 93 points.",93,2015-11-02,https://www.whiskyfun.com/archivenovember15-1-Armagnac-Brora-Clynelish-Caol-Ila.html,1769fbc3f7751bdf9288bd5c7f24338a71ec8058a447c73a0bc05e2faa04b33b
"Brora 37 yo 1977/2015 (50.4%, OB, Special Release, 2,976 bottles)","Brora 37 yo 1977/2015 (50.4%, OB, Special Release, 2,976 bottles) High expectations, high expectations… Especially since the 35 yo bottled in 2013 was a 1977 as well, and fetched a well-deserved 95 points mark in my little book. Colour: gold. Nose: Brora seems to be indestructible. I can well imagine in 2037, on Whiskyfun, a 65 years old 1972 Special Release being tasted. Stocks are said to be low, but they always said that, and they still managed to vat around ten casks this year. The result is amazing, curiously softer than the G&M and more herbal, more coastal as well, and perhaps a little smokier too. Less sherry for sure, so less tobacco and chocolate. There are the trademark farmy touches (hay), then oysters and chartreuse, then more resinous notes, between pinesap and artisan absinth. Astounding complexity, as expected. With water: superb sappy oil extracts. Old candle, linoleum, bandages, embrocations, verbena, wormwood… and mud. Mouth (neat): huge, ashy, almost drying, in a good way. This one reminds us that 1977 was still a peaty year at Brora. More absinth, tarry smoke, liquorice, salted fish, with a mouth feel that’s becoming oilier and creamier. Touches of salted chestnut honey, which gives it a Chinese side, in a way. Huge whisky. With water: exceptional. Dry, coastal, liquoricy, herbal, both fat and chiselled. The best cough syrup ever. Finish: perhaps not extremely long, but all these herbs, liquorice and cough drops just work in sync. It’s the freshness that’s most impressive. Comments: one of 2015’s grands crus, no doubt, together with some of the Karuizawas. Hey, next time, could someone sell a blend of Karuizawa and Brora? You could call it either Karuibrora or Brorazawa. I’m sure that would make it to 97 points if it’s well made, serious. Hint, hint, John Glaser… In any case, this one beats last year’s in my book. SGP:465 - 95 points.",95,2015-11-02,https://www.whiskyfun.com/archivenovember15-1-Armagnac-Brora-Clynelish-Caol-Ila.html,ff7b8855aeb5362fd348267338a75b28370526784e8da0fae9fcf367eecea29b
"Domaine de Charron 2003/2015 (50.5%, OB, Bas-Armagnac)","Domaine de Charron 2003/2015 (50.5%, OB, Bas-Armagnac) This little Domaine only mature their Armagnacs in new French oak, and always bottle at cask strength. Quality-oriented, obviously. Colour: amber. Nose: you instantly understand that you’re in front of some quality spirit, even if it’s got a wee ‘international’ style because of some whiffs of toasted oak. Perfect notes of sultanas, panettone, white chocolate, then rather stewed white peaches, covered with some coffee and chocolate sauce. And a touch of earth for good measure. With water: oh great, tertiary notes! We’d love to see more tertiary notes in new malt whiskies. Rancio, tobacco, cough syrup, perhaps a touch of umami (yes, in the nose)… Mouth (neat): absolutely excellent, and a bit ‘meta’ again, with suggestions of rhum agricole and malt whisky beyond the prunes and the raisins. A touch of old PX or even Sauternes, and always this toasted oak. With water: fudge, malt, toasted bread, roasted raisins. Finish: quite long, a tad gritty as young Armagnac should be, with some coffee in the aftertaste. Comments: this session starts extremely well. A genuine malternative – well, it’s more to my liking than many malts. SGP:551 - 86 points.",86,2015-11-01,https://www.whiskyfun.com/archivenovember15-1-Armagnac-Brora-Clynelish-Caol-Ila.html,a7412991a2fde2b36bf6f8357bfa6ca2774ff2585d63ca8cd74abd40287d6ead
"Château Garreau 1998 (40%, OB, Bas-Armagnac, +/-2014)","Château Garreau 1998 (40%, OB, Bas-Armagnac, +/-2014) Picture without the vintage. The good people in Armagnac are so laid-back and sometimes ‘unconcerned’ that it’s almost impossible to find acceptable pictures of their bottlings on the Web. This one’s also got one flaw that’s to be seen almost everywhere down there: a very low strength. Colour: dark amber. Nose: more classic Armagnac, straight on prunes and raisins, plus cake and roasted chestnuts. I enjoy these touches of wood smoke, and even the wee notes of bacon (that’s recently become highly carcinogenic, apparently). A style that my father used to enjoy, and before him my grandpa, and before him my… Mouth: yeah, even after a long break, it suffers a bit after the stronger Charron, and indeed it’s more classic Armagnac, with a grapy side, more prunes, tea tannins, stewed fruits, a touch of honey… Perfectly acceptable, just not extremely interesting. Finish: a bit short, becoming drying. Rosehip tea, perhaps? Some caramel. Comments: my father, and before him my grandpa, and before him my grand-grandpa would have liked this. I find it a tad un-modern. SGP:551 - 78 points.",78,2015-11-01,https://www.whiskyfun.com/archivenovember15-1-Armagnac-Brora-Clynelish-Caol-Ila.html,a6df8aad97cde27feb8e750e130ac86bb96e4f2551d791fa3a1dcd6f497fa9fd
"Château Garreau 1996 (40%, OB, Bas-Armagnac, +/-2014)","Château Garreau 1996 (40%, OB, Bas-Armagnac, +/-2014) Colour: deep brownish amber. Nose: rounder, more chocolaty, more roasted, more cake-y. Roasted pecans, roasted raisins, brioche, then orange blossom and a little lemon balm, which is lovely, then a touch of earthy rye that comes together with a little old wood. I really like this nose, let’s hope the palate won’t be too flabby… Mouth: not! Excellent, starting with orange marmalade, and going on with some orange zests covered with chocolate, perhaps watermelons and strawberries, then a funny touch of moscatel. Great maturity, good body. Finish: medium, quite fruity, with some depth. Oranges, a little honey, sultanas. Comments: a sipper. You could watch just any stupid TV show with this in hand. Even Jeb Bush talking about France. Yeah, this Armagnac is that good. SGP:641 - 84 points.",84,2015-11-01,https://www.whiskyfun.com/archivenovember15-1-Armagnac-Brora-Clynelish-Caol-Ila.html,152b21a3d7d5c92abe1bf88fdaee7060aa9f88b795ceca2d2f6b1a82a27fccb8
"Domaine de Charron 1995/2015 (48.9%, OB, Bas-Armagnac, cask #52)","Domaine de Charron 1995/2015 (48.9%, OB, Bas-Armagnac, cask #52) Colour: bright amber. Nose: perfecto. Oranges, quinces, orange blossom, oak vanilla, mango chutney, stewed peaches, sultanas, ripe mirabelles. Very fruity, perfectly fresh and balanced, extremely seductive (and yet absolutely not whorish). This will be quick. Mouth: the oak imparts hints of well-matured bourbon, but there’s also a little cooked wine, Marsala, then cinnamon cake, stewed peaches, golden raisins, a touch of chocolate… It’s the freshness that’s really impressive here. Finish: rather long, fresh and fruity, with touches of pencil shavings, vanilla, and more stewed peaches. A drop of mint essence in the aftertaste – for the road. Comments: totally a malternative. Like old-style Macallan? You may try this! (for a fraction of the price). SGP:651 - 88 points.",88,2015-11-01,https://www.whiskyfun.com/archivenovember15-1-Armagnac-Brora-Clynelish-Caol-Ila.html,6d0b6f857bebde4ab709a9fe5b77d0ca78f5d35306e7b06b8d6efb4a871aa5fa
"Domaine Lous Pibous 1994/2015 (53.7%, L'Encantada, Bas-Armagnac)","Domaine Lous Pibous 1994/2015 (53.7%, L'Encantada, Bas-Armagnac) Some pure folle blanche, selected by some crazy young independent bottlers down there in Gers. We’ve already tried some gems from them. Cask strength, no filtration, no colouring… Colour: dark red amber. Nose: this one’s rounder and thicker, apparently. More rich honey, prunes, raisins, jams and marmalades… Before some very lovely floral notes arise, such as lilies, perhaps. I’m asking you, who needs some sherried Speysider when you can buy this? (ooh, I can hear some flak coming my way)… With water: some fresh oak, then putty, whiffs of grass smoke, cigars, earth… Shall e call this one ‘the malt killer’? Mouth (neat): exceptional. Brilliant jammy fruitiness (oranges, quinces, plums) with a citrusy underline, and just the right amount of honey and maple syrup. And agave syrup. Man this rocks. With water: it’s one of these spirits that can be both ultra-focussed and complex. Adore these oranges, the fine spices, the herbal touches… Finish: long, appropriately drier and grassier. Leaves your palate clean! Comments: very impressed. In this case, it’s not a malternative, malt is becoming a brandinative (hey?), just like it was one century ago. SGP:651 - 90 points.",90,2015-11-01,https://www.whiskyfun.com/archivenovember15-1-Armagnac-Brora-Clynelish-Caol-Ila.html,50fe90c6e365a51c6f7b04a863f9d974064f678eab8ca26c413775f6acb976f6
"Domaine de Charron 1994/2015 (49%, OB, Bas-Armagnac)","Domaine de Charron 1994/2015 (49%, OB, Bas-Armagnac) I believe Charron do baco. Again, genuinely cask strength, no additives… In short, as Dame Nature intended. Colour: deep amber. Nose: oh great, we’re having a fight between L’Encantada and Charron. It’s Ali vs. Frazier! Once again, this style is a tad more ‘contemporary’, with more vanilla and oak, but everything mingled to perfection. Exceptional roasted nuts of all kinds, herbs, rubbed orange skin, walnuts, quinces, apricots, tobacco, a wee bit of ham again… I find this totally exceptional. Also rosewood, linoleum, wax polish… A killer, a killer. Mouth: the oak’s a notch loud, perhaps (black tea, menthol) but since oranges, mandarins, and quinces are soon to join in the dancing, it’s a happy ending. Pepper, cinnamon, even a little tar, roasted peanuts… The body’s perfect. Finish: long, with an oak that gets loudish, but that’s not uncommon in Armgnac. Loses one or two points. Comments: magnificent Armagnac once again, but the Los Pibous had the upper hand in the finish, because of a better-integrated oak. Or maybe is it another case of folle blanche defeating baco? A close call. SGP:661 - 88 points.",88,2015-11-01,https://www.whiskyfun.com/archivenovember15-1-Armagnac-Brora-Clynelish-Caol-Ila.html,8608f083c7a4f9707843b08bcd4fcbb5f94285c1b280ef50047c68e4d03329b2
