whisky_name_raw,review_text,score,review_date,source_url,dedupe_hash
"Highland Park 'Cask Strength Batch 3' (64.1%, OB, 2022) This brand-new baby that was bottled at rocket fuel strength, just like its predecessor will you say, is ex-first Fill sherry American and European oak.","Highland Park 'Cask Strength Batch 3' (64.1%, OB, 2022) This brand-new baby that was bottled at rocket fuel strength, just like its predecessor will you say, is ex-first Fill sherry American and European oak. Colour: gold. Nose: it is a meaty, grassy, slightly metallic sherry, which makes it really rustic and robust on the nose. Now at 64% vol., anything will be robust. With water: only few changes, it remains grassy, slightly fermentary, with some ale, walnuts, some raw chocolate, ham… It is less honeyed than last year's C/S. Mouth (neat): sweet and pungent at the same time, with some leather, hay, walnut skins, puréed chestnuts, cured ham, peppery oak… Robust and rustic indeed! Water is absolutely obligatory in this context. With water: there, the fruits are coming out, first bitter oranges, then bitterer apples, plus some triple-sec and always these walnuts, as well as bitterer vegetables, around our good friends the artichokes and eggplants, not to mention Baldrick's turnips. Finish: long, still leathery and a little bittersweet. Some welcome raisins in the aftertaste. Comments: I like my HPs more al natural, but this one's good for sure, if a little rustic and robust indeed. For the hipflask with a skull, bones and an Harley logo. SGP:452 - 83 points.",83,2022-11-09,https://www.whiskyfun.com/archivenovember22-1-Highland-Park-Aberfeldy.html,0b1bcaa29e524a31724d85c3fd183497fd06846ef2f659f10d612abed14ca05d
"Highland Park 13 yo 2008/2021 'Sigrid Storràda' (66.5%, OB, for Poland, first fill European oak sherry butt, cask #2530, 652 bottles) Brought back from the very excellent Whisky Live Festival Warsaw, a single cask for lovely Poland. As for the strength, no comments, I may just call my lawyer before we proceed… By the way and according to wikipedia, Sigrid Storràda, a.k.a. S´wie?tos?awa (968-1014) was a Polish-born queen of Sweden and Denmark.","Highland Park 13 yo 2008/2021 'Sigrid Storràda' (66.5%, OB, for Poland, first fill European oak sherry butt, cask #2530, 652 bottles) Brought back from the very excellent Whisky Live Festival Warsaw, a single cask for lovely Poland. As for the strength, no comments, I may just call my lawyer before we proceed… By the way and according to wikipedia, Sigrid Storràda, a.k.a. S´wie?tos?awa (968-1014) was a Polish-born queen of Sweden and Denmark. Colour: dark red amber. Nose: hectolitres of walnut wine and stain in your glass, plus similar amounts of coffee, as well as some damp black garden peat. That's pretty all this far, because I wouldn't try 'too hard'. But with water: long story short, it is a double espresso with a few drops of armagnac. Say the Gascon way (50% coffee, 50% armagnac). Mouth (neat): black Corinth currants, prunes, tamarind jam, ganache, pipe tobacco, more walnut wine, Fernet Branca… Those sorts of things. With water: back to civilisation, with honey, raisins, chestnut purée, touches of chilli, marmalade… and armagnac indeed. Very good, but you really need a pipette. Finish: long, drier, rather on unsweetened coffee, pipe tobacco, clove and bitter chocolate (Wedel's, naturally). Some saltiness in the aftertaste. Comments: we had a blast in Warsaw a few days ago. This is just a tiny, yet excellent example, a dark HP that never stopped improving in the glass and that took water without flinching. Cheers Piotr and Jarek, and na zdrowie! SGP:562 - 89 points.",89,2022-11-09,https://www.whiskyfun.com/archivenovember22-1-Highland-Park-Aberfeldy.html,b569e97f1f9072561587912b0680a5197428559ee4fee107f72584a0c4c74b7e
"Highland Park 30 yo (45.2%, OB, 2667 bottles, Spring 2019) We've never tried this batch, however we've tried many earlier 30s, all bottled at 48.1%. Always stunning stuff in my book, but let's see how this one will survive the sherry monster from Poland...","Highland Park 30 yo (45.2%, OB, 2667 bottles, Spring 2019) We've never tried this batch, however we've tried many earlier 30s, all bottled at 48.1%. Always stunning stuff in my book, but let's see how this one will survive the sherry monster from Poland... Colour: gold, so a rather lighter colour given the age. Nose: subtle and delicate, rather on branches, leaves, herbs and vegetal oils, as well as mosses, fern, fresh mushrooms, pinecones and nuts. Fresh-crushed hazelnuts, almond milk, some hay, perhaps one tiny cigarillo, then old manzanilla, seawater, and perhaps one tiny drop of raspberry liqueur in the end. Good fun, that. Mouth: some resemblances and some differences. There's this subtle leafiness that would include resins and tobacco, but also more fruits, around apricots and quinces, coated with the trademark heather honey. That part is rather reminiscent of Highland Park of old. Tends to become earthier after a short while, and then we're back on manzanilla, walnuts, tobacco and pine resin. Finish: raisins chiming in, old rancio, and stronger honey such as chestnut. Comments: you do feel the oak and yet it never gets oaky. Excellent old-style Highland Park that you could have with food, such as foie gras. Or perhaps Parmesan cheese? But beware, it goes down fast and as some friends would say, 'it would tend to evaporate faster than others'. SGP:452 - 90 points.",90,2022-11-09,https://www.whiskyfun.com/archivenovember22-1-Highland-Park-Aberfeldy.html,8b5d200c817507266b990b89fb6ec7aa9fbe951f452472bfc5bb638a752e2e5e
"Highland Park 40 yo (43.2%, OB, Spring 2019) The last official HP 40 I've tried had been bottled around 2008 (WF 91 despite a generous amount of oak). Let me salute Sir Martin of Highland Park, a great man of whisky and the best ambassador any whisky brand could ever dream of.","Highland Park 40 yo (43.2%, OB, Spring 2019) The last official HP 40 I've tried had been bottled around 2008 (WF 91 despite a generous amount of oak). Let me salute Sir Martin of Highland Park, a great man of whisky and the best ambassador any whisky brand could ever dream of. Colour: deep gold. Nose: oh! There are echoes of the 1960s, of 'the' John Goodwin, of the St Magnus labels, of the black dumpies round black labels… Do you see what I mean? That would translate into this very specific, some would say idiosyncratic, kind of honeyed meaty fruitiness that you wouldn't find in any other makes. Old Sauternes, preserved peaches with a little mint, old mead, earthy charcuterie, softer tobacco, chartreuse and verbena liqueur, with also a little caraway (but caraway may stem from the wood, we shall see…) Mouth: when tasting them, always remember that very old spirits are very old (bravo, S.!) Some moist fruitcake (Alsatian beerawecka), some very delicate teaishness that's bordering on, well, old oak, old sweet wines, marsalas, malagas… Several honeys, not just heather or clover, old cognac (but again, remember old malts and old brandies do tend to converge), dried fruits and jams, figs, sultanas… It is just dazzling and would just never falter, at any moment. Finish: perhaps not the longest ever, but it's aligning dried fruits and old sweet wines as if on parade. Comments: no surprise here, it is perfect Highland Park. Some would say that we're having the one-million times cheaper official 10 yo at WF 90, which is true, but they're discontinuing that 10 yo. Good things never last. SGP:551 - 92 points.",92,2022-11-09,https://www.whiskyfun.com/archivenovember22-1-Highland-Park-Aberfeldy.html,b7a8ecc7472a31cf08f46419625ad0d1173eee9d75cb2c0948d22d5cbcb214a2
"Highland Park 20 yo 1997/2018 (55.8%, Hunter Laing, The First Editions, refill hogshead, cask #HL 14625, 286 bottles) We shall expect something tenser. A 18 yo 1997 (HL 12099) had been splendid (WF 90).","Highland Park 20 yo 1997/2018 (55.8%, Hunter Laing, The First Editions, refill hogshead, cask #HL 14625, 286 bottles) We shall expect something tenser. A 18 yo 1997 (HL 12099) had been splendid (WF 90). Colour: gold. Nose: exactly. Sunflower oil, stearin, wool, engine oil, oyster shells, chalk, suet, grist… You see. With water: more chalk, grist and wool, less of the rest. More porridge too, this is some perfect breakfast drink (rather than champagne or sekt, as they do in eastern Europe). Mouth (neat): apple juice, lemon juice, lime juice, rhubarb juice, tangerines, grapefruits, two raisins, one dollop of heather honey. With water: what a distillate. Water makes it fatter and brings out more honey and beeswax as a consequence. Finish: long, both tight/vertical and rather fat, which is pretty much oxymoronic, I agree. Comments: one of these whiskies you could score without even opening the bottle. Make + vintage + bottler + wood, that's almost all you need; but I hereby solemnly swear that we'll never do that, cross my heart. SGP:552 - 90 points.",90,2022-11-09,https://www.whiskyfun.com/archivenovember22-1-Highland-Park-Aberfeldy.html,930eeadb7ab381cef3811bd8b19381c375265614ffcf72c2f3d02b07c8334b3a
"Highland Park 10 yo 2011/2022 (64.2%, The Whisky Blues, hogshead, cask #15, 261 bottles) Awesome label here; the pedigree doesn't sound too bad either, but isn't this just another lethal strength? Let me call my lawyer back…","Highland Park 10 yo 2011/2022 (64.2%, The Whisky Blues, hogshead, cask #15, 261 bottles) Awesome label here; the pedigree doesn't sound too bad either, but isn't this just another lethal strength? Let me call my lawyer back… Colour: pale white wine. Nose: it's a killer, it's extremely close to the distillate, while we all know that the distillate is perfect. Wax and grist and seawater and lemon and stuff. We shan't go on, we need our nose. With water: mezcal, chalk, seawater, oysters, varnish, grist, porridge. Enough said (even if lemons are missing). Mouth (neat): extraordinary rocket fuel. Elon M. should have bought Highland Park instead of Twitter. With water: top five distillate, no doubt, while there's a funny Cynelishness in here. Granny smith, paraffin, lemons (there) and bitterer leaves in the background. This is where it's missing the 90-mark. Finish: long, a notch spirity, but otherwise perfect. Barley sugar. Comments: could be that this one should have gone to 12 or 15, it is still a wee tad wobbly. But, yeah, brilliant distillate, maybe to be cellared for 30 additional years? SGP:551 - 88 points.",88,2022-11-09,https://www.whiskyfun.com/archivenovember22-1-Highland-Park-Aberfeldy.html,9984580120a2141c88ea46b364e4835d7d6a5989a76964926c39cf6bb011b24e
"Highland Park 5 yo 2015/2021 (59.7, Joecy and Or Sileis, oloroso octave, cask #565B)","Highland Park 5 yo 2015/2021 (59.7, Joecy and Or Sileis, oloroso octave, cask #565B) Colour: white wine, so no first fill oloroso for sure. Nose: some younger yet HP, so probably more immature, at a pretty high strength. Wool, porridge, chalk, flour, bakers' yeast, fresh baguette and leaven bread. With water: mud, chalk, porridge, wool, iodine, beach sand, rainwater, carbolineum. Mouth (neat): classy distillate, fruitier here, with cherry drops, Kriek, oranges, marshmallows, varnish… Much youth for sure. With water: same. Finish: rather long, kirschy, eau-de-vie-ish. Comments: great distillate, bottled when a little too young if you ask me. But better wait than dump into very active wood (STR or else) when the spirit is this classy (but that's not my business, naturally)… SGP:551 - 83 points.",83,2022-11-09,https://www.whiskyfun.com/archivenovember22-1-Highland-Park-Aberfeldy.html,29668c625cdb8d30946521c4f0863f1a2c5942857ea97e6dbd0650dfd2e93fb5
"Deanston 21 yo 2000/2022 'Organic Whisky' (50.9%, OB, 2784 bottles) Organic malt whisky matured in organic bourbon casks and finished in organic fino sherry casks. Probably not something very easy to do, especially with ex-solera sherry – unless that would have been 'anada' (single vintage) sherry instead.","Deanston 21 yo 2000/2022 'Organic Whisky' (50.9%, OB, 2784 bottles) Organic malt whisky matured in organic bourbon casks and finished in organic fino sherry casks. Probably not something very easy to do, especially with ex-solera sherry – unless that would have been 'anada' (single vintage) sherry instead. Colour: deep gold. Nose: there's really a lot of fino, as if the finishing casks had been 'extremely wet'. But naturally, that could not be. Basically, that translates into chalk and walnuts, bone-dry, almost acidic white wine, apple peel, a little curry, a little mustard, and a little fudge. The fino's having the lead guitar, on the other hand we just loooove good fino. With water: a curious sulphur-like touch at first, then old Jerez vinegar, musty old cellar, curry indeed, miso, malt extracts and a lot of chalk. Mouth (neat): huge fino indeed, plus pepper, heavy marmalade, chutneys, dried pears, and walnut wines and liqueurs. You could have said 'this is nocino', amigo. With water: back to maltiness, liquorice, amontillado rather than fino, chocolaty walnuts, chalk… Finish: very long, very bitter-sour, with walnuts running the show, for good. Comments: feels a little unnatural here and there, but Nature is sometimes overrated (what???) What's sure is that it is very Jerezian and probably not for everyone. I'm on the right side. By the way, I remember a 2013 'The Union Exclusive' that was also organic and ex-fino, and very good too (WF 85). SGP:372 - 87 points.",87,2022-11-08,https://www.whiskyfun.com/archivenovember22-1-Highland-Park-Aberfeldy.html,d7ed82f2f1945ec6312906c66e017c045e15bf17221b935f8520c0b0f9fae00f
"Deanston 13 yo 2008/2022 (57.7%, Whisky Age for Whisky Picnic Bar and O'my Bar, bourbon barrel, cask #185, 179 bottles)","Deanston 13 yo 2008/2022 (57.7%, Whisky Age for Whisky Picnic Bar and O'my Bar, bourbon barrel, cask #185, 179 bottles) Colour: white wine. Nose: it is almost hilarious, in a good way of course, to try such a pure, immaculate malt after a much more, say made-up counterpart. It's almost as if Iggy Pop's brother were a clergyman, well, I mean, you get the idea. So, pure apples, pears, barley, beer, bread and vanilla, plus cut celeriac and gentian. With water: more beer, paraffin, bread, nut oils… Mouth (neat): pure pear cider, plums, biscuits, assorted fruit drops, sweet beer, vanilla, drops of barley syrup, toffee apple, boiled sweets… With water: more bitter leaves, Campari, ginger, turmeric… Rather bizarrely, water made it bigger. Finish: rather long, sweeter and fruitier when neat, leafy and bitterish when reduced. Mezcaly aftertaste (when reduced). Comments: Distillers would have asked for more selling points (read woods, wines etc.) They would have been wrong, it is an excellent malt.. SGP:551 - 86 points.",86,2022-11-08,https://www.whiskyfun.com/archivenovember22-1-Highland-Park-Aberfeldy.html,6a5eec59550fbebc7762fb5250ab88bc81bacd9eeacf1943c9655e9400c9dd32
"Aberfeldy 15 yo 'Napa Valley' (43%, OB, batch #2922/B, +/-2022) It's hard not to laugh, to me at least. Apparently, someone's decided that it would be a good idea to finish a 15 yo Aberfeldy, probably just fine, in some 'Cabernet Sauvignon wine casks from the Napa Valley'. And French oak, I suppose. I mean, beyond the tastes, imagine the carbon footprint. Do they then export this to San Francisco? To Sausalito's bourgeoisie, you say?","Aberfeldy 15 yo 'Napa Valley' (43%, OB, batch #2922/B, +/-2022) It's hard not to laugh, to me at least. Apparently, someone's decided that it would be a good idea to finish a 15 yo Aberfeldy, probably just fine, in some 'Cabernet Sauvignon wine casks from the Napa Valley'. And French oak, I suppose. I mean, beyond the tastes, imagine the carbon footprint. Do they then export this to San Francisco? To Sausalito's bourgeoisie, you say? Colour: apricot. Nose: naturally, they are not stupid (of course they aren't), you do not feel the red wine upfront, you rather get fruitcakes, dried apricots, then heather honey and, indeed, some strawberry jam and marshmallows. At this point, we're still fine (even if I'd love some regular Aberfeldy instead)… Mouth: starts okay, then falls apart, killed by red berries and oak spices. Blackcurrants, never such a good idea in whisky, if you ask this very humble little taster. Clafoutis, Mon Chéri, green pepper, leaves, cherry stems… Pass. Finish: medium, leafy, bitterish, some chocolate in the aftertaste kind of saves it, though. Those Mon Chéri again. Comments: it's not that it's utterly bad, it's that it's not needed. But then again and again, only one man's opinion. SGP:651 - 79 points.",79,2022-11-07,https://www.whiskyfun.com/archivenovember22-1-Highland-Park-Aberfeldy.html,6385fe9bd74cd3aa793c10fbeea86cbcc1b9ac203cf1aa95d7be32eabf70b776
"Aberfeldy 18 yo 'Tuscan Red Wine' (43%, OB, batch #2922/A, +/-2022) Phew, they're on a stroll! Tuscan, that would mean either Sangiovese (great), or Bordeaux blend a.k.a. Super-Tuscan (bad, well just watch the movie Mondovino again). Now on the label, there is a drawing of a little cask that says 'Bolgheri', which suggests a Bx Blend ala Sassicaia indeed. Bad news, I never managed to finish a bottle of Sassicaia… Or of Ornellaia for that matter…","Aberfeldy 18 yo 'Tuscan Red Wine' (43%, OB, batch #2922/A, +/-2022) Phew, they're on a stroll! Tuscan, that would mean either Sangiovese (great), or Bordeaux blend a.k.a. Super-Tuscan (bad, well just watch the movie Mondovino again). Now on the label, there is a drawing of a little cask that says 'Bolgheri', which suggests a Bx Blend ala Sassicaia indeed. Bad news, I never managed to finish a bottle of Sassicaia… Or of Ornellaia for that matter… Colour: apricot. Nose: this time again, it starts gently, on cakes, brioches, crema catalana… But fruity teas and red berries are approaching. Some earthiness too, which I find nice. All in all, a nice nose, not too winey. Not winey at all, actually. But careful… Mouth: let's remain honest, this is okayish at first, even if the whole's unbalanced and too spicy. Everything goes pear-shaped after that, disjointed, bitter, and un-Scotch. Finish: medium, unpleasant, bitter, sour. Comments: makes illusion for a few seconds, then falls apart. Why do so many brands torture and torment their own makes like this these days? SGP:451 - 72 points.",72,2022-11-07,https://www.whiskyfun.com/archivenovember22-1-Highland-Park-Aberfeldy.html,717f96c25f9d61a5548aeac24eadeaf728940d807beeee14039e81340e3846fa
"Aberfeldy 7 yo 2014/2021 (57.7%, Cut Your Wolf Loose, refill hogshead, 266 bottles) Some fun, at last! Aren't we also tired of faux Victorian designs?","Aberfeldy 7 yo 2014/2021 (57.7%, Cut Your Wolf Loose, refill hogshead, 266 bottles) Some fun, at last! Aren't we also tired of faux Victorian designs? Colour: white wine. Nose: there, some barley, some bread, some cakes, some shortbread, some butterscotch, cappuccino, mocha, latte… Everything! With water: same, almost. Mouth (neat): it instantly kills the two red-wined OBs, but that was to be expected. Then we have panettone (panettone, back on WF!) and cornflakes, mead, honey cake, makrouts, Turkish delights, pistachio nougat, candied bergamots… With water: very good, malty, fresh, a tad bitter here and there, perhaps. Some ale and some liquorice wood. Finish: long, otherwise not particularly noticeable, but it does call for the next dram (of the same whisky). Comments: malt whisky as in malt whisky, and Aberfeldy as in Aberfeldy, not as in lousy self-appointed Super-Tuscans. Oh forgot to say, and I'm quoting some PR here, 'each bottle is labelled with custom artwork by London-based graffiti artist Tom Blackford. The labels depict a 'rambunctious' seagull dressed in 'informal attire'. Well, as long as it's fun… SGP:551 - 86 points.",86,2022-11-07,https://www.whiskyfun.com/archivenovember22-1-Highland-Park-Aberfeldy.html,426f89aa71faeafa5ee7466fdc260161884dee4d58065617b237c576364db25f
"Batavia Arrack 'By The Dutch' (46%, OB, Indonesia, finished in Cognac, +/-2022) Nicknamed 'The World's First Luxury Spirit' (by the owners, while we had thought that was Dalmore), this Indonesian rum distilled from molasses in pot stills is stemming from the island of Java. This baby's said to be 8 yo, while 'Batavia' is Jakarta's ancient name. Some say they use some ex-red rice yeast but I'm really not sure.","Batavia Arrack 'By The Dutch' (46%, OB, Indonesia, finished in Cognac, +/-2022) Nicknamed 'The World's First Luxury Spirit' (by the owners, while we had thought that was Dalmore), this Indonesian rum distilled from molasses in pot stills is stemming from the island of Java. This baby's said to be 8 yo, while 'Batavia' is Jakarta's ancient name. Some say they use some ex-red rice yeast but I'm really not sure. Colour: white wine. Nose: somewhere between a Cuban and a cachaça, I would say, with an herbaceous lightness that's certainly not unpleasant, plus some liquorice wood and bits of sawn pinewood. I find this pleasant. Mouth: same grassiness, notes of cane juice indeed, the whole being very dry, then evolving towards something like… moutai? Not too sure. It is not your 'average' rum for sure. Finish: medium, with a salty touch and, indeed, echoes of sake. No, really. Comments: it is not a very bold rum, but I would guess some single casks selected by good bottlers would be interesting to try. Who would take up the challenge? SGP:351 - 77 points.",77,2022-11-06,https://www.whiskyfun.com/archivenovember22-1-Highland-Park-Aberfeldy.html,88b63072854e7a89dadc843ef2da83c2002ae1d3c5de8f9bde6a50461c1bd60c
"French Antilles 2021/2022 'Grand Arôme' (57%, S.B.S.) White rum, ex-molasses, what's called 'rhum industriel' and not agricole. Grand Arôme means high-esters, in this case around 500g/HLPA. This should stem from Le Galion in Martinique.","French Antilles 2021/2022 'Grand Arôme' (57%, S.B.S.) White rum, ex-molasses, what's called 'rhum industriel' and not agricole. Grand Arôme means high-esters, in this case around 500g/HLPA. This should stem from Le Galion in Martinique. Colour: white. Nose: these very typical whiffs of fresh glue (UHU) and gherkiny varnishes, moving towards high pineapples and even strawberries. Acetone would tend to dominate after a few seconds, but bizarrely, we enjoy acetone in our spirits. With water: some dirtiness, around old fruits rotting in earth, plus some juniper. Much, much nicer than that sounds. Mouth (neat): really between acetone/glue and very aromatic fruits, indeed pineapples, peaches, plus some brine and the obligatory green olives. Touches of aquavit (you would have thought this would rather belong to the Batavia arrack). With water: anchovies coming out, more olives, some fermented fruits (plums) and a drop of miso. Finish: rather long, with fermented tropical fruits at the forefront and those salty glues and varnishes in the back. Comments: everybody's thinking agricole whenever we're talking Martinique, but these 'industriels' can be rather superb too, especially when 'grand arôme' indeed. SGP:552 - 86 points.",86,2022-11-06,https://www.whiskyfun.com/archivenovember22-1-Highland-Park-Aberfeldy.html,8ed83eb77f93ae197fd27389e00093a4ec8d4d81bed29a1ef5438fc68e922ddf
"Australian Rum 10 yo 2012/2022 (66.9%, Swell de Spirits, ex-bourbon, 368 bottles) This baby, most probably a secret Beenleigh, has been first spending 6 years in Oz, then 4 years in the UK. We've already had some superb Beenleigh, let's hope this is Beenleigh indeed.","Australian Rum 10 yo 2012/2022 (66.9%, Swell de Spirits, ex-bourbon, 368 bottles) This baby, most probably a secret Beenleigh, has been first spending 6 years in Oz, then 4 years in the UK. We've already had some superb Beenleigh, let's hope this is Beenleigh indeed. Colour: gold. Nose: this feeling of 'a bourbon of rum', with some vanilla, coconut, cakes, and really a lot of ethanol. No chances taken at WF Towers, my friend. With water: coconut and vanilla running the whole show, plus baked bananas. Quite some fudge too. Mouth (neat): just half a drop… Well, the expected and obvious pears, butterscotch, pineapple liqueur… With water: good, with touches of genever perhaps, aniseed too, caraway, then rather floral tones, viognier and pinot gris, pomegranates… Finish: medium, with a little green tea, more viognier, a drop of pineapple juice, rosewater… The aftertaste is the nicest part, with a lovely liquoricy earthiness and even a touch of mint. Comments: not a top Jamaican, but the evolution is fascinating, it would never stop gaining depth and, well, earth. But is it really Beenleigh? Shh, that's a secret. SGP:641 - 85 points.",85,2022-11-06,https://www.whiskyfun.com/archivenovember22-1-Highland-Park-Aberfeldy.html,e7c3078d4283737dd1a736f3cc8f1024b9102e7562d3d3ea761fecdd6f663eef
