whisky_name_raw,review_text,score,review_date,source_url,dedupe_hash
"Clynelish 15 yo 1997/2013 (52.2%, The Whisky Mercenary, for beproefd)","Clynelish 15 yo 1997/2013 (52.2%, The Whisky Mercenary, for beproefd) Another Belgian affair ;-). Colour: straw. Nose: not much to say, this is a perfectly balanced, mineral, waxy and citrusy nose. I will say nuffin' more. With water: spritzer, lemonade, 'clean' floorcloth and tonic water. Some coal too. Mouth (neat): this is interesting. This baby starts with the expected waxy citrons and some kind of very mineral sauvignon blanc, Pouilly-Fumé style, but it tends to become a notch fatter than usual, with maybe a little more custard and vanilla cake. After that, a little pepper. With water: no, cancel that. Clean, zesty, mineral and lemony. Finish: long, sharp, zesty, chiselled. Modern Clynelish in full swing. Comments: it's a dangerous spirit because you can get hooked on this profile. Clynelish can kill many other malts, it can even kill Ardbeg once you've acquired the taste. Warning! SGP:462 - 89 points.",89,2013-10-30,https://www.whiskyfun.com/archiveoctober13-2.html,3ca751a1e01e604b909cf93abb720e0e6c99570f4e0cdee627db2fcdfb597b8d
"Clynelish 14 yo 1998/2013 (46%, Hart Brothers)","Clynelish 14 yo 1998/2013 (46%, Hart Brothers) Colour: white wine. Nose: great news, the stronger 1997 does not kill this one, which is actually sharper, zestier and sappier. On the other hand, it's also got more difficult notes, such as old damp newspapers and aspirin tablets. Maybe a little too austere this time? Let's see what happens on the palate... Mouth: no, it's all good, really. Wonderful fruits, grapefruits and not too ripe mangos, lemon marmalade... It's less mineral and waxy than the 1997 but the fruits are quite perfect. Limejuice. Finish: long, sharp and chiselled, as expected. It's almost pure lemon juice with only a drop of cane sugar syrup. No, it's not a mojito. Comments: another impressive one, even at 46% vol. A bit in the style of the 1982s or 1983s. Very well selected, Hart Bros! SGP:552 - 88 points.",88,2013-10-30,https://www.whiskyfun.com/archiveoctober13-2.html,03ed33e4273b02abd8cfe3cae94f35a06a6b40954e265ef0364f48db9843fd60
"Caol Ila 18 yo 1995/2013 (57.5%, Wilson & Morgan, sherry butt, cask #10027)","Caol Ila 18 yo 1995/2013 (57.5%, Wilson & Morgan, sherry butt, cask #10027) Anyone who hasn't tried the old Manager's Dram or the early James MacArthurs cannot imagine what Caol Ila + 1st fill sherry can do. It's like Motörhead on Brora 1972 (right, I may be exaggerating...) Colour: dark amber. Nose: bingo-ish. I mean, balance is found, which is quite an achievement, and the peat plus sherry combo creates this very peculiar kind of chocolaty profile that you cannot find in, well, chocolate. A leathery, tobacco-like kind of chocolate. With water: more cigars, hay and bitter chocolate. Mouth (neat): once again, this works. I don't know if this is because the excellent bottlers are Italian, but I find notes of maraschino and amaretto. Must be me... The peat is big! With water: yes. Smoother, perfectly balanced, cigary, with drops of kirsch and always amaretto and maraschino. In the background, oysters with a drop of tabasco. Finish: long, peaty, chocolaty and, bizarrely, kind of clean and fresh, which is always welcome at this stage. Comments: exactly what was needed after the Clynelishes. A style that's quite rare these days. SGP:456 - 90 points.",90,2013-10-30,https://www.whiskyfun.com/archiveoctober13-2.html,63fc6222985fca612c4265f1aed828a5f451535e108e6484d8dbd5497a0aa81a
"Johnnie Walker ‘The Royal Route’ (40%, OB, Explorers’ Club Collection, blend, travel retail, 2013)","Johnnie Walker ‘The Royal Route’ (40%, OB, Explorers’ Club Collection, blend, travel retail, 2013) Another new Johnnie Walker that comes with a story as long as an arm. Don't you need more story when you've got no age? It's the third and the last within the 'Explorer's Club' collection. I quite liked The Gold Route (WF 79) and liked The Spice Road even better (WF 81). Colour: gold. Nose: it's quite potent and malty despite the low strength, there's especially a kind of fat fruitiness that works well (around candied peaches and melons, perhaps), as well as some peat smoke and beeswax. The feeling of hot wax mingled with fermenting hay is also welcome. Mouth: same flavours as in the nose, with some depth, some smoke, some candied fruits, some wax... and sadly, not much middle. B****y 40% vol. Finish: saltier and even a little longer than expected. Takes off again, which sometimes happen. A bitterness in the aftertaste. Comments: very high quality blend, perfectly composed. I remember a 'Director's Blend' by Johnnie Walker that had a similar profile. The only problem is the weakness on the palate, which is entirely related to the strength. Sweet whiskies can stand low strengths but in my modest experience, 'phenolic' ones need 43% or more or they can be a little, say frustrating. SGP:452 - 82 points.",82,2013-10-29,https://www.whiskyfun.com/archiveoctober13-2.html,45dac0063c172c7d8b8a7c2387b4a88b9ee1334c6816d48817f6066aa66cbbdd
"Littlemill 24 yo 1988/2013 (55.8%, The First Editions, refill hogshead, 330 bottles)","Littlemill 24 yo 1988/2013 (55.8%, The First Editions, refill hogshead, 330 bottles) I think Andrew Laing 'baked' a pretty impressive set of new bottlings in this autumn. Ah, the Jura... Colour: pale gold. Nose: I had thought we'd have a fruity explosion, not so. It's a rather mineral and slightly papery Littlemill at first nosing, pretty austere and quite far from some recent fruitbombs. Clay, chalk and perhaps touches of grapefruit zests. Not the easiest Littlemill but water may help. With water: so unusual, so funny! Mashed potatoes, Champagne and... hold on, warm waffles? Mouth (neat): a beast! One of the sharpest malts I've tried this year, it's almost concentrated lemon juice plus grass, chalk and pepper. Spectacularly ultra-green. With water: became more typical, that is to say fruitier, with lemons and a wee slice of mango, but the papery side remains there. Finish: quite long. Tonic water, lemon, chalk, cardboard, white pepper. Grapefruits are back in the aftertaste. Comments: fun and intellectual at the same time. You really need to dissect it, so to speak. Certainly not one these easy/sexy fruity Littlemills, and using water is de rigueur. One for a whisky lover who already has everything? SGP:371 - 84 points.",84,2013-10-29,https://www.whiskyfun.com/archiveoctober13-2.html,9fb1dc129a08dec66162c5be6bc1659e7ccfcc97c346ad81b50a43fda662ec3a
"Paul John 'Edited' (46%, OB, India, 2013)","Paul John 'Edited' (46%, OB, India, 2013) This new one from Goa was matured in bourbon wood. Colour: gold. Nose: very simple but perfectly balanced, on vanilla, apple pie, maple syrup, fresh oranges and a little grenadine. It reminds me a bit of some young Arran or, for that matter, Amrut. It is said to be lightly peated but I do not detect much peat or smoke so far. Am I tired? Maybe a little cardamom... Mouth: apple juice, a lot of apple juice. I mean a blend of apple juices, ripe sweet ones, drier ones (cider apples), overripe ones... Add to that a little white pepper and you've got a good idea. And 'ideas' of a kind of green peat indeed. Finish: quite long, just as fruity, probably a little more citrusy than before. Also pineapples. The aftertaste is frankly peaty indeed. Comments: honestly, I had thought this would be junk, McDowell style. Not at all! It's actually an easy, fruity, well-crafted malt whisky. Very solid! SGP:642 - 82 points.",82,2013-10-28,https://www.whiskyfun.com/archiveoctober13-2.html,da35f4f2c4c99c6a8088360ba91fbcf4283b88bfdeef87815bc26ac098e366aa
"Paul John 'Classic Select Cask' (55.2%, OB, India, 2013)","Paul John 'Classic Select Cask' (55.2%, OB, India, 2013) Colour: full gold. Nose: less expressive than the 'Edited' but that's because of the higher strength. Very similar easy style, or maybe a little more pencil shaving, café latte and custard. With water: becomes a little rounder, more compoty. Mouth (neat): hey hey hey! What a surprise again! Big bright fruits all over the place, blood oranges, pineapples, limes... There's even something of Bladnoch, in a way (please don't shoot!) Very easy, very good. With water: same. Excellent, really. Maybe just a wee notch lactic? Finish: medium length, clean, fruity, full, easy. Comments: I don't know if this Goa whisky is made by old hippies but I'm afraid the very excellent Amrut aren't the only ones to make great Indian malt whisky anymore. Speaking of Amrut... SGP:641 - 85 points.",85,2013-10-28,https://www.whiskyfun.com/archiveoctober13-2.html,5f425ab03160cf355c42fa38c6e7f0b7e9aef2904dae6c52c19d1638c8ba97bd
"Amrut 2009/2013 (60%, OB for La Maison du Whisky, India, bourbon, cask #3438)","Amrut 2009/2013 (60%, OB for La Maison du Whisky, India, bourbon, cask #3438) Distilled from unpeated Indian Barley. It's to be noted that the angel's share (rather a garuda if you ask me) has reached 40% over those four years. Oh, and kudos to Amrut for not hiding the age of their whiskies, it's often not the case elsewhere in the world. Colour: full gold. Nose: as I wrote above, we have a similar style but this Amrut seems to be a little more complex, with more floral and 'tropical' touches. For example, it's got guavas, as well as a little sandalwood and incense. Melons? Very likeable! With water: more of all that. Multivitamin juice, this baby must be good for your health. Mouth (neat): yeah, once again, it's got more character and personality than the already excellent Paul Johns. Rich yet 'nervous' fruits, touches of bananas, passion fruits... So once again, its more 'tropical' and, in a way, more un-Scottish than the Paul Johns. With water: oh, this is great! It's got more pink grapefruits and some very funny touches of citrons and Campari-orange. Serious, this could be Campari-orange. I love Campari-orange. Finish: long, on... oak-aged Campari-orange. Apologies. Comments: this is hard to beat. I could quaff litres of this (Mum, you know that was just a figure of speech, don't you!) SGP:641 - 89 points.",89,2013-10-28,https://www.whiskyfun.com/archiveoctober13-2.html,4da1bb0a6fc58205f652a44814561dc9ff4a8cbba6e76a4fe8cdb9aea80f7418
"Domaine des Hautes Glaces 2011/2013 'Secale' (56%, OB, Condrieu wood, 511 bottles)","Domaine des Hautes Glaces 2011/2013 'Secale' (56%, OB, Condrieu wood, 511 bottles) Not whisky yet, as this single malt is only 18 months old. The wood's a little scary as viognier (Condrieu's grape) is very fruity and spicy. Let's see... Colour: light gold. Nose: uh! Do I like this? Believe it or not, it's not easy to decide, for it's so 'different'. What's sure is that it's very big spirit, the distillate is fat and oily, a style that I like. In a sense, it's the kind of distillate that should best stand very expressive wines. There's a lot of barley, damp earth, lemon zests, moss, ginger... Let's see what happens with water: very marmalady. Mouth (neat): first lemony, with some spearmint, then much spicier. Huge nutmeg and ginger, pepper, green cardamom... I wouldn't call this 'balanced', but spectacular it is. With water: less spices, more sweet barley and citrons. Finish: long and spicier again. Comments: it's funny how one can feel that the distillate is of high quality behind this barrage fire by big oaky spices. Not my style at all on the palate but this interesting baby's got all my sympathies. SGP:471 - 65 points.",65,2013-10-27,https://www.whiskyfun.com/archiveoctober13-2.html,5319e280f7e9c52d7f3b56f2f4b8ff932cbab9d9848bfc225011d71c09ef21d8
"Domaine des Hautes Glaces 2010/2013 'L.10#03' (46%, OB, French oak, 1616 bottles)","Domaine des Hautes Glaces 2010/2013 'L.10#03' (46%, OB, French oak, 1616 bottles) This one's almost whisky. The distillers have used oak from the Tronçais forest, which is the place where the very best wines, not only the French, source their oak. Colour: white wine (starts better!) Nose: oh yes yes yes! Another world, another galaxy. Wonderful barley, fields after the rain, damp earth, leaves, fermenting tobacco, fresh coffee, yellow peaches, new magazine just out of the printers, bread, raw wool, broken branches... Mouth: absolutely excellent, fresh, clean, loyal to the barley, with a perfect oiliness (don't I detect sunflower oil?), some almond oil as well, a little custard, some brioche and then a mild spiciness from the oak. Well, it's much milder than in the 'Secale'. Finish: quite long, now with a little gentian and other roots, a wee feeling of spicy absinth and maybe a little genever, probably from French oak. Some liquorice too. Comments: indeed, another world. I'm really a fan of these spirits that are genuine 'aged barley spirit, when they're as classy as this one. SGP:551 - 85 points.",85,2013-10-27,https://www.whiskyfun.com/archiveoctober13-2.html,37d1636878defd34d23c811c77f912383e7099685a5a5ee2f67d6f18fc0a8b44
"Pappy van Winkle 20 yo 'Family Reserve' (45.2%, OB, straight bourbon, 2012)","Pappy van Winkle 20 yo 'Family Reserve' (45.2%, OB, straight bourbon, 2012) This one's still from the Stitzel-Weller Distillery that was closed in 1992 and not from Buffalo Trace, according to many bourbon connoisseurs (sadly, I'm not one of them - at all). I'm sure I'm the very last whisky 'blogger' in the world to try this edition of this famous baby, but the latest news about some cases being 'stolen' was too good an occasion. Colour: orange amber. Nose: there's no denying, this is superb. It's a very easy and sexy kind of soft nose that you just cannot resist unless you're averse to maple syrup, honeydew, coconut, rosewater, soft sweet curry and chocolate. I think only die-hard wet blankets wouldn't like this nose. Let's only hope it's not sweetish on the palate... Mouth: it's sweet, but it's not 'too' sweet. More pineapple liqueur - it is a little liqueury, or pina-colada-ish - and even touches of - hope you won't kill me for writing this - Southern Comfort. Oriental pastries, orange blossom water, almonds, these touches of grenadine or even geranium syrup that I sometimes find in bourbon and a very moderate oakiness. Impeccable. Finish: maybe not the longest but the sweet spiciness is most pleasant. A funny earthy/rooty touch in the aftertaste. And caraway? Comments: I think just everyone in the house would enjoy this lovely and very easy whiskey. Even the cat and the goldfish. SGP:630 - 89 points.",89,2013-10-27,https://www.whiskyfun.com/archiveoctober13-2.html,725902243151b52540e5e31d2ffc3bc7bdb92dcb98a31c313493a6677b949cfe
"German Hazelnut Spirit 2012 (40%, The Whisky Agency, 270 bottles)","German Hazelnut Spirit 2012 (40%, The Whisky Agency, 270 bottles) That's right, the famous Whisky Agency. They already bottled quite a few 'deviant' drinks and many have been excellent I have to say. But what is 'hazelnut spirit'? Must be some kind of liqueur, I guess. What's sure is that it looks unaged. Colour: white. Nose: do you know Nutella? Well, this actually smells like a blend of Nutella and Bailey's Irish Cream, except that it's better than both. There's also a very wee smokiness, very discreet, as well as some milk chocolate, Lindt-style. This reminds me of my childhood... Mouth: it's a well-integrated spirit - I think it's a kind of liqueur -, probably a little more complex than on the nose. Hazelnuts for sure but also walnuts, more chocolate, a little vanilla, touches of sweet herbs, a little caramel. Its extremely smooth but not dull, and the sugar doesn't quite show. Finish: short but clean, with milk chocolate in the aftertaste. Comments: fun stuff for the children inside us whisky lovers. SGP:820 - (no score).",,2013-10-27,https://www.whiskyfun.com/archiveoctober13-2.html,0b630cf2675581f01cc36b0d6b7b526a192ea045d4e495dc2f674dedd646c329
"Caperdonich 1996/2013 'Dunes An Oir' (58.6%, Malts of Scotland for Van Zuylen, bourbon hogshead, cask #MoS 13025, 276 bottles)","Caperdonich 1996/2013 'Dunes An Oir' (58.6%, Malts of Scotland for Van Zuylen, bourbon hogshead, cask #MoS 13025, 276 bottles) Van Zuylen is a well-reputed Dutch retailer. Good selection and, above all, a very fair price policy. Colour: gold. Nose: punchy and quite gingery. Some freshish oak involved, it seems. A lot of muscovado sugar too, speculoos, toasted brioche, bitter oranges... Maybe a tad rough at this point but the strength is very high. Water should help. With water: yes it does! Cough mixture, mint, humidor, pu-erh tea... Mouth (neat): huge and extremely spicy. Curry powder and very strong liquorice, very heavy tea, heavy pepper... A very extreme Caperdonich (not that you would detect the distillery) but I've got many friends who like these ooh-aah profiles. With water: once again water helps a lot, even if it remains spicy and herbal. Pumpernickel, earth, pepper, cardamom. Finish: long but, bizarrely, not really tannic. Sweet pepper sauce. A lot of bitter chocolate in the aftertaste. Comments: a heavily oaky beast. Bourbon wood with sherry wood aspects. I'm wondering whether this wasn't filled at a very high strength, around 72% or more. What's even more bizarre is that it's also quite pleasant but you just cannot avoid adding water. SGP:471 - 83 points.",83,2013-10-25,https://www.whiskyfun.com/archiveoctober13-2.html,993475bba1ee7d9f409628ec60c593bfb65524e3ee56c3fbb744749bd2fb13f5
"Glen Garioch 1989/2013 'Brandy Casket' (46%, Wemyss Malts, hogshead, 322 bottles)","Glen Garioch 1989/2013 'Brandy Casket' (46%, Wemyss Malts, hogshead, 322 bottles) This baby from the new series. A 1989 should be of the 'floral' style. Colour: light gold. Nose: I was wrong, it's rather an earthy and fruity one, showing good depth and indeed, obvious notes of peaches like some 'uncommercial' cognacs have. There's a little paraffin too, some hay, some tobacco and lastly, 'a new opened box of black tea'. Mouth: some peat coming through, bitter herbs, touches of salt, more tobacco, pepper, cough mixture and, maybe one or two glazed chestnuts. I love glazed chestnuts, they were very popular around Christmas time when I was a kid but sadly, it seems that they've gone out of fashion, at least in this country. Maybe also touches of juniper in this Glen Garioch. Finish: quite long, bitter, rather dry. Some green spices. A saltiness in the aftertaste. Comments: I think we're pretty much midway between the distillery's earlier smoky/spicy style and an easier, fruitier style. Rather firm, in fact. SGP:462 - 87 points.",87,2013-10-25,https://www.whiskyfun.com/archiveoctober13-2.html,7a6ff70f9b0cedd6bf7d070c433cfc9be321f2e1e8781f82ac4a0663c4292e7a
"Glen Grant 59 yo 1954/2013 (53.5%, Gordon & MacPhail for La Maison du Whisky, Book of Kells, first fill sherry butt, 120 bottles)","Glen Grant 59 yo 1954/2013 (53.5%, Gordon & MacPhail for La Maison du Whisky, Book of Kells, first fill sherry butt, 120 bottles) Another brand new one. Superb make, vintage, age, strength and bottler. I'm asking you, what could go wrong? Colour: rich amber. Nose: oh! This one will need quite some adjectives but no hyperboles, since it's absolutely magnificent. Where to start? Maybe with the fruits, first apricots and quinces, then raisins, dates, figs and dried pears. Good, that's done. Then we have chocolate, chocolates of all kinds. After that, enter more tertiary aromas, around teas and tobaccos, as well as funnily tense floral and honeyed notes, to which we could add drops of genuine maple syrup. Lastly, all things herbal, sappy and resinous, which could include natural tar and pinesap. Simply grand. With water (although water isn't needed): exactly what I was expecting and anticipating, it starts to resemble some great old Sauternes. Must be the apricots ;-). Mouth (neat): crunching a kind of artisan Mars bar that would be covered with marmalade. Or millionaire shortbread. What's utterly impressive is the way the oak components are behaving, they never get in the way, they're almost working like a thorough-bass in one of Bach's finest suites (hey, that's smart, S.!). Green pepper, cinnamon, bitter chocolate and cloves are doing that job. Other instruments would be dried fruits and marmalades. Notes of fresh oranges are keeping the whole as light and fresh as a fugue. With water: explodes into myriads of fruitier and spicier aromas and, most importantly, doesn't get any oakier. Finish: the chocolate is back. Marmalade-filled chocolate. Comments: this one is ideal for some Christmas time bacchanalias. Not cheap but worth every cent or penny, I think. SGP:551 - 93 points.",93,2013-10-25,https://www.whiskyfun.com/archiveoctober13-2.html,74689f1163c25db08119d28b47ab705edfe1058c2993ca6d35ea2af935525d7d
"Braes of Glenlivet 18 yo 1994/2013 (55.4%, Hart Brothers, Finest Collection)","Braes of Glenlivet 18 yo 1994/2013 (55.4%, Hart Brothers, Finest Collection) Another name that's seen more often these days. That's right, it's now called Braeval. I remember a good ten years ago, there were rumours that the distillery would be mothballed, so I sent an email to the owners asking for confirmation. A few days later, I got this reply: 'Are you sure this distillery belongs to us?' Says a lot... But that was ten years ago. Colour: straw. Nose: it's one of these 'natural' Speysiders that are all on sweet barley and western fruits, that is to say apples and pears. A little Muscovado sugar, vanilla, corn syrup... And that's all. Nice but very simple. With water: maybe a little mint? That happens often, wood oils and all that. Mouth (neat): good simple malty arrival. Sweet beer, apple pie and custard, back and forth. With water: same. Good balance - which might be easy to achieve when the whisky's simple. Finish: a little short. Cake, vanilla and liquorice. Comments: good, simple, barleyish. Pretty satisfactory. SGP:541 - 80 points.",80,2013-10-24,https://www.whiskyfun.com/archiveoctober13-2.html,c682475d9fdf35b9d3db6386ff37cb829295a53742d6d511b5d3b1c54412b215
"Glentauchers 17 yo 1996/2013 (46%, Càrn Mor, Strictly Limited, bourbon barrels, 501 bottles)","Glentauchers 17 yo 1996/2013 (46%, Càrn Mor, Strictly Limited, bourbon barrels, 501 bottles) This one from two casks. Small batches of two or three casks can often be better than single casks in my experience. Colour: white wine. Nose: sugar, sweets, overripe apples and maybe whiffs of 'sweet' flowers. Honeysuckle. Also melon. Really simple! Mouth: another sweet, easy, fruity Speysider. Sweet apples and one or two green ones, lemon drops, sweet barley, tinned pineapples and maple syrup. Does the job. Finish: a little short, with a little more caramel. Sweet malt. Comments: yeah well, no flaws and no thrills. It's very drinkable but there are millions (?!) of similar casks over there in Scotland. No flaws so I cannot go below 80; no thrill so I cannot go above 80. SGP:431 - 80 points.",80,2013-10-24,https://www.whiskyfun.com/archiveoctober13-2.html,6aa1fa741c0450b297342bef774216510a42ca137a22a54f0d1e15e8b39d2526
"Teaninich 29 yo 1983/2013 (57.5%, Signatory Vintage, refill butt, cask #8071, 471 bottles)","Teaninich 29 yo 1983/2013 (57.5%, Signatory Vintage, refill butt, cask #8071, 471 bottles) Colour: straw. Nose: hold on, isn't this heavy rum? Amazingly big notes of sugar cane, petrol, olives and tar, we're extremely far from 'Teaninich' but I must say I'm enjoying this a lot. No, no mistakes at WF's sample handling department. Becomes a tad gentler over time but it remains mineral and kind of flinty. Putty. With water: more of all that! Was the cask seasoned with (good) plasticine? Or smoked? Liquid smoke? Was the cask stored in a Harley garage? Mouth (neat): whah! Same feeling, this is quite incredible, mineral, petroly, very nervous (lime!), with some white rhum agricole, some salmiak... Spectacular whisky. With water: and now there's some seawater! More lemons, more almond oil, gravel, chalk, crisp chenin blanc, wax, smokes... Yes, holy smokes! Finish: long, putty-like, salty, mezcaly... What's not to like? Just the aftertaste that's maybe a notch fizzy, bizarrely. Comments: Springbank in disguise? Ex-Lagavulin wood? Fortified Pouilly-Fumé? I wanna see this cask's papers! (just joking). My best surprise this year since Pichon-Baron 1990 in May - but that's not whisky, is it? SGP:373 - 93 points.",93,2013-10-24,https://www.whiskyfun.com/archiveoctober13-2.html,3282da3856a93e0f79000817aa33a485424316396eac3908389568f132d921f7
"Ben Nevis 17 yo 1995/2013 (51.8%, Càrn Mor for Whisky Circle Pinzgau, sherry hogshead, cask #965)","Ben Nevis 17 yo 1995/2013 (51.8%, Càrn Mor for Whisky Circle Pinzgau, sherry hogshead, cask #965) Sherry + Ben Nevis is often a funny game. Colour: gold. Nose: very dry and leathery! A leather shop somewhere in Turkey, with hundreds of jackets, coats, shoes, even trousers (I think we got it, S.) Some gunflints too, a feeling of smoke, then soot and saltpetre, moss, cellar, fern, engine oil, chocolate, matches, more rocks... And before you ask, no cabbage/eggs. More raisins, chocolate and oranges after a while, it's becoming much less dry. With water: yesss! More fresh herbs, mint, lime and oranges. Doesn't go off the tracks - as some may do. Mouth (neat): as I often say, Ben Nevis is never boring. This time it's a combination of malt and oranges that take the lead, with something slightly burnt in the background (bacon??) and a growing chocolaty side. Big cinchona and chlorophyll too, a little biting. With water: chocolate, pepper and oranges. Remains just a notch prickly/fizzy. Finish: good length. Orangeade, touches of leather again in the aftertaste. Comments: fun and very good, as a middle-aged Ben Nevis should be. Not 'dirty' at all! SGP:652 - 87 points.",87,2013-10-23,https://www.whiskyfun.com/archiveoctober13-2.html,d34a3403385fd5de81e4de3571adbfb9dd2b0794a4d78a05d98dd351e653911f
