whisky_name_raw,review_text,score,review_date,source_url,dedupe_hash
"St Lucia 11 yo 2002/2013 (52.6%, Duncan Taylor, cask #5)","St Lucia 11 yo 2002/2013 (52.6%, Duncan Taylor, cask #5) Ouch, this is genuine pot still rum from St Lucia Distillers, not some sweetened/flavoured ethanol. Tell me about contrasts… Colour: pale gold. Nose: total cane-ness, phenolic, olive-y, rubbery in a good way, herbal, mineral, with some eucalyptus and plenty of aniseed and liquorice… What’s not to like? We’ve tried an official one called ‘1931 Second Edition’ which was really nice, but not this nice. Mouth: indeed, great work by Duncan Taylor. Very salty, extremely salmiaky, quite huge, and actually more on salted liquorice than the most extreme Trinidadians or Jamaicans. Perhaps not for beginners – but I am a beginner. Love the saltiness. Finish: extremely long. Touches of rose jelly and Turkish delights, otherwise it’s totally on salted liquorice. Comments: doesn’t go in for subtleties. Beastly! SGP:651 - 83 points.",83,2015-11-08,https://www.whiskyfun.com/archivenovember15-1-Armagnac-Brora-Clynelish-Caol-Ila.html,15aa2fbda69a4f1a826d42afca45a1ce4fcdc2f877ea3c4ab368ad4fc65e55c6
"Guyanan Rum 10 yo (46%, Cadenhead, Green Label, +/-2014)","Guyanan Rum 10 yo (46%, Cadenhead, Green Label, +/-2014) A shame that we wouldn’t know which ‘style’ of Demerara rum this is, but on the other hand, the official El Dorados are sweetened so a more natural one is welcome. Colour: straw. Nose: it’s rather light style Demerara, close to the cane, without much salty/phenolic things. In fact it’s almost Cuban. Sunflower oil, a little sugar, cut grass, fresh walnuts… In fact it’s rather delicate. Most probably column. Mouth: indeed, it’s sweet and light, with rather unusual notes of barley sugar, plain Demerara sugar, orgeat, confectionary, marshmallows… The lightest side of Demerara. Finish: rather short, with touch of paint/putty. Nougat and sweet nuts. Comments: the lighter side of Demerara indeed. Not the most interesting to malt drinkers, I’d say. SGP:540 - 76 points.",76,2015-11-08,https://www.whiskyfun.com/archivenovember15-1-Armagnac-Brora-Clynelish-Caol-Ila.html,635f93ebc2ee3cefdfdc0350a18e292d314bdad8213f6c5a6bc5b1fc3a3b5303
"St. Lucia Distillers '1931 First Edition' (43%, OB, St. Lucia, 80st Anniversary, 2011)","St. Lucia Distillers '1931 First Edition' (43%, OB, St. Lucia, 80st Anniversary, 2011) This is funny, we just had another St Lucia – and we already tried the second edition, bottled in 2012 (WF 80). Colour: dark amber. Nose: very rich, full of sugar liqueur, caramel, and maple syrup, but this kind of works. Dried bananas, molasses, a touch of plastic, perhaps. Toasted pastries. The jury’s still out… Mouth: thick, rather oaky, but quite nice, with fairly complex flavours, chocolate, bananas, liquorice, honey… I’m reading my notes for Edition 2 and that one was a little lighter and more herbal, perhaps. This one’s really rich. Some liquorice and mint. Finish: medium, saltier. Liquorice and honey, apricot jam… Comments: not my favourite style, but should I intellectualise this baby (yeah right), I’d say it’s probably excellent. Probably not sweetened. SGP:652 - 82 points.",82,2015-11-08,https://www.whiskyfun.com/archivenovember15-1-Armagnac-Brora-Clynelish-Caol-Ila.html,b9e343ae0b5b26c47cccdcd1b3d2c804b6093f18d2d4400465df05b7199ab35b
"Worthy Park 8 yo (43%, Bristol Spirits, Jamaica, 2015)","Worthy Park 8 yo (43%, Bristol Spirits, Jamaica, 2015) Oh, a Worthy Park! We’ve recently had some by Rum Nation – Wilson & Morgan that were superb. Colour: gold. Nose: extraordinary nose! Rocks, oils, salt, gherkins, olives, tar, Barbour grease, fermenting hay, fennel, menthol… Let’s only hope it won’t be a little thin on the palate, because of the low strength. Mouth: what a spirit. Earthy and sooty, with dust and gravel, ashes, a feeling of coal or pencil lead, black olives, salted liquorice, seawater, perhaps mussels… The spirit is just perfect, and at 50% vol., it would be even more perfect. Finish: long despite the strength. Salty, almost vinegary aftertaste. Comments: what a distillery! What a distillate! SGP:462 - 86 points.",86,2015-11-08,https://www.whiskyfun.com/archivenovember15-1-Armagnac-Brora-Clynelish-Caol-Ila.html,200a9e1493852cde95362e06b9be8478d5c2a910d1fdf7ec025e8a120d768a8e
"Angostura 12 yo '1824' (40%, OB, Trinidad, +/-2014)","Eeny, meeny, miny, moe… Angostura 12 yo '1824' (40%, OB, Trinidad, +/-2014) Crikey, not much luck this time. Column still rum from molasses. Colour: deep amber. Nose: hello? Is there somebody? Very light, honey sauce, caramel… ‘Ideas’ of PX. Perhaps herbal teas. Raisins and vanilla. Mouth: sweet and light. Goes down well. Raisins. Light. Perhaps a little boring and weak. Finish: short, sweet, easy, raisiny. Orange syrup. Burnt sugar and maple syrup in the aftertaste. Comments: did we just have some rum? Not unpleasant, just very unnoticeable. For mad mixologists, I imagine. Hello? SGP:530 - 71 points.",71,2015-11-08,https://www.whiskyfun.com/archivenovember15-1-Armagnac-Brora-Clynelish-Caol-Ila.html,ddebeb32255fc006e5c8ac2b28d01c4d0d9a44a9fe668b2e6777a621a273212b
"Deadhead 6 yo (40%, Mexico, +/-2014)","Eeny, meeny, miny, moe… Deadhead 6 yo (40%, Mexico, +/-2014) A funny bottle. It’s a blend of pot still and column rum, not too sure about the origins. Not too sure it’s about the content anyway. Colour: pale gold. Nose: sugar, herbal tea, honey, a touch of maple syrup. Sweet stuff, it seems. Quick… Mouth: not too sweet, good news. Teas, ashes, a tad dusty, notes of overripe apples. A rather good blend, it just lacks body. Peaches, perhaps. Finish: short, a little sugary. Mint and apple juice. Comments: we’ve seen much worse. The bottle’s funny. Let’s move on. SGP:540 - 70 points.",70,2015-11-08,https://www.whiskyfun.com/archivenovember15-1-Armagnac-Brora-Clynelish-Caol-Ila.html,da94c94c1b80c51be5b41e915ae2d7d8cfa5330e9344a270588a77cffb9d4d42
"Zacapa ‘Solera 23 Etiqueta Negra' (43%, OB, Guatemala, +/-2014)","Eeny, meeny, miny, moe… Zacapa ‘Solera 23 Etiqueta Negra' (43%, OB, Guatemala, +/-2014) Ouch. The successor to the Black Label, discontinued in 2004, which I did not like, which was a fake 23 years old, but that’s kind of legendary. Colour: dark red amber. Nose: not much. Molasses, coffee, dried bananas, a little cardboard. Mouth: thick, cloying, ridden with sugar. Caramel and corn syrup. Thin body. Finish: short, dusty, sweet. Papaya jam and marmalade in the aftertaste. Banana purée. Comments: extremely weak, needs ice. Totally unbalanced. Not worth of our time. Bwaah… SGP:720 - 40 points.",40,2015-11-08,https://www.whiskyfun.com/archivenovember15-1-Armagnac-Brora-Clynelish-Caol-Ila.html,84a2c94c0570b25a8609541189c9c3cce39ac21f5b158f6752c29ef0f7144550
"Clynelish 21 yo 1992/2014 (49.8%, La Maison du Whisky, Jam Session #3, bourbon hogshead, cask #1510/9)","Clynelish 21 yo 1992/2014 (49.8%, La Maison du Whisky, Jam Session #3, bourbon hogshead, cask #1510/9) Jazz and Clynelish, a great sounding combination, am I not right? And the Vanguard/Blue Note style label just clicks on me. Great pastiche work, not far from my favourite recent whisky label. Now in my experience, 1992 was lighter, less waxy vintage, let’s see… Colour: gold. Nose: indeed, this is rather akin to neighbouring Glenmorangie at first nosing, only a tad grassier. Apple compote, baked oranges, gooseberries, a little olive oil, husk, brioche… So indeed a lighter, more elegant style. For your lounge rather than for the hipflask. Mouth: a notch more ‘Clynelish’, with touches of wax indeed, but other than that, it’s a rather light, slightly oily, fruity and barleyish malt whisky. Orange and apple cakes, drops of maple syrup, a floral side… It’s greatly balanced and greatly elegant, just not totally ‘Clynelish’. Finish: yeah and as that sometimes happen, the finish just proves me wrong. In this case, there’s much more salt, and much more grass than in Clynelish’s lighter neighbours, up there. And the aftertaste is very Clynelish, and just wonderful. Salty butter, waxes, orange skin, and tobacco. Comments: superb, and interestingly different. Very complex whisky. SGP:452 - 88 points (98 for the label!)",88,2015-11-06,https://www.whiskyfun.com/archivenovember15-1-Armagnac-Brora-Clynelish-Caol-Ila.html,725e350f6f2325ddde696fecaafb23b1d12fb72c02f05bf3ce95dd1798e0f7a4
"Clynelish 18 yo 1996/2014 (52.7%, The Whisky Agency, for Taiwan, refill butt, 360 bottles)","Clynelish 18 yo 1996/2014 (52.7%, The Whisky Agency, for Taiwan, refill butt, 360 bottles) The Whisky Agency, long time no see! Colour: gold. Nose: do you know Rudolph Lindt? Did you know he was the manager at Clynelish around 1996? Only half joking, this is as chocolaty as whisky can be. We’re not talking oloroso-ed dark chocolate, we’re talking Lindt’s milk chocolate, creamy, buttery, soft, and rather nutty/vanilled. I’m not a huge fan of sherried Clynelish, but I have to say these refill casks can make wonders. Very nice touches of gunpowder, dried mushrooms, and tobacco. So far so nice. With water: great. Mushrooms and ev’rything that comes with them. You know, pine needles, earth, mud, moss, parsley… Yes, parsley! Mouth: wow, excellent! Some parts remind me of the old 1965s and 1966s by Cadenhead for Italy, with this stony, gamy, and leathery style. Perfect bitter oranges in the background, and always this salty touch. And rocks, stones, and gravel. Impressed. With water: yess. Tobacco, earthy pu-erh tea, bitter oranges, and a touch of ginger and Campari. Finish: perfect, long, with more pepper and ginger, perhaps two raisins, and always this waxy smoke. Very mentholy retro-olfaction, which is cool. Toothpaste ;-). Comments: I often find sherry and Clynelish don’t sing in tune, but when they do, the end result can be magnificent. That’s the case here, even dear Ornette would have approved. SGP:362 - 91 points.",91,2015-11-06,https://www.whiskyfun.com/archivenovember15-1-Armagnac-Brora-Clynelish-Caol-Ila.html,fdbe9dd269ff03c5f0028d3002299e649253e6aaeb44a63d6fe369e748a2e51a
"Clynelish 16 yo 'Darkness' (54.9%, Master of Malt, Oloroso Cask Finish, 2014)","Clynelish 16 yo 'Darkness' (54.9%, Master of Malt, Oloroso Cask Finish, 2014) It is to remember that this slightly unlikely brew got great silver at the Malt Maniacs Awards 2014. All 100% blind, no categories that give everything away. You know, like Skye, 10 yo, 45.8% and all that. Yeah, blind tasting… Excuse me? We’re running late? I know, I know… Colour: pale amber, so not that dark, hehe… Nose: cigars. And cigars. Plus cigars. And perhaps a little tarmac, soot, old walnuts, and fresh concrete. Forgot to mention dried porcinis and Grisons meat – or Bresaola. With water: hay, mud, cured ham, tobacco, saltpetre, more hay. Mouth (neat): I hate it that I quite enjoy this heavy, slightly stuffy concoction. Bitter chocolate, walnut wine, oloroso indeed, tobacco, bitter oranges, pickled ginger, pepper, leather… With water: same, only a notch grassier, with a limy backbone. Finish: long, and quite curiously, fresher and zestier, with more lemons. Comments: excellent. Once again, sherry+Clynelish worked. Maybe be was I totally wrong… SGP:462 - 87 points.",87,2015-11-06,https://www.whiskyfun.com/archivenovember15-1-Armagnac-Brora-Clynelish-Caol-Ila.html,f1a0263c0a9e84aea85f4a1f97d8b4f1d4cc2367ef773ab4fadac17eeb15cb66
"Clynelish 18 yo 1997/2015 (53.3%, Wilson & Morgan, Barrel Selection, Tokaji wood, cask #6493)","Clynelish 18 yo 1997/2015 (53.3%, Wilson & Morgan, Barrel Selection, Tokaji wood, cask #6493) Okay I’ll say it, some of the worst (excuse me, my least favourite) whiskies I’ve ever tasted had been matured, or rather finished in Tokay/Tokaji. There’s no sweeter wine than Tokay, and while the best ones are fabulous, others are just too sugary and cloying, in my opinion. Which will just wreck a 1974 Ardbeg, if you ask me. But let’s move on… Colour: gold. Nose: it’s not in the nose that problems occur. In this case it’s quite lovely, rounded and sweet, like nosing your mirabelle jam while having breakfast early in the morning. Or something like that. Having said that it’s not the Clynelishest Clynelish ever so far. With water: f***k, this works. More overripe mirabelles, plus some chamomile tea and ‘nosing a 500g-jar of all-flower pollen’. Mouth (neat): LOL! You get the Tokay, and mirabelles, and zwetschke, and maybe even quince jelly, plus maybe even some honeycomb – which does, indeed, include some wax – but I would not hope anybody would say ‘this is Clynelish’. Except the good people at Wilson & Morgan, of course. But if you like mirabelles – and golden sultanas - you’ll like this. With water: gets thick as the thickest jam. It’s silly, I think I never experienced this, to this extent. Where’s my silver spoon? Eating mirabelle jam while your spouse isn’t watching… What’s great is that no oaky off-notes are playing the killjoys, so all is fine. Finish: long, and curiously lighter, with some lemonade. I’m not saying this is light whisky. Comments: please give me a minute to gather my thoughts... Good, I hate it, and I love it. In fact, I hate it that I love it, but the lack of Clynelishness will prevent me from going to 90 and north. So (ha, the Italians)… SGP:751 - 89 points.",89,2015-11-06,https://www.whiskyfun.com/archivenovember15-1-Armagnac-Brora-Clynelish-Caol-Ila.html,3abd63477780bbad59f3672ce39d2114168a7aaa0bd45328992b735088cab9b9
"Clynelish 22 yo 1992/2014 (62.1%, Blackadder, Raw Cask, hogshead, 190 bottles)","Clynelish 22 yo 1992/2014 (62.1%, Blackadder, Raw Cask, hogshead, 190 bottles) Wait wait wait, I owe you another quote from Black Adder. How about this one: ‘There hasn't been a war run this badly since Olaf the hairy, King of all the Vikings, ordered 80,000 battle helmets with the horns on the inside.’ Right, I may have published that one before. Colour: gold. Nose: I’m sure Olaf The Hairy would have approved, since I’m sure this would kill any enemy. There is a waxy/fruity Clynelishness, but other than that, this would just send you to the Whallalha (however that thing is spelled). With water: ci-vi-li-za-tion! Quite. Honeycomb, overripe apples, cakes, grapefruit jelly. Some limestone too, but I wouldn’t call this ‘a mineral Clynelish’. Mouth (neat): it’s great. Someone’s pouring liquid wax into your throat. I couldn’t tell you much more, but it’s a great feeling. And now excuse me, but I need to add water… With water: exactly the same feeling of sipping Glenmorangie as with the jazzy 1992. Apple pie covered with honey and butter cream. Finish: quite long, very fruity, very orchardy. Oily feeling, like if you just drank sunflower oil. Comments: so not very Clynelish, but very good, smooth, malt whisky. Yep, when diluted. SGP:551 - 85 points.",85,2015-11-06,https://www.whiskyfun.com/archivenovember15-1-Armagnac-Brora-Clynelish-Caol-Ila.html,c776e21f4f2e77d720dafc56ee43a26a3cd6adb618ff4e9e7e67d82b95e5dab2
"Clynelish 1997/2013 (46%, Gordon & MacPhail, Connoisseurs Choice, refill sherry hogsheads)","Clynelish 1997/2013 (46%, Gordon & MacPhail, Connoisseurs Choice, refill sherry hogsheads) Let’s remember that G&M have long been the only ones to really carry the new Clynelish flag, with their famous ‘orange and brown’ label. The old official cream label was containing ‘old’ Clynelish. Colour: straw. Nose: I don’t know if that’s pure magic, but these bottlings by G&M are the closest to the ‘old’ Clynelish indeed, with a grassy, sooty, very mineral smokiness that’s not often to be seen elsewhere these days. That makes it a tad unsexy, especially given the rising porridge and leaven, but lovers of old skool Highlanders should love it. Earth. Mouth: very old style indeed. Ashes and soot again, on wholegrain bread, tobacco, and bitter oranges, plus even more salt than usual, and always this feeling of strong ale. Rather raw and, yes, unsexy. Finish: quite long, with the trademark citrus and wax coming out. Comments: I love it, but I know some folks may find it difficult and a little too austere. Not me. SGP:362 - 84 points.",84,2015-11-05,https://www.whiskyfun.com/archivenovember15-1-Armagnac-Brora-Clynelish-Caol-Ila.html,ad6c99bf7c24c744aeeda9c4e7b2a476f5509837c4ac6a3e2faf0e5a36379f6d
"Clynelish 18 yo 1996/2014 (46%, Berry Bros & Rudd, cask #6824)","Clynelish 18 yo 1996/2014 (46%, Berry Bros & Rudd, cask #6824) I remember a superb sister cask by BBR last year (#8783, WF 90) but that one was CS. Colour: straw. Nose: the base profile is the same, but this one’s rather brighter and fruitier, with a little more citrons and oranges on top of plenty of candle wax, then soot and ink, plus fresh almonds, wet sand, and touches of hessian and menthol. An old bag that was used to carry mint leaves, perhaps? Mouth: prototypical Clynelish from those years. Lemon, a touch of salt, an acridness, soot, wax, some earth, cider apples, roots… Need I say more? Finish: long, tense, a little angular, in a good way, leaving roots, salt, and earth on your tongue. Comments: this could have been bottled at CS if you ask me. Typical. SGP:363 - 87 points.",87,2015-11-05,https://www.whiskyfun.com/archivenovember15-1-Armagnac-Brora-Clynelish-Caol-Ila.html,cc7239774e5bd31b0311b04eeda22a945a5ea994843bf23b225dac2698fea8f5
"Clynelish 1997/2015 'Redcurrant Jus' (46%, Wemyss Malts, hogshead, 300 bottles)","Clynelish 1997/2015 'Redcurrant Jus' (46%, Wemyss Malts, hogshead, 300 bottles) These SMWS-like names always make me laugh. They add some fun to these otherwise rather austere packages. And I often find the whiskies quite superb, let’s see. Colour: pale gold. Nose: the cask was more active, which imparted more roundness and fruitiness. Which, in turn, would rather lead to the early-to-mid eighties at Clynelish, if you see what I mean. A tropical touch, passion fruits, lemons, was, lemon balm… And rather less sooty, grassy, or mineral notes. Mouth: sweet Vishnu, this is much to my liking. Blinded, I’d have said 1982 or 1983, really. Citrons, vanilla, beeswax, a touch of raspberry jelly (okay, redcurrants, if you like), then more coastalness, especially touches of salt and seashells. Finish: long, with some kind of waxy lemon pie, with some custard. Comments: impeccable, with just the right amount of oak influence. SGP:562 - 88 points.",88,2015-11-05,https://www.whiskyfun.com/archivenovember15-1-Armagnac-Brora-Clynelish-Caol-Ila.html,ffcfb5271e5807b9283e6499c9ba9984e27d3f286c95bd2da060e1cdd6ca0b38
"Clynelish 'Select Reserve 2nd Edition' (56.1%, OB, Special Release, 2946 bottles, 2015)","Clynelish 'Select Reserve 2nd Edition' (56.1%, OB, Special Release, 2946 bottles, 2015) Despite it being NAS, I had enjoyed last year’s version quite a lot (WF 88). Now the lovely little book about these SRs states that it’s ‘at least fifteen years’, which virtually makes it a 15 yo, ‘and often far more’. They have used several types of cask – too long to mention – but the colour does not suggest first fill sherry. Colour: pale gold. Nose: there is a little vanillin at first nosing, but no coconut. And then, indeed, a combination of various periods of Clynelish, blended together with care. It’s almost as if you had vatted the BBR and the Wemyss that we just tried. Mangos and passion fruits, all things citrus, wax and paraffin, a drop of honey, some hay and some damp earth, some tobacco, a little menthol yet again… In truth, this nose is beyond reproach. With water: some mud and some seaweed coming out. Mouth (neat): watch it! Starts smooth, so you may want to down a good sip, but it’s very strong! Lemon skin, waxes again, a lot of lemongrass, green tea, a great bitterness (around grapefruits), and more and more salt. A grassy smokiness. With water: becomes sauvignony, like many 1995-1998s are. Or rather, manzanilla-like. Walnuts, a drop of seawater, a touch of mustard. I juts couldn’t be against that. Finish: long, grassier, limy and salty. A great margarita made in Sutherland. Comments: it seems that it’s sharper and better chiselled than last year’s version. Which leads to this fact: I like it even better. Too bad it’s too expensive (£550) SGP:462 - 90 points.",90,2015-11-05,https://www.whiskyfun.com/archivenovember15-1-Armagnac-Brora-Clynelish-Caol-Ila.html,2bba70bd620229940f3c870114aa54db5c0c7988804f7f0cba9aa6b7de41b0a0
"Clynelish 19 yo 1995/2015 (57.8%, The Single Malts of Scotland, hogshead, cask #932013, 254 bottles)","Clynelish 19 yo 1995/2015 (57.8%, The Single Malts of Scotland, hogshead, cask #932013, 254 bottles) Priced at less than a fifth of the price of the new Select Reserve. Colour: straw. Nose: there’s a sucrosity in this nose, but that won’t last, since it’s rather a tense, slightly yeasty, pretty organic and medicinal Clynelish that rises to your nostrils. Tincture of iodine, green tobacco, fern and moss, wet chalk, lager beer… Maybe is that the high strength? With water: smoother, with more fruits. Blood oranges, perhaps. Also the expected wax, and various tiny berries – or rather the spirits made thereof. Sorb, holly, elderberries… Mouth (neat): huge, sharp like a blade, with unexpected notes of blackcurrant fruits and buds, possibly from the alcohol. Let’s see… With water: great, but earthy, chalky, slightly bitter and herbal, with less fruits than expected. An austere Clynelish. Finish: same-ish, with this medicinal side once again. Not unlike a lightly peated Laphroaig. No, not Laphroaig Select! ;-). Comments: perhaps more for the Jansenist Clynelish lover. SGP:362 - 87 points.",87,2015-11-05,https://www.whiskyfun.com/archivenovember15-1-Armagnac-Brora-Clynelish-Caol-Ila.html,590b442e29ba577d8a2d8d54bedbf727a37b76c0430919398d60d929e69b404f
"Caol Ila 10 yo 2005/2015 (56.4%, Gordon & MacPhail, for McWhisky, 233 bottles)","Caol Ila 10 yo 2005/2015 (56.4%, Gordon & MacPhail, for McWhisky, 233 bottles) McWhisky.com are an online retailer. Colour: white wine. Nose: raw, fresh, young, extremely coastal sweet peat, with a medicinal side. Tincture of iodine, antiseptic. That’s all, folks. With water: some raw barley, beach sand, a little ink. Perhaps new plastic pouch at the supermarket – but those are now streng verboten. Say leatherette. Mouth (neat): sweet peat. I’d call this ‘minimal’, but it hasn’t got any flaws. With water: nice seawater and lemon juice, plus smoked water. Of course you can smoke water. Finish: medium, a tad grassier. Spearmint? Comments: a good young soft Caol Ila. Does the job and does it well. SGP:555 - 82 points.",82,2015-11-04,https://www.whiskyfun.com/archivenovember15-1-Armagnac-Brora-Clynelish-Caol-Ila.html,7389b04fa4f953c64509341734b55bb8bc7dc9dc8416ad6354d368152bbe294b
"Caol Ila 10 yo 2004/2015 (60.1%, Gordon & MacPhail, Cask Strength, sherry butts)","Caol Ila 10 yo 2004/2015 (60.1%, Gordon & MacPhail, Cask Strength, sherry butts) A vatting of four casks. Colour: straw. Nose: the sherry’s light. Some sucrosity, gravel, grass, mint… It’s quite strong, so… With water: simple, easy, straightforward. Not one that will revolutionise Mankind, but it’s fine. Mouth (neat): very thick, clean, salty, zesty, with a honeyed roundness. Is that the sherry? Love its almondy side. Lemon-flavoured marzipan coated with Demerara sugar. Or something like that. With water: nice salty touch. Green olives, salted marzipan, smoked fish. Finish: medium, sweet and salty. Comments: very good. You don’t need an essay, do you? SGP:556 - 83 points.",83,2015-11-04,https://www.whiskyfun.com/archivenovember15-1-Armagnac-Brora-Clynelish-Caol-Ila.html,fae7ffe9388e7f72ffffe9124035e76cf759d4c8497515be5be81714341490c7
"Port Askaig '100° Proof' (57.1%, Specialty Drinks, +/-2015)","Port Askaig '100° Proof' (57.1%, Specialty Drinks, +/-2015) Now what’s 100° proof exactly? 56.9%? 57.0%? 57.1%? Colour: white wine. Nose: yep, but moderately expressive when undiluted. With water: bandages, barley sugar. Mouth (neat): excellent young sweet peat. Extremely simple, very good (says the guy who just wouldn’t stop pestering people with stories about complexity). With water: tinned fruits, fructose, peat smoke. Finish: rather long, narrow, simple, good. Comments: a tad binary, perhaps, but good (so that would be 1, I suppose). SGP:546 - 82 points.",82,2015-11-04,https://www.whiskyfun.com/archivenovember15-1-Armagnac-Brora-Clynelish-Caol-Ila.html,396b11369fde7c4aabeda12c93723cf26ed6514b4540312aefd2acb25dd3a2b4
