whisky_name_raw,review_text,score,review_date,source_url,dedupe_hash
"Glen Garioch 1975/1987 ‘Coilltean’ (57%, Duthie for Samaroli, 648 bottles)","Glen Garioch 1975/1987 ‘Coilltean’ (57%, Duthie for Samaroli, 648 bottles) Bwah bwah bwah, not the first time we’re trying this beauty, but it’s from another bottle and, yeah, it’s Samaroli. Colour: white wine. Nose: it’s from the peaty years, and it’s as straight, austere, and millimetric as whisky can be. Astounding high-precision combination of coal ashes, beach sand, iodine, bandages, grapefruits, and horseradish. Grand Cru style. With water: absolutely immaculate. We’ll never see whiskies this great again, I’m afraid. Mouth (neat): totally huge, fat, terribly Brora-ish (after all, that’s the East Coast as well), mustardy, peppery, very smoky, and stunningly citrusy. We’re rather talking old citrus liqueurs, the ones that hip mixologists are gathering these days like if there was no tomorrow. Amazing whisky that was probably totally out of fashion when Sig. Samaroli was proudly trying to sell it to the incompetent masses. With water: oh, all these tiny herbs and oils! Sage, tarragon… Well, the list would be too long. Finish: very long, salty, coastal, still rather fat, herbal… Simply magnificent. Comments: simply a blade. First gun whisky, up there in the pantheon of malts, just like its bottler. Pace, dear Silvano! SGP:466 - 95 points.",95,2017-03-09,https://www.whiskyfun.com/archivemarch17-1-Caol-Ila-Glenrothes-Amrut.html,26e69f497c6be738cf78d623be716dfd475d0a488bc761983188ec2801fd73f9
"Glen Garioch 12 yo (48%, OB, +/-2016)","Glen Garioch 12 yo (48%, OB, +/-2016) The 12 is back on WF, after almost seven years! And it’s got more power too, at 48% vol., an unusual bottling strength for a ‘core of standard range’ bottling. What’s more, from the official website, we’ll learn that this is ‘the perfect accompaniment to Parmigiano-Reggiano’. Would you mind if we discarded the cheese? Colour: gold. Nose: muesli, flowers and porridge abound in this nose, as well as hints of IPA beer and acacia honey, zucchini flower, sweet malt… I find it gently yeasty, in a very nice way, but we’re far from the heavier peaty ones from times gone by. Mouth: sweet and creamy arrival, but the whole’s soon to become lemony, pretty mineral, and pleasantly sour. Always these notes of IPA. Some lemon, some grass, some green tea, some not-too-ripe pears… It’s pretty firm and tense, actually, which is very nice. I think it’s got the body of the older ones, just not the smoke. Finish: rather long, rather ‘green’. Peeling, white pepper and grasses, as well as some custard. Comments: a style that’s a little austere, but at times you’d think it’s going a bit towards Springbank or Benromach. On the right track! SGP:462 - 86 points.",86,2017-03-08,https://www.whiskyfun.com/archivemarch17-1-Caol-Ila-Glenrothes-Amrut.html,003fbe90b9efc0234e3dea4e43e150b2ff451d5b1b9d1270b256d8a8dd30165e
"Glen Garioch 1998/2016 (57.5%, Càrn Mor, Celebration of the Cask, sherry hogshead, cask #3728, 220 bottles)","Glen Garioch 1998/2016 (57.5%, Càrn Mor, Celebration of the Cask, sherry hogshead, cask #3728, 220 bottles) Colour: gold. Nose: more coffee and malt in this one, and I guess that’s the sherry’s work. Walnut wine, chocolate, chicory, pecan pie, roasted peanuts… All things that are liked at WF Towers. The whole’s surprisingly smooth and rounded, having said that. With water: gets rather floral, with honeysuckle and orange blossom. A bit of earthy tobacco in the background, as well as some pear liqueur. From Alsace, naturally. Mouth (neat): starts rich, and rather peppery and gingery beyond all the marmalade that’s entering your mouth. Bitter oranges everywhere, and a touch of icing sugar. With water: more oranges than in natural Dalmore! Was it in a Cointreau cask before being re-racked into sherry? (hey, I’m joking). Finish: medium, on the same notes. Quite fresh given this baby’s pedigree. Comments: very different, but rather in the same league as that of the official 12. Me likes. SGP:551 - 86 points.",86,2017-03-08,https://www.whiskyfun.com/archivemarch17-1-Caol-Ila-Glenrothes-Amrut.html,3dca01c55bc968d7fe2df4ab449410653cdbe2c4d7f2e4a2f2babe3a4aa98f95
"Glen Garioch 21 yo 1995/2016 (51.5%, Douglas Laing, Old Particular, cask #11471, 290 bottles)","Glen Garioch 21 yo 1995/2016 (51.5%, Douglas Laing, Old Particular, cask #11471, 290 bottles) This one came out in November last year. Let’s expect something very ‘naked’ according to the colour. Colour: pale white wine. Nose: a steel cask? Glass? Stone? Plexiglas? It’s not often that you’re getting this much youth (pears and stuff) from a twenty-one years old malt whisky. But the fact is that it’s pretty brilliant distillate, chalky, bready, mashy… And there are super-cool whiffs of rubbed mint leaves as well as some kind of light smoke. The neighbour burning dead leaves and cut grass. With water: same, with a little more barley water. Mouth (neat): very vibrant, very fresh, and perfectly fruity. All fruits from a western orchard, really, plus a drop of all-flower honey and another one of grass and lemon juice. Plus this chalk. With water: another very fine barley eau-de-vie, perfectly matured, and not oaked. Finish: medium, very fresh, maltier now. Oatcakes. Comments: I’m sorry but I think I’ll go for the same score. No copying-and-pasting that went wrong. SGP:551 - 86 points.",86,2017-03-08,https://www.whiskyfun.com/archivemarch17-1-Caol-Ila-Glenrothes-Amrut.html,2b877d381a93decacfe8808925115d0745564c0c59c2bed3d9bb3c688abd88e0
"Glen Garioch 22 yo 1992/2014 (49.3%, Sansibar, 136 bottles)","Glen Garioch 22 yo 1992/2014 (49.3%, Sansibar, 136 bottles) Classic vintage, many indies were having these, and many were excellent. Colour: straw. Nose: more smoke in these vintages, coal, scoria, soot… And Seville oranges, camphor, leather polish… So a fatter, more phenolic spirit, much closer to Springbank, in a way. Not the baddest of news! Mouth: really, Springbank from the same vintages, with some old rusty metal parts, some clay, some peppery peat, some cigar ashes, and a very peculiar rubbery/tarry side that. Almost forgot to mention some very acidic grapefruits. Finish: long, sharp, leafy, ashy, smoky, sooty, earthy… Comments: in way, Glen Garioch used to be like Brora, you had very peaty batches and you had gentler one. This one sure stems from the former category. SGP:453 - 89 points.",89,2017-03-08,https://www.whiskyfun.com/archivemarch17-1-Caol-Ila-Glenrothes-Amrut.html,51fbab732df2c7080f1ab8a4b6bd764ca27c117c8ac09a3c25526e2ac6864fb3
"Glengarioch 23 yo 1991/2015 (54.1%, Cadenhead, Small Batch, bourbon hogshead, 444 bottles)","Glengarioch 23 yo 1991/2015 (54.1%, Cadenhead, Small Batch, bourbon hogshead, 444 bottles) That is right, Cadenhead are using the ‘Glengarioch’ moniker, no typo here. Colour: straw. Nose: a gentler batch again, much less smoky – although I do find a little coal smoke – and much grassier and mineral. Zests, seaweed, salted butter… all we need now is a large plate of oysters. With water: plain malted barley and a little wax polish. Mouth (neat): a funny feeling of lemon drops and limoncello at first, then a lot of lemongrass and a little icing sugar. Haribo’s most lemony, err, stuff. With water: some plasticine coming out, some spirits do always react like that. Other than that, same lovely lemony profile. Finish: medium, very zesty. Lemon Schweppes. Comments: what did you expect? (oh come on!) Very good, bright and zesty. SGP:551 - 87 points.",87,2017-03-08,https://www.whiskyfun.com/archivemarch17-1-Caol-Ila-Glenrothes-Amrut.html,73251c4ba2e6bbd2e6b16c9977f58053de653bd8a96b51999dfd24e9385f9672
"Amrut 2009/2016 ‘Virgin Oak’ (60%, OB for Hot Malt Taiwan, cask #958, 102 bottles, +/-2016)","Amrut 2009/2016 ‘Virgin Oak’ (60%, OB for Hot Malt Taiwan, cask #958, 102 bottles, +/-2016) This is from peated barley, fasten your seat belts. Colour: amber. Nose: you would have thought the peat plus the new oak (virgin sounds better doesn’t it) would have offset Amrut’s creamy/fruity character, but not at all. In truth, this combination of mentholy saps and tropical fruit jams is just amazing. A wee bourbony side as well, but that would rather be an old Willett or something. With water: yess. Umami, old pu-her, soy sauce, beef stock, marrow, very old Chambertin… Mouth (neat): ueber-rich, and yet well-chiselled, with a feeling of old-style herbal liqueur and sweet pepper, Szechuan-style. Some kind of fruity coffee as well, but that may be the virgin oak. Old bourbon. What I do not get much is the peat. With water: where is the peat? And who cares? As usual, water brings out the oak, so careful, do not go below, well, say 50% vol. or it will become tea-ish/plankish. Finish: very long, youthful and yet complex, with all these tiny lemony herbs and spices. A touch of coconut in the retro-olfaction. Comments: I just cannot not think of those stunning Japanese malts that we used to get ten or fifteen years ago. And of the one that used to start with a K. This starts just as well. SGP:562 - 90 points.",90,2017-03-07,https://www.whiskyfun.com/archivemarch17-1-Caol-Ila-Glenrothes-Amrut.html,89fbbb9f80ef29f041a57f2f92d4c60628bcd10770297c995f184913f421c2b9
"Amrut ‘Port Pipe’ (59%, OB, cask #2713, 346 bottles, 2013)","Amrut ‘Port Pipe’ (59%, OB, cask #2713, 346 bottles, 2013) Not too sure this is a Taiwan exclusive, some European retailers are claiming that it was bottled for Europe, as does the label. Who knows, what’s sure is that it’s ex-Indian barley smoked with Scottish peat and matured in Portuguese wood (kind of). What a small planet. Colour: dark apricot. Nose: it’s great that the peat was light, I’ve always thought peat and Port were working together as well as Donald Rumsfeld with Bob Dylan. This has pot-pourri, propolis, peonies, millionaire shortbread, old Banyuls, lilac, chocolate, butterscotch, liquorice… What a whirlwind! With water: some very nice earthy touches. Mouth (neat): okay, I’ll say it, this is a little too much for me. Hyper-concentrated and rather too hot, with some dissonant spices. For example, I find there’s a little too much green pepper. With water: better but now there’s something spritzig and metallic that’s coming out. Bitter herbs, Fanta… Finish: long and very spicy. Peppered raspberries. I know, I know. Comments: some extreme and insane whisky that goes into many directions. I know some love it, though. SGP:662 - 78 points.",78,2017-03-07,https://www.whiskyfun.com/archivemarch17-1-Caol-Ila-Glenrothes-Amrut.html,52068abb2513844c4b44ae0d25911706866b89c50a29b95d41cdda491a79b72f
"Amrut ‘Intermediate Sherry’ (57.1%, OB, +/-2016)","Amrut ‘Intermediate Sherry’ (57.1%, OB, +/-2016) Not too sure this is a Taiwan exclusive either, friends, but when I first tried an earlier version, I just loved it. As far as casks go, it’s sandwiched, in a way. Bourbon, sherry, bourbon. Colour: deep amber. Nose: ah yes, I remember. Perfect chocolate, the best Mars bar ever, maraschino, prunes-and-marzipan, ham cooked in orange juice (works great), late-harvest gewürztraminer… I know all that sounds weird, but it’s not. Fantastic nose. Fan-tas-tic, believe me (Donald J., come out of this body!) With water: perfect. Sappy oranges and flowered fudge. Exceptional nose, really. Mouth (neat): tart blood oranges, chartreuse, a touch of rubber, cinnamon mints, marmalade, figs, cloves, mulled wine… In truth some flavours should clash, but they don’t. A matter of balance… Citrus. With water: here come the earthy tones, the drier spices, the cloves, the bitter chocolate… In short, the sherry. Finish: long and dry, which is always perfect. Sweet and cloying finishes are ‘no-goes’ in the house. Ginger, liquorice, unsweetened herbal teas… Comments: this should benefit from twenty further years of bottle ageing and become a star of whiskydom. SGP:662 - 91 points.",91,2017-03-07,https://www.whiskyfun.com/archivemarch17-1-Caol-Ila-Glenrothes-Amrut.html,5b0b0d8b8381906df8f2f2cb5c9d9e46fcbab109d329276661ed0ded3218ab36
"Amrut 2011/2016 ‘Pedro Ximenez Sherry Cask’ (56.5%, OB for Hot Malt Taiwan, cask #4122, 624 bottles)","Amrut 2011/2016 ‘Pedro Ximenez Sherry Cask’ (56.5%, OB for Hot Malt Taiwan, cask #4122, 624 bottles) This one’s unpeated, the rest is self-explanatory. Now careful with anything Pedro-ised … (says this humble taster)… Colour: deep amber. Nose: quadruple hurray, there’s no stuffy raisiny smells that I can get, rather a wonderful chocolaty and coffee-ish arrival that tends to split into various cake-y touches. Including banana cake. Love banana cake, don’t you? With water: I think Lindt have got some milk chocolate that’s filled with marmalade and ginger. That’s more or less it. Mouth (neat): spicy oranges and chocolaty herbs, I’d say. Some greenish spices and peppers tend to keep it a little harsh, it may need a little more time to polish itself. Other than that, nothing to complain about. With water: the oak spices feel a bit (nutmeg and cinnamon, as often) and there’s a slightly gritty leathery tea-ishness (tannins like) but all the rest is fine. Finish: long and spicy. Not unlike your fifth glass of mulled wine. Comments: I’ve always thought PX was difficult to handle (see Glendronach or Kilchoman) but in this case I think it’s worked rather well. Rather. SGP:571 - 80 points.",80,2017-03-07,https://www.whiskyfun.com/archivemarch17-1-Caol-Ila-Glenrothes-Amrut.html,5efd496d62ca16c30ea31cbd9fafc918710cd07095288f0bd2cb700087526a1f
"Caol Ila 6 yo 2009/2016 ‘Erin’s Drop’ (59.9%, Bar du Nord, 305 bottles)","Caol Ila 6 yo 2009/2016 ‘Erin’s Drop’ (59.9%, Bar du Nord, 305 bottles) A bottling for that famous whisky bar in Switzerland. Colour: straw. Nose: first a little fresh butter, then bags of smoked lemons and grapefruits. It’s clean but narrow, but that may come from the very high strength, let’s see… With water: damp fabric and earth, plus smoky pears. Mouth (neat): ultra-young, very ashy, and frankly mezcaly. Tart lemons and a smoky earthiness. A little too strong though, it’s hard to enjoy it ‘like that’. With water: tropical fruits come out. Perhaps blood oranges? Finish: medium, fruity, slight sour. Sour apples, soot and ashes. Comments: young and good. Hard to say much more. SGP:545 - 82 points.",82,2017-03-06,https://www.whiskyfun.com/archivemarch17-1-Caol-Ila-Glenrothes-Amrut.html,debba6b63f8de6de0f379099d5523fb62882599eb8162c4af68115c2124d9254
"Caol Ila 9 yo 2006/2015 (51.2%, Eiling Lim, 109 bottles)","Caol Ila 9 yo 2006/2015 (51.2%, Eiling Lim, 109 bottles) From Switzerland straight to Malaysia (through Belgium)! Colour: white wine. Nose: this is a fruity one, but that’s not only pears and pineapples like in many very young malts. There are passion fruits, for example, and of course lemons, then some classic brine-y/smoky olives. Always a treat when those do make an appearance. With water: more classic sooty CI. Mouth (neat): crystal clear lemony smoke, then rather citrons and oranges. This one’s very well chiselled, while it’s rather less ‘seawatery’ on the palate than others. With water: towards apple and lemon juices, blended. Milder smokiness. Finish: medium, clean, fruity. Some green tea in the back. Comments: very good, but careful with water. SGP:554 - 85 points.",85,2017-03-06,https://www.whiskyfun.com/archivemarch17-1-Caol-Ila-Glenrothes-Amrut.html,9fe0fd0256af7eec10211d4df1d34a12dac657904697914dd966cbd23a9398c3
"Caol Ila 13 yo 2003/2016 (58.9%, Adelphi, cask #301264, 280 bottles)","Caol Ila 13 yo 2003/2016 (58.9%, Adelphi, cask #301264, 280 bottles) Adelphi are well known for working hand in hand with the eyewear industry. Well that’s what anyone will understand from their whisky labels… Colour: white wine. Nose: its incredible what a few extra-years can do to a whisky. Indeed, again, this is much more complex, with many more flowers and herbs, resins, mint, liquorice, camphor, thuja wood, grapefruits, garden bonfire, coal smoke… With water: ah yes, smoked marzipan, orange zests, tiger balm… Mouth (neat): wonderful, tart, perhaps a little pungent, all on lemony things and pure grass and peat smokes. Grapefruits, lime, rhubarb… Really wonderful. With water: perfect ashy orangey smoke and smoked almonds. A cup of lapsang souchong to boot. Finish: rather long, sooty, almondy, citrusy. Wonderful freshness. Comments: excellent young/middle-aged Caol Ila, already complex. SGP:556 - 88 points.",88,2017-03-06,https://www.whiskyfun.com/archivemarch17-1-Caol-Ila-Glenrothes-Amrut.html,872e85817169b04f7c5d6953725d8a30e90eb464725541daa671dd7076d97a87
"Caol Ila 13 yo 2003/2016 (55.5%, Maltbarn, sherry, 175 bottles)","Caol Ila 13 yo 2003/2016 (55.5%, Maltbarn, sherry, 175 bottles) Always a great show by the tiny Maltbarn that always seem to favour quality over quantity. Wonderful labels too. Colour: straw. Nose: we’re so close to the Adelphi, so close… Possibly a sister cask. Well this one’s actually a little more medicinal, perhaps… With water: smoky pinesap and plasticine. Mouth (neat): ditto and repeat. Great orangey smokiness and creaminess on the palate. With water: soot and ashes are kicking back. And that lapsang souchong… Finish: perhaps a tad more coastal and briny at the same time. I mean, than the Adelphi. Comments: totally equivalent. Excellent. SGP:556 - 88 points.",88,2017-03-06,https://www.whiskyfun.com/archivemarch17-1-Caol-Ila-Glenrothes-Amrut.html,92f18027607ab7225624320f8121672538d83db2eaa3f057aa028d1f4fb2cd36
"Caol Ila 14 yo 2002/2016 (50.7%, Valinch & Mallet, sherry hogshead, cask #16-242, 322 bottles)","Caol Ila 14 yo 2002/2016 (50.7%, Valinch & Mallet, sherry hogshead, cask #16-242, 322 bottles) The darker of them all, and perhaps the most mature, let’s see… Colour: gold. Nose: niiice! It’s got more sour fruits, ale, cider, sooty seawater, and also walnuts, fino-style, as well as a wee medicinal side. Iodine and bandages. Right up my alley, so far. With water: broken branches and almond peelings, seaweed, and a spoonful of miso soup. Nah, you may drop the tofu. Mouth (neat): quite big and very excellent. More oak impact, obviously, but this mustardy and coastal arrival is just perfect. Where are the oysters, Nestor? Some further-fortified Manzanilla of some sort? With water: wonderful, it never got sweetish. Lemon zests, smoked almonds, oysters (thank you Nestor)… And just wee traces of tiny oak shavings. Finish: rather long, walnutty and mustardy, with Seville oranges in the aftertaste. Comments: super good, we’re bordering total perfection (I know, a pleonasm but we’ve done much worse, haven’t we.) SGP:366 - 89 points.",89,2017-03-06,https://www.whiskyfun.com/archivemarch17-1-Caol-Ila-Glenrothes-Amrut.html,b31666a131f42153f14bd550eff73aec3d4fe818325848604faaccbd32bf8369
"Trois Rivières ‘Cuvée de la Princesse’ (43%, OB, La Martinique, +/-2016)","Trois Rivières ‘Cuvée de la Princesse’ (43%, OB, La Martinique, +/-2016) Ahem, maybe not the ideal start, as this baby’s a very expensive super-premium cuvee. But how would we know, since there’s no proper age and no vintage? Colour: deep gold. Nose: yeah well, it’s a great, ueber-classic nose. Touches of nail polish, then bananas, pineapples, orange blossom, mangos, ylang-ylang, rosewater, litchis, papayas, liquorice… All this is fragrant and complex. And, ach, sexy. Mouth: I’m not too fond of the arrival, which is rather too oaky/varnishy for me. Ginger and cinnamon, bitter tea… It’s as if some super-old rum that went way over the hill was added to the vatting. Frankly, I’m not convinced, I’ve tried many more vibrant Trois Rivières. Finish: long, drying, oaky. Comments: rather stunning nose, but a palate that’s too oaky for me. Not that we have never seen that happening in whisky, mind you, but poor princess! SGP:471 - 72 points.",72,2017-03-05,https://www.whiskyfun.com/archivemarch17-1-Caol-Ila-Glenrothes-Amrut.html,0c4cc7f7dff3f705ea14b758b6b76aa8a1bdfdd71240483463e579374765847c
"HSE ‘Grande Réserve XO’ (43%, OB, La Martinique, agricole, +/-2016)","HSE ‘Grande Réserve XO’ (43%, OB, La Martinique, agricole, +/-2016) Said to be a vatting of six to eight years old rum, to which a little 1960 has been added. My year, imagine. In any case, this is called an ‘extra-vieux’. Talking ‘bout the rum, eh. Colour: deep gold. Nose: caramel, honey, tropical liqueurs, tropical jams, and a little plasticine. Plasticine always works in this context. And one can really feel the 1960, very vividly. Of course I’m joking. Nice whiffs of broken branches and moss. Mouth: quite a lot of coconut, which a little frightening, but things settle down, with more vanilla, herbal teas, and light molasses. Very good and very fair… But all this coconut? Too much young US oak? Finish: medium, with an added saltiness, which brings us back to agricoleness. Comments: it’s a very different kind of oakiness, this time much ‘newer’, but I’m not totally convinced either. Feels a little engineered. SGP:561 - 77 points.",77,2017-03-05,https://www.whiskyfun.com/archivemarch17-1-Caol-Ila-Glenrothes-Amrut.html,b1ca3c5b02324460197b9745d66a4169b82f0aece33cabdbe8ad0bc509107fb1
"La Mauny ‘Héritage 1749’ (40%, OB, La Martinique, agricole, +/-2016)","La Mauny ‘Héritage 1749’ (40%, OB, La Martinique, agricole, +/-2016) We’re at the other end of the spectrum, this is a simple ‘ambré’, so some cheap and very young rhum agricole. Oh and as with any contemporary booze, whenever I hear the word ‘heritage’, I’m taking out my gun. Oh and even worse, it’s a Port finish. Courage, serge, courage… Colour: gold. Nose: hello? Crushed overripe fruits (plums), old rusty tin box, caramel… In truth it’s not that bad, it’s just no nosing rum. IMHO, as we used to say when the Web was free. Mouth: wait, this ain’t bad. Earthy and slightly brine-y, with some nice cane-iness and a tiny-wee bit of garage-y funk. Perhaps a little quince jelly, which can’t be bad. Finish: medium, a little indefinite. Mentholy earth and cane juice. Comments: some good - and cheaper – whites should be more pleasing, but this is fair and loyal. SGP:561 - 75 points.",75,2017-03-05,https://www.whiskyfun.com/archivemarch17-1-Caol-Ila-Glenrothes-Amrut.html,45caa426f05f476a81a3742429feb87e744061d093825c034bb1e3c21808f547
"Héritiers Madkaud ‘VSOP Cuvée Castelmore’ (40%, OB, La Martinique, agricole, +/-2016)","Héritiers Madkaud ‘VSOP Cuvée Castelmore’ (40%, OB, La Martinique, agricole, +/-2016) A very old brand that recently resurfaced, and that’s most probably some Saint-James juice behind another label. Perhaps some Bally? Their 3 yo was a hit at WF Towers, so you never know… Colour: gold. Nose: easy, discreet, rather un-Bally if you ask me. Some chocolate, acacia honey, cane syrup… Nah it’s very light rum, unless I’m tired (who’s tired? Not me!) Some nice earthy touches, though… Mouth: ah, this is pretty nice. Some earthy and rooty notes, and indeed it hints at Bally’s young ones, plus notes of liquorice and orangey ginger. Lacks oomph for sure, but the core is there. Finish: medium, earthy, rooty. This, I like. Comments: not some rhum to nose, but I do enjoy the wild minerality on the palate. Could we have some at 60% vol.? SGP:462 - 79 points.",79,2017-03-05,https://www.whiskyfun.com/archivemarch17-1-Caol-Ila-Glenrothes-Amrut.html,5cfffc0a95244c2bf49a673e17eba74f648da29ed5b2136408774f2cd8a78b91
"Dillon 13 yo 2002/2015 (44%, Compagnie des Indes, La Martinique, agricole, cask #MA56, 298 bottles)","Dillon 13 yo 2002/2015 (44%, Compagnie des Indes, La Martinique, agricole, cask #MA56, 298 bottles) First aged on location for a few years, this cask was then exported to Europe and benefited from some additional rest in Dickensian climates. But Dillon? What is Dillon? Well, in France it’s rather a supermarket brand that belongs to La Martiniquaise (think Glen Moray). Nothing to do, I believe, with Haut-Brion’s Clarence Dillon. Colour: white wine. Nose: nature! Some fresh, clean, slightly shy distillate, rather grassy than fruity, with hints of natural rubber and, there, plasticine. Behind all that, some coastal whiffs, seaweed, samphires… But all that remains very shy. Let us see… Mouth: well well well, this is very nice. Very well done Compagnie! It’s not a sexy rhum at all, and it’s even kind of uninteresting, but it’s totally close to the distillate, with some sugar cane and some bananas, with a light plasticine-y layer. Very nice notes of white fruits and shy herbs, hay, even straw… You do feel the canes. Finish: medium, grassy, cane-y, slightly austere. Totally natural indeed. Comments: not a star at all, and frankly, you don’t need this in your bar, but should you want to taste this style totally natural agricole without any ‘fiddling’, this is for you. For the sake of research. SGP:351 - 81 points.",81,2017-03-05,https://www.whiskyfun.com/archivemarch17-1-Caol-Ila-Glenrothes-Amrut.html,a37bcf8f02512047a33a194c6b0fa44d21fcff42c16c00446b7a091a2e6b1a6a
