whisky_name_raw,review_text,score,review_date,source_url,dedupe_hash
"Caroni 1998 (40%, Jean Boyer, Bullion, Trinidad, +/-2014)","Caroni 1998 (40%, Jean Boyer, Bullion, Trinidad, +/-2014) Another French bottling, by pioneering whisky bottlers Jean Boyer. Colour: gold. Nose: oh, Caroni indeed! Burning tarred papers, linoleum, new tyres, old musty cellar, green olives, damp earth, kippers, old banana skin… What’s not to like? And the power is good at 40% vol. The palate might be another story… Mouth: my my… Why only 40% vol.? (no worries, I’ve got the answer.) But what a superb combo involving tapenade, plenty of tar and liquorice, smoked fish and meat, candy sugar, violet sweets, gherkin brine… This is absolutely perfect rum for whisky freaks. Correction, peat freaks. Finish: extremely long despite the low strength. Concentrated smoked tea, salt, salmiak and kippers. And yes, this is rum. Comments: love it. Can we have more, but at a higher strength? SGP:452 - around 89 points.",,2014-09-07,https://www.whiskyfun.com/archiveseptember14-1-Clynelish-Brora-Benrinnes-Karuizawa-Glenlivet.html,4a13b4556848bd990226010791dc77b75314b1772513fee0a42aea2aaf38a8ec
"Caroni 1996/2013 (43%, Bristol Classic Rum, Trinidad)","Caroni 1996/2013 (43%, Bristol Classic Rum, Trinidad) Colour: gold. Nose: a sweeter, rounder version, with a little more sweet oak as well, more smoothness, more vanilla and bananas… In short, an easier Caroni. This baby might have been finished in some kind of sweet cask – if I remember well, it was. Strawberry jam, mango chutney… So yes, it’s a gentler Caroni, but quality’s there again, and so are the (lighter) tar, olives and liquorice. What’s so wrong with easiness? Mouth: no no no no no, we’re well at Caroni’s on the palate, and the 1998 and 1996 are pretty similar, even if this baby’s a notch sweeter and more candied. Bags and bags of smoked liquorice and olives in Grand-Marnier. We might have to try that one day. Love the tarry smoke. Finish: dangerously long, don’t eat delicate food after such a monster. Comments: one day we’ll do a large Caroni vs. Ardbeg session. One day! SGP:642 - around 87 points.",,2014-09-07,https://www.whiskyfun.com/archiveseptember14-1-Clynelish-Brora-Benrinnes-Karuizawa-Glenlivet.html,5a248fe8f8944e6b8a05a225ff86d051b1c32783b43304eb1691a05ebb71d815
"Caroni 1991 (40%, Mezan, Trinidad, +/-2013)","Caroni 1991 (40%, Mezan, Trinidad, +/-2013) Colour: gold. Nose: oh this is interesting. Quite strangely, we’re going downwards as far as phenols are concerned, this is well a lighter style, much more on crisp and clear tropical fruits. The tarry side remains there in the background, but melons and papayas are doing most of the talking, together with small bananas (the pink ones) and a little bit of tamarind. It seems that we did it all… backwards. Mouth: it’s heavy rum when compared to the schmaltzy Dominicans or South-Americans, but it’s, indeed, light and fruity rum when compared to the other Caronis we just had. Probably a cask of light-style Caroni, as they were doing both heavy and light when the distillery was alive. I find melon again, maybe apricots, pineapples, bananas and some light honey. Only a drop of tar liqueur in the background. Even the body’s lighter, it’s got less fatty heaviness. Finish: of medium length, but quite surprisingly, Caroni’s heavy style is back to add a worthy signature to this baby. Smoky olives, tar and ashes. Comments: a fun Caroni, even if it’s kind of schizophrenic. Liked the other ones better, though. SGP:632 – around 82 points.",,2014-09-07,https://www.whiskyfun.com/archiveseptember14-1-Clynelish-Brora-Benrinnes-Karuizawa-Glenlivet.html,f4537af0a7c1b53e6ef5a61be23884ee59858941028954e23d4b3ffbcdadec1d
"Trinidad Distillers 6 yo 2000/2006 (45%, Alambic Classique, Trinidad)","Trinidad Distillers 6 yo 2000/2006 (45%, Alambic Classique, Trinidad) That’s right, more Trinidad, but this cannot be Caroni, as Caroni was closed in 1993. In fact, it’s most probably Angostura, so lighter column rum. Colour: white wine. Nose: oh-hum, this is much lighter indeed. It’s nice, but it’s light. Hay and sugarcane, overripe apples and bananas, herbal teas (lime tree), a touch of earth… It’s all delicate and pretty subtle, and I’m sure quality’s high, or Alambic Classique wouldn’t have bottled it. Let’s check the palate… Mouth: it’s okay. The higher strength makes it powerful, but the profile is narrow, rather on orange cake and sugar cane syrup. A touch of raspberry, melon, even apricots… So it’s good and it’s gentle, it’s just not characterful. A kind of Glenlivet of rum? Finish: medium length, rather on ripe plums this time. Mirabelle tart. Comments: good and even ‘perfect’, but probably forgettable. It’s true that the Caronis didn’t help… SGP:531 - around 78 points.",,2014-09-07,https://www.whiskyfun.com/archiveseptember14-1-Clynelish-Brora-Benrinnes-Karuizawa-Glenlivet.html,babb669ae87fa7728a2b299e0b3aee03e3867026f6ea74b7d019360141b32c91
"Diamond 10 yo 2003/2014 (51.1%, Whisky-Fässle, Demerara)","Diamond 10 yo 2003/2014 (51.1%, Whisky-Fässle, Demerara) What, why isn’t this named Rum-Fässle? Seriously, whisky bottlers have already proven that they were good at finding worthy malternative spirits. I don’t know why, I have the feeling that this one will match our tastes… (no preconceptions, he once said.) Colour: red amber. Nose: I’d like to know with which stills this baby was made. I find it rather ‘Enmore’, with both a light and fruity style and a phenolic, almost petroly background. Honey cake? It’s quite superb but I simply do not believe that it was bottled at some measly 51.1% vol. Surely they were meaning 71.1%? With water: there, it opened up, with these typical notes of tarry liquorice and fruitcake. Mouth (neat): we’re sitting right between rum and whisky. Or Demerara and Speyside. Raisins aplenty and of all kinds, plus a very vivid feeling of pure Pedro Ximenez. Very thick stuff. With water: classic rum. Not much phenolicity (c’mon, S.!) and rather sweet honeyed dried fruits. Bananas. A drop of crème de menthe. Finish: long, sweet, well balanced when reduced. Comments: not one of the heavy tarry ones, but it really delivers and would please many a single malt drinker. The body’s perfect. SGP:631 - around 85 points.",,2014-09-07,https://www.whiskyfun.com/archiveseptember14-1-Clynelish-Brora-Benrinnes-Karuizawa-Glenlivet.html,4716116bdf28891a2ef0ab3c7b84a7c4d18a4b3beac938a674a952976e62645f
"Hibiki 12 yo (43%, OB, blend, Suntory, Japan, +/-2012)","Hibiki 12 yo (43%, OB, blend, Suntory, Japan, +/-2012) Imagine I’ve tasted the 17, the 21 and the 30 years old, but never the 12. Whisky blogger my hat! Colour: light gold. Nose: I find it rather dry, probably quite elegant but it’s mostly grass and paraffin that first come out, before something slightly resinous (propolis?) and then garden fruits emerge. Apples, a little coconut perhaps, grapefruit skin… Mouth: good power and a pleasant spiciness (ginger and white pepper), then more baked apples and slices of orange cake and perhaps plum cake. I enjoy these notes of lemon and orange marmalades. Finish: quite long, rather gingery. Comments: it’s not a blendy blend, I’d say. I’ve read that this baby’s partly matured in ex-plum liqueur barrels, is that true? High quality blend for sure, but not quite my favourite within the range. SGP:452 - 78 points.",78,2014-09-05,https://www.whiskyfun.com/archiveseptember14-1-Clynelish-Brora-Benrinnes-Karuizawa-Glenlivet.html,62171c0399cae4e066e820577a26393495321ed93f37743461a6ea9d8921c7ed
"Yoichi 10 yo (45%, OB, Nikka, Japan, +/-2012)","Yoichi 10 yo (45%, OB, Nikka, Japan, +/-2012) Same story, I’ve formally tried quite a few older Yoichis for WF, but never the 10. Incredible! Colour: gold. Nose: it’s quite wild, earthy and grassy, with little fruitiness and rather a feeling of pu-erh tea. Then rather eucalyptus and the kind of menthol that can come from extractive oak, as well as touches of pencil shavings (same) and burnt wood. Austere and unsexy, not obligatorily a bad thing. Mouth: creamy, starting on a combination of eucalyptus drops again, mint, a touch of mustard and a little sawdust. Then come the fruits (apples and raisins ), together with a little ginger. Pleasant firmness Finish: rather long, earthy, honeyed and gingery. A touch of iron or silver in the aftertaste. Comments: very solid, the wood technology does not feel too much. There are some similarities with the Hibiki – maybe the oak works? SGP:452 - 81 points.",81,2014-09-05,https://www.whiskyfun.com/archiveseptember14-1-Clynelish-Brora-Benrinnes-Karuizawa-Glenlivet.html,94365a65a5227712437a529f98ff7c3cb4740027fc20e61593ba8a39e1082ba7
"Yoichi 1990/2011 (50%, OB, Nikka, Japan)","Yoichi 1990/2011 (50%, OB, Nikka, Japan) And yet another earlier Yoichi that hasn’t been subjected to our stringent checks – yet. Colour: full gold. Nose: it’s another rather earthy and oaky one, a bit in the same style as that of the 10 yo, but with more complexity and an oakiness that’s… yeah, more complex. Some menthol, dry liquorice, ginger, beeswax, sawdust, thuja wood (Moroccan wooden box for tourists – that would be me), then a touch of meat, probably from sherry ( a new pack of beef jerky), then more moss and pine needles. It’s not a smooth/rounded one at all, and that, we like. Mouth: starts on some heavy gingery oak and quite some earthy peat. There are funny touches of vegetables (celeriac?) and then more sweetness, but that remains grassy. Banana skin, ginger, cinnamon, spicy orange marmalade… It tends to become a little acrid and pungent, but in a way, that’s an asset. Finish: very long, with lovely notes of all kinds of teas and oaky spices, chiefly cinnamon. Comments: there’s a lot of oak in this baby, but those exposed beams, so to speak, are part of this style. You just have to like that. SGP:372 - 85 points.",85,2014-09-05,https://www.whiskyfun.com/archiveseptember14-1-Clynelish-Brora-Benrinnes-Karuizawa-Glenlivet.html,b0d9f8677f4afe07efd2d7fad35703d736f7b5f01d899144db73c9d704721d3f
"Taketsuru 21 yo (43%, OB, Nikka, blended malt, Japan, +/- 2013)","Taketsuru 21 yo (43%, OB, Nikka, blended malt, Japan, +/- 2013) It’s been a few years years since I tasted my last Taketsuru 21. They actually call it ‘pure malt’. Colour: dark gold. Nose: great, all on tobacco and soft leather, then dried fruits and vanilla cream. Much softer than the Yoichis, much easier, and perhaps even more complex. The oak as such doesn’t feel this time, and it would rather unfold on crystallised oranges, citrons and mints. After Eights. Mouth: the oak feels a little more (leather/coffee/cinnamon) but balance is perfectly achieved, while raisins and nuts start to dance on your tongue. Add a few oranges, tangerines and kumquats and you get a perfectly sexy combo. Finish: long, soft and fruity, with some earl grey tea, honey, salted fudge and even more oranges. Orange blossom water. Comments: this goes down extremely well. Warning, reaching danger zone. SGP:651 - 87 points.",87,2014-09-05,https://www.whiskyfun.com/archiveseptember14-1-Clynelish-Brora-Benrinnes-Karuizawa-Glenlivet.html,3ae68f294fb07aede587be82228ce0ef186081e124fd7333c2b74ea169e29237
"Nikka 'From the Barrel' (51.4%, OB, blend, Japan, +/-2013)","Nikka 'From the Barrel' (51.4%, OB, blend, Japan, +/-2013) I’ve noticed that this baby’s many whisky enthusiasts’ darling. I have to say a simply love the very minimalist, and very… Japanese packaging. Colour: gold. Nose: it’s like nosing a freshly brewed hazelnut-flavoured coffee at Starbuck’s. More or less. So coffee with milk and roasted nuts (bingo, S.), then praline, vanilla and various spices from the oak, more or less the same as in the Yoichis (ginger, cinnamon). Black tea too. No varnish, hurray! Mouth: not as much toasted oak as I had feared, rather fresh and tinned fruits in the arrival, which is a great surprise. Peaches, apples, plums and tangerines. The oak is there but it remains tamed and discreet. The vanilla’s there as well but it all remains fresh and lively. And fruity. Finish: long, with even more fruits. I’d say gooseberries this time. The aftertaste is a little oakier and spicier, understandably. Comments: I have to say this is a great fruity surprise to me. Great work by Nikka’s masters of many things. SGP:641 - 86 points.",86,2014-09-05,https://www.whiskyfun.com/archiveseptember14-1-Clynelish-Brora-Benrinnes-Karuizawa-Glenlivet.html,b2406a9365423ab2e185d2fbbf2165337bb777cebbc46f6c21b491c1120b02af
"Nikka 'From the Barrel' (51.4%, OB, blend, Japan, +/-2009)","Nikka 'From the Barrel' (51.4%, OB, blend, Japan, +/-2009) Colour: gold. Nose: same, both are completely undistinguishable. Mouth: same. This one’s maybe a notch more solventy. Or maybe not. Finish: same, both batches are identical. Comments: I’m impressed, Japanese engineering at its best and most consistent. We don’t always need variations, do we? SGP:641 – 86 points.",86,2014-09-05,https://www.whiskyfun.com/archiveseptember14-1-Clynelish-Brora-Benrinnes-Karuizawa-Glenlivet.html,c988fd43bd565a293b9258eb831514f619d6c86f49782075590ddfa8c87f363c
"Yamazaki 1991/2006 'Owner's Cask' (62%, OB, Suntory, puncheon, cask #1P70529)","Yamazaki 1991/2006 'Owner's Cask' (62%, OB, Suntory, puncheon, cask #1P70529) A beast from this well-known series. We’ve got quite a few older ones yet to taste. BTW, your screen and computer are all right, it's the picture that's very blurred, sorry about that. Colour: gold. Nose: not that strong! A crystal clean blend of vanilla, coffee, earth, leather and eucalyptus. Maybe a little incense, these batches used to nose more ‘globally Japanese’ than newer batches in my opinion. Maybe a trick of my mind? With water: brilliant! Malty smoke (and conversely), earth, fern, old cellar, vanilla, great green tea, lemons… Just beautiful. Mouth: just perfect indeed. Great maltiness, coffee, citrus, baked apples, brioche and croissants, very soft spices… Love this one. With water: even better. Many citrus fruits, tangerines, Seville oranges, a touch of salt, candy sugar, tobacco, honey… And even drops of cane sugar that you can really feel. Finish: long, sweet but extremely clean. Comments: proof that whisky can be perfect without being hugely complex. Now go find a bottle, S.! SGP:651 - 91 points.",91,2014-09-05,https://www.whiskyfun.com/archiveseptember14-1-Clynelish-Brora-Benrinnes-Karuizawa-Glenlivet.html,b3629655a1c2415b736ebb5b4dfd53ea9c600224285c2254cdf8497c8f550d82
"Yamazaki 1991/2007 'Owner's Cask - Excellent Smokey' (56%, OB, selected by Mr. Kawachiya, hogshead, cask #1V70010)","Yamazaki 1991/2007 'Owner's Cask - Excellent Smokey' (56%, OB, selected by Mr. Kawachiya, hogshead, cask #1V70010) Colour: full gold. Nose: indeed, a pretty smoky Yamazaki! And it’s both Ardbeg-coastal and Laphroaig-medicinal, mind you. Actually, it’s a very brilliant nose, and it seems that a bit of OBE just did it more well. Burning fir wood, propolis, tar, seaweed smoke, bicycle inner tube, antiseptic, cider apples, leather, light tobacco… With water: new latex, new leather couch, seashells, pine cones smoke, mercurochrome. What’s not to like? Mouth (neat): amazing! It’s to old Ardbeg what a Lexus was to a Mercedes-Benz twenty years ago. More old Ardbeg than modern Ardbeg can be, that’s for sure. With water: oooh! Old riesling, fifty years old chartreuse, a drop of real absinth and an utterly magnificent minerality. And salinity (I’ve heard that’s the new minerality, baby.) Finish: incredibly clean, pure, phenolic, salty, smoky, medicinal and topical… Even mangos are joining the dancing. Comments: lifts you like Mozart. Extremely well selected, Mister Kawachiya! SGP:565 - 93 points.",93,2014-09-05,https://www.whiskyfun.com/archiveseptember14-1-Clynelish-Brora-Benrinnes-Karuizawa-Glenlivet.html,dc75f5576ab4969044af56227e3f2f7be2850f51ed9f0a78dad4c75ff2be19a8
"Yamazaki 1992/2006 'Owner's Cask' (57%, OB, hogshead, selected by T. Nigita, cask #ZQ70670)","Yamazaki 1992/2006 'Owner's Cask' (57%, OB, hogshead, selected by T. Nigita, cask #ZQ70670) Colour: full gold. Nose: this is becoming embarrassing, as it seems that we’ve got another wonder on our tasting table. No peat this time, rather a full vanilla-ed profile, but it’s not dull modern vanilla at all, it’s vanilla like in some genuine, natural vanilla from, say Madagascar (oh whatever.) Behind the vanilla, rather herbs, camphor, menthol, eucalyptus and aniseed. Nothing too bad… With water: no real further development. Maybe more herbalness? Not too sure, there’s this faint soapiness that can come from newish oak… (no saponification, that wouldn’t go away.) Mouth (neat): Japanese modernity at its best. Perfect vanilla (again!), marshmallows, mint, honey and yellow plums. It’s not complex, it’s even very simple when unreduced, but it’s perfect. Bauhaus whisky (c’mon, S.!) With water: water works this time. More fresh fruits, more marshmallows. Finish: quite long but a little sugary, perhaps. I’m splitting hairs again, it’s a great… how do you say dram in Japanese? Comments: I liked the 1991s better, this one’s a little more, say standard. But quality remains very high. SGP:641 - 88 points.",88,2014-09-05,https://www.whiskyfun.com/archiveseptember14-1-Clynelish-Brora-Benrinnes-Karuizawa-Glenlivet.html,1c8a06ce853ce6a89662e28ce8d4b7d4d07a199118a280de07f31d2fb144fa31
"Yoichi 18 yo 1987/2005 (54.1%, Scotch Malt Whisky Society, #116.6, a kilted Samurai, 232 bottles)","Yoichi 18 yo 1987/2005 (54.1%, Scotch Malt Whisky Society, #116.6, a kilted Samurai, 232 bottles) I’ve never seen any kilted samurais in any of Kurosawa’s movies! Colour: gold. Nose: this one has got as much peat as Mr. Kawachiya’s Yamazaki, but it’s a different beast, with much more tar and even rubber, and less fresh herbs. So rather Port Ellen, if you will. I also find more and more zesty aromas, lime, lemon… Or peppered rhubarb? With water: what often comes out of fine peaters after water’s been added: almond oil and marzipan. And linseed oil. No soap though. Mouth (neat): peat hell! One of the peatiest Yoichis I’ve ever tried – not that I have tasted thousands – and it’s just perfect, because the peat is encrusted in an oily, fruity oakiness that does it much good. Also lemons, of course. With water: a bit of new oak goes through the peat. I like it less when water has been added, new oak can make whisky a tad vulgar in my book. Finish: of medium length. No more tar, no more Port Ellen. Rather peated Bunnahabhain, I’d say. Some lemon for sure. Comments: all very good, it’s got a death seat after the Kawachiya, that’s all. SGP:556 - 87 points.",87,2014-09-05,https://www.whiskyfun.com/archiveseptember14-1-Clynelish-Brora-Benrinnes-Karuizawa-Glenlivet.html,caa838875057fa2c669153a96e5ea45e67b91ff9172de2b80496851a03e49d6e
"Karuizawa 1992/2007 (62.8%, OB, hogshead, cask #6978)","Karuizawa 1992/2007 (62.8%, OB, hogshead, cask #6978) This baby from a time when you could still get them for a song and a dance. Almost. And without these very fancy (and beautiful, I feel I should add) labels. Colour: gold. Nose: a little too strong, I’m afraid. Hay, calvados apples and leather, perhaps, but it burns your nostrils. So, come my best friend… With water: it’s a subtle one, it’s got hay indeed, overripe apples, mentholated tobacco, a touch of cedar wood, popcorn, marzipan-filled chocolate, peanuts, fudge, pollen… and a little wood smoke too. After ten minutes it’s becoming much more floral, with violets and jasmine. Mouth (neat): very strong, thick, aggressive… and yet as oily as the fruitiest olive oil. I seem to detect quite some caramelised oak, toasted bread and warm vanilla fudge (when you leave it in your car in summer – yes I’m speaking from experience.) With water: excellent. Earth, gentian roots, walnuts, smoky liquorice and more bourbon wood goodness. Also love the oranges in it. Finish: long, clean, maybe not the most interesting part. Walnut cake? Pecan pie? More phenolic/sappy notes on the aftertaste. Smoked Chlorophyll – or something like that. Comments: an unusual Karuizawa that’s rather less ‘tertiary’ than others. More like an ex-bourbon unpeated Yamazaki, if you like, even if this Karuizawa’s a little more on tar. Needs time but then it’s extremely rewarding. Yes I liked it a lot. SGP:563 - 90 points.",90,2014-09-05,https://www.whiskyfun.com/archiveseptember14-1-Clynelish-Brora-Benrinnes-Karuizawa-Glenlivet.html,913c7e6fa101aafe29b35f0a42effacf55ecfd2fb3a9edb91ef73f5851021197
"Littlemill 23 yo 1990/2014 (51.2%, Whisky-Fässle, hogshead)","Littlemill 23 yo 1990/2014 (51.2%, Whisky-Fässle, hogshead) The crazy ducks are back. Colour: pale gold. Nose: wee whiffs of soap… no, forget about that, those would just go away after three seconds. In fact, this nose is boringly fruity, stupidly clean, ridiculously zesty and embarrassingly tropical. And topical. This nose is tediously wonderful – may I add as expected. Grapefruits and mangos. With water: some thuja wood coming out, menthol, eucalyptus, liquorice, unlit beedies… Mouth (neat): unreasonably fruity, with just a wee – and mucho unexpected - touch or brine, that came from… nowhere, I guess. Anchovies. The combination with the tropical fruits is foolishly brilliant. I’m wondering if there isn’t a little yak butter as well. Probably not. With water: even better. Pink grapefruits, guavas, all that always with a touch of salt. Finish: quite long, very tropical, always a little salty, always perfect. Comments: another smashing Littlemill, this time with an extra dash of salt. It seems that they used to like playing practical jokes at Littlemill! A great one, really. SGP:651 - 91 points.",91,2014-09-04,https://www.whiskyfun.com/archiveseptember14-1-Clynelish-Brora-Benrinnes-Karuizawa-Glenlivet.html,d184060242b92c084ef57fda9c6c3145aa6b541f7e2e64bdfc4d7f87def8642d
"Littlemill 25 yo 1988/2014 (51.9%, Archives, bourbon hogshead, cask #12, 134 bottles)","Littlemill 25 yo 1988/2014 (51.9%, Archives, bourbon hogshead, cask #12, 134 bottles) The Fässle was great, it’s gonna be tough. Colour: straw. Nose: great, but a little less great indeed. It’s rather a ‘regular’ fruity Littlemill, which is already a lot, agreed. Grapefruits and papayas, one passion fruit, a little cut hay, aniseed and just a touch of eucalyptus. Normal, in a way. A minerality as well. With water: same. Mouth (neat): same feeling, it’s one of the very fruity ones, displaying many grapefruits and lemons, then some mango and papaya, with a slightly peppery background as well as herbs, fennel, grass… With water: the grass comes to the front. Sharpy white wine. Finish: long, zesty and grassy. More white wine, Loire-style. Comments: more a classic, with a smaller wow-dimension, but it is top notch Littlemill for sure. SGP:561 - 88 points.",88,2014-09-04,https://www.whiskyfun.com/archiveseptember14-1-Clynelish-Brora-Benrinnes-Karuizawa-Glenlivet.html,d8e5b59073469bda0a9131251eb6a552ba0fb6fa6f16f396bebbefa17d384913
"Rosebank 6 yo 1992/1999 (59.9%, Cooper's Choice)","Rosebank 6 yo 1992/1999 (59.9%, Cooper's Choice) A super-young Rosebank from the last years, how cool is that? And these old labels were really ‘artisan-cool’. Colour: pale white wine. Nose: yes, there, that’s what I had expected, the fruity Littlemills and a young clean Rosebank such as this one do share the same profiles, more or less, although this one’s obviously rougher, harsher, and more spirity. So same kind of citrus (grapefruits and lemon) and a similar grassiness, but then this youngster starts to… burn. I have to say it tends to become feinty and yeasty as well. Beer, baker’s yeast, leaven… With water: breads of all kinds all over the place. This one reminds us that whisky’s made out of grains. Mouth (neat): yah! Extremely strong, just like some prune spirit straight from the still (I’ll distil some in November again, by the way, so I do know what I’m, cough, cough, talking about.) A feeling of cane sugar syrup, grass, almonds/fruit stones, barley water… But it burns your lips. Quick… With water: lovely! All citrus out, all grass out as well, rawness in. Tastes very young, but the spirit’s perfectly citrusy. Finish: long, simple, clean, lemony and grassy. Comments: it’s well Rosebank at its most citrusy. Great spirit indeed, even if this baby was probably too young when they issued it. SGP:661 - 84 points.",84,2014-09-04,https://www.whiskyfun.com/archiveseptember14-1-Clynelish-Brora-Benrinnes-Karuizawa-Glenlivet.html,c053eb1101819787b3cfd8b54336db829b165a24ad29d5e168a5b4ac313d46f9
