whisky_name_raw,review_text,score,review_date,source_url,dedupe_hash
"Speyburn 2004/2024 ‘Spirit of Speyside Exclusive’ (58.6%, OB, cask #215, 546 bottles)","Speyburn 2004/2024 ‘Spirit of Speyside Exclusive’ (58.6%, OB, cask #215, 546 bottles) Could we please stop with the gold and silver labels? They no longer work at all online, not even on those very ‘low-tech-low-graphics’ sites like WF. Colour: dark amber. Nose: a distinctly chocolaty and slightly soapy character, heavily marked by paraffin and, let’s be honest, a touch of shampoo. It’s a hit or miss, as they say; water will be the ultimate judge. With water: the shampoo fades away (as expected), but the chocolate becomes even more pronounced. We’re practically inside a chocolate shop now. Mouth (neat): pretty woody, with strong notes of resin, fir bud syrup, walnut husk, bitter oranges, and menthol… Water is definitely needed here. With water: softer, of course, but still quite marked by bitterness, amaro, cinchona, and all that. I like those things rather a lot, but I’m not sure I need a 20-year-old Scotch malt to appreciate these flavours. Finish: long. Wood, resins, chocolate, bitters, and green walnuts. Comments: spectacular in terms of style, but I’m much more a fan of the ‘Rum’ and the ‘16’. Maybe a tad over-oloroso-ed. SGP:371 - 80 points.",80,2024-08-23,https://www.whiskyfun.com/archiveaugust24-2-Bruichladdich-Springbank.html,b868f9734bb3e59c1021ba94120c5dd7968fb0a336ae0ce5a5c2718fb16ff36d
"Ardbeg 14 yo ‘Anthology The Unicorn’s Tale’ (46%, OB, refill bourbon and Madeira, 2024)","Ardbeg 14 yo ‘Anthology The Unicorn’s Tale’ (46%, OB, refill bourbon and Madeira, 2024) No, no, no, enough of these far-fetched tales! And why is everyone so enamoured with ex-Madeira casks these days? Colour: straw. Nose: rather fresh and quite simple, with lovely notes of smoked almonds, followed by putty and tar. It appears that the Madeira has mellowed this Ardbeg into something rather gentle and polite. A few hints of new rubber boots as well. Mouth: fairly light, with a touch of sweetness (white clover) and a bit of tar liqueur. A slight medicinal edge, then tinned peaches and almond milk. Finish: of medium length, soft, gentle, and saline. Some periwinkles and white wine. Touches of mercurochrome and ashes in the background. Comments: the softer side of Ardbeg peat. An easy, agreeable Ardbeg, perfect for sharing with guests who aren't whisky geeks. Perhaps they will become so after this? I did slightly prefer the 13 yo Harpy’s Tale, though. Yet more Tales. SGP:556 - 86 points.",86,2024-08-22,https://www.whiskyfun.com/archiveaugust24-2-Bruichladdich-Springbank.html,25cb1b0007b8e6316453ee4d9b19df006887a64ee6435c5271391458e2631f11
"Ardbeg 19 yo 2005/2024 'Traigh Bhan Batch 6' (46.2%, OB, American oak & oloroso, batch #TB/06-04.04.2005/24.GM)","Ardbeg 19 yo 2005/2024 'Traigh Bhan Batch 6' (46.2%, OB, American oak & oloroso, batch #TB/06-04.04.2005/24.GM) The new batch. I was quite taken with last year’s (WF 89). Colour: white wine. Nose: pure, crystalline Ardbeg peat, with sauvignon blanc, seawater, green apples and limes, rubber, almonds, pistachios, ashes, and a touch of light tar. Mouth: sweeter and gentler, yet again. There’s a sensation of smoked apples, a hint of oysters, marzipan, and more ashes. Finish: medium length, a bit fruity, fairly easy-going. Lemons, ashes, and smoked almonds linger in the aftertaste. Comments: nothing much to add; it's very much in line with the 2023 batch, though it feels slightly softer, perhaps. No need to pen a novel each time, I like it a lot, there. SGP:556 - 89 points.",89,2024-08-22,https://www.whiskyfun.com/archiveaugust24-2-Bruichladdich-Springbank.html,d3243aa934ec5182648b8428c6398f7a3162569e3ac1a9b162df6119988ec137
"Ardbeg 2011/2024 (58.2%, OB, for Sweden, 1st fill manzanilla, cask #2464, 624 bottles)","Ardbeg 2011/2024 (58.2%, OB, for Sweden, 1st fill manzanilla, cask #2464, 624 bottles) Ardbeg and Manzanilla, it’s like Jagger and Richards for me, though a bit rarer. Just a reminder, Manzanilla is a fino sherry aged in Sanlúcar, but that doesn’t necessarily mean the grapes come from that part of the ‘sherry triangle’. Generally, Manzanilla is a bit lighter but slightly saltier (just a touch). Colour: dark gold. Nose: grand elegance. Green walnuts, seawater, seaweed, fresh tar, cement, and lemon peel oil. The combination seems perfect. With water: a touch of Savoyard fondue and fresh hay bale, which is rather amusing. Mouth (neat): yes, perfect, powerful, uncomplicated, with bitter orange, seawater, and salted liquorice. Then a bit of mint and those famous green walnuts. Millimetric, as they say in... Sweden. With water: that Sauvignon Blanc note previously mentioned. A lovely Pouilly-Fumé and green pepper. Finish: long, with the same notes of green pepper, walnuts, mustard, seawater, and tar... A strong charcoal note in the aftertaste. Comments: I find this young Ardbeg rather exceptional, though it is slightly aggressive. The Swedes are lucky; they’ve got a top pole vaulter and now they’ve got this Ardbeg too. A shame for dear Mackmyra, though; that’s rather sad. SGP:567 - 90 points.",90,2024-08-22,https://www.whiskyfun.com/archiveaugust24-2-Bruichladdich-Springbank.html,907b1f3cbd5e78d33e489c77975b3bc4ca0eaa0998bdd003b34ce2f725547ae2
"Secret Islay 13 yo 2009/2023 (58.7%, Archives, for China, ‘Birds from the Orient’, refill hogshead, cask #200000125, 300 bottles)","Secret Islay 13 yo 2009/2023 (58.7%, Archives, for China, ‘Birds from the Orient’, refill hogshead, cask #200000125, 300 bottles) Colour: straw. Nose: utterly Ardbeggian, with rubber boots at least size EU43 (if you will) and plenty of tar, followed by camphor, bandages, and used engine oil, then loads of green olives, which we absolutely adore. With water: that old tweed jacket battered by salty maritime winds. You get the idea... Mouth (neat): our friends in China have excellent taste. Superb notes of lime juice, then candy sugar, smoked fish, olive oil again, and a touch of ink… Wow. With water: it’s almost like being transported back to the 1970s. Superb oily and maritime lemon. Finish: long, precise, assertive (why not?) and full of olives. Comments: it’s a shame that this magnificent whisky doesn’t boldly carry the Distillery’s name; it could have done wonders for the brand. We’ll be talking about this one in a few years, I’m sure of it. I love it as much as the aforementioned Swede. SGP:567 - 90 points.",90,2024-08-22,https://www.whiskyfun.com/archiveaugust24-2-Bruichladdich-Springbank.html,a6cd5785ec7d97b633e9c6d12ea41003c226e712c06bf2eb7398534e12227555
"Kildalton 15 yo 2008/2023 (61.5%, The Whisky Jury for Lucky Choice, China, refill butt, cask #5080, 132 bottles)","Kildalton 15 yo 2008/2023 (61.5%, The Whisky Jury for Lucky Choice, China, refill butt, cask #5080, 132 bottles) Calling an Islay single malt ‘Kildalton’ that isn’t from Ardbeg would surely be an act of ultimate perversion, utterly condemned by all moral standards, wouldn’t you agree? Colour: golden. Nose: rather softer, but loaded with salted liquorice and seaweed, iodine tincture, paint and varnish, cider apples, and putty. Magnificently soft and complex on the nose, with a few pink olives and a hint of fresh fibreglass. With water: there was also a slight hint of cologne, which has now disappeared. Raw wool, rainwater, lanolin. Ardbeg. Mouth (neat): more massive on the palate, more robust, almost brutal, but that’s what one seeks from this side of the island. Then it becomes increasingly saline, taut, sharp, lemony, very fresh, chiselled, with bitter almonds, even very bitter almonds. Very lovely. With water: even saltier. Olive brine, rollmops, stalks and leaves, lapsang souchong, and a sensation of engine grease (though we’ve never tasted that, of course). Finish: long, oily, putty, paint, olives, plasticine… Comments: these spirits don’t yet have the complexity of age, but heading towards twenty years, I’m absolutely certain they’ll gain a point or two. SGP:467 - 90 points.",90,2024-08-22,https://www.whiskyfun.com/archiveaugust24-2-Bruichladdich-Springbank.html,ec76f8af88483537d60f6b7dad9c30a85c891edf10bee98ccfbd42b86ec17618
"Springbank 18 yo ‘2024 Edition’ (46%, OB, bourbon)","Springbank 18 yo ‘2024 Edition’ (46%, OB, bourbon) A freshly bottled edition, August 2024. A sign of the times, you’ll currently find Springbank 18 priced anywhere between €350 and €750 from online retailers, or from €250 on eBay. Of course, this doesn’t change the quality of the liquid one bit. The last one we tasted was the 2020 edition, very good (WF 86) but a far cry from our favourite, the 10-year-old (WF 91 last time) or the younger Local Barleys (also 91). And it's far superior to the ‘Red’, about which we’ll remain silent. Colour: straw. Nose: surprising, heading in the direction of the 10-year-old, with plenty of wet chalk, raw wool, sourdough, aspirin tablets, even bandages, followed by lemon zest, paraffin, a hint of seawater, and traces of tar. This is riiiight up my alley. Mouth: oilier and saltier on the palate, with peat, ashes, a touch of green apple liqueur, and that persistent wet chalk that’s a bit reminiscent of ‘natural’ champagnes. A lovely green pepper then appears, accompanied by small bits of candied lemon, which I find particularly ‘Springbank’. Finish: long, saline, peppery, with fine bitterness and ash, and then paraffined lemon in the aftertaste. Comments: well, either Springbank 18 is evolving, or it’s me. Or, well, perhaps both. SGP:562 – 90 points.",90,2024-08-21,https://www.whiskyfun.com/archiveaugust24-2-Bruichladdich-Springbank.html,bbc9b3f3876fde01fa99d3fb932adae1f76a681c84d07e9fcf0b96045402aa5f
"The Springbank 'Cuvée' 1965 & 1993/2004 (46%, Murray McDavid, sherry and bourbon, MM 0406, 1224 bottles)","The Springbank 'Cuvée' 1965 & 1993/2004 (46%, Murray McDavid, sherry and bourbon, MM 0406, 1224 bottles) We first sampled this intriguing expression two decades ago, albeit from a different bottle, and, well, any excuse is a good excuse when it comes to whisky. In any case, what we have here is a ten-year-old, for which a cask of 1965 was sacrificed—likely one that had dipped below the fateful 40% ABV mark. A different time, indeed... Colour: pale gold. Nose: I had thought that the additional time in the bottle might have further harmonised the two vintages, but that doesn’t seem to be the case here. It’s rather disjointed, with that medicinal and metallic edge typical of those early 1993 vintages when they were young, alongside a subtle older Springbank showing hints of coconut and chamomile. Not exactly a Springbank one would 'nose' with enthusiasm. Mouth: a bit closer to the 18-year-old but still retaining that slightly sulphurous and overly waxy character (yes, it’s possible) of the young distillate. Plenty of lemon juice and even a touch of Sprite (apologies). Of course, it’s a very good whisky, but it’s kept a slightly off-kilter, metallic quality. Finish: much the same. Comments: slightly disappointed. I had expected it to improve over twenty years, but quite the opposite seems to have happened. In any case, it’s all rather anecdotal. SGP: 363 - 81 points.",81,2024-08-21,https://www.whiskyfun.com/archiveaugust24-2-Bruichladdich-Springbank.html,1827542bc862dc2774b0dc4f05c182fd14bab3b72745f39d4e11b48c29731455
"Springbank 30 yo 1993/2023 (52.2%, Royal Mile Whiskies, cask #159, 178 bottles)","Springbank 30 yo 1993/2023 (52.2%, Royal Mile Whiskies, cask #159, 178 bottles) Colour: full gold. Nose: a tale of a chrysalis blossoming into a butterfly, thanks to the grace of a very fine cask. There’s still that powdered sulphur (not burnt), chalk, even a bit of lime, paraffin, but also citrus fruits and their peels, with a touch of beeswax mixed with propolis, much like one finds in a beehive. Rather adore it, I must say. With water: wax paper, a hint of lapsang souchong—not too much—and a stack of old magazines stored in an ancient cellar. Rather like the wedding of Charles and Lady Di, or that scuffle between the Stranglers and the Clash. Mouth (neat): superb, very compact and coherent, with smoked lemons and minty seaweed, plus some wax and that’s all. But that’s already quite a lot. With water: everything falls into place perfectly, one of the most idiosyncratic malt whiskies in the world, showing a particularly emblematic version of this distillate’s style, which isn’t always the case. Wax, carbon, lemon zest, roots, petrol. Finish: long but gentler, a bit buttery, with peanut butter, peat smoke, and... a tiny sardine. The lemons hold their ground in the aftertaste. Comments: these 1993s clearly needed some time to come into their own. Brilliant drop. SGP:562 - 93 points.",93,2024-08-21,https://www.whiskyfun.com/archiveaugust24-2-Bruichladdich-Springbank.html,502112e28f2276db28fed7bff5230fa542a0b8caf5e76bab0808752a0ec1cfe0
"Springbank 1965/2004 (46%, Lombard, Jewels of Scotland, USA release, 75cl)","Springbank 1965/2004 (46%, Lombard, Jewels of Scotland, USA release, 75cl) ‘Aged in oakwood casks’, as the label proudly proclaims. Quite refreshing to see a time before we started to be endlessly bombarded with improbable stories about casks and wine, wouldn’t you say? But imagine, this baby is nearly 40 years old. Lombard had several different Springbank 1965s, but we’d never had the pleasure of trying this one... Colour: bright gold. Nose: a perfect lineage, more evident in casks that aren’t too active like this one, even though the Distillery filled plenty of active sherry casks in those vintages. Here we find seawater, putty, old paint pots, ashes, wax, chalk, citrus peels, paraffin, old papers, and even sardines and anchovies... Mouth: it’s crazy, you’d swear it was a 1993, I assure you. Has anything ever changed at Springbank? Paint, tar, paraffin, metallic touches (copper), lemon, petrol, seawater, shellfish (our friends, the whelks) ... Then the expected citrus and just plain apples. Plain but very good apples. Finish: of medium length but very consistent, with tar and hints of brine. The putty lingers even into the aftertaste. Comments: I do think 30 years is better, all the same. I also believe that’s what we already noticed when tasting the famous ‘Millennium’ series, albeit informally. SGP:552 - 90 points.",90,2024-08-21,https://www.whiskyfun.com/archiveaugust24-2-Bruichladdich-Springbank.html,2e474e2e0813a7205959b4632abe2d9c6219a6ae03632ff0d80233d8965b2e37
"Springbank 26 yo 1998/2024 (56.8%, Decadent Drinks, WhiskyLand, Chapter One, first fill sherry butt, 550 bottles)","Springbank 26 yo 1998/2024 (56.8%, Decadent Drinks, WhiskyLand, Chapter One, first fill sherry butt, 550 bottles) It’s a bit awkward, I already know it’s good since I had a taste at the official launch of WhiskyLand (and the funeral of WhiskySponge) in Glasgow earlier this month. But never mind, we’ll taste this baby again anyway... Colour: amber. Nose: at first, there are those little resinous touches, pine bud liqueur, burnt firwood, and so forth, then a sudden burst of mango accompanied by a few raisins, a pinch of pipe tobacco, followed by a cigar box and a splendid tar laced with liquorice. I could mention some rancio, but I fear that could be the influence of the Cognac-style bottle. With water: those usual touches of natural rubber, artichoke liqueur, tar, Lapsang Souchong... The water seems to add a smoky edge. Tarmac. Mouth (neat): oily texture. Beware, it’s more potent than it seems. A peppery side, leather, amontillado, cigar, another touch of salt, salted butter caramel, and let’s say it straight away, a bit of that Samaroli character, claro que si (but that’s Spanish, S.!). With water: splendid orange liqueurs, caramel, milk chocolate, a hint of coriander adding freshness, Dutch salted liquorice (for instance) ... It’s another dimension, tauter. Finish: very long, saltier. Salted caramel, tobacco, a touch of leather, and blood orange. Frankly smoky aftertaste, almost astringent. Magnificently astringent. Comments: seriously, I even considered going up to 94, then I re-tasted the Westie Sponge Ed3 and found them on par, although they’re very different. If half-points were a thing—God forbid—I’d give it 93.5. Sublime bottle. Oh, and to hell with it, it’s a perfect marriage between a stubborn distillate and an equally stubborn cask… SGP:563 - 94 points.",94,2024-08-21,https://www.whiskyfun.com/archiveaugust24-2-Bruichladdich-Springbank.html,69abe9f293eb91b112a85f2dd1a12e9c171d1a1e3a2d188d7e9ea5e514dd0ad5
"Loch Ryan (40%, Inver House, France, blended Scotch, +/-2010)","Loch Ryan (40%, Inver House, France, blended Scotch, +/-2010) I acquired this rather modest bottle back in the days when I was fond of conducting ‘el cheapos’ sessions, primarily to demonstrate that we are genuinely making use of the full 100-point scale, not just its upper reaches. And so, this ‘supermarket’ bottle ended up languishing at the back of a shelf, unopened... Nowadays, Inver House Distillers belongs to ThaiBev and operates some truly charming distilleries (Pulteney, Balblair, Speyburn…). Colour: pale gold. Nose: in the style of J&B, light, with a few hints of pear eau-de-vie, a touch of medicinal alcohol, a bit of vanilla, some biscuits, and a note of English tea… All this is fairly inoffensive and, as such, not unpleasant. But let’s be clear, this is neither Balblair nor Pulteney. Mouth: slightly sweet, gently malty, with small notes of banana, followed by vanilla, scones, and tea. I nearly forgot the drops of pear liqueur and a slightly burning alcohol in the background. Finish: short but civilised, lightly malty again. Comments: not horrible and even fairly balanced, but very light. I reckon if you pour this over some large ice cubes, you’ve got yourself a highball without even needing to add water. All in all, it’s a respectable Scotch. SGP:441 - 70 points.",70,2024-08-20,https://www.whiskyfun.com/archiveaugust24-2-Bruichladdich-Springbank.html,9984be95338562384f37c3ca0566a6baefdd10090e54f1072975546df82f1c15
"Royal Salute 25 yo (51.8%, OB, Chivas Brothers, blended Scotch, for Claudio’s 70th Anniversary, 2024)","Royal Salute 25 yo (51.8%, OB, Chivas Brothers, blended Scotch, for Claudio’s 70th Anniversary, 2024) A rare private bottling crafted to celebrate the 70th birthday of Waldhaus' and World of Whisky's clan chief, Claudio Bernasconi, this year. An extraordinary place with wonderful people; do make a brief detour on your way to your next business rendezvous in Davos. Colour: amber with hints of walnut. Nose: indeed, a profusion of walnut wine, prunes, toffee, butterscotch, with a dash of mint sauce, Cuban cigars, a touch of compost, dried beef (Grisons meat, ha!), and a drop of soy sauce. We’re in the realm of an old malt matured in genuine sherry (solera butt), and I’d wager there’s not much grain whisky in here. Sublime nose. Mouth: it’s gentler on the palate, with dried figs and marzipan-stuffed dates, followed by our perennial chestnut honey and a whisper of very old Jerez brandy. Clearly an old-school style, somewhat reminiscent of the days when malts and brandies were neck and neck. Light touches of glutamate and Maggi, splendid. Finish: remarkably long for 40%, now more chocolatey, with some coffee lingering in the aftertaste. Comments: there’s a sense that Chivas has packed a fair amount of very old Glenlivet and Longmorn into this ‘small’ blend, the kind that holds the minimum proof perfectly. Gorgeous sherry and absolutely no ‘grainy sensation’; had you told me this was a 1950s Glenlivet, I’d have said, ‘of course’. SGP:561 - 92 points.",92,2024-08-20,https://www.whiskyfun.com/archiveaugust24-2-Bruichladdich-Springbank.html,f0856f7ce0915d2cf6350c9118044461a2809163096e70b161002b20df382ea8
"The Antiquary 15 yo (40%, OB, Blended Scotch, claret casks finish, 2024)","The Antiquary 15 yo (40%, OB, Blended Scotch, claret casks finish, 2024) The Antiquary brand, which is Tomatin's blend, has been revived this year. I do somewhat regret the heavy-handed use of red wine here. I would have preferred to try the 21-year-old, but that one is now finished in tawny port casks, so red for red, Bordeaux it is. There's no escaping it now, in malt whisky, in vino veritas. Colour: gold. Not rosé. Nose: there's a slight old barrel note, along with bell pepper and blackcurrant buds, then blood oranges. It's actually quite pleasant, despite that premixed feel that makes us long for... a good old Tomatin ex-refill or bourbon. Mouth: the wine influence is very evident. A hint of rubber, then leaves and buds, raspberries, apples, oranges. Finish: medium length, with the weakness of the 40% ABV showing a bit. Comments: not bad, but do we really need all this wine? I used to really like the old natural The Antiquary blends (WF 87 for the 21 yo in 2014). SGP:451 - 74 points.",74,2024-08-20,https://www.whiskyfun.com/archiveaugust24-2-Bruichladdich-Springbank.html,34e9e1401509f1bfcb3ad7a8810c1a546bb3b79358d5af0f13b14577d4eaa182
"Nectarosity (46%, Compass Box, blended scotch, 2024)","Nectarosity (46%, Compass Box, blended scotch, 2024) Funny name, much better than morosity, don’t you think? It seems to be all about patisserie, and quite rightly so. Inside, you’ll find Linkwood, Clynelish, Balmenach, and more or less one-third grain (Cameronbridge and Girvan), so it's a rather ‘good’ blend. I recall that in the olden days, a blend boasting 50% malt was already considered quite top shelf. Colour: lemon gold (and why not indeed?). Nose: very fresh, very much on freshly baked croissants and beeswax, with yellow peaches and ripe apples. Plus, an entire bag of mirabelles. Mouth: very good, the concept works well, and it’s not just a one-malt-show from Clynelish (not that we would’ve complained, of course), but you can definitely sense it, alongside some citrus and fresher orchard fruits. Finish: a touch of green wood and a very slight bitterness, which adds dimension. Medium length, very pleasant, with a peach skin aftertaste. Comments: this reminds me of an old personal recipe I once kind of came up with kind of with CB just for fun: 10% Laphroaig, 30% Clynelish, and for the remaining 60%, just whatever came to hand – that didn’t really matter. But different times, different manners, and nothing to do with this little Nectarosity, of course. SGP: 551 – 85 points.",85,2024-08-20,https://www.whiskyfun.com/archiveaugust24-2-Bruichladdich-Springbank.html,27a7353995dc1d137554dde6509370291c42a520898ead311b68d8b0d82b8d33
"Bridget’s Kirk 35 yo 1988/2024 (43.9%, Hannah Whisky Merchants, blended scotch, refill butt, 450 bottles)","Bridget’s Kirk 35 yo 1988/2024 (43.9%, Hannah Whisky Merchants, blended scotch, refill butt, 450 bottles) Colour: pure gold. Nose: the first word that comes to mind is ‘elegance’, the second is ‘yellow peaches’, and the third is ‘patisseries and herbal teas’. It’s not the heavily honeyed profile you might find elsewhere, more like shortbread, oatcakes, and macarons, with just a hint of coconut milk, likely from the grains. Mouth: it’s the oranges, cinnamon, and café latte leading the dance here. There’s a slightly improbable side to it, as if this composition wasn’t entirely intentional, but that only adds to the charm, along with… a touch of old Cuban rum from the same era. Vanilla and latte. Finish: not very long, but increasingly focused on that famous old Cuban rum. Coffee with milk, coconut, vanilla, orange liqueur… Comments: this old blend has really aged gracefully with lots of charm, nicely converging with time. SGP: 541 – 87 points.",87,2024-08-20,https://www.whiskyfun.com/archiveaugust24-2-Bruichladdich-Springbank.html,96fefeabcdab01539e61b7840ff8fef7a0cc3dd9e396857230c8760f4a2a04e5
"Bruichladdich 2014/2024 ‘Islay Barley’ (50%, OB, bourbon and wine casks)","Bruichladdich 2014/2024 ‘Islay Barley’ (50%, OB, bourbon and wine casks) The barley hails from Islay, though I dare say the wine casks are from elsewhere, ha. It would also be intriguing to explore even more ‘terroir-forward’ expressions where the casks have been well-used enough to erase much of the influence from their previous contents. In any case, this baby is made from a harvest of autumn 2013 barley, once again highlighting the disconnect between the vintages of the cereals and the distillate, unlike, say, in Cognac. We'll talk about the dormancy of barley another time. Colour: white wine. Nose: delightfully fresh, with notes of white currants, green apple, yellow melon, brioche dough, citron, and gooseberries. Very fresh indeed, very Bruichladdich-esque. With water: much more on pastries, custard, streusels, and a very slight soapy note from the addition of water (saponification). Mouth (neat): plenty of yellow and white fruits, lemon peel, more green apple, and a touch of green pepper. There's a hint of wormwood too. Once again, it’s fresh and vibrant. With water: a bit more on stewed fruits, greengages, and other plums… Finish: of medium length, leaning more towards preserved yellow and white fruits, such as mirabelles. Some pollen on the aftertaste, and once again, a bit of green pepper. Comments: it’s really quite lovely, fresh, and fruity. SGP: 651 – 85 points.",85,2024-08-19,https://www.whiskyfun.com/archiveaugust24-2-Bruichladdich-Springbank.html,d7e406a0e4f9a1b09bd42954f5c158295b2fcaef7cf732b17fa72c2bdc482a01
