whisky_name_raw,review_text,score,review_date,source_url,dedupe_hash
"Arbikie 5 yo ‘Cask Strength Edition 1’ (59.7%, OB, Distillers Series, Scottish rye, 966 bottles, 2024)","Arbikie 5 yo ‘Cask Strength Edition 1’ (59.7%, OB, Distillers Series, Scottish rye, 966 bottles, 2024) Single farm, field-to-bottle rye whisky (thus grain whisky) from 4 casks, from ‘one of the most sustainable distilleries in the world’ where they also make various gins and vodkas. Along the rye here they add wheat and malted Concerto barley. Colour: light gold. Nose: intensely fruity and floral at first, full of tangerines, lavender, and violets, then develops a ‘gin’ side or even hints of young marc from Burgundy for the uninitiated taster. We’re not at all on a rye that smells of rye bread, if you see what I mean. With water: it moves much closer to cereal, in a very pronounced way. A subtle whiff of quality cologne. Mouth (neat): I like it, it’s very excessive but the kind of imbalance one enjoys. Loads of black pepper, pink pepper, mandarin zest, coriander seeds, and Earl Grey tea, with a sharper rye profile than on the nose but also hints of buckwheat and an ultra-fruity character. With water: this gets almost perfect, more earthy, grainy, and with a wider variety of fruits and roots. Gentian, pear… Even a curious saline touch. After all, the North Sea isn’t far away. Finish: not overly long but very clean and chiselled. In short, more ‘rye’. Comments: quite the tasting adventure, where every drop of water counts. You could have fun with your pipette for a good two hours—I’d even have liked to test several different waters if I’d had the time. In short, it started rather low but reached… SGP: 841 – 85 points.",85,2025-01-14,https://www.whiskyfun.com/archivejanuary25-1-Longmorn-Linkwood.html,a47a6f4b4ec925c3f35808ba86f9510abe21de6905e670837f0c4626f9877b66
"Lochside 1981/2001 (61.0%, Scotch Malt Whisky Society, #92.10)","Lochside 1981/2001 (61.0%, Scotch Malt Whisky Society, #92.10) I’ve never had the chance to taste this Lochside; only Angus has. I regret that no one talks about Lochside anymore, and that it’s entirely unavailable nowadays—it was a magnificently fruity malt, though sadly neglected by its last owners, the Spanish group D.Y.C., who had released a rather uninspiring official 10-year-old expression, probably tailored for southern markets where whisky was often consumed with plenty of water and ice. The distillery closed in 1992 after being acquired, along with DYC, by Allied, and was later demolished and even ravaged by a fire. In short, it met a fate rather similar to that of Littlemill. Colour: white wine. Nose: I’d almost forgotten how exotic Lochside’s fruitiness could be. Here, alongside a little musk, soft smoke, and blackcurrant buds, we find an entire container of passion fruits plus some pink grapefruits to complete the profile. I don’t think any grand fruity malt (old Bowmore, Laphroaig, Littlemill, Bushmills, Clynelish, etc.) ever showcased a profile even vaguely similar. With water: the pink grapefruits take the lead, joined by a hint of Petit and Grand Manseng wine. Mouth (neat): a bag of fruit sweets. Lemon, orange, mango, blackcurrant, redcurrant, pineapple, and, of course, passion fruit. It then transitions into a pure ‘maracuja sherbet’. With water: its only, very slight flaw is a touch of monotony. After adding water, you end up with something resembling a mix of passion fruit and blackcurrant juice—let’s say a 75/25 split. Finish: much the same. Comments: the Lochside tower was so beautiful! Remember, it was originally a brewery. SGP: 751 – 91 points.",91,2025-01-14,https://www.whiskyfun.com/archivejanuary25-1-Longmorn-Linkwood.html,30763f719ea6ea89cb24491398f453aa79f74fca0de742ef00f0f1c34394a5ef
"Moon Harbour ‘Signature’ (41.2%, OB, France, +/-2024)","Moon Harbour ‘Signature’ (41.2%, OB, France, +/-2024) A very young single malt from Bordeaux, naturally matured in Bordeaux casks. Everyone’s doing it worldwide, so it would be quite ironic if the Bordelais didn’t follow suit. One imagines the stills used might be either cognaçais or Stupfler. Colour: pale gold. Nose: heavily influenced by woody spices and sweet wine, Sauternes, pencil shavings, lychees, rose petals, apricots, pink peppercorns… It’s rather exuberant and far removed from classic malts, almost veering towards rye. Mouth: the woody spices and sweet wine immediately take centre stage. Cherries, blackcurrants, pepper, apricots, cinnamon, nutmeg, and barley sugar. Very fruity. Finish: fairly short, quite focused on the sweet wine, with a return of pencil shavings in the aftertaste. Comments: quite similar to other ‘wine inside’ malts produced in the south-west. Not exactly my style, but it’s very young yet well made. SGP:730 - 75 points.",75,2025-01-13,https://www.whiskyfun.com/archivejanuary25-1-Longmorn-Linkwood.html,0dc3e26ab1134989dba64768fc2c5d82fb25c8fda226583d8a92a520b8bc606f
"BM Signature 8 yo (42%, OB, France, +/-2024)","BM Signature 8 yo (42%, OB, France, +/-2024) BM is Bruno Mangin, from the now sadly defunct Distillerie Rouget de Lisle in the French Jura. The still used was an Armagnac-style column, and the casks were mostly local wine casks (in France, it’s practically a tradition). Colour: gold. Nose: a rather pleasant fino-like edge, with acidity and fresh walnuts layered over damp earth and vineyard peaches. The walnuts dominate, but who doesn’t love walnuts? Mouth: still that slightly sour edge, those walnuts, dry wine (Madeira), plus a salty note that really makes it take off, and it keeps improving as it goes. Quite Jerez-like, if I may say so. Finish: medium length, with tart little apples and more walnuts. Impeccably dry. A drop of gentian in the aftertaste. Comments: I was a bit sceptical at first, I must admit, but it won me over in the end. There will be other BMs. SGP:361 - 85 points.",85,2025-01-13,https://www.whiskyfun.com/archivejanuary25-1-Longmorn-Linkwood.html,3e4078220470f51f29802679dc263344e052916e1b71e59e4b9a0fbbb822c708
"Laizhou ‘Inaugural Edition’ (46%, OB, China, single malt, +/-2024)","Laizhou ‘Inaugural Edition’ (46%, OB, China, single malt, +/-2024) Another young Chinese distillery, this time from Szechuan. There are more and more of them in China, and I can’t help but feel this could play out much like the car industry—everyone dreams of selling their whiskies to our Chinese friends, but now they’re starting to produce their own, and doing it well (we’re far from Red Labial or Chinas Regal here). In any case, what I’ve already tasted was rather a little impressive! Moreover, Laizhou appears to be employing some ‘wood technology’ that would make quite a few people in Tain (Scotland) green with envy. Colour: gold. Nose: wow. A highly unusual smoke, resinous, empyreumatic, wrapping around candied citrus fruits and a touch of top-notch yellow curry. A very pretty nose, compact and highly engaging. Mouth: creamy, still smoky (eucalyptus wood), saline, almost mustard-like, followed by roasted nuts of all kinds—pecans, pine nuts, hazelnuts, almonds… That little yellow curry makes a welcome return, which we rather love. Finish: long, beautifully dry, and ever so slightly charred. Comments: what impresses me is that they haven’t tried to ‘copy’ (OK, perhaps take inspiration from) Scottish malts. It’s genuinely different, with what seems to be excellent cask work. Real new world. This malt too, we’ll be seeing more of. SGP:362 - 85 points.",85,2025-01-13,https://www.whiskyfun.com/archivejanuary25-1-Longmorn-Linkwood.html,9737011f54c6d11b0c98573ea396da0fafe304575920ee306ec5e3ef83b7cedf
"Paul John 2016/2023 (58.5%, OB, India, peated, Madeira cask, cask #14363, 186 bottles)","Paul John 2016/2023 (58.5%, OB, India, peated, Madeira cask, cask #14363, 186 bottles) Straight from India through our dear friend Krishna who is also a great oyster connoisseur. Colour: golden amber. Nose: pretty sulphury (no prob) and camphory at first but this aspect gradually gives way to overripe mangoes and fudge, with some rather unexpected background touches of game birds and tobacco. This creates a highly dramatic profile overall, let’s press on... With water: barely tamed, highly aromatic, with hints of rose petals and sugar-coated caraway. Truly beautiful and it really takes you on a journey. Mouth (neat): it’s almost like mango jam with spices and honey, to be honest. Oily texture. With water: an absolute indulgence. Honey, mango, apricot, rose, jasmine, cardamom... A touch of leather and tobacco, possibly from the Madeira. Finish: long, spicy, now drier. Notes of chocolate, coffee and pink peppercorns. Comments: what an adventure! SGP:761 - 87 points.",87,2025-01-13,https://www.whiskyfun.com/archivejanuary25-1-Longmorn-Linkwood.html,63059a0b0e0a322202b80682b8f69abf06b7edd5dc966556d66b828a8fa453b6
"Amrut 2016/2024 ‘Virgin Oak Refilled’ (60%, OB, India, Foundations, cask #915, 102 bottles)","Amrut 2016/2024 ‘Virgin Oak Refilled’ (60%, OB, India, Foundations, cask #915, 102 bottles) Let’s address the question straight away—does ‘virgin oak refilled’ not sound like an oxymoron? Probably not... Well, we get the idea; it’s neither refill bourbon nor refill sherry, etc. In any case, we’re not entirely sure, but it’s amusing—much love for Amrut. Colour: amber. Baltic amber (indeed). Nose: ultra-compact and brilliant. Mango liqueur, parsley, bay leaf. Slightly crazy in its precision. With water: all kinds of mint, especially peppermint. Mouth (neat): medicinal mango! Someone had to invent that. With water: still mango, but also banana and a hint of truffle dust. Finish: long, with similar notes but eventually leaning towards citrus (oranges). Comments: this tasting note might be a bit all over the place, I’m sorry, but the whisky is perfect. SGP:651 - 89 points.",89,2025-01-13,https://www.whiskyfun.com/archivejanuary25-1-Longmorn-Linkwood.html,6cbacc66f4e7cba36e1784f26a901c8cc675f3259e2d9fdb1d06baa6f8bf3fad
"Kinglake 2018/2021 ‘In The Blood’ (49%, OB, Australia, 93 bottles)","Kinglake 2018/2021 ‘In The Blood’ (49%, OB, Australia, 93 bottles) Speaking of finishing, those crazy Australians matured this single malt in an ex-Buffalo Trace barrel before transferring it to a Red Gum barrel (no idea what that is—though I suppose one could look it up) seasoned for six months with Moondog stout and another six months with barley wine. Right then, let’s take a deep breath and dive in… Colour: reddish amber. Nose: it’s all about chocolate. Chocolate filled with a touch of raspberry liqueur, a combination that feels distinctly... Alsatian. Mouth: absolutely bonkers. Still plenty of chocolate, but also very young Pinot Noir and pink grapefruit. The flavours are so explosive that the 49% ABV feels more like 60. Really. Finish: very long, with more crazy nuances—raspberry making a return, dark beer, cloves, malt extract, cumin, black cherry, and so on. Mad stuff. Comments: it’s so explosively aromatic that if they bottled this at 60% ABV, it might just shatter your tasting glass without hesitation. Mad, I love it. SGP:771 - 87 points.",87,2025-01-13,https://www.whiskyfun.com/archivejanuary25-1-Longmorn-Linkwood.html,a5504d903b1e8f00060356f057fa4c438fe58a8202877440cb26a52c5a5e9a4f
"Bimber ‘Witkievicz the Artist’ (58.7%, OB, England, Shoulders of Giants, for Poland, oloroso, cask #460, 285 bottles, 2024)","Bimber ‘Witkievicz the Artist’ (58.7%, OB, England, Shoulders of Giants, for Poland, oloroso, cask #460, 285 bottles, 2024) I note that, for now, there hasn’t been a bottling in this series dedicated to Elon M. Colour: gold. Nose: a combination of ripe bananas and roasted nuts, followed by slightly burnt cake. Light hints of concrete dust in the background. With water: oh, very lovely—lighter, almost floral. Blood oranges and wisteria. Mouth (neat): this is clearly very well done—raisins, strawberry liqueur, pink peppercorns, chocolate cake, and a drop (just one) of banana liqueur. With water: gentle spices emerge, adding a stronger impression of dark chocolate. Finish: fairly long, chocolatey. Notes of dark tobacco. Comments: we tend to favour ex-bourbon, but I must admit this ex-oloroso has been crafted with great attention to detail and, above all, freshness. Freshness matters. Na zdrowie. SGP:661 - 87 points.",87,2025-01-13,https://www.whiskyfun.com/archivejanuary25-1-Longmorn-Linkwood.html,c24df0c9c8dc5bea53711deeaf02195a45e6083bfb38fbc31efc568dd57739e1
"Black Stripe (40%, OB, Canada, +/-2020)","Black Stripe (40%, OB, Canada, +/-2020) The bottle is quite intimidating, though it’s worth noting this is blended by Forty Creek. One can’t have it all, can they? Colour: white. Nose: hello? Well, there’s a touch of cane juice, hints of bamboo shoots, a drizzle of sugar syrup, and a mere drop of pineapple liqueur. Hardly the kind of profile one might recall the next morning. Mouth: it’s fine, let’s move on swiftly. A bit of earthy cane, a faint suggestion of artichoke, and sweetness without actual sugary weight, if you follow. Finish: virtually non-existent. A faint note of lime. Comments: not dreadful, but rather weak for a malt enthusiast’s palate. SGP:330 – 60 to 69 points.",,2025-01-12,https://www.whiskyfun.com/archivejanuary25-1-Longmorn-Linkwood.html,1fe4dc02922df41c51b3bc6cc47eaf9f47ff5abf463d40c0c38bd3e26b0eff19
"La Favorite ‘Cœur de Canne’ (50%, OB, La Martinique, agricole, +/-2023)","La Favorite ‘Cœur de Canne’ (50%, OB, La Martinique, agricole, +/-2023) This ‘Cœur de Canne’ (Heart of Cane) is also available at other strengths, such as 55%. Colour: white. Nose: ah yes, fermented cane, olives, capers, lime, parsley, Thai basil, beet syrup (and cane syrup, naturally). Mouth: a touch sweet but otherwise very good, vibrant, and perfectly enjoyable even without water or ice, with a lovely earthy character. Fresh carrots, lychee, hints of roses. Finish: long, clean, and fragrant. Comments: quite gentle for an agricole, yet still very charming. SGP:441 – 80 to 85 points.",,2025-01-12,https://www.whiskyfun.com/archivejanuary25-1-Longmorn-Linkwood.html,934090a2d6ed9d2183fbae6aa1fb18a6a6d7523af611da98264055d3e57d68b0
"Taragawa (40%, OB, Japan, +/-2023)","Taragawa (40%, OB, Japan, +/-2023) Made by sake makers in Okinawa, using shochu stills (steel). Colour: white. Nose: ultra-soft, almost like rose water blended with lychee syrup. Mouth: moves closer to the world of rum. Lovely fermentary notes, with rice and chocolate, roses, violets, and papayas. Finish: good length, with a pleasant acidic structure beyond the floral and lychee elements. Pink grapefruit. Comments: interesting and unusual, I rather like it. SGP:730 – 75 to 80 points.",,2025-01-12,https://www.whiskyfun.com/archivejanuary25-1-Longmorn-Linkwood.html,db8a8987efac8591e03ae2bec7d283b2f721013828e4c333efc8394541b06d74
"Aguardiente de Cana (46.9%, OB, El Destilado, Mexico, +/-2020)","Aguardiente de Cana (46.9%, OB, El Destilado, Mexico, +/-2020) This is from Oaxaca, though it’s not mezcal. Colour: white. Nose: well, it may not be mezcal, but it certainly smells like it, with just the right mix of olives and charcoal. Small pickled lemons, pickled onions… Mouth: frankly, it tastes like mezcal. It’s excellent, still packed with olives and smoked lemons, along with earthy tones and a hint of petrol. Crazy stuff. Finish: long, smoky, earthy. Comments: I’m not sure they still produce this, at least that’s what I gather from the TWE website. The world’s gone mad if we lose top-quality spirits like this while continuing to churn out oceans of ghastly, sugar-laden gut-rot. Right, let’s take a deep breath... SGP:372 – 85 to 90 points.",,2025-01-12,https://www.whiskyfun.com/archivejanuary25-1-Longmorn-Linkwood.html,0cc131ae8a896a058a563771d5611bfebeaddddc4d8af35722006f1b59dd7cae
"Duppy Share White (40%, OB, Jamaica, +/-2024)","Duppy Share White (40%, OB, Jamaica, +/-2024) The bottle is very pretty. We had tried an aged version before, which wasn’t bad at all. Mind you, this is Jamaican! Colour: white. Nose: hey, this is lovely! Super-ripe mirabelles, raspberry syrup, blackcurrant juice, and prickly pear. No Jamaican funk at this stage, but who cares. Mouth: oh yes, hints of varnish, fermented fruits, and olive oil, followed by touches of liquorice and even tar. Finish: not very long, but the flambéed banana note is superb. Comments: this deserves more than 40% ABV; it would be brilliant at 50%. SGP:561 – 80 to 85 points.",,2025-01-12,https://www.whiskyfun.com/archivejanuary25-1-Longmorn-Linkwood.html,fe2f674b4d76a0a4840e95243297e9dccdba2fc0d747da4f0419a2891b1c9432
"Neisson ‘Clos Godinot’ (52.5%, OB, Martinique, agricole, +/-2023)","Neisson ‘Clos Godinot’ (52.5%, OB, Martinique, agricole, +/-2023) One of, if not the very first parcellaire white rum from Neisson. Colour: white. Nose: geranium and jasmine, white peaches, longans. With water: fresh concrete, engine oil, tropical greenhouse. Mouth (neat): slightly hot, earthy, and loaded with fermented fruits. It needs water. With water: a lovely saline touch, hints of tarragon and sage, with a fermentary bitterness. Finish: long, this time with extremely, extremely ripe bananas. Comments: plenty of action in this Neisson blanc. SGP:462 – 80 to 85 points.",,2025-01-12,https://www.whiskyfun.com/archivejanuary25-1-Longmorn-Linkwood.html,7cc1b9ca61417e7f306264af07f7916c87fad396fc121a34a7cc539dea4913ee
"Renegade ‘All-Island Cuvée Aura’ (46%, OB, Grenada, 2024)","Renegade ‘All-Island Cuvée Aura’ (46%, OB, Grenada, 2024) So much emotion here, as the distillery has closed. People definitely prefer sugary rubbish and that’s why major alcohol companies prefer to invest in brands of fake rum with made-up stories while being loaded with additives. As Coluche used to say, ""To calculate the IQ of a crowd, you take the IQ of the dumbest person and divide it by the number of members."" Alright, let’s take it easy, after all, Vox Populi, Vox Dei. Colour: white. Nose: a stunning distillate, saline, tarry, oily, and elegant. Tiny pink olives and a beautiful manzanilla en rama. Mouth: exceptionally saline and oily, followed by ripe mangoes and black cherry juice. Magnificent. Finish: long, with more citrus and spice. A superb saline aftertaste with olives. Comments: what a distillate! As a white rum, this is easily in the world’s top ten or even five, in my opinion. After the lovely Neisson, this confirms it. SGP:462 – 90 points.",90,2025-01-12,https://www.whiskyfun.com/archivejanuary25-1-Longmorn-Linkwood.html,5b271477731611ab93458be06e3aa3d02db1f826d5a03d0b16ec45ae74995d68
"Bielle Blanc (59%, OB, Marie-Galante, agricole, +/-2023)","Bielle Blanc (59%, OB, Marie-Galante, agricole, +/-2023) Colour: white. Nose: closed and simple at 59%, which is not really ‘Bielle’. Sugar syrup (eh?). With water: no development, which is very surprising. Mouth (neat): varnish and cane, but again, it’s too hot. This must be made for ti-punches. With water: better, but a bit messy and poorly defined. It struggles after the Renegade. Finish: same. Comments: I don’t quite understand this. Bielle, in theory, is top five as well—I’m sure of it. Must be me, I might have done something wrong, I totally loved this one five years ago. I'll try again with another batch. SGP:441 - 75 to 80 points.",,2025-01-12,https://www.whiskyfun.com/archivejanuary25-1-Longmorn-Linkwood.html,0a81c7e14ae36123b08417f60505b96e7f8394731ae29486cd1520037c1e619c
"Domaine de Bellevue ‘Rhum Blanc Bio’ (59%, OB, Marie-Galante, agricole, +/-2023)","Domaine de Bellevue ‘Rhum Blanc Bio’ (59%, OB, Marie-Galante, agricole, +/-2023) This is a single-parcel rum from Marie-Galante, though it carries the Guadeloupe GI, as administratively, Marie-Galante is part of Guadeloupe. We’ve already tasted some great Bellevues. According to the owners, ‘the Bellevue distillery is the only eco-positive distillery in the world’, though I’ve seen ‘carbon-positive’ rums before. To be verified… In any case, this rum comes from the new Bellevue distillery, built in 2001 right next to the old one. They own 62ha of sugarcane. Colour: white. Nose: fairly gentle at first, slightly earthy with notes of ripe pear, hearts of palm perhaps, and fresh blackcurrants… In any case, it’s very mild so far. With water: little development, a touch of paraffin. Very discreet, which is surprising. Mouth (neat): very powerful, very grassy, quite bitter, with bagasse and hay. Water is really necessary here. With water: again, it’s discreet, but rather elegant, with green berries. It then gains complexity with notes of olives and a touch of seawater bringing a light ‘funk’. Much more to my taste now. Finish: of medium length, quite grassy and salty. The little olives remain, as does a hint of vanilla. Comments: it needed quite a bit of water and some patience, but it worked out very well in the end, phew. SGP:461 - 80 to 85 points.",,2025-01-12,https://www.whiskyfun.com/archivejanuary25-1-Longmorn-Linkwood.html,77e9deefe068f9d3239e5583e50f7ce673b87812f9e8107081aeb929a97549c8
"Longueteau ‘Souvenir L’Intemporel’ (62%, OB, Guadeloupe, agricole, 2024)","Longueteau ‘Souvenir L’Intemporel’ (62%, OB, Guadeloupe, agricole, 2024) A blend of approximately one-third blue cane and two-thirds red cane here. Like many fine white rums, it is matured for several months in vats before bottling. I’m very fond of the simpler Longueteau blanc at 50% ABV (WF 88). Colour: white. Nose: a distinctive nose, starting with vegetables and fish (sardines in olive oil), seaweed, and beach sand… It almost feels like standing before a ‘low marque’ Jamaican. Naturally, we love this, even at 62%. With water: hints of carbon, exhaust fumes… (in rum, that’s appealing; in real life, not so much) followed by orange blossom. Mouth (neat): brilliant, with lime, green pepper, olives, and seawater. This is bold! With water: the cane reigns supreme, elevated by the same very saline flavours. Finish: long, precise, even refreshing. Comments: I’m not sure all of this is ‘timeless’, but it certainly evokes the style of a great white mezcal, for instance. SGP:462 - 85 to 90 points.",,2025-01-12,https://www.whiskyfun.com/archivejanuary25-1-Longmorn-Linkwood.html,74c9642ee643bbc44866693468147510ad6ce28cda6af1dcaa3f2519e61ccd99
"Amrut 2022 (62.8%, Habitation Velier, India, pure sugarcane juice, 2023)","Amrut 2022 (62.8%, Habitation Velier, India, pure sugarcane juice, 2023) Made from cane harvested just near the distillery and distilled in the pot stills used for Amrut’s famed malt whiskies. Colour: white. Nose: delightful! More tarmac than in all the others, with fresh rubber, zucchini, dried mushrooms, seawater, and whelks… Very surprising. With water: a touch fresher, more maritime, and even a bit chalky. Do they have all these aromas ‘near the distillery’? Mouth (neat): oh yes! Gorgeous ‘funky’ mangos alongside bags upon bags of Williams pears, which is entirely unexpected. With water: brilliant—cakey, honeyed, and salty. Finish: long and tight, with a hint of varnish. The pears remain in the aftertaste, along with a return of tar. Comments: a delightful surprise. SGP:552 - 85 to 90 points.",,2025-01-12,https://www.whiskyfun.com/archivejanuary25-1-Longmorn-Linkwood.html,b6fc6a0244ee5102183e639d147caf0860e6320da34782ca2e841c4f6f3134d7
"Montebello 2019/2022 ‘Canne Rouge’ (52%, Barikenn, Guadeloupe, 551 bottles)","Montebello 2019/2022 ‘Canne Rouge’ (52%, Barikenn, Guadeloupe, 551 bottles) Colour: white. Nose: soft and fruity, with pears and plums, papayas and bananas, plus soft honey and fresh cane juice with a faint chalky touch. With water: cement, plaster, limestone, and rainwater. Mouth (neat): earthy, with fermented fruits and saline notes… With water: it’s the earthy side that truly stands out. Rather dry in profile, which is exactly what we like. A drop of mustard. Finish: long, mineral, and rich. Shares characteristics with a fine fino sherry from Jerez. Green pears. Comments: this little Montebello is a true champion swimmer. SGP:562 - 85 to 90 points.",,2025-01-12,https://www.whiskyfun.com/archivejanuary25-1-Longmorn-Linkwood.html,fbd73ace76b3c3a999841cac5416426c2d855b2f9fd5825736eee681a8decc00
"Bielle 2023 (58%, Swell de Spirits, Marie-Galante, On Tour Series, for Limoges Spirits Festival 2024, 250 bottles)","Bielle 2023 (58%, Swell de Spirits, Marie-Galante, On Tour Series, for Limoges Spirits Festival 2024, 250 bottles) We’ve got some lovely friends in Limoges. Colour: white. Nose: coconut, mercurochrome, and peach syrup. I’m sure water will work wonders. With water: the pears take control once again. Delicate touches of first rain, though it remains discreet. Mouth (neat): rich and oily, with lemon, pear, cane juice, and a hint of brine. With water: cane juice, agave juice, and pear juice—very gentle. Finish: of medium length, soft, and almost folded onto apples. Comments: these fresh Bielles strike me as surprisingly gentle, but this one is still vastly superior to the official ‘59’. SGP:551 - 80 to 85 points.",,2025-01-12,https://www.whiskyfun.com/archivejanuary25-1-Longmorn-Linkwood.html,5e1a6a525a29062ce5400699e345f3f94ebba258ce572726cc3e47935c2bc481
