whisky_name_raw,review_text,score,review_date,source_url,dedupe_hash
"Irish Single Malt Whisky 29 yo 1990/2019 (49.3%, The Whisky Blues, Irish, barrel, cask #593, 100 bottles)","Irish Single Malt Whisky 29 yo 1990/2019 (49.3%, The Whisky Blues, Irish, barrel, cask #593, 100 bottles) Most probably single malt from ‘the other country in ye north’. Indeed, B. Colour: gold. Nose: it’s a metallic and acidic cask, and the problem is that I love that. Especially when passion fruits and mangos would get unveiled, together with blood oranges and, in this very case, half a drop of raspberry vinegar. I’m dead serious! Mouth: you remember when dear Richard Paterson explains how to taste a whisky? Say hello, then aha, uh-oh, ha, yum, mmm… Indeed, this one’s extremely chewy, as tropical as these Bs could get, and just shock-full of passion fruits, grapefruits, mangos and pink bananas. And always this tiny-wee vinegary touch that works so well – I swear that’s raspberry! Finish: rather long, with just a touch of vanilla and a curious wee smokiness showing up. Perhaps some influence from a former content? Some mint too, by the way. Comments: fantastic. These casks will always remain very hard to beat, even when they’re not utter champions of complexity. SGP:651 - 90 points.",90,2020-04-24,https://www.whiskyfun.com/archiveapril20-2-Ben-Nevis-Macallan.html,33b35c462a9f52b6db22cfe2558c3a494573778466934566ad416d678b46eea7
"Ireland 15 yo 2002/2018 (51.2%, The Whisky Fair 2019, Irish, barrel)","Ireland 15 yo 2002/2018 (51.2%, The Whisky Fair 2019, Irish, barrel) Poor Whisky Fair Limburg that should have started right tomorrow (right, rather tonight)! But see you in 2021! Room is booked and Currywurst reserved, we’re already ready! Colour: as white as a German riesling. Ha-ha. Nose: this classic feeling of barley eau-de-vie with hints of bananas and whiffs of dill and aniseed (and fennel). Of course this is not a 1988-1992, but I find it fine and fresh this far. With water: indeed! Kiwi and rhubarb juices with a touch of vanilla and the smallest amount of grass. Like, one blade. Notes of proper poppy candy too, which I always found lovely even while I was growing (a little) older. Mouth (neat): ah, tropical fruits showing up, with some custard, sweet bread, and rather a pineapple-mango combo that would work very well. Touch of porridge. With water: frankly, water was unnecessary. Perhaps a little more lemon. Finish: medium, very fruity. A family pack of Haribo’s best, but without too much sugar. Comments: not one of those legendary vintages but we’re getting there. Excellent, even more so given the age and vintage. SGP:651 - 87 points.",87,2020-04-24,https://www.whiskyfun.com/archiveapril20-2-Ben-Nevis-Macallan.html,680c967ee9794c7b4b00046b7e14fcadd99b9e6281e4d51b0722eb92c03ad623
"A Drop of the Irish 8 yo (58%, Blackadder, single malt, Irish, cask #DI 2015-6, 366 bottles, 2016)","A Drop of the Irish 8 yo (58%, Blackadder, single malt, Irish, cask #DI 2015-6, 366 bottles, 2016) Colour: white wine. Nose: this is raw, eau-de-vie-ish, you could almost believe this is fine (as in brandy). I’m positive they’ve added some marc de gewurztraminer, and that is much less unpleasant than a Facebook quizz! With water: apple juice, pear juice… Mouth (neat): oh very good! Simple, young, a tad hipflasky (meaning not one to sip in your best armchair while watching Citizen Kane) and beautifully fruity. I would say cherries and plums, and perhaps melon. Not too sure about the last part, but there’s also a feeling of saccharose that should go away as soon as… With water: indeed, adios sugar welcome grass and earth, although this would remain a very fruity and easy whisky, and certainly not an austere grassy/earthy malt. Finish: medium, with a little hay, grass and peelings. With some flesh remaining! Comments: an excellent , very cool and pretty natural little drop from Van Morrison’s country – if I’m not mistaken. SGP:551 - 84 points.",84,2020-04-24,https://www.whiskyfun.com/archiveapril20-2-Ben-Nevis-Macallan.html,a4e3f2755197ce4fa6ce48b0b7327768597a09106136d162dfa3885e6693702d
"Benriach 9 yo 2010/2019 (62.4%, James Eadie, Paolo Cortado finish)","Benriach 9 yo 2010/2019 (62.4%, James Eadie, Paolo Cortado finish) You do remember what Palo Cortado is, don’t you! Indeed, it’s situated kind of between a fino and an oloroso. Excuse me? Indeed, not unlike an amontillado, but a palo cortado went further towards an oloroso. So it's more oxidative than an amontllado, if you will. They don’t make much palo cortado anyway, I’m even surprised they make some for seasoning ‘sherry casks’. Colour: gold. Nose: crikey, don’t they really know how to make these at James Eadie’s? Wonderful metallic, chalky, mustardy, walnutty style. There’s even what we always just adore, olives! Someone should try to distil olives one day. With water: gentle vanilla and brioche dough joining the dance. Mouth (neat): ueber-modern, hyper-extractive style, bursting with oak spices, bitterish herbs (thyme, rosemary, tarragon) and roasted nuts. With water: café latte, Thai soup, oude geneever (aged). Not sure the distillate has got anything to say in this context, and indeed this could be just any young Speysider including The Mac, but I like this rather brutal style that just would not bother with nuances. Finish: long. Spiced coffee, anyone? Comments: a crazy concoction for sure. I’m sure you could use it as an alternative to garam masala. SGP:372 - 82 points.",82,2020-04-23,https://www.whiskyfun.com/archiveapril20-2-Ben-Nevis-Macallan.html,c1d02f27ce11ad8078044c4a153ec002889ad08b7a655b431890211a499c0e74
"Benriach-Glenlivet 11 yo 2008/2020 (55.9%, Cadenhead, Sherry Cask, sherry hogshead, 270 bottles)","Benriach-Glenlivet 11 yo 2008/2020 (55.9%, Cadenhead, Sherry Cask, sherry hogshead, 270 bottles) I believe young Benriach needs some very active wood indeed. Colour: mahogany. Nose: there, tamarind jam, caramel, putty, a drop of paint thinner, certainly some marzipan, model glue, new sneakers, dried mushrooms, burnt sugar, new leatherette, coffee liqueur, tar, new Macintosh, new Renault, new Ford, new BMW (I think we got a good grasp of your general idea, S.) … What a joyous carnival of petroly aromas! With water: gets gentle as sheep, bizarrely. Twix and Golden Grahams. Mouth (neat): LOL, and I mean, really, LOL. Heavy varnish, heavy glue, plastics, tar, prune concentrate, plywood, molasses… Watch your tongue! With water: very good, gentler indeed, very cake-y, with touches of soy sauce in the back of the background. Finish: long and all on real chocolate. Comments: rather love this little monster of a sherry monster (de la muerte). Cellar it for… like 30 years, for post-Covid generations! It reminds me a bit of the early Glenfarclas 105s. Well done on all accounts Cadenhead, now we’re talking. But don’t forget to add water. SGP:571 - 88 points.",88,2020-04-23,https://www.whiskyfun.com/archiveapril20-2-Ben-Nevis-Macallan.html,cd58fc361d671dfc9ce099111f488d0c6722538656320e82e6ca967b46db42f6
"Dalmore 19 yo 1999 ‘Moscatel Cask Finish’ (54.9%, OB, Private Cask, cask #10)","Dalmore 19 yo 1999 ‘Moscatel Cask Finish’ (54.9%, OB, Private Cask, cask #10) In theory, this should be a little sweet. Colour: gold. Nose: we’ve always known that Dalmore knew how to make these, and that they wouldn’t leave anything to chance. Which means that there are no off notes, no excessive rubber, green pepper, old ginger or even sulphur whatsoever. I’m rather thinking a large warm mirabelle tarte, sprinkled with honey and maple sauce, the squeezed oranges blended with honey as well, and then sultanas treated just similarly. More globally, this is some liquid oriental pastry (baklava, kenafeh…) With water: lovely freshness. Honeysuckle and perhaps elderflowers! No we haven’t got anything against elderflowers. Mouth (neat): very good, sweet and rounded, much in line with the nose, a tad harsher of course, rather all on tarte tatin and baklava. In other words, caramel, orange blossom water, and honey. With water: smooth, soft, honeyed. Reminds me of those large greengage pies that my grandma used to bake. We want our greengages back! Finish: medium, soft, on ripe plums and more honeys. Apricot am too (yummy!) Comments: extremely seductive, very good, and pretty easy once you’ve added a drop of water. SGP:551 - 88 points.",88,2020-04-22,https://www.whiskyfun.com/archiveapril20-2-Ben-Nevis-Macallan.html,5ffe91c35dc12f523a59e32de3da326e164fe25d1104c8a0890b6f7494ac2dfa
"Dalmore 21 yo ‘Matusalem Oloroso Sherry’ (55.9%, OB, Private Cask, China)","Dalmore 21 yo ‘Matusalem Oloroso Sherry’ (55.9%, OB, Private Cask, China) It seems that this is not a finish, rather full maturation. Matusalem means Gonzalez Byass (of Tio Pepe fame), long time partners of The Dalmore and Whyte & Mackay in general. But careful, Matusalem is a ‘dulce’ oloroso, so rather some cream sherry blending palomino and PX. It is not exactly an oloroso, which ought to be dry if I’m not mistaken. Colour: gold. Nose: it is sweeter than your ‘average’ oloroso monster, and by the way, it’s not a monster. But indeed, it’s close to those lovely old VORS they have in Jerez, between old Corinth raisins and precious walnut cakes. You could almost describe it as ‘bodega-y’, with these whiffs of old wine cellar. I mean, a proper Jerezian winemaker’s (or breeder, a.k.a. almacenista), bodega. With water: pretty fantastic, despite the few struck matches that are prowling around this wee Dalmore. Mouth (neat): very good, pretty thick, rich, yet elegant, full of prunes, walnuts, blood oranges, dried figs, just a touch of gunpowder, liquorice… With water: perhaps a notch more gunpowder, and some grassier notes. Cooked asparagus, Brussels sprout… Finish: long, nutty, a tad tarry and smoky. That gunpowder. Comments: I was about to jump higher but the gunpowder ate a few points, so to speak. Remains top-notch, and what a nose! SGP:461 - 88 points.",88,2020-04-22,https://www.whiskyfun.com/archiveapril20-2-Ben-Nevis-Macallan.html,1c37accbe32b3b684bf6b9cf1e94f7c86aef6f157f85e7af870056f0ff7e551d
"Dalmore 24 yo 1995 ‘Madeira Wine Cask Finish’ (56.4%, OB, Private Cask, cask #29)","Dalmore 24 yo 1995 ‘Madeira Wine Cask Finish’ (56.4%, OB, Private Cask, cask #29) I seem to remember well, when Glenmorangie released their very first set of core-range finishings (not the first specials), I had thought the Madeira was the best. Colour: gold. Nose: it’s probably malmsey/malvasia, and yet I find this appropriately dry, mustardy, and full of walnuts in all their possible forms. And I really enjoy this leather, the tobacco, and these notes of real milk and mashed potatoes. Remember, 50% potatoes, 50% butter. With water: gets a tad bonbony, candied… Cranberry drops? No prob. Mouth (neat): mustard, radish, bananas flambéed, walnuts, tobacco, crème brulée, tarte tatin and raisin roll. In short, feels like home. With water: a little spicier. Cracked pepper, cloves… Finish: rather long, first on dried fruits, then on baking spices. Allspice. Or that mix that the Moroccans call ‘the lazy spouses’ spice mix’. Works with just anything… I suppose you could even enhance Jack! Comments: indeed my favourite, but that was a tight grouping. Probably more double-maturing than simple finishings! SGP:451 - 89 points.",89,2020-04-22,https://www.whiskyfun.com/archiveapril20-2-Ben-Nevis-Macallan.html,35a4a74990fb37381167bbff59e2103d94195773e8f5c03bac08e83f184e11a7
"Glenrothes 10 yo (40%, OB, +/-2019)","Glenrothes 10 yo (40%, OB, +/-2019) I believe this is the humblest newish OB from the ‘Soleo Collection’. What we call a drunken name, but there, that doesn’t matter, shouldn’t be bad at all, the 12 is very good I think (WF 85). Now they may have some sh***y NAS too, not too sure. Colour: pale gold. Nose: not that gentle, not that smooth and rounded, and even slightly earthy, with notes of toasted cake and English breakfast tea. A pleasant maltiness, some chocolate, Golden Grahams, pancake syrup… All that is very pleasant I have to say. Mouth: modern and good. Butterscotch, custard, Jaffa cake, cappuccino, latte (I’ll say it again, they make latte by adding $5 to regular coffee – ha) and a touch of oak (sawdust). Finish: a tad short but we’re cool. Malt, orange syrup, cake, chicory coffee. Only the aftertaste is a tad too much on sawdust and cardboard, but few people would last until the aftertaste without having poured another dram anyway. Comments: it really is a fine dram, no complains whatsoever, on the contrary. Just cut the finish. SGP:441 - 81 points.",81,2020-04-21,https://www.whiskyfun.com/archiveapril20-2-Ben-Nevis-Macallan.html,9b874027869394aa32c76acf6d55a10cfae00df0ba7f0bddc23f9e1ce27288a4
"Glenrothes 30 yo 1989/ (41.9%, The Single Malts of Scotland, cask #18177, 92 bottles)","Glenrothes 30 yo 1989/ (41.9%, The Single Malts of Scotland, cask #18177, 92 bottles) I’m always quite curious about the bottlings by these ladies and gentlemen, as I’m often finding some kind of statement behind each of them. Must be me, probably some kind of cognitive bias… Colour: gold. Nose: yeah forget. Jurançon moelleux, mango juice, orange blossom, all-flower honey from the Alpes, and fresh quince jelly. Quince jelly tears everything up anyway. In my book, in any case. Mouth: are we sure this is not from the 1970-1976 vintages? The lower strength and the herbal oak that was about to seize control are not obligatorily great news, but all the rest is perfect, honey, mead, halva, Sauternes, quinces indeed, apricots, mirabelles… So a Turner with a hole in a corner, that’s still a Turner, no? Finish: it didn’t even get too drying, but some varnishy touches come unexpected. Comments: on the edge. Great whisky with some flaws appearing, I would say. Shall we call this wee baby an imperilled masterpiece? SGP:651 - 84 points.",84,2020-04-21,https://www.whiskyfun.com/archiveapril20-2-Ben-Nevis-Macallan.html,5ccaeca77430f408c6866435d0b31c4f91473c79cdad941f5a2a5bc66aaa1201
"Glenrothes 11 yo 2007/2019 (51.4%, North Star spirits, for Ralfy, sherry butt, 618 bottles)","Glenrothes 11 yo 2007/2019 (51.4%, North Star spirits, for Ralfy, sherry butt, 618 bottles) This one celebrates Ralfy’s 10th anniversary. I mean, the 10th anniversary of his excellent vlog, which we keep encouraging and supporting unreservedly since its inception. Fresh, independent and pleasantly deviant voices are exactly what the whisky industry needs in my opinion, before it gets too dusty and lethally consanguineous. Now I agree, those tartan jackets… ;-). Colour: gold. Nose: cool soft honey and custard, butterscotch, Ovaltine, praline, plum cake, overripe apples, poached pears, tarte tatin, raisins, all that. With water: apple juice and cracked white pepper. Mouth (neat): extremely good, malty, jammy, on more butterscotch and shortbread, fudge, toffee, café latte, millionaire shortbread… With water: once again apples and all the kinds of cakes make thereof come to the front. Finish: medium, uncomplicated, very good, very malty. Comments: a winner at 11 years of age. You cannot make any more complex at 11 years of age. Kudos North Star and kudos Ralfy! SGP:551 - 85 points.",85,2020-04-21,https://www.whiskyfun.com/archiveapril20-2-Ben-Nevis-Macallan.html,0cc3b6576e2f8dc1a6a88eba58cec98875b9ff8cf14745693b68b09d67e6c3ff
"Glenrothes 22 yo 1997/2019 (59%, Liquid Treasures, 10th anniversary, rum barrel, 109 bottles)","Glenrothes 22 yo 1997/2019 (59%, Liquid Treasures, 10th anniversary, rum barrel, 109 bottles) Hold on, isn’t that poor Melania T. on the label? To think that she could have become a cell biology researcher and won a Nobel Prize! Colour: light gold. Nose: really all on custard, tarte tatin, brioche, Jaffa cake, madeleines and shortbread, and anything similar. With water: some fine fresh oak coming out. Fresh almonds too. Mouth (neat): liquid cake, really. I guess the rum feels a bit, rather with overripe bananas in this cake, I mean case, otherwise this is a rather gigantic liquid tarte tatin indeed. With water: calvados rather than rum, that’s funny. Finish: medium, okay, malty, on cakes and tartes. Especially tarte… right, tarte tatin. Comments: once again, no complains and no quibbles. Just not a dram that will bring back Janis and Billie Holliday. See what I mean? SGP:451 - 83 points.",83,2020-04-21,https://www.whiskyfun.com/archiveapril20-2-Ben-Nevis-Macallan.html,74e6746230014b30833724a55b2d0a69bd4d3d0785313b36d7f4cea81316e6b3
"Glenrothes 2007/2018 (53.4%, The Limburg Whisky Fair 2019, sherry wood)","Glenrothes 2007/2018 (53.4%, The Limburg Whisky Fair 2019, sherry wood) Question of the day, could Glenrothes be a slightly boring dram sometimes? Discuss… But anyway, dear dear Whisky Fair, stay strong, the ‘whisky community’, should that really exist, needs you more than any other whisky fair in the world! Colour: pale gold. Nose: this will be short and sweet. Shortbread, butterscotch, oatcakes, vanilla fudge, pancake syrup, and pear cake. With water: more pears. Mouth (neat): a liquid Mars bar. A deep-fried one, naturally. Also Williams pears and just malty beer. With water: so some deep-fried Williams pear in a thin layer of Belgian chocolate. Apologies. Finish: medium. Comments: good, but what’s on TV? SGP:541 - 80 points.",80,2020-04-21,https://www.whiskyfun.com/archiveapril20-2-Ben-Nevis-Macallan.html,9761d02aa0eb688460255502f102160c52cf6eb90e47426319cb09070ece87c1
"Glenrothes-Glenlivet 17 yo 2002/2019 (55.5%, Cadenhead, Small Batch, bourbon hogshead)","Glenrothes-Glenlivet 17 yo 2002/2019 (55.5%, Cadenhead, Small Batch, bourbon hogshead) This one from two hoggies. Not sure it’ll change the world, but let’s see… (with an open heart)… Colour: white wine. Nose: malt, grass, apple pie, porridge, banana bread. With water: not too sure. Green malt? Beer? Mouth (neat): sure, yes, notes of ale, slivovitz, pears again, malt, some pleasant earthy touches… With water: it’s good, it’s okay, it’s got notes of café latte, it’s got cakes and muffins… But I think I’m about to fall asleep… Finish: good. Comments: good. Now I’ve heard there’s another lost episode of Inspektor Derrick on Netflix, so if you would excuse me… SGP:441 - 81 points.",81,2020-04-21,https://www.whiskyfun.com/archiveapril20-2-Ben-Nevis-Macallan.html,4afa784986756c753a5487ce64f4c7777e5de3185b7ef5a6d83c8e81743f8787
"Glengoyne 'Cask Strength Batch 006' (59.8%, OB, 2018)","Glengoyne 'Cask Strength Batch 006' (59.8%, OB, 2018) We had No 5 and No 7, but indeed No 6 was missing. Time to remedy that unbearable situation. Colour: gold. Nose: I have the feeling that this one was a little fresher than the others, and rather more on apples (goldens) and oranges. Then indeed, a few juicy sultanas and something like a pecan pie. Very very pleasant so far. With water: some white chocolate, madeleines, and drops of almond milk. No quibbling. Mouth (neat): really good, powerful of course, but fresh, with no leathery sherryness in the way (I find many hastily seasoned sherry casks too leathery). Apples and oranges again, walnut cake, Golden Grahams and then even more orange. That’s very good. With water: notes of bonbons coming out, and the faintest touch of natural rubber. No problemo. Finish: medium, clean, on pastries and cakes, with just a touch of leather/rubber again in the aftertaste. Comments: some very fine whisky, well composed, very classic, I liked it a little better than both 5 and 7. SGP:541 - 85 points.",85,2020-04-20,https://www.whiskyfun.com/archiveapril20-2-Ben-Nevis-Macallan.html,bc05dfff74db133a398e8ab8188269dd0d300e95dc34e8a7cb09784941572a9d
"Glengoyne 21 yo (43%, OB, +/-2018)","Glengoyne 21 yo (43%, OB, +/-2018) I haven’t tried this expression since 2013. Should be good. Colour: deep gold. Nose: really a classic, extremely well balanced, perhaps a tad conservative but that’s rather an asset in this context. I absolutely adore these notes of stewed peaches and quinces, for example, as well as the Sauternes and the honey. Wonderful and rather the opposite of ‘modern’ whisky. Mouth: extremely good, but too easy to quaff down, really. Lovely caramel and fudge, honey, buttered popcorn, marmalade, maple syrup and just one or two roasted raisins. Finish: medium, perfectly clean, seductive, malty, and cake-y. Who does not like this doesn’t like malt whisky at all. Comments: rather impressed with this little baby. I don’t think all batches are this good, but there, it’s typically moreish! SGP:641 - 89 points.",89,2020-04-20,https://www.whiskyfun.com/archiveapril20-2-Ben-Nevis-Macallan.html,952781c194373cc04257e519b71f0e12a8327e055579ca65739ff21a6f56fce5
"Glengoyne 12 yo 2005/2019 (57.9%, Archives, cask #1938, 248 bottles)","Glengoyne 12 yo 2005/2019 (57.9%, Archives, cask #1938, 248 bottles) More fish! I’m thinking of our friends who do collect Archives’ whiskies, their shelves should look like… aquariums ;-). Nah, love Archives and it’s true that most European bottlers have been heavily influenced by Mr Mongiardino, of Moon Import fame. Colour: white wine. Nose: a box of Walker’s shortbread and a slice of apple tarte with a glass of orange juice on the side. That’s more or less it, but it was lovely. With water: a little grassier and more on fresh almonds and walnuts. Oh, and barley, and grist. Mouth (neat): just some perfect fresh malt whisky, rather on orange liqueur this time, with touches of earl grey. The usual butterscotch in the background. With water: it wouldn’t get any more complex, but it’s still clean and malty, with a little tobacco this time. Finish: long and very barley-y. Comments: perhaps is it a tad elementary, but it does deliver on all accounts. Very natural clan barley eau-de-vie. SGP:551 - 85 points.",85,2020-04-20,https://www.whiskyfun.com/archiveapril20-2-Ben-Nevis-Macallan.html,9144b3f77340996b0017d85e0af3d49bb5e7b25c8cac27ff07d2abdde7852215
"Glengoyne 28 yo 1988/2016 (51.1%, OB, for Taiwan, European oak sherry cask, cask #835, 574 bottles)","Glengoyne 28 yo 1988/2016 (51.1%, OB, for Taiwan, European oak sherry cask, cask #835, 574 bottles) Colour: cognac. Nose: this one’s much jammier. Think apricot jam, maple syrup, pancake syrup, raisins, drops of muscat, perhaps some PX… Was it PX indeed? With water: more cakes, perhaps. Biscuits and a wee glass of sweeter ale, or perhaps stout. Heavily caramelised Brit beer. Mouth (neat): rather rich, a tad on the oaky side perhaps, that is to say spicier than usual, but that may be that European oak. Raisins plus caraway and cracked pepper. With water: coffee dregs and bitter dark chocolate. No sweetness left, it became totally dry! What’s this sorcery? Finish: medium, a tad cognacqy and with touches of mangos when neat, drier and more drying when diluted. Espresso. Comments: very good, naturally, but it’s been hesitating and searching itself all along the tasting. SGP:461 - 84 points.",84,2020-04-20,https://www.whiskyfun.com/archiveapril20-2-Ben-Nevis-Macallan.html,31046fe3a05eaf550aa3e94a1894ef5cce4cf2b0146e73eedb9b1ffc5777a614
"Glengoyne 30 yo 1986/2017 (54.4%, OB, for Taiwan, cask #1652, 505 bottles)","Glengoyne 30 yo 1986/2017 (54.4%, OB, for Taiwan, cask #1652, 505 bottles) No picture for this one, I’m afraid. And the colour’s suspiciously pale given its age, but let’s see… Colour: white wine. Nose: ooh, rhubarb, kiwi, gooseberries, grapefruits, chalk and just the wee-est whiff of cat piss. Did someone distil some sauvignon blanc and matured it in an amphora? With water: wonderfully clean and zesty. Just a touch of oak. Mouth (neat): same feeling of sauvignon blanc, grapefruits, stems, geranium, flints, and a little custard… This is perfect. With water: amazing freshness and a perfect maturity. The wonders of 30 years of aging in a self-restrained container. Incredible elegance. Finish: so good, so good! Comments: a perfect example of a pretty old malt whisky that’s aged with grace and refinement. Very, very impressive, now to find a bottle… SGP:651 - 91 points.",91,2020-04-20,https://www.whiskyfun.com/archiveapril20-2-Ben-Nevis-Macallan.html,3eff7c859bef6fd15de03d6641fb750a00814c32d5d694f1301bc72c46e70a76
"Loustau ‘Solera Gran Reserva Finest Selection’ (40%, OB, brandy de Jerez, +/-2019)","Loustau ‘Solera Gran Reserva Finest Selection’ (40%, OB, brandy de Jerez, +/-2019) This one’s a 15 yo and it was aged in very old ex-oloroso and ex-PX solera casks. At Loustau they also have a younger ‘Gran Reserva’ that’s rather 10 yo. Colour: coffee with reddish hues. Lovely colour, I suppose it’s natural here. Nose: and indeed it noses of coffee as well, prunes and raisins, coffee liqueur, walnut wine, a touch of oak but not that much, some dry oloroso indeed… That’s the main difference between these Jerezian brandies and cognac or Armagnac, they’re using sherry casks while French brandy would rather use new or ‘self’ casks. Hoep the palate is not sweet despite the PX… Mouth: well, it is a tad sweet and indeed PX-y, but it doesn’t quite have this sugary side that other brandies of Jerez do showcase. Really a lot of raisins, chocolate and coffee, with a touch of earth in the background. Pretty simple, yet good spirit. Finish: medium, oakier. Spent coffee beans, raisins, burnt caramel and molasses. Comments: still not a huge fan of these sweet brandies, but I would say this is rather among the top of the heap. SGP:730 - 79 points.",79,2020-04-19,https://www.whiskyfun.com/archiveapril20-2-Ben-Nevis-Macallan.html,e92c60908ab08ed5768e54bdd3670946e317923fb3f68d96fd59616f184fe71f
