whisky_name_raw,review_text,score,review_date,source_url,dedupe_hash
"Caol Ila 2004/2016 (46%, Gordon & MacPhail, Connoisseurs Choice)","Caol Ila 2004/2016 (46%, Gordon & MacPhail, Connoisseurs Choice) These ones are usually ex-refill bourbon barrels, but I haven’t got this one’s back label. Let’s assume it is. Colour: white wine. Nose: well in their style and genre. Some smoky buttered dry apple juice and growing hints of fresh mint, dill, and lemongrass. Some liquorice wood too, maybe more than in earlier bottlings. Very nice nose. Mouth: it is the softer side of Caol Ila, to the point where I’m wondering if it’s not a blend of ‘Highland’ Caol Ila and ‘Islay’ Caol Ila. So unpeated and peated. It’s also very citrusy (pink grapefruits) and tends to become appropriately salty. Finish: medium length, and it’s rather fruity and sweet. That’s smoked sweets, in fact. Comments: always very good, easy yet not too easy… SGP:545 - 84 points.",84,2017-03-02,https://www.whiskyfun.com/archivemarch17-1-Caol-Ila-Glenrothes-Amrut.html,b34552daac2b870baf26f4c285311877f679c058f7afb47948234960dcbd787f
"Caol Ila 7 yo 2009/2016 (46%, Càrn Mor, Exclusive to The Whisky Exchange, hogshead, 850 bottles)","Caol Ila 7 yo 2009/2016 (46%, Càrn Mor, Exclusive to The Whisky Exchange, hogshead, 850 bottles) A vatting of two very young casks, this is almost bottled barley, yeast, and water. But if the distillate’s pristine, that could work, let’s see… Colour: pale white wine. Nose: smoked Red Bull and plasticine with a little citron and cranberry thrown in. A little teak oil too. Mouth: good. Lemon zests and sweets, a drop of seawater, some sweet barley, some pear liqueur, and a feeling of charcoal. Elementary just like several others, but balance sits there and there are no off-notes. Finish: medium, rather lemony/fizzy. A wee feeling of Spritz. Comments: after all, we must make way for young whiskies. SGP:545 - 84 points.",84,2017-03-02,https://www.whiskyfun.com/archivemarch17-1-Caol-Ila-Glenrothes-Amrut.html,ca677b9566be371c6dc137783aa557f0fb3e364647fd603d233782b6ae08a268
"Caol Ila 5 yo 2010/2016 (46%, Douglas Laing, Provenance, cask #11321, 476 bottles)","Caol Ila 5 yo 2010/2016 (46%, Douglas Laing, Provenance, cask #11321, 476 bottles) I’m sure we’ll soon see bottled new make again (B.P.S.) Colour: very pale white wine. Nose: well in the style of the Carn Mor, only with rather more plasticine, tung oil, and perhaps more mashed vegetables. Perhaps not totally some whisky to nose? Mouth: lemon and lime playing first fiddles, and plasticine on the double bass. Sweets and jellies, marshmallows, chewing-gums… It really feels very young, but since the spirit is clean and fresh, all this works, even if it is rather eau-de-vie-ish. Finish: medium, fruity. More lemon sweets. A little chlorine in the aftertaste? Comments: bizarrely, I do not get a lot of smokiness from this fine youngster. SGP:534 - 83 points.",83,2017-03-02,https://www.whiskyfun.com/archivemarch17-1-Caol-Ila-Glenrothes-Amrut.html,9fecae8c96b8c3b321b329e8b1878a66551be642f496d52c1dba3e1f7bf1df11
"Caol Ila 2006/2016 (52.2%, Whisky-Doris, bourbon hogshead, cask #303049, 310 bottles)","Caol Ila 2006/2016 (52.2%, Whisky-Doris, bourbon hogshead, cask #303049, 310 bottles) More years, and perhaps a higher complexity. Colour: very pale white wine. Nose: indeed, more signs of maturity. Linseed oils and several other oils, kiln, yellow peaches, damp earth, clay, liquorice and gentian roots… This is all we like at WF Towers! With water: your old tweed jacket after a long walk in Islay’s rain. Right, a walk on Islay. Mouth (neat): excellent, crystalline, slightly Fanta-ish, faintly peppery, smoky, brine-y, and even a wee tad mustardy. With water: perfect. Tangerines and mangos coming out! Finish: medium, sitting exactly where fruits, seawater, and peat smoke meet. Comments: it seems that generally speaking Ten is a minimum. No ten, no deal. SGP:546 - 87 points.",87,2017-03-02,https://www.whiskyfun.com/archivemarch17-1-Caol-Ila-Glenrothes-Amrut.html,639661815129dff8337f080ef06cbc3c485f58663080a46e1198f9e12d6c9aa7
"Caol Ila 2002/2014 ‘Distillers Edition’ (43%, OB, C-si; 1-474)","Caol Ila 2002/2014 ‘Distillers Edition’ (43%, OB, C-si; 1-474) Moscatel, baby. There are some total disasters and there are some fairly good ones. Ask our grandmas… Colour: gold. Nose: that’s what’s nice with these CIs DE, the moscatel doesn’t feel much, and in this particular case, it feels even less than in the earlier versions. Couldn’t they just drop the finishing and still call it ‘moscatel’? I’m sure no one would complain. In short, a nice fresh and clean Caol Ila, properly coastal and smoky, with whiffs of oysters and kippers. Mouth: okay, it is a little rounder than the average CI, and there is a very little winey sourness in the back, but other than that, it’s good Caol Ila, with grapefruits and salty smoky fish and seashells. It’s just a little less ashy than usual. Finish: same. Medium length. Some brine, some iodine, a touch of butterscotch. Comments: this one’s getting better IMHO, going from ‘why?’ to ‘ah!’ over the years. SGP:444 - 83 points.",83,2017-03-01,https://www.whiskyfun.com/archivemarch17-1-Caol-Ila-Glenrothes-Amrut.html,4b1652cb2f8c8d6cb3c7304d3a35251faadb3aac6b84367dfaffa63a6224bb16
"Caol Ila 8 yo 2007/2016 (46%, Signatory Vintage, Un-Chillfiltered Collection, bourbon barrels, casks #315329-315330)","Caol Ila 8 yo 2007/2016 (46%, Signatory Vintage, Un-Chillfiltered Collection, bourbon barrels, casks #315329-315330) Colour: white wine. Nose: light mezcal from Islay. Elementary smoked malt, with golden delicious apples, some burning charcoal, some tincture of iodine, and some seawater. Totally uncomplicated but perfectly classy and even distinguished. Mouth: that’s the problem with these wee whiskies, you could down litres and litres of them. Smoked salmon, lemon, perhaps a little plasticine (not that nice here), artichokes, and a briny smokiness. Burnt gherkins, perhaps? Finish: medium, saltier. Always this faint ‘burnt’ note in the background. Some lemon as usual. Comments: goodly good young CI. SGP:355 - 84 points.",84,2017-03-01,https://www.whiskyfun.com/archivemarch17-1-Caol-Ila-Glenrothes-Amrut.html,d732b4315fa1f9899fc69cf17aaf8e913d0483a47f136d4434b8a252bb317b0a
"Caol Ila 8 yo 2007/2016 (53.4%, The Whisky Agency and The Speakeasy, refill hogshead, cask #1, 292 bottles)","Caol Ila 8 yo 2007/2016 (53.4%, The Whisky Agency and The Speakeasy, refill hogshead, cask #1, 292 bottles) A wee bottling for Switzerland, where indeed, many things are happening behind the curtains. Colour: pale white wine. Nose: this is getting newmake-y if you ask me. Tincture of iodine, apple eau-de-vie, smoked fish, and basta cosi. With water: smoked seawater. Mouth (neat): lemons, pears, grapefruits, almond oil, and smoked salmon. Have I already used the word elementary? With water: tequila? I’m not joking. Finish: medium, ashy. Comments: we’re going towards unaged spirits. Its good spirit, good Caol Ila, good Islay whisky, it’s just lacking soul and complexity. Some blaséed tasters may consider it’s a little too young. Some others will shamelessly call it a near-infanticide. SGP:445 - 80 points.",80,2017-03-01,https://www.whiskyfun.com/archivemarch17-1-Caol-Ila-Glenrothes-Amrut.html,0a93129d3adce37513affdab0fbb00acb4ae22b159a1a3a99f3ee0b6442f7cf7
"Caol Ila 5 yo 2008/2016 (61.5%, La Maison du Whisky, Artist #6, bourbon, cask #311913)","Caol Ila 5 yo 2008/2016 (61.5%, La Maison du Whisky, Artist #6, bourbon, cask #311913) Once again, the age is just a number here. As long as it’s younger than the actual age, that’s legal, isn’t it! Crazy French… Colour: pale white wine. Nose: another one that feels extremely young, but what saves it is the fact that it’s very olive-y and gherkiny, if I may. Almond oil, brine, sour apple juice, whelks (why whelks, S.?) With water: a large cardboard box full of unused bicycle inner tubes. Mouth (neat): hot and limy. Sounds like a disco song circa 1976, doesn’t it? Burns your throat, actually. With water: we tamed it, congrats! Ashy lemons and smoked shellfish. Finish: long and smoky/rubbery. Comments: a very dry smoky youngster. It’s good and even spectacular as an example of a strongly smoked whisky, so a quasi-Octomore if you will, but I feel we’re almost off-limits as far as maturity is concerned. SGP:266 - 81 points.",81,2017-03-01,https://www.whiskyfun.com/archivemarch17-1-Caol-Ila-Glenrothes-Amrut.html,9fbb3a26ff19e9ef73048062d3cee569e7b64da0fbe326096e496196db798df8
"Bowmore 17 yo 1998/2015 (48.4%, Douglas Laing, Old Particular, refill hogshead, cask #DL11007, 333 bottles)","Bowmore 17 yo 1998/2015 (48.4%, Douglas Laing, Old Particular, refill hogshead, cask #DL11007, 333 bottles) We’ve already tried quite a few very excellent late 1990s Bowies! Colour: straw. Nose: let’s keep this short, this is perfect. Mud, roots, seaweed, bandages, kippers, green olives, beach fire. Indeed, perfect. Mouth: really very perfect. Perhaps less crystal-clear than earlier vintages (say 1992-1995) but it’s immediately very satisfying. Seawater, lemon juice, olive oil, and smoked fish. Finish: long, zesty, clean, pure. Some smoked blend of lemon juice and olive oil. Nice waxy touches in the aftertaste, some green pepper too. Comments: anyone not liking this has got a problem. SGP:357 - 89 points.",89,2017-03-31,https://www.whiskyfun.com/archivemarch17-2-Glenfiddich-Ardbeg-Macallan.html,239de9850804289780e22412c788455180004a9880a0ecab978f843ec7056bcf
"Bowmore 17 yo 1998/2016 (57.4%, Scotch Malt Whisky Society, refill barrel, #3.276, ‘Oysters in a thyme mignonette’, 114 bottles)","Bowmore 17 yo 1998/2016 (57.4%, Scotch Malt Whisky Society, refill barrel, #3.276, ‘Oysters in a thyme mignonette’, 114 bottles) A refill barrel and an excellent vintage, seriously, what could go wrong? Now it seems that they’ve smoked the carpet again at the honourable SMWS before they tried to find a name for this… Colour: straw. Nose: ah, Bowmore’s tropical fruits now. Passion fruits, mangos, all that. It’s not that they’re as big as in the 1960s Bowmores, but they’re there. Other than that, you know the song, kippers, seaweed, kilny smells… With water: and blood oranges! Mouth (neat): indeed, it’s more tropical, and more citrusy than its bro. Smoked pink grapefruits? Bananas? Long story short, it’s a perfect, trans-era Bowmore. With water: very very very good, salty/smoky all-vitamin fruit juice. Finish: long, and particularly accurate. Yeah, whatever that means. Comments: one more point for the tropical fruits. Ain’t that fair? SGP:557 - 90 points.",90,2017-03-31,https://www.whiskyfun.com/archivemarch17-2-Glenfiddich-Ardbeg-Macallan.html,99cb5d1b1b3bbfb61a4d9aef528b43258da14f2aaeed8a186b0c77fbe3684a1b
"Port Ellen 32 yo 1983/2016 (54%, The Auld Alliance, Singapore, cask #001/508, 120 bottles)","Port Ellen 32 yo 1983/2016 (54%, The Auld Alliance, Singapore, cask #001/508, 120 bottles) Colour: white wine. Hurray, refill wood! Nose: as fresh and vibrant as an old Islay can be, and once again this demonstrates that tired oak, provided you give it a lot of time, will give you back the smartest, cleanest, and most faithful old malt whiskies. Superb hessian, iodine, brine, oysters, kelp and fresh mint, plus lime and lemon, without any fattish or buttery notes. Some shoe polish instead, and perhaps a little anti-rust paint or something, as well as very wee hints of Thai basil, coriander, or fennel. One of the brightest old Port Ellens, in the style of those older Old Bothwells. With water: huge saponification, let’s wait… zzz… zzz… good, it got much gentler, almost floral, with some orange blossom water and a very gentle vanilla mingled with seawater and almond oil. Somethingb that could happen with old Caol Ila (pre-extension). Mouth (neat): a massive amount of grapefruits and lemons, with a pinch of salt. Smoked water, oysters, capers, samphires… This is almost a deluxe margarita. With water (although it doesn’t need water): gets very salty! Olive brine… Finish: long, very clean, superbly coastal. Smoked brine. Ashy aftertaste. Comments: I just knew this was going to be great. Now let’s keep a bottle for thirty more years, and see you here in 2047. SGP:367 - 92 points.",92,2017-03-30,https://www.whiskyfun.com/archivemarch17-2-Glenfiddich-Ardbeg-Macallan.html,63997829bd4e993c29ade19401ce4ab224e347ed818d9fe08c71337cd2d15dc6
"Port Ellen 23 yo 1983/2006 (54.1%, The Way of Spirits)","Port Ellen 23 yo 1983/2006 (54.1%, The Way of Spirits) A fairly obscure bottling by Waddell Hepburn in Glasgow, a name that seems to have been related to Douglas Laing, according to the shape of the bottles. Colour: white wine. Nose: a notch more ‘brutal’ than the Singaporean, with more fresh paint, tar, coal smoke… I’m also finding some green pepper, Barbour grease, some brine again… This one’s perhaps more ‘traditionally PE’. With water: ah, wet dogs! (we’re eternally sorry, dogs) and yet again, that old tweed jacket that we’re left under the rain for hours. Quite a lot of plasticine too. Mouth (neat): salt and lemon, with some paint, paraffin, and pepper. Very straightforward and once again, perhaps a tad brutal. With water: more citrus, but not quite more complexity, I wouldn’t say it’s totally got the zing of the Auld Alliance. Now of course, it’s very good whisky. Finish: long, sharpish, lemony, salty and ashy. It’s almost as if it could have been twelve years old. Comments: it’s Port Ellen, you understand! Maybe just not one of the very best there is. SGP:367 - 88 points.",88,2017-03-30,https://www.whiskyfun.com/archivemarch17-2-Glenfiddich-Ardbeg-Macallan.html,b232ed868fad4cd2ac83fbeee3377dd2319500b8bccf677cccd888e4399da089
"Glenfiddich ‘Vintage Cask’ (40% OB, +/-2016)","Glenfiddich ‘Vintage Cask’ (40% OB, +/-2016) Some kind of slightly misleading double entendre here, it’s called vintage but there’s no vintage, so that’s rather vintage as in vintage, I suppose. Oh well I know what I’ trying to say. And there’s no age either, but apparently, there should be some peat, let’s see. Colour: gold. Nose: plain and pure fresh apple juice, seriously. Then indeed, touches of peat smoke and more fresh barley. Rather more vigorous than other Glenfiddichs, but perhaps less peaty than that Caoran that they used to have around ten years ago. I rather enjoy this nose. Mouth: it’s interesting and it’s good, and certainly peatier than expected. It’s kind of Talisker-peated, if you will. A wee saltiness, some green pepper, then more cider apples. Rather firm for Glenfiddich, and to tell you the truth, I’d have never recognised the distillery. Only the middle is a tad weak, and that’s the low strength. Finish: picks up again for a little while, on a greenish smokiness. Comments: why this instead of some proper peaters remains to be debated as an aficionado’s POV, but this baby’s perfectly quaffable, although I liked last year’s Project XX a little better. SGP:464 - 81 points.",81,2017-03-29,https://www.whiskyfun.com/archivemarch17-2-Glenfiddich-Ardbeg-Macallan.html,e9cb539c9928163dbceb27ce9f997d7cfe6577b7fca3211157f86e94830184f0
"Glenfiddich 21 yo (43%, Wedgwood Decanter, 1987)","Glenfiddich 21 yo (43%, Wedgwood Decanter, 1987) This famous decanter was issued in 1987 to celebrate the distillery’s centenary. It’s still relatively easy to find since collectors do not quite trust stone or china decanters because of possible evaporation (and perhaps because grandmas don’t drink much whisky). If you ever buy one of those, always ask for its weight! Colour: pale gold. Nose: a rather leathery and tobacco-like profile, fatter and drier than the Vintage’s, then some fruitier notes, between Jell-O, sweets, and sweet cider. Also tinned peaches, perhaps. Mouth: some ODE for sure (Old Decanter Effect ;-)) and some smoke for sure, with a much fatter mouth feel than that of the Vintage, loads of green tea, and some earthy bitterness. It’s firm and almost big malt whisky, tenser than any current Glenfiddich, but it’s true that this is mid-1960s distillation, partly using, perhaps, some barley malted at Balvenie. Finish: rather long, a little creamier and certainly very ‘sweet-malty’. Hints of lemon and fresh rhubarb in the aftertaste. Comments: a decanter that kept well! SGP:551 - 84 points.",84,2017-03-29,https://www.whiskyfun.com/archivemarch17-2-Glenfiddich-Ardbeg-Macallan.html,e17dab6cadacd6eaf398473faf2feb0a8df9217a617136ee089c829a65685ced
"Ardbeg 22 yo 1965/1987 (46%, Cadenhead, sherry wood)","Ardbeg 22 yo 1965/1987 (46%, Cadenhead, sherry wood) We’ve tried quite a few 1965s already, and many have been excellent (not quite the OB with white gloves, having said that), but the early-to-mid 1970s were even better. Colour: office coffee. Nose: it’s true that it delivers. Amazing. A bag of old copper coins, an old toolbox, the engine of an E-type (the straight 6, of course), some cooked white wine, a box of Cuban cigars, some kind of liquoricy fudge, an old stereo set, and today’s Le Monde (or any other proper newspapers). I mean, fresh ink and paper. Flabbergasting nose. Mouth: sweet Vishnu! It hasn’t lost one tooth, and hits you right between your ears at first sip, with an earthy/roasted sweet style and more ashes than in an early steamboat. Jaffa cakes dipped into smoked tea, smoked cloves (can you do that?) and some kind of lemony cigars. What’s even more amazing is that there’s always some kind of freshness over everything, around lemon juice, which prevents it from becoming a tad cloying or tiring. This was whisky art. Finish: long, and yet fresh and even ‘lifting’. Smoked tangerines, perhaps. Oh and one oyster, forgot to mention our beloved oysters. And menthol, as usual. Comments: one of my favourite 1965s, I think. I know they would jail you if you use the word ‘seminal’, but I think it will, it’s seminal Islay. Up there with the best. SGP:365 - 95 points.",95,2017-03-28,https://www.whiskyfun.com/archivemarch17-2-Glenfiddich-Ardbeg-Macallan.html,49e4b87419fb1c104e137909cabf0344104fb1ff9d6f72377541aa446fda3235
"Ardbeg ‘Kelpie’ (51.7%, OB, Committee Release, 2017)","Ardbeg ‘Kelpie’ (51.7%, OB, Committee Release, 2017) As usual, this baby Ardbeg comes with some kind of ‘Celtic legend’, as well as some unlikely wood, in this case some new oak from around the Black Sea. Isn’t it funny that you’d need so many funny stories when you cannot or do not want to disclose the age of your whisky? Is it that young? Colour: straw. Nose: as simple as 1+1, almost elementary, and yet immediately appealing. I’m finding it very pure, very obvious in the best way, with a little lemon and custard, and then an ashy/coastal smokiness mixed with raw malt and, indeed, some kelp. A thin nose, yet a great nose. With water: fresh bread and a gingery smoke. Mouth (neat): very different, there’s perhaps a little too much spicy oak for me in the arrival. A little too much caraway, nutmeg, ginger, and cloves for Ardbeg, at times it feels like some two-year-old American craft whiskey, really. Not that it’s bad, quite the opposite, it’s just kind of lost lost a wee chunk of the brand’s DNA, as they say in London. With water: rather better, water brings out more Ardbegness. Finish: better, fresher, lemony, smoky, rather gentle. Very nice spicy grapefruits in the aftertaste, as well as more spicy tannins again. Comments: very good but feels a little young and a wee bit doctored on the palate. The nose was really very nice, especially when unreduced, though. SGP:476 - 86 points.",86,2017-03-28,https://www.whiskyfun.com/archivemarch17-2-Glenfiddich-Ardbeg-Macallan.html,89f40898c11bb7e058b4e43db850693138a638a6cc124cb0726b30936fc84458
"Ardbeg 24 yo 1965/1990 (54.4%, Cadenhead, black dumpy, 75cl)","Ardbeg 24 yo 1965/1990 (54.4%, Cadenhead, black dumpy, 75cl) There was also a version for Sestante, with a cream label, and one for ‘Andy and Norman’, probably all the same juice. Granted, it’s not the first time we’re trying this baby, but it’s from yet another bottle and how could you resist? Colour: the whitest white wine. Nose: barbecued sardines! Yes I’ve checked what the neighbours were doing, they are NOT barbecuing sardines. And old turpentine, old embrocations, engine oil, Le Mans, Bakelite, bits and pieces of various metals, some rusted, grapefruits, old forgotten lemon liqueur that your grandma brought back from Italy around 1960, smoked salmon… Well you see what I mean. No water needed, for once. Mouth: brutal. A fire in a lemon plantation, burning tyres, seawater. Bwilliant. With water: oily, engine-y, lemony, salty, ashy. Everything is in place. Finish: sadly. Extremely pure. Comments: essential. I used to be at 94, but I think that was cheap and stingy. Booh! SGP:457 - 95 points.",95,2017-03-28,https://www.whiskyfun.com/archivemarch17-2-Glenfiddich-Ardbeg-Macallan.html,5354cc8f4631a068cea35db3560a8eaffa03b912669754633067324f76603338
"Macallan 40 yo 1949/1990 (37.9%, Signatory Vintage, casks #852+855, 280 bottles)","Macallan 40 yo 1949/1990 (37.9%, Signatory Vintage, casks #852+855, 280 bottles) A rare old under proof bottling, one of the very first ones by Signatory – we’ll soon taste their very first bottling, a Glenlivet 1968. This Macallan is not, by today’s standards, Scotch Whisky anymore, can you guess why? (apologies). Colour: gold. Nose: sublime! Somewhere between some very old Sauternes and old Alsatian Gewurz, with ripe apricots, dandelions, rose petals, honeysuckle, mead, leatherwood honey (just got some fantastic Tasmanian leatherwood honey from a friend, it’s amazing), crushed avocado, almond oil… What a great complexity! The oak doesn’t quite feel as such, that would rather be herbal teas… Mouth: the most fantastic tea ever. It’s so complex, you do not even need more power and strength. Various tobaccos and herbal teas, touches of caraway, earl grey, sandalwood, a little cinnamon, Turkish pastry, various honeys again, a wee bit of leather… Now it sure doesn’t kick you in your teeth, but it never gets flat. Finish: sure it’s a little short, and perhaps a tad dry/oaky. Chlorophyll, tealeaves and a wee touch of soap in the aftertaste. Comments: the nose is pure poetry, while the palate is way above average. Great old wine territory. SGP:351 - 89 points.",89,2017-03-27,https://www.whiskyfun.com/archivemarch17-2-Glenfiddich-Ardbeg-Macallan.html,25e89e5c521560f7e0f02a3a2cdc1b4b6a860ff4a3026624991eb731ca7716ec
"Pride of Strathspey 50 yo 1937/1987 (40%, Gordon & MacPhail, Book of Kells, single malt, decanter, 75cl)","Pride of Strathspey 50 yo 1937/1987 (40%, Gordon & MacPhail, Book of Kells, single malt, decanter, 75cl) I believe this was not, contrarily to what many websites wrote, blended malt. And as the MI5 would say, it cannot not be Macallan. How many glories have we already tasted that were coming from this legendary Book of Kells series? Colour: gold. Nose: please have a seat. Precious golden raisins, many honeys, and the most astounding flowery and mentholy development I’ve experienced in recent months. Vanilla pod, orange blossom, pollen, the smallest bit of camphor cream, fresh grape juice (mosto? Paxarette?), dandelions again… This nose is as sublime as the 1949’s. Mouth: some great old cognac, really. Ripe peaches and apples, raisins, some prunes, dried pears, strawberry juice, mead, orange liqueur… And not one ounce of distinguishable oakiness, mind you. As if the spirit had digested it, as we say in the wine world. Finish: medium and amazing, more herbs-forward. Verbena, mint… Comments: I don’t think all Pride of Strathspey have been fabulous, but this one was, for sure. SGP:551 - 93 points.",93,2017-03-27,https://www.whiskyfun.com/archivemarch17-2-Glenfiddich-Ardbeg-Macallan.html,ba7f781a0e25b77eec5946e6d5c389b8adb0b405aed7ffa81dca0c248b5ccdbe
"Macallan 25 yo 1965/1990 ‘Anniversary Malt’ (43%, OB, Giovinetti, 75 cl)","Macallan 25 yo 1965/1990 ‘Anniversary Malt’ (43%, OB, Giovinetti, 75 cl) We’ve had the 25/1965 in a decanter christened ‘M’ (already!) a while back and had just loved it (WF 93) but I’m not sure it’s the same juice. I’d add that I had found the 1967 in this very series a little disappointing (WF 87). So, there is some suspense… Colour: gold. Nose: same territories as the ‘Pride’, only rather rounder, more candied, and with more dried fruits, including bananas, pears, raisins… Cigars are obvious too in this ‘buy-this-or-buy-a-small-car’ whisky. Rhubarb tarte, with meringue on top of it, and much less sherry than you would think. A wee whiff of wood smoke. Mouth: really similar to the 1937, which rather comes as a surprise. Once again we’re a little in cognac territories (did Michael Jackson ever write about cognac? I cannot remember…) with ripe fresh fruits everywhere, juicy raisins, overripe apples, oranges, and then more and more tropical fruits, rather around ripe bananas. It’s the freshness that’s impressive here, first and foremost, as well as the way it tends to turn more herbal and dry, in a magnificent way. Teas and tobaccos. Finish: medium, on some kind of spicy marmalade, with a stunning freshness. Comments: a grand cru of Scotch whisky, with this amazing complexity that’s not often to be seen in contemporary bottlings anymore. SGP:651 - 94 points.",94,2017-03-27,https://www.whiskyfun.com/archivemarch17-2-Glenfiddich-Ardbeg-Macallan.html,dbff959443f3f6712c775ee1b7ee24df1b1f276dbf81cc8bb43aa0aa4255a11f
