whisky_name_raw,review_text,score,review_date,source_url,dedupe_hash
"Teeling 27 yo 1991/2019 (44.1%, OB for The Whisky Exchange, Ireland, rum cask, cask #10678, 160 bottles)","Teeling 27 yo 1991/2019 (44.1%, OB for The Whisky Exchange, Ireland, rum cask, cask #10678, 160 bottles) In theory, and just between us, this should stem from those casks that Diageo had sold before they got rid of the distillery. We’re talking about Bushmills, but indeed, pure speculations… Colour: gold. Nose: bananas mangos maracujas guavas oranges tangerines prickly pears. Long story short, vitamins. Mouth: incredible. bananas mangos maracujas guavas oranges tangerines prickly pears. Long story short, vitamins. Finish: medium, a tad more citrusy. Comments: bombastic fruitiness. Why the owners, be them Pernod Ricard or later Diageo, never released such single casks while they were at the helm remains one of whisky’s most mysterious, err, mysteries. SGP:741 - 92 points.",92,2020-04-03,https://www.whiskyfun.com/archiveapril20-1-Chichibu-Lagavulin.html,a87ddb03145dbd15fe6dd9032b1a38ef92516b1d259433e2711bd6773b3b6059
"English Whisky Company 11 yo 2007/2019 (49.8%, North Star Spirits, UK, Burgundy red wine, 330 bottles)","English Whisky Company 11 yo 2007/2019 (49.8%, North Star Spirits, UK, Burgundy red wine, 330 bottles) Fear not! Colour: apricot. Nose: reminds me of Signatory Vintage’s first Port Ellen finished in pinot noir. Or was it Pomerol? Used matches, gunpowder, truffles and gas, then cassis leaves and buds. Not the easiest nose ever, that’s for sure. Mouth: some fun to be had here. Manure, cabbage, cork, cherry stem tea, black olives (really), leek, salsify… What a strange juice, really. Finish: long, bitter, dry, on more black olives, tapenade, Jägermeister, lapsang souchong… Comments: some crazy mutant juice produced in England. I’m sure you could make a fantastic spritz out of it, but just don’t use Krug. English bubbly would work well, I’m sure. Peace… SGP: 374- 72 points.",72,2020-04-03,https://www.whiskyfun.com/archiveapril20-1-Chichibu-Lagavulin.html,a8ea67adab0ec09ea63674e1c2425ae2a7af9df5f1efd8a3c51a8440d3aafee8
"Kavalan 2006/2014 ‘Golden Gate Sunset’ (58.6%, OB, USA, Taiwan, sherry, cask #S060710001, 479 bottles)","Kavalan 2006/2014 ‘Golden Gate Sunset’ (58.6%, OB, USA, Taiwan, sherry, cask #S060710001, 479 bottles) We have hundreds of Kavalans to taste. Really. One day, after the virus, we’ll do the mother of all Kavalan tastings, I swear, cross my heart! In the meantime… Colour: ristretto coffee. Nose: coffee, chocolate, patchouli, camphor, furniture polish, Chinese prune juice. I keep forgetting the name of that sauce that our Chinese friends are serving with Peking duck. Getting old, perhaps… With water: pretty sublime. Extremely well balanced, on more of that sauce (Chinese friends, help!) and the most complex chocolate there is. Blackberry ganache, mole sauce, grilled steak, humidor, walnut stain… Oh wow! Mouth (neat): fabtastic prunes, cigars, chocolate, coffee, Corinth currants… With water: just amazing. Bitter oranges, chocolate, turmeric, old Armagnac, mocha, proper oloroso… Finish: long, beautifully dry, all on tobacco, coffee and chocolate. Comments: we’ve always been wondering how they were doing this. The fact is the end result is just amazing. SGP:362 - 91 points.",91,2020-04-03,https://www.whiskyfun.com/archiveapril20-1-Chichibu-Lagavulin.html,23c7689e3b1c27994a73f93acef0a21f74cd020a80bb8479be1bc408e4ab5480
"Ransom WhipperSnapper (42%, OB, USA, Oregon spirit, +/- 2019)","Ransom WhipperSnapper (42%, OB, USA, Oregon spirit, +/- 2019) LOL, this is 1 years old ‘on average’. But this is Oregon, baby, the wild wild West! 80% maize and 20% barley (both malted and unmalted - naturally). No rye in this mash bill, apparently. All right, just for the fun of it… Colour: deep gold. Nose: butter, custard, geraniums, juniper, kippers, baby’s milk, sawdust, and really a lot of nutmeg. It’s nutmeg galore! Mouth: between Norwegian aquavit and Danziger Goldwasser, with a lot of stale cream in the background. Sour, difficult, unlikely. An old bottle of Bailey’s Irish Cream and some readymade custard in Tetra Pak. As a whisky, pass. Finish: forget. Oak spices on probation. Comments: it’s funny, it’s nice-ish and friendly, but frankly, it isn’t very good. I’m not even sure you could use it in a cocktail, it would probably wreck your Manhattan. And I think I’m being kind. SGP:341 - 40 points.",40,2020-04-03,https://www.whiskyfun.com/archiveapril20-1-Chichibu-Lagavulin.html,7e97437f0596daddcc0e5a562d0804fdb514b1be15d90ab415c0ad1331619118
"Milk & Honey ‘Founder’s Edition’ (57%, OB, Israel, 1000 bottles, 2019)","Milk & Honey ‘Founder’s Edition’ (57%, OB, Israel, 1000 bottles, 2019) We’re in Tel Aviv now. This was matured in bourbon and STR, and then finished in, cough, PX. Any distiller’s friend, all over the world ! (perhaps just not in Spain, ha-ha). Anyway, the M&Hs I could already try have all been pretty much to my liking. Colour: pale amber. Nose: you do feel something’s been going on with the woods, as I’m rather finding notes of cranberries, a pack of orange drops, some kinds of fruity spices, Easter sugar eggs (how timely), raspberries and grenadine and old barrique. Very bonbony! With water: the old barrique tends to try to have the upper hand. Mouth (neat): big, on green pepper, turmeric, raisins, leaves, more raspberries, and perhaps kumquats. A lot of ginger from the oak in the background. With water: water works well and would rather favour the bourbon. I shall not complain. Touch of salt too. Finish: rather long, leafy, with more ginger and turmeric – in short oak spices. Having said that, it’s not too, say ‘unpredictably funny’. More custard and butterscotch in the aftertaste – see, bourbon! Comments: not my preferred style (the one for LMDW was pretty great last year) but I think it’s a very fine malt and that they coped well with the acrobatic handling of the casks they’ve chosen. SGP:651 - 82 points.",82,2020-04-03,https://www.whiskyfun.com/archiveapril20-1-Chichibu-Lagavulin.html,143f3feef53af9d9dbb81d0cd4d86aa9b956a438a412d4e707bc7c3e7c5fcb17
"Eddu 2004/2019 (45%, OB, Pure Malt, 654 bottles)","Eddu 2004/2019 (45%, OB, Pure Malt, 654 bottles) Yes we’ve spared you Bastille or Brenne. De nada. Now this is unusual, as it’s old malted buckwheat from the Distillerie des Menhirs in Plomelin, in the Finistère, in Brittany. Finistère means ‘the end of land’. They’ve only done a few casks of malt at the beginning of their venture, so this is very rare. To tell you the truth, I didn’t even know you could malt buckwheat. Colour: gold. Nose: you would believe you’re nosing a crêpe, with some wheat, buckwheat, some good bread, touches of oranges, gooseberries, perhaps kiwis, then puréed chestnuts and a spoonful of Cointreau. Quite a lot of Cointreau, in fact. There’s an unusual kind of breadiness, pretty pleasant I have to say. Mouth: really very funny, and really very unusual. Calvados, pear eau-de-vie, kirsch, brioche, then orange blossom, oriental pastries and once again a touch of kiwi. Finish: the thing is, I find this pretty un-whisky, but really very good. Nice vanilla and baked butter pears in the aftertaste. Poiré (pear cider). Comments: a very good surprise, and more proof that good whisky does not always have to taste like Clynelish. I mean, Macallan. SGP:741 - 86 points.",86,2020-04-03,https://www.whiskyfun.com/archiveapril20-1-Chichibu-Lagavulin.html,193a2aa7b5a28a992b9a06a17c31e4f8579cad8819b5e77c877b2cd3897a4ee3
"Tomatin ‘Five Virtues – Earth’ (46%, OB, +/-2019)","Tomatin ‘Five Virtues – Earth’ (46%, OB, +/-2019) An NAS peated Tomatin. Some start to hope that the current crisis would eradicate all NASses, but let’s not wish the crisis will be this hard. But indeed it would be welcome if everyone would now go back to proper age statements for the malts. Colour: white wine. Nose: some kind of smoked apple juice, I would say. Whiffs of varnish and fresh paint as well, but I find the whole harsh and rather charmless. Similar to a too young Ardmore. Mouth: no, peat without anything either coastal or medicinal creates rather vulgar sensations. In this case, this is too bitter and grassy for me. Finish: medium, very leafy. Nicer notes of kiwi juice after that, and a little brine in the aftertaste. Comments: let’s not be too harsh, this is fine whisky, but does the whisky world need this? SGP:564 - 78 points.",78,2020-04-02,https://www.whiskyfun.com/archiveapril20-1-Chichibu-Lagavulin.html,c03e193f432a862439f6b9868ffc2425cdc34a3c5ce89a9a64f105db472a15ce
"Tomatin 15 yo 2003/2018 ‘Moscatel Wine’ (46%, OB)","Tomatin 15 yo 2003/2018 ‘Moscatel Wine’ (46%, OB) The label wouldn’t say if this is only a finish, but I guess so. It’s also a Limited Edition, so not obligatorily bad news. Colour: gold. Nose: a little vague and imprecise, between malted barley, rubber bands, and indeed something a little muscatty and a touch dirty, like an empty old wine barrel lying in a corner. I don’t find it sulphury, having said that. Mouth: I find this difficult, too leathery, with just layers of apricot jam that did not mingle too well yet with the grassy notes. Not too sure, really. Tomatin 15 au naturel anytime against this, even a miniature for a bottle. Finish: rather long but really lacking integration. A spoonful of apricot jam in a cup of chicory coffee. Comments: to its credit, it’s true that I’m never a huge fan of these improbable mixtures. SGP:561 - 75 points.",75,2020-04-02,https://www.whiskyfun.com/archiveapril20-1-Chichibu-Lagavulin.html,436bfc4e766701066a62509c5eadc63b643c5875201a12bebb84aef81774c07a
"Tomatin 12 yo (43%, OB, +/-2017)","Tomatin 12 yo (43%, OB, +/-2017) Colour: pale gold. Nose: nicer, obviously cleaner, with proper malt and proper fruits this time, even if we remain far from older-type Tomatins that used to display bags of tropical fruits. Nice overripe apples, fruit peelings, watermelons, a spoonful of muesli, some porridge… All that is nice. Mouth: there, this is good! Oranges and cornflakes, pancake syrup, touches of melons and, indeed, papayas, a little heather honey, toasted bread, and a wee feeling of muffin (with a not to FZ and the good captain). Finish: medium, slightly roasted, fruity, balanced, clean, malty. Comments: perhaps not an utter star yet, but we’re already in the upper leagues. SGP:541 - 84 points.",84,2020-04-02,https://www.whiskyfun.com/archiveapril20-1-Chichibu-Lagavulin.html,e97be44ed3fa7f098dffde605e1aa230ad87f29820efd032ca953617fed94d9f
"Tomatin 'Legacy' (43%, OB, +/-2017)","Tomatin 'Legacy' (43%, OB, +/-2017) We had tried an earlier version of this NAS in 2012 and were not flabbergasted at all (WF 72). Mind you, they’ve used virgin oak, one of the crutches of modern malt whisky. No age statement and virgin oak, that’s just bad news in my book, but I shan’t pinch my nose just now… Colour: gold. Nose: no no no, this is perfectly fine, with nice whiffs of Fruit Loops, crushed bananas, acacia honey, Belgian waffle and even popcorn. That’s well-handled virgin oak. Mouth: oooh they had been working on the recipe! I find this really good, balanced, with these notes of tarte tatin, guavas, notes of white Rhône wine (white Hermitage while we’re at it) and a very delicate leafiness. Say silver needle tea, they should come out in April I guess, but will that stupid virus let them travel to our shores? Finish: medium, still clean and fresh. Ore white tea, that’s cool. Comments: really an excellent drop, thank you Tomatin. Ans stay safe. SGP:651 - 88 points. PS: I’ll say it again, if I may, the NAS issues are not about quality, they’re about transparency and prices.",88,2020-04-02,https://www.whiskyfun.com/archiveapril20-1-Chichibu-Lagavulin.html,fe3997ffa1a2bceebd617d8ed5c881d2a3ec494d3df7da0c58e1828eb38350ac
"Tomatin 26 yo 1988/2015 (54%, OB, for Taiwan, oloroso sherry, cask # 950378, 402 bottles)","Tomatin 26 yo 1988/2015 (54%, OB, for Taiwan, oloroso sherry, cask # 950378, 402 bottles) Still the older livery. I have to say it was classy. Colour: deep amber. Nose: perfect oloroso, that is to say Assam tea, walnut wine, raw cocoa, mocha, marrow, cigars, and a touch of tar. That’s the expurgated version of my note, right? With water: no rubber or used matches out, so thumbs still up! Mouth (neat): love this. Eating your cigar after having crunched some crude chocolate and sipped some late 19th century Armagnac. There’s worse sherried whisky. With water: some old Macallans 15 yos. Why have they broken (or lost) the moulds? Stunning coffee-ish dryness, coffee freaks should love this. You know, cold-brewed and stuff. Finish: medium, dry, more on old walnuts again, oloroso (VORS) and proper chocolate. Like, dark chocolate at 80 or 90% cocoa. Comments: as good as it gets. Well done Tomatin, Taiwan, and anybody involved. Now indeed, if you dislike dark chocolate, rather go your way. SGP:462 – 91 points.",91,2020-04-02,https://www.whiskyfun.com/archiveapril20-1-Chichibu-Lagavulin.html,1f15bab564612dcfc5a1d6f382cf37fbe21d0b5bb9b8b9d5b1c1bd8f255bb1b4
"Tomatin 12 yo 2006/2019 (58.1%, Single Cask Nation, bourbon hogshead, cask # #800230, 219 bottles)","Tomatin 12 yo 2006/2019 (58.1%, Single Cask Nation, bourbon hogshead, cask # #800230, 219 bottles) I thought SCN and its inceptors have always done some pretty unusual choices, always a bit off the beaten tracks, and I say that’s what we should be expecting from some proper indie bottlers. I’m still in love with their latest Angostura, for example. Colour: white wine. Nose: neat, square, tidy and clean. Apples, gooseberries, green pears and proper cider. With water: same. Mouth (neat): well done! Orchard fruits coated with a wee coconut and custard sauce. An aggressive grassiness in the back, but water should sort this out. With water: indeed, this has become a fruit salad sprinkled with, well, with some Tomatin (ooh that’s smart, S.) Finish: medium, malty, with a little café latte. Comments: no hacking here, it’s exquisitely simple, honest and just very good. SGP:551 - 86 points.",86,2020-04-02,https://www.whiskyfun.com/archiveapril20-1-Chichibu-Lagavulin.html,5d856b41e3de585f2526f89c8fb7a8807f78a9bd77628c78f67e622c517900eb
"Tomatin 11 yo 2008/2019 (56.1%, Artful Dodger, bourbon, cask #453, 323 bottles)","Tomatin 11 yo 2008/2019 (56.1%, Artful Dodger, bourbon, cask #453, 323 bottles) All right, let’s try to beat the shortest-tasting-note for a cask strength whisky record… Colour: white wine. Nose: butterscotch. With water: same. Mouth (neat): malt, liquorice and chicory. With water: fab pumpernickel and butterscotch. Finish: long, malty, grassier, perfect. Touch of chlorophyll in the aftertaste. Comments: don’t get me wrong, it’s much more complex than that, but I’m having a go at minimalism. No, not at frugalism! Good, experiment over, let’s move on… SGP:551 - 87 points.",87,2020-04-02,https://www.whiskyfun.com/archiveapril20-1-Chichibu-Lagavulin.html,682edfc1087ea8d8f73473ba0c600787253670eff416e472fab12b6306f092a7
"Tomatin 24 yo 1993/2017 (53.2%, Blackadder, Raw Cask Statement, hogshead, sherry finish, cask #9727, 190 bottles)","Tomatin 24 yo 1993/2017 (53.2%, Blackadder, Raw Cask Statement, hogshead, sherry finish, cask #9727, 190 bottles) What kind of statement would this be? Colour: coffee. Nose: well, this is only a poor finish, but it was well done, even if in no way it can match a perfect full-term maturation. Some gunpowder and struck matches for sure, then liquorice, fig cake, and sultanas.. When is Christmas again? With water: meats and tar. And a little coal tar and burnt sulphur. Mouth (neat): good for sure, earthy and even sooty, tarry, then on black raisins and that Christmas cake. A wee miso-y side. With water: the sulphur feels more. Some love it, some don’t, it’s true that it’s bordering umami paste. Finish: long, leathery and rubbery, salty, bouillony, soupy. A very controversial style indeed. Comments: un-scorable, some would say 90, others would just sink it or use it to make hand gel. SGP:362 - 85 points.",85,2020-04-02,https://www.whiskyfun.com/archiveapril20-1-Chichibu-Lagavulin.html,cff4b31c3d53b648ac7ee3102089f583db754d5a6a414a2259504cad36dc071e
"Ben Nevis 17 yo (50.8%, Milroy’s of Soho, +/-2016)","Ben Nevis 17 yo (50.8%, Milroy’s of Soho, +/-2016) I believe this was a 1999, but I am not sure about that, at all. Beginners, novices and humble people, check Jack And Wallace Milroy’s lives, that’s mandatory knowledge. Colour: white wine. Nose: sunflower oil to the max, and citrons to the very max, with an expected layer of paraffin and chalk over that. Then lemon squash and bandages. I can’t see how and why anybody would resist this extremely unusual, yet amazingly profound profile. There, this session starts well. With water: new electronics and expanded polystyrene foam Mouth (neat): it’s not unusual that a taster would find a little plastic in a Ben Nevis, and that’s the case here. Plastic which then turns into paraffin, which turns into candlewax. Add chalk, clay, lemons, and a little engine grease or something. With water: careful with water, as always with Ben Nevis. So much for a pretty ‘coastal’ distillery. Hey, do electronic pipettes exist? May we try one of those? Other than that, more lemons and more chalk and wax. No complaining. Finish: rather long, totally in line. As architects usually say, just an extension. Comments: yes, I’m aware of the fact that these ‘plastic-like’ notes would bother some whisky lovers. SGP:462 - 88 points.",88,2020-04-30,https://www.whiskyfun.com/archiveapril20-2-Ben-Nevis-Macallan.html,051d3357ab115b893b4275efb083f37f35fc1dcf9caee0ebc5999a3f2cbf78ed
"Ben Nevis 16 yo 1999/2015 (55.4%, Archives, hogshead, cask #166, 294 bottles)","Ben Nevis 16 yo 1999/2015 (55.4%, Archives, hogshead, cask #166, 294 bottles) I always found it very cool that the owners of Archives would put their own portraits onto their labels. No, nothing fishy at all. Colour: white wine. Nose: you wouldn’t notice that from the colour but this has got a higher oak impact, more roundness, more butterscotch, more gentleness… But underneath all that we’re rather finding a rawer, pretty spirity spirit (seriously, S.?) That’s bizarre, I cannot not think of white Bacardi of Havana Club. I know, I know… With water: the earthy malt won the battle, but there are casualties. Something strangely sour floating over the battlefield. Mouth (neat): soapy tones this time, then supermarket cranberry juice and touches of lady’s soap. Uh-oh, that’s all bizarre indeed… With water: oranges come out, which is obviously nice, but we’re not quite done with the soap. Finish: medium, saltier, and frankly nicer. Comments: something may have gone wrong here. There will be a score since that’s the law, but please take it with a lorryload of salt. SGP:272 - 70 points (on hold).",70,2020-04-30,https://www.whiskyfun.com/archiveapril20-2-Ben-Nevis-Macallan.html,641ae4efb74179f5e81b1772f41f64489b4afe7e8e8644edbef3a4e144caeca2
"Ben Nevis 22 yo 1997/2019 (52.5%, Cask & Thistle for SCSM, China, refill butt, cask #126, 300 bottles)","Ben Nevis 22 yo 1997/2019 (52.5%, Cask & Thistle for SCSM, China, refill butt, cask #126, 300 bottles) I’m wondering if and how the dynamics as regard to whisky and China will change or not after Covid. Am I being too serious here? Colour: light gold. Nose: Ben Nevis as we expect it, with just a wee touch of vanilla-ed oak over it. Seriously, it’s pretty perfect. Beeswax, tangerine marmalade, clay, orange blossom honey, lime blossom, paraffin, touch of yoghurt and dough, proper chardonnay (proper Meursault)… With water: yeah, sheep’s wool, grist and porridge. Mouth (neat): this is rather wow. Granted, it’s a tad modern, with notes of chicory coffee (I know that’s hardly modern) and butterscotch, but that works extremely well with all the waxy, citrusy, chalky and slightly medicinal notes. A big boy. With water: yes, perfect. Chalky and waxy lemons, can’t beat this. Finish: same for a pretty long time. More cracked pepper in the aftertaste; a tad less sure about the aftertaste. Comments: pretty splendid. If we wanted to split hairs (which we never do, oh no no no) we’d say that the modern oak was just a notch too loud. Loudish. A tiny wee tad loudish-like. SGP:462 - 89 points.",89,2020-04-30,https://www.whiskyfun.com/archiveapril20-2-Ben-Nevis-Macallan.html,39a3dfdfbb20f71f1189f16b8ef888da3a7a9235e166280dfc03be5fdc4e2e61
"Ben Nevis 23 yo 1996/1999 (51.6%, The Whisky Jury, refill hogshead, cask #1513, 260 bottles)","Ben Nevis 23 yo 1996/1999 (51.6%, The Whisky Jury, refill hogshead, cask #1513, 260 bottles) Yet another new wee bottler, but I find this very refreshing. These guys carry more passion than any large and rather blasé, and consequently pretty arrogant booze consortium. I say those should work on their values, and chop-chop. Coz BS lifestyle is dead and buried; back to the product! Colour: pale gold. Nose: typical, unquestionable, chalky, waxy, lemony, barley-y, with whiffs of warm hay in the midst of summer and high-class hand cream. And perhaps a little maracuja. With water: once again, careful with water, Ben Nevis no swim well always, as they say in Sicily (?) Mouth (neat): oooh! More tropical fruits here, mangos, maracuja… And grapefruits, bell pepper, horseradish (we don’t find that too often in whisky)… With water: really cool, midway between the austere chalky ones, and the easier, fruitier ones. Yet, do not add too much water. Finish: log, with more spices. Comments: yup (I’ve decided to expurgate my comments for the time being). SGP:562 - 89 points.",89,2020-04-30,https://www.whiskyfun.com/archiveapril20-2-Ben-Nevis-Macallan.html,48b8816d7ba9a4af03dcd4201ec32ccc4a74c46c513b9f6360bbfcc372a5c878
"Ben Nevis 23 yo 1996/2019 (47.4%, Maltbarn, bourbon, 150 bottles)","Ben Nevis 23 yo 1996/2019 (47.4%, Maltbarn, bourbon, 150 bottles) Apparently, the much skilled Maltbarn people too have just decided to put their portrait onto their labels. Good idea, very convenient at whisky festivals. Seriously, I find it great that Maltbarn would use original art, even for very low outturns. That’s good spirits! Colour: pale gold. Nose: it’s a leafier one, more on patchouli, green bananas, pils, cut grass… One word springs to my mind, elegance. I suppose the lower strength is fully natural here, all that usually leading to more complex whiskies (or cognacs, armagnacs, und so weiter). Mouth: right. Crème brulée à la menthe, soft liquorice, artisan pastis, citron liqueur, lemon grass, custard made with a lot of natural vanilla, and… Gasp I drank it all! Finish: most probably. Comments: seriously, this is state of the modern art. My star among the stars, Anselm Kiefer! I’m sure he would love to do a wee label for a wee bottle of whisky… SGP:562 - 90 points.",90,2020-04-30,https://www.whiskyfun.com/archiveapril20-2-Ben-Nevis-Macallan.html,ba42d65f781710d78f2e20025d20ded0027cfd3dac095685bf6e546089e04828
"Ben Nevis 1995/2019 (51.2%, The Whisky Jury, refill hogshead, cask #970, 245 bottles)","Ben Nevis 1995/2019 (51.2%, The Whisky Jury, refill hogshead, cask #970, 245 bottles) The jury’s still in… Colour: light gold. Nose: candied fruits all over the place. And waxes, chalk and clay, bandages, ointments, fresh concrete ad plaster, damp earth, roots... Need I say more? With water: pickled fruits, chutneys, passion fruits, balsa wood, putty, coriander leaves… So funny to follow! Mouth (neat): just perfect. Perfect distillate, perfect age, perfect sourness, perfect herbalness, no compromise. With water: ditto. Easy and very complicated at the same time. Once again, careful with the amount of H2O. Oh, just drop water! (proud about that one, S.?) Finish: no water please. Otherwise, long, spicier, reflective, intriguing and thought-provoking. Pushing things a bit, perhaps… Bonbons in the aftertaste, that too is not unseen with Ben Nevis. Comments: seriously, another perfect Ben Nevis. Dear Jury, what’s the verdict? SGP:462 - 90 points.",90,2020-04-30,https://www.whiskyfun.com/archiveapril20-2-Ben-Nevis-Macallan.html,d2f23a514d59081a8798b72ca227453c374aadc2c6de0b1787876141e263aa82
"Glen Garioch 2011/2017 (45%, Whisky & Rhum, Golden Barley, barrel, cask #882)","Glen Garioch 2011/2017 (45%, Whisky & Rhum, Golden Barley, barrel, cask #882) I hope this one will be fully naked. I mean, you see what I mean, checking a pure distillate and all that. Colour: white wine. Nose: a blend of sooty water with various yellow fruits, all very well ripened. Mirabelles, pears, quinces, then a dollop of barley water and just a touch of vanilla. It’s very barley-y, just a tad sootier, perhaps even smokier than your usual very young Speysider. A little moss as well, which I find very pleasant as well as some leavened bread. I enjoy these rather eau-de-vie-y young malts! Mouth: good stuff, you just have to enjoy baby whiskies that are not totally polished yet. Pretty much the same flavours actually, with just a little more grass, green olives and capers (very vivid), and something slightly estery. Right, bacterial if you like. Finish: rather long, more on anything green olives. Sootier aftertaste again. Also liquorice wood, and more rubber. Comments: very intriguing. I like it a lot, but it’s probably more for a taster than for a street sipper. I know. Some interesting echoes of GG’s much smokier past. SGP: 462- 83 points.",83,2020-04-29,https://www.whiskyfun.com/archiveapril20-2-Ben-Nevis-Macallan.html,98fec25717bd1dfd59a05380adf17fcf7a98f1387d6dbfde7563210c3cd0720b
