whisky_name_raw,review_text,score,review_date,source_url,dedupe_hash
"Bimber ‘Chopin the Composer’ (52.0%, OB, England, Shoulders of Giants, for Poland, fino, cask #513/28, 328 bottles, 2023)","Bimber ‘Chopin the Composer’ (52.0%, OB, England, Shoulders of Giants, for Poland, fino, cask #513/28, 328 bottles, 2023) Another release for Poland, naturally. At WF, we’re fino-ists—and manzanilla-ists too. Colour: gold. Nose: the fino influence is quite massive, with gunflint, gunpowder, bitter apple, and mustard, not to mention those famous fresh walnuts and a touch of mocha. With water: no real change, everything stays almost identical. Mouth (neat): lots of bitters, beer, mocha indeed, Seville oranges, chervil, tobacco, leather, chilli chocolate, and juniper berries… There’s a lot going on here—this is no little nocturne composed by Frédéric Chopin himself. With water: water smooths it out a bit, though cooked bell pepper also emerges. Finish: long, softer, with raisins finally making an appearance. Comments: more Frank Zappa than Frédéric Chopin, but we love them both. SGP:461 - 87 points.",87,2025-01-31,https://www.whiskyfun.com/archivejanuary25-2-Caperdonich-Mortlach.html,d7d96f5d8536986e73ccded07947c766aa51c146e59495b5a5305abbcaa49858
"Kilian 2017-2021/2024 ‘Signature Edition Fourteen’ (49.8%, OB, Germany, 4,260 bottles)","Kilian 2017-2021/2024 ‘Signature Edition Fourteen’ (49.8%, OB, Germany, 4,260 bottles) Colour: light gold. Nose: nothing really stands out, but that’s perfectly fine, and the nose is anything but extreme. It’s beautifully malty, with notes of pastries, a touch of wine influence (though subtle), yeast, hints of young Alpine Gruyère, vineyard peaches (as found in summer Gruyères), and a bit of white nougat. Ultimately, it’s very delicate. Mouth: wonderfully fruity, with stewed and candied fruits, notably cherries and angelica, buttery pears, some raisins, praline, and always those peaches (probably from the Sauternes and Cognac duo). Finish: long, spicier, leaning more into wood spices now—cumin, nutmeg, and pepper. Comments: how could I not love this? Spitzentropfen , truly classy. SGP:551 - 87 points.",87,2025-01-31,https://www.whiskyfun.com/archivejanuary25-2-Caperdonich-Mortlach.html,85148da0c6b9cb957e6e539f5ffefc6df731f5a0699472b2fce6d43a1cfe6883
"Hellyers Road 21 yo 2002/2024 (62.4%, OB for La Maison du Whisky & Kirsch Import, Australia, American oak, cask #3093.04)","Hellyers Road 21 yo 2002/2024 (62.4%, OB for La Maison du Whisky & Kirsch Import, Australia, American oak, cask #3093.04) I don’t need to elaborate further on my thoughts about this Tasmanian distillery and, above all, its products. While the earliest releases didn’t impress me, each passing year has been more and more convincing. Let’s keep this quick, like having a small spoonful of caviar swallowed in one go (why not?). Colour: gold. Nose: just brilliant. Vanilla cream, passion fruit, mango, orange, nectarine, fir honey, and plenty of pollen—all in complete and total harmony. With water: meadow honey. Mouth (neat): explosively fruity, with touches of varnish and glue, likely from the wood—or perhaps the 62%. With water: what I particularly love are these faintly minty herbal tea notes that join the fruits, mostly yellow fruits, and of course, the honey. Finish: long, with subtle wood emerging and tiny hints of coffee (ditto). Peach skin. Comments: you could almost use this wee marvel to replace honey. Well, maybe not for breakfast. SGP:651 - 90 points.",90,2025-01-31,https://www.whiskyfun.com/archivejanuary25-2-Caperdonich-Mortlach.html,4244c475f0b3d5950b04fd24c34dbf1bb406821809ba030edfe83af055fe138a
"Benromach 2012/2024 ‘Contrast: High Enzyme’ (46%, OB, first fill bourbon barrel)","Benromach 2012/2024 ‘Contrast: High Enzyme’ (46%, OB, first fill bourbon barrel) A playful series by Benromach, featuring some relatively classic elements (more peat) and some more unusual ones, such as a comparison of kiln-dried and air-dried oak, or this high-enzyme malt, which is usually used to produce grain whisky. This is what is called high-DP malt with a lot of nitrogen (DP = diastatic power), and it’s used to convert the mash into fermentable sugars. Typically, about 10% is added to grains like maize or wheat. It’s worth noting that in Scotland, the use of additional enzymes in other forms is not allowed, though it’s permitted elsewhere. Let’s taste this high-DP malt, which should be sweeter and maybe even a little sugary… Colour: white wine. Nose: indeed, it’s very sweet, evoking bottled apple juice, an enormous pile of marshmallows, and touches of very vanilla-forward oak. It feels quite far removed from those slightly ‘dirty’, robust, and smoky Benromachs we love so much. Mouth: yes, it’s sweet, with plenty of apple again, marzipan, grapefruit, and above all a rather noisy oakiness. A standard Benromach would normally handle such situations brilliantly, but this baby Benromach (if I may) struggles a bit with the wood. It almost reminds one of a young Auchentoshan. Finish: medium length, with a hint of orange and perhaps papaya, then more apple juice and a lingering sensation of wood, almost like sawdust. Comments: not bad at all, really, but perhaps best suited for our friends who already have all the ‘normal’ Benromach expressions on their shelves. And remember, it’s only experimental. SGP:630 - 82 points.",82,2025-01-30,https://www.whiskyfun.com/archivejanuary25-2-Caperdonich-Mortlach.html,93dda45124888e96f4703fa2872abd1cd19546712ce9343814ec5704e680f442
"Benromach 20 yo 2003/2024 (56.7%, LMDW, Artist #14, first fill bourbon barrel, cask #666, 172 bottles)","Benromach 20 yo 2003/2024 (56.7%, LMDW, Artist #14, first fill bourbon barrel, cask #666, 172 bottles) There were five releases in this dazzling series, of different ages. We had already tasted four of them, all of extremely high quality, but for some unknown reason, this one slipped through my fingers. Let’s rectify that… And do note the rather devilish cask number. Colour: straw. Nose: it immediately reminds me of a malt produced slightly further north along the coast, starting with B. Stunning ashes, coal smoke (they also used to produce coal in the town of Brora), citrus fruits, seawater, shellfish, menthol… To be honest, it’s quite sublime. With water: even more beautiful and even more B. from the north. What kind of sorcery is this? That smoked ham in the background is fantastic, as are those farmyardy and almost stable-like smells. Mouth (neat): fat, oily, very peaty, with splendid bitterness (bitter orange) and a truly beautiful astringency dominated by the zests of all kinds of citrus fruits. A wonderful saline edge too. What’s sure is that it’s not messing about… With water: candied citron and pepper. Finish: very long, very smoky. Ashes and green pepper linger in the aftertaste. Comments: from an especially peated batch, it seems—and as always, those magnificent labels. We love it, though we expected nothing less. SGP:466 - 91 points.",91,2025-01-30,https://www.whiskyfun.com/archivejanuary25-2-Caperdonich-Mortlach.html,615976c93debb026f9e88fbe2e057d05755f01c5e4e6884410f776d4e9f76b7a
"Monkey Shoulder ‘Batch 27’ (40%, OB, William Grant & Sons, blended malt, +/-2024)","Monkey Shoulder ‘Batch 27’ (40%, OB, William Grant & Sons, blended malt, +/-2024) This one is enjoyed from time to time, being a very important malt in France, a vatting of Glenfiddich, Balvenie, and Kininvie. Since its introduction in 2005, it has always been Batch 27—surely the largest vatting tank in the world! Jokes aside, I used to prefer earlier versions, but things can always evolve. Colour: gold. Nose: well, it’s lovely, ever so slightly cardboardy, but also on shortbread, acacia honey, ripe mirabelles, and cinnamon cake. Honestly, I really like this nose… Perhaps they’ve increased the Balvenie proportion? Mouth: yes, it’s good, not as light as you might expect, with flavours close to the nose, plus a touch of orange. It only loses momentum after about thirty seconds—that’s the 40% for you. Finish: very short, indeed, and that’s its main flaw. A return of cardboard. Comments: a shame, I felt it was heading beyond 80 points. SGP:441 - 79 points.",79,2025-01-29,https://www.whiskyfun.com/archivejanuary25-2-Caperdonich-Mortlach.html,bc35ae16021a29a075d16408b828132df52b7ee3165c78379f49b62727122ed1
"Speyside Blended Malt 12 yo ‘Famille Dupont’ (52.7%, Mossburn, Cask Collaboration Series, calvados finish, 2024)","Speyside Blended Malt 12 yo ‘Famille Dupont’ (52.7%, Mossburn, Cask Collaboration Series, calvados finish, 2024) This intriguing baby was finished in ex-calvados Pays d’Auge and ex-pommeau casks. Famille Dupont, renowned calvados makers in Normandy, also produce pommeau—a kind of pineau or ratafia, essentially apple juice fortified with calvados. Colour: light gold. Nose: it’s not easy to detect the calvados in an obvious way, which is for the better, as many aromas from calvados (including apple, naturally) are also commonly found in malt whiskies. This results in a very coherent nose, which I find lovely, round, and well-balanced, with very light muscat-like touches that may stem from the… pommeau. With water: very subtle earthy touches, which are delightful. Mouth (neat): apple and even cider are far more apparent on the palate, with a slightly fizzy character and hints of lemon. This makes the malt very refreshing—it could work beautifully with desserts. Light liquorice and green pepper. With water: more honey, heather, and linden blossom. It’s very good. Finish: rather long, soft yet robust, and very attractive. Comments: essentially a finishing that doesn’t feel like a finishing—right up my alley. And I adore apples. But beware, it goes down all too easily—you’ve been warned. SGP:641 – 86 points.",86,2025-01-29,https://www.whiskyfun.com/archivejanuary25-2-Caperdonich-Mortlach.html,4bdeaa3b4ec2ae9492a9deab46c9746bb37d20eebadaf0ad1320991674a30fb8
"The Bad Na H-Achlaise (46%, Badachro Distillery, Tuscan oak, +/-2024)","The Bad Na H-Achlaise (46%, Badachro Distillery, Tuscan oak, +/-2024) A name even harder to pronounce than Allt-A-Bhainne or Bruichladdich—quite the achievement! But oops, this is a single malt sourced elsewhere. My bad, as Badachro appears to only make gin and vodka. They’re located on the mainland, just opposite the northern tip of Skye. We had previously tried a cask-strength Bad Na H-Achlaise, which was excellent. Colour: gold. Nose: oh, this is lovely! A medicinal smokiness, but not in the Islay style—perhaps Ledaig? —with oysters, tarred ropes, resinous wood ashes, cherries, oil paint, and fresh tar… all very charming. Mouth: excellent fresh peat, once again with a touch of cherry (perhaps from the Tuscan oak?) and loads of maritime notes, including hints of a neighbouring ship’s hold. Finish: long, more lemony, perfectly ashy, and peaty. Comments: the only issue is going to a whisky shop, not speaking Gaelic, and asking, ‘Have you got some Badnahashlez, by any chance?’… If they don’t throw us out, we’re in luck. A superb bottle. SGP:564 – 88 points.",88,2025-01-29,https://www.whiskyfun.com/archivejanuary25-2-Caperdonich-Mortlach.html,66c50bf312e48cd8ed08a7bbc443c9874b40193bcf5ad5a880155aafbf2c3a9c
"Ben & Sherry 6 yo (57.1%, Watt Whisky, blended malt, butt, 282 bottles)","Ben & Sherry 6 yo (57.1%, Watt Whisky, blended malt, butt, 282 bottles) This hippy whisky combines fifty percent Benrinnes and fifty percent Glasgow Dist. Let’s try to avoid overly frosty commentary. Colour: Nose: an unusual start, quite fermentary, with notes of cooked vegetables, courgettes, and even Brussels sprouts. Then comes saltpetre, soot, cherry stalks (in herbal tea), and roasted aubergines. It’s very polarising, as they say. With water: still those cooked vegetables, but now joined by honey and slightly ""evolved"" dried figs. Mouth (neat): more sherry-driven, but spicy and almost fizzy. Think chilli-infused Schweppes, kirsch straight off the still, pink grapefruits, and braised cabbage. With water: it settles down, revealing walnuts, baked apples, marmalade, tobacco, honey, and sweet peppers. Finish: similar, and it lingers for a good while, with a peppery aftertaste. Comments: don’t be fooled—my notes may seem odd, but this little UFO is rather charming, taking you on a journey from Brussels sprouts to meadow honey. Almost a thriller. SGP:571 – 86 points.",86,2025-01-29,https://www.whiskyfun.com/archivejanuary25-2-Caperdonich-Mortlach.html,25c6391c443310a999299631301335d5eda0866c2ffd7b23ccc2143c1775334a
"Crimson Casks (46%, Compass Box, blended malt, 2024)","Crimson Casks (46%, Compass Box, blended malt, 2024) Sherry butts (yay) but also red wine casks (ouch). You might say that if they added Clynelish, as usual, things would work out. Let’s just hope the proportion of “red wine” (what kind of wine?) remains modest. There are also tales of kings in the story—perhaps a secret nod to Robert Fripp? You know, King Crimson and all that. Colour: reddish amber. There’s definitely red wine here. Nose: well, I rather like this! As expected from Compass Box, it’s well-balanced, though there are plenty of peonies, black cherries, tomato leaves, roasted peppers, raspberry ganache, and heaps of milk chocolate. Mouth: it’s more of a mix on the palate, a “cuisine whisky” as some might say. Dark chocolate, morello cherries, red peppers, dates, prunes, marmalade, raisins, and hints of ginger… It’s remarkably structured, almost like molecular cuisine. Finish: long, jammy, and spicy, with a certain Turkish delight vibe. Candied orange zest lingers in the aftertaste. Comments: it’s really amusing, but please, Adrià and Veyrat, stay out of my glass! SGP:551 – 82 points.",82,2025-01-29,https://www.whiskyfun.com/archivejanuary25-2-Caperdonich-Mortlach.html,a0dbf5ff17af45e3331d1ad9c947abc31a2b907139cdb433560f57a29acf80f8
"Blended Malt 23 yo 2001/2024 (45.1%, Decadent Drams, Decadent Drinks)","Blended Malt 23 yo 2001/2024 (45.1%, Decadent Drams, Decadent Drinks) Watch this one, it’s been finished for a year in an ex-Ardbeg cask, which feels pretty decadent indeed. But here we are… Colour: amber. Nose: it seems the Ardbeg cask had been thoroughly emptied—or rinsed—or steamed… Or perhaps not? You do catch distant hints of burnt tyres (was there an F1 GP nearby?) and a faint whiff of medicinal tincture, but that’s about it. Oh wait, a little menthol emerges too, along with perhaps three or four whelks, a sense of old dunnage warehouse, and a trace of dried kelp on the beach. Right then, this might just be the ideal way to create a ‘lighter’ Ardbeg. A stunning nose, truly, so delicate and finely chiselled. But as we’ve said before, Ardbeg leaves its mark even at homeopathic doses, doesn’t it? Mouth: zut alors, this is fantastic stuff! A faint Schorle-like vibe, with strawberry lemonade and chilli, but also a charmingly saline fruitiness. Blood oranges, pecans, and a slightly earthy, dirty (slaggy) touch—surely the Ardbeg’s doing. Finish: long, with quinine and orange. Comments: one simple question—can they make this in-cask blended malt exactly like this again? SGP:562 – 88 points.",88,2025-01-29,https://www.whiskyfun.com/archivejanuary25-2-Caperdonich-Mortlach.html,938062c8f473fb92d5aff02ac083d17ecfcb9df80df7a5a4d9d76f6df0d5ce25
"Glen Avon 30 yo (40%, Gordon & MacPhail, Avonside, +/-1990)","Glen Avon 30 yo (40%, Gordon & MacPhail, Avonside, +/-1990) Whoops, another single malt in disguise. It’s worth noting that no one at G&M has ever admitted what Glen Avon really was, not even under torture (even after being tied up and forced to listen to Mariah Carey’s entire discography). Main candidates, M. and GF. That said, the vintages of Glen Avon that were available more or less coincided with those of Macallan, which were also bottled by G&M. However, it’s not set in stone that all Glen Avons came from the same distillery… Same goes for the Glen Gordons. Anyway, let’s simply taste this baby without any further ado. Colour: gold. Nose: there’s this smokiness we never found in GF, but which was common in M. It’s also less fruity than the GFs of the time. On the other hand, there are superb notes of shoe polish and tobacco. Roasted nuts of all kinds complete the profile beautifully. Mouth: it’s just a tiny bit tired, having become slightly dry, fairly liquorice-y, mentholated, and meaty (bone broth), but the smokiness remains, and those roasted nuts are still doing their job in the background. All in all, it’s still magnificent, just a bit fragile and light. Finish: short to medium in length, with a touch of plasticine and a faint salty edge. There’s a hint of sorrel soup in the aftertaste, but it’s very elegant. Oh, and a little piece of grilled bacon. Comments: it’s a bit like a vintage sports car—you just need to handle it gently. This resembles M. a great deal, but then again, the river Avon flows into the river Spey right next to Ballindalloch, the home of GF. M. is much further away, on the Spey. Right, enough playing Sherlock Holmes… SGP:452 - 89 points.",89,2025-01-29,https://www.whiskyfun.com/archivejanuary25-2-Caperdonich-Mortlach.html,3fe04056e1c6df20409da4ca8202a6a3118f26eb19733f63ad7e222b6c87a600
"Togouchi ‘Misty’ (48%, OB, Stillman’s Selection, Japan, 2024)","Togouchi ‘Misty’ (48%, OB, Stillman’s Selection, Japan, 2024) While the Togouchi whiskies we used to encounter in Europe were largely sourced and imported spirits not distilled in Japan, the owners, Sakurao in Hiroshima, established their own distillery in 2017, which began producing peated malt in early 2018. Hurrah, this means we are now enjoying a true Japanese single malt in our glass. Colour: white wine. Nose: exceedingly light and, above all, very fresh, with green apples and subtle hints of green tea. There’s a delicate Sauvignon Blanc character, particularly with honeysuckle, which suits it well. A touch of gooseberries follows, then vanilla and a whisper of fresh coconut, though nothing excessive. The profile is faintly reminiscent of older malts distilled in Lomond stills (Mosstowie!). Mouth: that same freshness continues, with a hint of bubblegum mingling with those distinctive green apples, a touch of coconut, chlorophyll-infused chewing gum, and a trace of liquorice wood. Finish: of medium length, displaying a certain acidity that once again evokes Sauvignon Blanc. Coconut milk re-emerges in the aftertaste, accompanied by a very faint saline note. Comments: it feels youthful and a tad light(ish), but the freshness is perfectly delightful. SGP:550 - 82 points.",82,2025-01-28,https://www.whiskyfun.com/archivejanuary25-2-Caperdonich-Mortlach.html,42f22f8f196785b8193ae0fd4d2947e5e7b7863588da7e8d9dfd007bc9f898e8
"Sakurao ‘Sherry Cask’ (50%, OB, Stillman’s Selection, Japan, +/-2024)","Sakurao ‘Sherry Cask’ (50%, OB, Stillman’s Selection, Japan, +/-2024) From the same distillery. It’s to be noted that the hybrid spirit still is equipped with a column, which might explain the Togouchi’s relative lightness. Let’s see how it fares in this ‘Sakurao’ version… Colour: gold. Nose: more body here, with the sherry doing its job. Notes of leather, walnuts, and tobacco emerge, alongside a hint of patchouli and ylang-ylang. A faint touch of sushi sauce (of course!). With water: the coherence strengthens, with menthol and anise rising to the fore. It seems to thrive with water. Mouth (neat): leaning more towards young kirsch, with a paraffin and almond milk character, followed by cinnamon mints and traces of pine resin, as well as orange marmalade. The overall texture remains fairly light. With water: once again, water works wonders, moving it towards chartreuse and verbena, almost with hints of absinthe. Finish: medium in length, with the casks regaining a bit of control. Walnuts make a return. Comments: very pleasant. I wonder if they’re also experimenting with double distillation through the sole wash still, which is a classic pot still—that would be intriguing. But that’s none of my business, is it… SGP:551 - 83 points.",83,2025-01-28,https://www.whiskyfun.com/archivejanuary25-2-Caperdonich-Mortlach.html,5434183a882899ba61c5df6d9e33bbf89994cdf76a69338fc4ff851127f43f44
"Chichibu 9 yo 2015/2024 ‘Daikokuten’ (61.9%, OB, Spirits of Salud, 7even Gods of Fortune, second fill bourbon barrel, cask #4664, 187 bottles)","Chichibu 9 yo 2015/2024 ‘Daikokuten’ (61.9%, OB, Spirits of Salud, 7even Gods of Fortune, second fill bourbon barrel, cask #4664, 187 bottles) Last year, we sampled a sister cask (Angel’s Favourite), and as expected, it left us rather impressed. In any case, Chichibu and bourbon barrels tango beautifully, as we know. Colour: white wine. Nose: a blade that slices right through you, as the saying goes. A perfect assembly of lime, rhubarb, cider apples, and passion fruit. But at this strength, let’s not take too many chances… With water: even livelier, sharper with water, as blood oranges join the party and mingle wonderfully. Stunning. Mouth (neat): it’s fatty, it’s oily, yet it delivers a vibrant freshness that jolts your spine. Remarkable notes of lemony eucalyptus and a hint of honey—at least it seems so—but again, water is more than welcome. With water: yes, that’s it, spot on. Lemons, grapefruit, cinchona, eucalyptus, and a touch of woodruff. Beautiful green pepper lingers in the background, keeping everything energetic and taut like a bowstring. Finish: long, fresh, with green apples taking the lead, almost refreshing—but therein lies the trap, right. Playful green oak in the aftertaste, including the honeydew our friendly bees craft for our delight. A dash of menthol too. Comments: right up my street—or motorway, as I was about to say. The only flaw? We saw it coming. Right. SGP:561 - 91 points.",91,2025-01-28,https://www.whiskyfun.com/archivejanuary25-2-Caperdonich-Mortlach.html,c127313fa66d61afa11dd8e06ad38e6da95292908fd17e8f33a12500662554fa
"Yamazaki 20 yo 1986/2006 ‘Owner’s Cask’ (60%, OB, La Maison du Whisky 50th Anniversary, Butt/Mizunara, cask #6G5029, 405 bottles)","Yamazaki 20 yo 1986/2006 ‘Owner’s Cask’ (60%, OB, La Maison du Whisky 50th Anniversary, Butt/Mizunara, cask #6G5029, 405 bottles) It’s unclear whether this is a ‘double cask’ sherry butt + mizunara or if the butt itself was constructed from mizunara oak, but let’s not nitpick too much. Regardless, both this older series and these 1980s vintages of Yamazaki have now reached legendary status, and I’d add that, in my opinion, they also benefit greatly from (slow) bottle ageing. Colour: gold. Nose: a blend of chestnut honey and fir honey—that’s it for now (but it’s a lot, as these honeys are incredibly complex). With water: all the resins, glues, sap, and vegetal varnishes of the world, adorned with a few fresh almonds and walnuts. Absolute compactness. Mouth (neat): oh, my goodness! Maximum resinous and camphoraceous power—it just pins you to the wall. Plenty of black propolis as well, tying back to the fir honey and, naturally, the mizunara. And a distinct glue-like sensation. An incredible gustatory territory. With water: it softens a bit, but various peppers take over in the most beautiful way—so many different types of pepper. Finish: long and, at last, a touch gentler and more benevolent, with some white fruits joining this intensely sappy cavalcade. Comments: I think—no, I am certain—that 20 years in glass have only elevated this Yamazaki further. I’d even suggest it might have climbed from 90 to 93 points. I humbly say this because we tasted many of these Owner’s Casks when they were released in the 2000s, so we have some perspective. But anyway… SGP:572 - 93 points.",93,2025-01-28,https://www.whiskyfun.com/archivejanuary25-2-Caperdonich-Mortlach.html,27d39bafd7231f027e5764842422be0ba81dbc3f87a2b1ad628d43a0635d4669
