whisky_name_raw,review_text,score,review_date,source_url,dedupe_hash
"Travellers 11 yo 2005/2016 (43%, Compagnie des Indes, Belize, cask #BL22, 455 bottles)","Travellers 11 yo 2005/2016 (43%, Compagnie des Indes, Belize, cask #BL22, 455 bottles) There was a very good 2005 at 8 yo a few years back. Colour: gold. Nose: mid-soft and mid-phenolic, not unlike some Guadeloupes, with overripe apples and bananas plus only a very mild tarriness, then rather ‘rich’ flowers (geranium, earl grey tea) and quite some hay. No wham-bam rum but it does talk. Mouth: starts a tad pina-colada-ish, but with good body and structure. Rosehip tea and bananas, plus hints of tinned pineapples, with just one drop of lapsang souchong tea and perhaps a little fennel and dill. Finish: medium, and rather more banana-forward. Yeah I know. Comments: I’m not sure 43% vol. is quite enough, and this little rum keeps hesitating between two territories (tarry grass vs. luscious fruits and flowers). Now it’s quite complex. SGP:541 - 80 points.",80,2017-03-26,https://www.whiskyfun.com/archivemarch17-2-Glenfiddich-Ardbeg-Macallan.html,74b11ec26c7a2e203c76e68da564d8d9443eb39d774143038502fbe1ed5054b5
"Travellers 11 yo 2005/2016 (66.2%, Compagnie des Indes, Belize, cask #BL11, 297 bottles)","Travellers 11 yo 2005/2016 (66.2%, Compagnie des Indes, Belize, cask #BL11, 297 bottles) From one extreme to another… Colour: gold. Nose: it’s so strong that it’s got something medicinal at first, but various flowers tend to come to the front, which is lovely. Iris and vanilla, perhaps? Some genuine gingerbread too (50% honey at least) and once again, whiffs of geranium flowers. With water: bananas, white chocolate, a little hay, vanilla… Little tar that I can smell this time, the whole being rather soft and subtle (once you’ve added enough water, that is). Precious green tea. Mouth (neat): burns you. Right. With water: good to very good. Delicate pineapples and bananas, guavas, vanilla, a wee bit of raspberry ganache… So it’s all pretty fruity, without one single hint of sugary sweetness. Finish: medium, still subtle, with something slightly Cuban. I’m sure you could make some excellent canchanchara with this. Comments: some subtle rum at 66.2% vol.? What is the world coming to? SGP:541 - 83 points.",83,2017-03-26,https://www.whiskyfun.com/archivemarch17-2-Glenfiddich-Ardbeg-Macallan.html,be1562692069395999934f18898c343dc908385f992d999d5a9eaf09d9418b0c
"Travellers 11 yo 2005/2017 (66.1%, The Whisky Barrel, Rabbie’s Rum, Belize, barrel #33SFBT)","Travellers 11 yo 2005/2017 (66.1%, The Whisky Barrel, Rabbie’s Rum, Belize, barrel #33SFBT) Yay, this is much lighter! Colour: full gold. Nose: there’s simply more oak influence in this one, more vanilla, cake… And rather more smoke as well, it seems. Barbecue? Let’s check that… With water: some pencil shavings coming out this time. Ex-bourbon wood? Crushed bananas, vanilla extracts, hay, fresh sawdust… Mouth (neat): ultra-powerful, this baby will send you to paradise if you swallow more than three drops at a time. So… With water: same feeling of oak extracts, beyond the pleasant notes of blood oranges and breakfast honey. It reminds me of many a modern NAS Scotch malt, in a way. Finish: medium, leafier. Green tannins and coconut. Comments: I think this powerful baby is very hard to handle. You’ll need a very competitive pipette. SGP:561 - 79 points.",79,2017-03-26,https://www.whiskyfun.com/archivemarch17-2-Glenfiddich-Ardbeg-Macallan.html,be712fdab75787f119bd2fa9fa6a9550013d46430fc184731a5e5d2f49b5eb45
"Chalong Bay 2016/2016 ‘Thai Sweet Basil’ (40%, OB, Thailand)","Chalong Bay 2016/2016 ‘Thai Sweet Basil’ (40%, OB, Thailand) This baby doesn’t claim to any rumminess, as the sugarcane spirit was ‘vapour infused’ with Thai basil right during distillation. Something pretty innovative, it seems. Should be fun, since Chalong is a great distillate. Colour: white. Nose: ueber fun stuff! Some kind of demoniacal gingerbread dry liqueur, smoky, earthy, and of course extremely herbal. I think this will beat most urban gins that our friends the hipsters are making (and drinking) these days. It’s just rather hard to describe, my bad… Mouth: I rather get bags and bags of caraway, to tell you the truth, and I cannot not think of these eau-de-vie de cumin that my Alsatian compatriots are making when they are running out of williams pears or marc de gewurz’. Some aniseed for sure, dill, fennel, caraway indeed, genepy, wormwood… It’s really fun, but it may need one or three ice cubes if you want to sip more than one spoonful of it. Finish: medium and perhaps a little toothpaste-y? Comments: great, just a little tiring. So greatly made, but anecdotal. Unless it’s got some demonstrable medicinal benefits… Has it? SGP:472 - 75 points.",75,2017-03-26,https://www.whiskyfun.com/archivemarch17-2-Glenfiddich-Ardbeg-Macallan.html,b1772d0f1bba9205c862b5bcf3cd21d8e549dc9a354887ea9dd446261ee68024
"Braeval 18 yo 1997/2016 (48.4%, Douglas Laing, Old Particular, sherry butt, 323 bottles)","Braeval 18 yo 1997/2016 (48.4%, Douglas Laing, Old Particular, sherry butt, 323 bottles) Colour: gold. Nose: a rather leafy and leathery sherry, with the obligatory walnuts and a few medicinal touches (grassy cough syrup). Green coffee beans, perhaps, then more straight maltiness and just hints of butterscotch. Mouth: same mildly medicinal arrival, then large slices of walnuts cake, cinnamon cake, and ginger cake. A tannicity as well, cedar wood, sucking liquorice wood… Tends to get spicier, with also notes of grapefruits and greengages. Finish: rather long, a tad peppery, with a maltier aftertaste again. Comments: all good, solid and honest malty Speysider with good oomph. SGP:351 - 83 points.",83,2017-03-24,https://www.whiskyfun.com/archivemarch17-2-Glenfiddich-Ardbeg-Macallan.html,4effc23b58bd212dc64fe044c56b727fa9f22f8a016d3cd907cb834a719eb7b0
"Braes of Glenlivet 12 yo 1994/2006 (57.2%, Scotch Malt Whisky Society, #113.2, ‘Compote of wellies’)","Braes of Glenlivet 12 yo 1994/2006 (57.2%, Scotch Malt Whisky Society, #113.2, ‘Compote of wellies’) Colour: straw. Nose: rather harsh, with more leather and rubber than in the 1997, and a rather mineral maltiness, around limestone, fresh concrete… Rather unsexy so far. With water: more fresh concrete, chalk, clay, gravel, and also broken branches, roots… So a very austere style, but a style that I do rather enjoy. Mouth (neat): more ‘young’ fruits, well in the style of many a young unsherried Speysider, that is to say full of orchard fruits, apples, pears, plums… With water: a simple fruit salad, with a touch of mint and, perhaps, rosehip (eau-de-vie, did you know that some Alsatian distillers make some very good rosehip/eglantine eau-de-vie?) Finish: medium, and fruitier again. All those small berries, sorb, elder… Comments: another one that was all good, solid, and honest. SGP:461 - 82 points.",82,2017-03-24,https://www.whiskyfun.com/archivemarch17-2-Glenfiddich-Ardbeg-Macallan.html,a5016027fcc76820707ceba4e835ecaed3105b4b6ba801cb1138be8f77c66bad
"Braes of Glenlivet 22 yo 1994/2016 (51.7%, Maltbarn, bourbon, 197 bottles)","Braes of Glenlivet 22 yo 1994/2016 (51.7%, Maltbarn, bourbon, 197 bottles) Colour: straw. Nose: all right, exactly the style of the SMWS, only more mature, that is to say better ‘mingled’ and with more oak. That kind of oak translates into some nice mentholy and liquoricy vanilla plus a little coconut. Perhaps dandelions? With water: as often, tends to become a little earthier, as well as more mineral. Mouth (neat): sweet and creamy, at times you would think it is bourbon. Coconut balls, vanilla, cinnamon and ginger cake… I’d even swear there is some rye inside. Serious. With water: very good, easy, creamy, and even a little gewurztraminerish. Okay, okay… Finish: medium, a little more spice-forward. Ginger, nutmeg… Comments: a very excellent cask for sure. I dig this creamy one. SGP:551 - 87 points.",87,2017-03-24,https://www.whiskyfun.com/archivemarch17-2-Glenfiddich-Ardbeg-Macallan.html,643c3a951aa7696ab90bd7b2feffa646b9e9b541918d1a29b51302e410183f24
"Lochindaal 2009/2016 (65.7%, Caora, first fill bourbon, cask #r10/002-100, 343 bottles)","Lochindaal 2009/2016 (65.7%, Caora, first fill bourbon, cask #r10/002-100, 343 bottles) Caora are a new Swiss independent bottler from Olten, which lies very close to Alsace. This one-off baby from Bruichladdich was peated to 50ppm, so it may lie somewhere between Port Charlotte and Octomore. Now I’m not sure it’s very smart to start a session with a whisky this strong, cough, cough… Colour: pale gold. Nose: this instantly reminds me of the bottlings done by those crazy Swedes named Svenska Eldvatten. It’s powerful yet pristine smoky malt, in the regions of mezcal and gentian (which, by the way, they know very well in Helvetia). So far, so great. With water: a little lemon in a used ashtray, plus some damp hay. Mouth (neat): some kind of nuclear war happening on your tongue, but quite bizarrely, that’s bearable. Vanilla-ed smoked lemons? With water: immaculate smoky lemons and oysters, then tangerines. Unexpected echoes of old Laphroaig from the 1960. I’m dead serious. Finish: long, still pristine, ultra-clean, and beautiful. Comments: sublime young distillate by Bruichladdich with very minimal cask influence. I believe that was the key here. Grüezi miteinander! SGP:557 - 90 points.",90,2017-03-23,https://www.whiskyfun.com/archivemarch17-2-Glenfiddich-Ardbeg-Macallan.html,8700d818fb8edb2d10f41c9f37ed40ff841b318ec5ed701f8bba0c1b6c486a44
"Bruichladdich 15 yo 2001/2016 ‘Wild and Primitive’ (54.3%, by Silvano Samaroli)","Bruichladdich 15 yo 2001/2016 ‘Wild and Primitive’ (54.3%, by Silvano Samaroli) This lovely bottle stems from Silvano Samaroli’s very last personal venture in the world of whisky, which he had supervised. It’s not from the current ‘official’ Samaroli range that did not actually belong to him, contrarily to what many whisky people believe. Colour: deep gold. Nose: burnt butter! I mean, butter just before it burns in the frying pan. Then a stunning development on cigars, smoked teas, some kind of smoked wild trout fried in, yeah, butter, and some kelp on an Islay beach. It’s a smoky Bruichladdich, so a Port Charlotte. With water: some wee bits of rusty iron and the kelp dried up. Mouth (neat): it’s not often that sherry and wild peat tango this nicely. No off-notes and no rubber, rather bags and bags of smoky Seville oranges, plus some peppered tobacco, perhaps. With water: gets very leathery, herbal, almost Tabasco-ish at times. Finish: long and cigary. Comments: now we understand why dear Silvano did call this ‘wild and primitive’. Impeccable selection, totally expected, even if I tend to like the cleaner and leaner style of the Swiss one a notch better. SGP:466 - 89 points.",89,2017-03-23,https://www.whiskyfun.com/archivemarch17-2-Glenfiddich-Ardbeg-Macallan.html,e01269a688e17fab6fc3f1b8ad93478c956a8d5c78e9f194affaf5adc8308735
"Bruichladdich 13 yo 2002/2016 (52.7%, OB for The Whisky Exchange, micro provenance, bourbon, cask #12/214, 240 bottles)","Bruichladdich 13 yo 2002/2016 (52.7%, OB for The Whisky Exchange, micro provenance, bourbon, cask #12/214, 240 bottles) There’s more literature on these bottles than in Dostoyevsky’s complete works! Now we’re very glad to learn that this comes from a micro-provenance, but we’d also love to know about where that was. Colour: white wine. Nose: we’ve made a long break after the peaters, so we do indeed get all the lovely melons and peaches that abound here. Golden barley, custard, some cut grass… With water: we kind of recreated the first batch of the new ‘ten’. We’re good, we’re good. And even better, we’ve added a few rooty notes. Mouth (neat): gorgeous melony arrival (I think our friends the Provençaux are making some good melon liqueurs), then rather more tropical fruits (whacky guavas), then more classic golden syrups, acacia honey, and simply sweet barley. With water: no changes, it just became lighter. Finish: medium, fruity, with a hint of fudge. Perhaps the barrel. Comments: different style, same huge quality. A fine session. SGP:551 - 89 points.",89,2017-03-23,https://www.whiskyfun.com/archivemarch17-2-Glenfiddich-Ardbeg-Macallan.html,ef54573a782c9749b938a40c2edc06601ac5fd6b86b1ec58c882dfb9871d8b26
"Lagavulin 1999/2015 'Distillers Edition' (43%, OB, lgv 4/504)","Lagavulin 1999/2015 'Distillers Edition' (43%, OB, lgv 4/504) We’ve already tried last year’s DE but had missed the one from 2015. As usual, it’s finished in Pedro Ximenez (which is to whisky what a turbo-look is to Porsche, haha). Ah, the 1979… Colour: gold. Nose: I didn’t enjoy the 2016 too much, but this is nice, soft, rather complex, with a mild tarry side, some peelings and leaves, blood oranges, marmalade, raisins, oyster mushrooms, cigars, a touch of agave syrup, and the faintest whiffs of pencil shaving (a thing that sadly got much bigger in the 2000/2016). Mouth: super good. In a way, this is smoked cognac. Oranges, peaches, sea salt, raisins, liquorice, sweet tar, candied citrons, and of course smoke. Relatively mild and easy, some Lagavulin to sip without thinking too much about it. Finish: rather long, drier, with some chocolate and some salty marmalade. Some oak in the aftertaste, which is the only weaker part in my opinion. Comments: a rather sweeter and fruitier Lagavulin DE, but still with all flags out. SGP:556 - 87 points.",87,2017-03-22,https://www.whiskyfun.com/archivemarch17-2-Glenfiddich-Ardbeg-Macallan.html,571ff4b3e09a18f32dc69629081cab89e626f7cc1b87cb70c6bd4cef756a5c09
"Laggan Mill 8 yo 2008/2016 (46%, The Cooper’s Choice, cask #7391, 400 bottles)","Laggan Mill 8 yo 2008/2016 (46%, The Cooper’s Choice, cask #7391, 400 bottles) Only the name and the excellent bottler suggest this is Lagavulin, so we could be wrong. Could we? Colour: white wine. Nose: rather quiet, leafy, with notes of wormwood, chartreuse, aniseed, dill… and all that. Did that come from the cask? Then more damp earth and some very soft and light dry white wine. Say a nice verdejo from Spain. Mouth: it’s really a soft and rounded one, with some lemonised vanilla and some kind of blend with apple juice and brine inside. Soft sweet olives (do you know the picholines?) and a sooty/ashy touch. One of the most drinkable ‘clean’ Lagavulins out there, softer than the official 8 from last year. Finish: medium, easy, smoky and sweetly lemony. The aftertaste is really sweet. Comments: the easiest side of Lagavulin, quite aperitive-y. Shall we call it a ‘Netflix Lagavulin’? Bring the zakuskis! SGP:547 - 85 points.",85,2017-03-22,https://www.whiskyfun.com/archivemarch17-2-Glenfiddich-Ardbeg-Macallan.html,dbe8de55bd8bce853ebc726082526d9c235b29889eba32d46693e3d6c901a363
"South Shore Islay Malt 2008/2016 (48.8%, Valinch & Mallet, bourbon hogshead)","South Shore Islay Malt 2008/2016 (48.8%, Valinch & Mallet, bourbon hogshead) Perhaps from the same source… Colour: pale white wine. Nose: not quite identical to the Cooper’s, but close. A few grassier and more herbal elements, around parsley, and a rather drier style all in all. A little more mineral as well, chalky, slightly woolly… Mouth: once again, we’re close. Limoncello, apple liqueur (manzana something, they love it in Spain), even a little candy sugar, also kippers and smoked salmon, a feeling of cigar ashes, and only a very faint coastal side. Some pears for sure. I’d say we’re almost closer to some peaters from the mainland (say some peated Benriachs or Tomintouls). Finish: medium, rounded, sweet. Smoked pear juice. Comments: fine fine fine and uncomplicated. This one too shows that Lagavulin’s rather sweeter than Ardbeg (unless ex-unlikely wine wood) and Laphroaig (unless ex-unlikely wine wood). SGP:546 - 85 points.",85,2017-03-22,https://www.whiskyfun.com/archivemarch17-2-Glenfiddich-Ardbeg-Macallan.html,743606195bca60046312d76aeaf88d51198b85befd7ac321cb651c8b70e1d862
"Russenschnaps (52.3%, Unicorn Production, Regensburger Whiskyclub, 294 bottles, 2015)","Russenschnaps (52.3%, Unicorn Production, Regensburger Whiskyclub, 294 bottles, 2015) Said to be some genuine L*g*v*l*n vatted in Germany, also said to contain some very old ones and some younger ones alike. There might be many private jokes behind this wee bottling from Bavaria, but as an Alsatian, I won’t even try to decipher them, and we’re farer from Vladi in any case. Guys, you rock anyway. Colour: deep gold. Nose: the Distiller’s Edition at cask strength! Chocolate, raisins, leather, cigars, pencil shavings (a few), and a leafy smokiness plus various soft spices, around cinnamon. Also cakes, cinnamon rolls, also seawater, dried kelp, wood and coal ashes... With water: and here it goes, miso soup, soy sauce, caraway liqueur, cloves… It just loves water. Mouth (neat): hoppla! Indeed, it is the DE at cask strength, with ‘ideas’ of the famous official 21s as well, including this famous tarry, marmalade-y, and slightly gingery side. Massive whisky, this, I wouldn’t say it goes in for subtleties, but it is excellent. With water: indeed it loves water, as much as Ludwig II used to, but with better consequences. Tamarind jam, cranberries, smoked spices, aniseed, marmalade… Finish: long, with a wee bit of leather and more cigary notes. Comments: rather a Riesenschnaps! Water really unlocks it. SGP:567 - 90 points.",90,2017-03-22,https://www.whiskyfun.com/archivemarch17-2-Glenfiddich-Ardbeg-Macallan.html,f834958adcb58eb03de296dbe68a99c74860f5a360dac5cecdbea8054fa9c017
"Lg6 (53.7%, Specialty Drinks, Elements of Islay, 2016)","Lg6 (53.7%, Specialty Drinks, Elements of Islay, 2016) Always the same question, where do you sneak in any NAS when doing a verticale? Now the very tight and pure Lg5 had been very much to my liking (WF 91), so there’s much hope here… Colour: white wine. Nose: it first smells just like the Port Ellen Maltings when they’re working, and then you get some very vivid notes of lemon, manzanilla, seawater, cigar smoke, and hessian. All that is beautiful and extremely ‘millimetric’ (with apologies to the British Empire). With water: an even bigger feeling of ‘a visit to the PE Maltings’. Wonderful whiffs of bread dough, more hessian, Islay mud… Mouth (neat): starts bigly, quite hot, with the usual almondy and very faintly tarry fruitiness (yellow melons, grapefruits), then jelly babies and a huge smokiness, perhaps ashier than elsewhere in Lagavulinland. Shakes you a wee bit. Very beautiful sour background (cider apples and more manzanilla). With water: smoky barley water mixed with lemon juice. Finish: long, while the almonds are back. Comments: we’re extremely close to the distillate, and yet it’s not mew-make-y at all. I have the impression that this bright youngster is rather less fruity than its predecessors. Totally a fan. SGP:458 - 91 points.",91,2017-03-21,https://www.whiskyfun.com/archivemarch17-2-Glenfiddich-Ardbeg-Macallan.html,78ebade226349d6ea9c7e94a1658574cfe07810041112ba1e637b522cdf92a13
"Lagavulin 10 yo ‘Batch 2’ (53.7%, That Boutique-y Whisky Company, 239 bottles, 2016)","Lagavulin 10 yo ‘Batch 2’ (53.7%, That Boutique-y Whisky Company, 239 bottles, 2016) Colour: white wine. Nose: this one’s much sharper, grassier, and more austere and acrid, and makes the Lg6 rather resemble a Lochside 1966 by comparison. More or less. Burning grass, ink, soot, hessian again, tarry ropes… I can’t find one ounce of fruitiness or sweetness in there. With water: fresh tree bark, leaves, paraffin, green tea, engine grease… Mouth (neat): all the fruits that weren’t in the nose are there on the palate! Especially oranges and green pears. Sweets, then more and more salt playing with your lips. Aged on Islay? You never know… Some superbly dry marzipan as well, some salty pepper, a touch of wasabi… All that is very, very impressive. With water: long and fruitier yet. Nectarines and lemon and cream sweets. Finish: long, and magnificently lemony. Comments: a totally gorgeous young Lagavulin, a true competition piece. I’m totally falling for it. SGP:557 - 92 points.",92,2017-03-21,https://www.whiskyfun.com/archivemarch17-2-Glenfiddich-Ardbeg-Macallan.html,7b82d9c912d8d79ceb08bf2a70e5f1c0d6efe4a32a507ef4f4113c7af3a56dec
"Lagavulin 15 yo 2001/2016 (54.2%, OB, 200th Anniversary, Casks of Distinction, Private Collector Edition, hogshead, cask #9554, 264 bottles)","Lagavulin 15 yo 2001/2016 (54.2%, OB, 200th Anniversary, Casks of Distinction, Private Collector Edition, hogshead, cask #9554, 264 bottles) One of those intriguing and very speculative official private casks from last year. Welcome to the modern whisky world, where money has no smell (anymore). Colour: pale gold. Nose: very nice, of course, but nowhere near the two sublime youngsters. Some smoked butter, seawater, kelp, Pilsen beer, wet fabric… It’s all relatively soft, despite the high strength. With water: that old jacket after some heavy rain. Mouth (neat): very good, obviously, with some lemon curd and some salty tea (Tibetan style?) as well as plenty of ‘mineral’ citrus, some unexpected mangos, and a little cardboard in the background. A fizzy lemon, somewhere, sometime. With water: becomes a little drying, more tea-ish, with a green tannicity. Now it does not disintegrate, don’t get me wrong. Finish: medium, and rather soft for Lagavulin. Smoky oranges and earl grey tea. Comments: very good, and yet I’m experiencing a mild disappointment. Maybe I just expected too much. SGP:556 - 88 points.",88,2017-03-21,https://www.whiskyfun.com/archivemarch17-2-Glenfiddich-Ardbeg-Macallan.html,1da7a0427ea8f0732952877a6a195ebc62cd9708b54f7529c5f61500f4ca83d8
"Lagavulin 14 yo 1978/1992 (64.7%, Kingsbury, Japan, bourbon, cask #132)","Lagavulin 14 yo 1978/1992 (64.7%, Kingsbury, Japan, bourbon, cask #132) Cadenhead have had quite a few 1978s around that time, under various labels including this one by parent company Eaglesome ltd. But watch the very high strength… Colour: pale gold. Nose: this one’s very mineral this time, with a lot of linseed oil as well, graphite, hints of bay leaves, plaster, soot, clay, broken branches… So rocks rather than fruits or seaweed, this time. But remember, almost 65% vol. With water: more iodine for sure, more salty/coastal notes, sea spray, a little mint as well, oysters, eucalyptus… When comparing the modern ones to this one, one feels that Lagavulin got more smoky/ashy, and rather less maritime/camphory/medicinal. Mouth (neat): some fruity sweetness, some flavoured beer, Kriek-like, and some buttered apple cake with a good dose of ginger and slightly prickly pepper. With water: gets much more medicinal. Cough syrup, salt and mint mix, eucalyptus, more seawater, and rather more apples as well, while there’s very little citrus, if any. Totally wonderful, but you have to get the amount of water right. Finish: long, with more salty almonds this time and a wee feeling of paint and plasticine, which works very well. Ashes, and there, lemons! And pineapples! Comments: this baby really took its time but it’s true that it never quite saw this much water. Slow and superb. SGP:557 - 92 points.",92,2017-03-21,https://www.whiskyfun.com/archivemarch17-2-Glenfiddich-Ardbeg-Macallan.html,3c98fa108db009923a92be8e134ee4bf4ef8adf6cad048c963d19f2565f8269e
"Hyde 6 yo ‘No.3 The Aras Cask’ (46%, Hibernia Distillers, single grain Irish, bourbon, +/-2016)","Hyde 6 yo ‘No.3 The Aras Cask’ (46%, Hibernia Distillers, single grain Irish, bourbon, +/-2016) According to the label, this is supposed to be triple distilled grain whiskey. Ah?! Dr. Jekyll’s work? This bottle celebrate 1916’s uprisings. These distillers seem to source their whiskies. Colour: gold. Nose: pencil shavings and a little vanilla, plus nail polish remover. Baby whisky. Mouth: very young, varnishy, with a layer of oak, mocha, vanilla, and lemon fudge. Finish: short, quite spirity. Comments: I guess you have to start from somewhere. Reminds me of some bottom-shelf bourbon, but yeah, it’s drinkable – I’m not saying sippable. Lovely packaging. SGP:430 - 60 points.",60,2017-03-20,https://www.whiskyfun.com/archivemarch17-2-Glenfiddich-Ardbeg-Macallan.html,0a9b70d208b2e3a4108f6369fd6f9ca4ea8a5c1834042ee10d8d421a873a2fc6
"The Quiet Man 8 yo (40%, OB, single malt Irish, +/-2016)","The Quiet Man 8 yo (40%, OB, single malt Irish, +/-2016) Another sourced whiskey with a story and some very fashionable retro packaging sold by future distillers, it seems. Always the same story, brandbuilders vs. distillers. Colour: white wine. Nose: hold on, there is some action! Some shoe polish blended with apple juice and drops of turpentine, as well as quite some cough syrup. The bags of apple peelings and a wee touch of mango, which makes it very Irish indeed. Very nice. Mouth: indeed, very nice, with some roasted fruits (oranges) and some barley water, plus a kind of peppery smokiness that goes well. A touch of pear and pineapple, sign of youth. Finish: short, but that’s the low strength. Comments: it’s the blogger’s mantra, why only 40% vol. when the spirit is nice? Taxes? Come on… In any case, I like this one, with its Tyrconnelly side. SGP:541 - 78 points.",78,2017-03-20,https://www.whiskyfun.com/archivemarch17-2-Glenfiddich-Ardbeg-Macallan.html,e27b5b9e34144c8bedd702d28f8b920ee10b51e133048e6e7ae0e602d5b062f6
