whisky_name_raw,review_text,score,review_date,source_url,dedupe_hash
"Ardmore 12 yo 1986/1999 'Centenary' (40%, OB)","Ardmore 12 yo 1986/1999 'Centenary' (40%, OB) Of course it's not the first time that I try this baby, but it's the first time I'm writing (hopefully) proper tasting notes for it. I had it at WF 82. Colour: gold. Nose: a rather curious nose, quite modal I’d say (in Miles’ sense of the word.) Imagine a blend of wet cardboard, ashes, old turpentine and overripe apples and bananas, then add a glass of old vin jaune and a few crushed walnuts. In other words, it noses pretty antique. A little smoked ham too – by the way the smoke keeps growing but this baby never becomes ‘a peat monster’. Mouth: the nose was quite superb, but the palate’s a little wobbly, maybe because of the low strength. You know, it’s one of these ‘powerful’ drams that are lacking a backbone, in a way. That makes the cardboardy side stand out, and gives a slight feeling of smoked water. Or peppered lapsang souchong tea. I’d have loved to be able to try this batch at 46 or even 50% vol. Finish: not that short, but rather bitter. Cardboard again. Comments: a strange one. Again, the nose as quite superb, but the palate wasn’t up to the distillery’s current standards in my opinion. Because Ardmore’s great! SGP:453 - 80 points.",80,2014-09-03,https://www.whiskyfun.com/archiveseptember14-1-Clynelish-Brora-Benrinnes-Karuizawa-Glenlivet.html,21fa6b3d430a12ccb6b858c0571635a38cc875d858459bee9c45165bdf6f70ac
"Ardmore 14 yo 2000/2014 (49.8%, The Whisky Agency, Liquid Library, refill hogshead, 289 bottles)","Ardmore 14 yo 2000/2014 (49.8%, The Whisky Agency, Liquid Library, refill hogshead, 289 bottles) Colour: pale white wine. Nose: it’s a sharper, much cleaner, much more Islayian Ardmore after the old 12. There are touches of pineapples and pears, signs of youth, but other than that a mineral and ashy peat reigns supreme. There are also leaves, grass, tree bark and there, walnuts again (fresher ones this time.) You may add one peach. Oh and one drop of gentian eau-de-vie. And a dash of black pepper. And a little chalk or clay. Plaster? Mouth: very punchy, sharp, narrow, ashy, acrid, leafy, smoky, bitter… So it’s all very austere, probably not a whisky to pour your beginning friends. A lot of soot, ashes indeed, grass… And pepper. Finish: long and even more austere. Green pepper. Comments: I like Jansenist a lot, and this is a great one, but to me it’s a tad too… monastic? SGP:366 - 84 points.",84,2014-09-03,https://www.whiskyfun.com/archiveseptember14-1-Clynelish-Brora-Benrinnes-Karuizawa-Glenlivet.html,efe2cfeebca9ac45e705c9abf860f4065f619ba2a46de4896cb761022df2179d
"Ardmore 2000/2014 (50.2%, Svenska Eldvatten, refill bourbon, 180 bottles)","Ardmore 2000/2014 (50.2%, Svenska Eldvatten, refill bourbon, 180 bottles) Colour: pale white wine. Nose: a rounder and sweeter version this time, with a little more candy sugar, honey and custard at first nosing, which gives it an interesting ‘Lagavulin 12 CS’ feeling. More earth and gentian as well, green apples, an ashy smokiness, some touches of seaweed smoke (and mezcal?) and whiffs of bandages or embrocations. Tiger balm? Mouth: bang! Huge peat on a sweeter bed – when compared to the previous 2000. It’s still a bit acrid and bitter, or even pungent, and it’s certainly a dry whisky, but there’s a fruitiness that sustains it. Sweets and jellybeans plus a little vanilla-ed honey. A touch of cinnamon cake. Finish: long, with more pepper this time again. A pleasant zestiness too, leaves… Comments: I’m afraid I forgot to add water. I guess it didn’t need it. Certainly one of the peatiest Ardmores I could taste – and quite a boneshaker. SGP:457 - 87 points.",87,2014-09-03,https://www.whiskyfun.com/archiveseptember14-1-Clynelish-Brora-Benrinnes-Karuizawa-Glenlivet.html,d4012f67456413def61fc2289fe2cc71114141b1ac224a02676cea21ec02d24b
"Glenlivet 12 yo (43%, OB, unblended all malt, 75cl, +/-1978)","Glenlivet 12 yo (43%, OB, unblended all malt, 75cl, +/-1978) Could as well have been a little earlier, not too sure. Colour: gold. Nose: it’s a dry and rather smoky one at first nosing, as older Glenlivets could be. Gravel and soot, then overripe apples, hay, cigars and walnuts, with a metallic touch. Some OBE must have happened, because it’s rather earthier than other old young Glenlivets. Mouth: big stuff, much bigger than contemporary Glenlivet twelves. Sour and tart apples, grapefruit skin, candy sugar, plus these metallic touches again. Apple crumble and strong tea after a few minutes. Not too sure it’s clear that I like it… Finish: long and ample, almost heavy, with some liquorice and more tea. Comments: big spirit of high quality. And it’s still quite easy to find… SGP:462 – 85 points.",85,2014-09-02,https://www.whiskyfun.com/archiveseptember14-1-Clynelish-Brora-Benrinnes-Karuizawa-Glenlivet.html,dd9c55db22caaf36c4a1712c54b0c0fe3fcb63d92b2dd72425b3a309b3bfa7c6
"Glenlivet 12 yo (40%, OB, pure single malt, 75cl, +/-1985)","Glenlivet 12 yo (40%, OB, pure single malt, 75cl, +/-1985) I believe this version is less old than the previous one, but I’m ready to be proven wrong. Colour: light gold. Nose: yes, it is a much lighter spirit and that’s not just the lower strength. More grains, toasted oak, roasted nuts, straight malt and honey cake. Easy, light and undemanding. Cornflakes. Mouth: a little wishy-washy, grainy, with some overripe apples and a buttery side. Premox in whisky? Some cardboard too, sawdust… Pass! Finish: short and grainy. And dusty. Comments: another, much lower world, but you never know with these old bottles, could have been bottle ageing gone wrong. It’s the dustiness that’s the main problem. SGP:331 - 65 points.",65,2014-09-02,https://www.whiskyfun.com/archiveseptember14-1-Clynelish-Brora-Benrinnes-Karuizawa-Glenlivet.html,57e144c40c96df751f566953e650d14c95486934891af72af1e1f2393d17b90f
"Glenlivet 12 yo (43%, OB, pure malt, French import, 75cl, +/-1982)","Glenlivet 12 yo (43%, OB, pure malt, French import, 75cl, +/-1982) This baby used to be imported by Barton & Guestier. Colour: full gold. Nose: back to the style of the first one, with some soot, gravel, ashes, hay, smoke and overripe fruits. It’s actually even nicer, with notes of beeswax, pollen, old wood polish and then more floral notes, dandelions and such. Great nose. Mouth: fantastic! Bold, firm, smoky and superbly raisiny, with marmalade and honey aplenty, as well as notes of baklavas (orange blossom) and marzipan. Perfect balance and mouth feel, hurray! Finish: astoundingly long, with more marmalade and baklavas. Comments: a great bottle! Sadly, this one’s hard to find but I doubt various European countries/importers were getting different batches. SGP:552 - 86 points.",86,2014-09-02,https://www.whiskyfun.com/archiveseptember14-1-Clynelish-Brora-Benrinnes-Karuizawa-Glenlivet.html,8ea0cc5f14e1a1c3e56b2e64ed63b2a03dd70ecdda02f07aaac5d268c5e8ca00
"Glenlivet 15 yo (43%, OB, pure single malt, 1l, +/-2000)","Glenlivet 15 yo (43%, OB, pure single malt, 1l, +/-2000) Colour: full gold. Nose: a much lighter spirit again, this session is really a rollercoaster. In fact, it’s pretty complex, but it hasn’t got the oomph and the stamina of the old 12s. Gently floral, I’d say, with a little honey and warm brioche. Plus other pastries, this is almost a breakfast malt. But there’s some elegance in there… Mouth: indeed, it is much lighter than, for example, the 12 for France. It’s also a little cardboardy, with also some toasted bread, cornflakes, a little chocolate, roasted chestnuts, overripe apples, raisins, honey… Everything is very okay, it’s just a little ‘simple’ for a 15yo malt whisky. Finish: rather short, a bit sugary, with some honey and cakes. Comments: I found this one a little too simple on the palate, but it was still honest and loyal malt whisky. SGP:441 - 78 points.",78,2014-09-02,https://www.whiskyfun.com/archiveseptember14-1-Clynelish-Brora-Benrinnes-Karuizawa-Glenlivet.html,021b68c9ea7286233aefd6bce9145f591f864190318661acca7977ad57380bb2
"Glenlivet 18 yo (43%, OB, pure single malt, +/-2002)","Glenlivet 18 yo (43%, OB, pure single malt, +/-2002) Colour: full gold. Nose: we’ve got the drier style again, but there isn’t any smoke, nor soot, ashes and all that. It’s rather hay-like dry, and the whole’s rather more herbal this time. Touches of camphor, cough medicine, rhubarb pie, then the expected honeyed oranges, baklavas, roasted nuts, toasted oak and all that. A very fine nose, let’s only hope it’ll also deliver on the palate. Mouth: it’s certainly good, and certainly very Glenlivet, with this honeyed maltiness and all these overripe apples and pastries. Good body, good nuts (roasted of course) and good marmalade. Ultra classic malt whisky that’s made to please anyone. Who wouldn’t enjoy this? Finish: good length. More honey, pastries, raisins and overripe apples. Ueberclassic. Comments: it’s hard to disagree with this classic. Not very moving, but all very fine. Classic indeed. SGP:541 - 82 points.",82,2014-09-02,https://www.whiskyfun.com/archiveseptember14-1-Clynelish-Brora-Benrinnes-Karuizawa-Glenlivet.html,6e6018566e0874c5b142e277b6fb8c98a9e0bdf391ffb1e07d751ddd2d4be337
"Glenlivet 16 yo 1986/2002 (58.2%, Glenscoma, sherry, cask #013469, 300 bottles)","Glenlivet 16 yo 1986/2002 (58.2%, Glenscoma, sherry, cask #013469, 300 bottles) As you may know, Scoma is one of the pioneering German bottlers. Colour: deep gold. Nose: narrow honeyness, I’d say. But if you like anything honeyed as much as I do, it’s just great. I also find a lot of mead, which isn’t that usual, then cider and even calvados. Fun stuff! With water: woof! It became simple and even narrow. Nosing a Mars bar. Mouth: punchy, very raisiny and very orangey. Cointreau and sultana juice (you may call that Sauternes, or Monbazillac), fifty-fifty. Oops, almost forgot to mention honey. With water: once again, water made it narrower. Sweet white wine and sultanas. Finish: good length, honeyed. That’s all, folks. Comments: it started well and I had high hopes, but beyond the lovely honeyed and raisiny notes, there wasn’t much. And water wouldn’t quite work. But it’s still a very solid malt whisky. SGP:541 - 83 points.",83,2014-09-02,https://www.whiskyfun.com/archiveseptember14-1-Clynelish-Brora-Benrinnes-Karuizawa-Glenlivet.html,abad99ec02b49acdca73f32121b50f486e72c6b8bb08d8a4cc199cdc975fe37c
"Glenlivet 1993/2006 (53.4%, Whisky-Fässle for Whiskymaniacs Süd-West, sherry)","Glenlivet 1993/2006 (53.4%, Whisky-Fässle for Whiskymaniacs Süd-West, sherry) Whisky Fässle’s bottlings are usually excellent, so I try to taste them as soon as I come across them, but this time this baby had wriggled out of my clutches. As for these Whiskymaniacs Süd-West, that’s the Southwest of Germany and no, nothing to do with the Malt Maniacs. Colour: pale gold. Nose: we’re now closer to the barley, which is something I always like. It’s almost bready, quite brioche-y (what?) and even croissant (excuse me?) Add some chocolate and you’ve got it. Nice, as they say. With water: same, nice, malty sweetness. Mouth (neat): more bread and pastries, with a firm body and a great maltiness. Also maple syrup, raisins as almost always, cornflakes… Another ultra classic Glenlivet that could have been an OB. With water: an OB indeed! Finish: good length, honeyed, malty, candied… Comments: me like mucho-mucho, even if it’s not quite ‘an alternative to the officials’ as some IBs would say. SGP:541 - 86 points.",86,2014-09-02,https://www.whiskyfun.com/archiveseptember14-1-Clynelish-Brora-Benrinnes-Karuizawa-Glenlivet.html,b7ccb7a57fd1a99237144a01a2ff1b64ee5a9f90c94d01331db910babfa20d22
"Glenlivet 14 yo 1980/1995 (57.3%, Cadenhead, sherrywood)","Glenlivet 14 yo 1980/1995 (57.3%, Cadenhead, sherrywood) How many monsters have we seen within this old series? Tremble, mere mortals… Colour: amber/mahogany. Nose: oh this is totally unusual. Imagine a combination of tamarind, roses, muscatel, blood oranges, cassis jelly and iris. I’d swear it’s the first time I come across this association in whisky. Well not only in whisky. And I just love it! With water: that profile remains but there’s also more chocolate and prunes. The whole combination makes it a little armagnacky, all for the (even) better. Mouth (neat): totally in line with the nose. We’re eating some cassis jelly – or drinking a glass of crème de cassis de Dijon, as you like. How funny! With water: once again, the chocolate strikes back. Another one that swims like Mark Spitz. Finish: long, superb, smooth, cassissy (cut the crap, S.) Comments: a very great bottle. In my experience Glenlivet takes heavy sherry particularly well, maybe because its relatively light style does not contradict the brave Spaniard. SGP:651 - 91 points.",91,2014-09-02,https://www.whiskyfun.com/archiveseptember14-1-Clynelish-Brora-Benrinnes-Karuizawa-Glenlivet.html,06dfc1a89ed476b78cedacfb985b5941145214edbe0bd9ed2f9f6c07ff2095a2
"Glenlivet 1974 (57%, Gordon & MacPhail, CASK series, twist cap, +/-1993)","Glenlivet 1974 (57%, Gordon & MacPhail, CASK series, twist cap, +/-1993) The 57% vol. look like it’s simply ‘100 proof’ but it’s well natural cask strength. Colour: full gold. Nose: it’s funny how this baby reminds of the strongest official 12s that we just had. Styles are similar, with whiffs of wood smoke on top of an honey-glazed apple pie, a bunch of various roasted nuts (rather almonds this time) plus the obligatory marmalade. Simple and straight. With water: a little hay coming out. Mouth (neat): big and all on honeyed raisins, brioche, baklavas and marmalade. Not much else to say, this isn’t really complex but it works pretty well, like a one-cylinder Ducati engine (right, make that Yamaha.) With water: no further changes. Finish: rather long but it remains simple. Honey cake. Comments: very good whisky, but I wouldn’t say there’s much happening in there. Hello? My exact definition of a 80-pointer. So… SGP:551 - 80 points.",80,2014-09-02,https://www.whiskyfun.com/archiveseptember14-1-Clynelish-Brora-Benrinnes-Karuizawa-Glenlivet.html,2ee6d0dcdcedb3894787466f559a267a545f2789ca154696526198b58e45c815
"Glenlivet 37 yo 1974/2012 (46%, Berry Bros & Rudd for Whisky.com.tw, cask #5247)","Glenlivet 37 yo 1974/2012 (46%, Berry Bros & Rudd for Whisky.com.tw, cask #5247) BBR have already got several great Glenlivets. High hopes here… Colour: deep gold. Nose: it’s a very floral one, all for the better. Pollen and nectar, dandelions and buttercups, then sultanas and touches of polished oak. Around an old humidor or ‘grandma’s wardrobe’. Add a few roasted, or rather toasted nuts. A wee earthiness arising over time, all for the better. Mouth: a bit narrow now, not exactly tired but it lacks stamina. Overripe apples, marmalade and glazed chestnuts. Then more and more black tea, that’s the oak speaking out. A touch of menthol too, most probably from the same origins. Finish: medium length. Same flavours, same balance. Comments: extremely good but just like with the G&M, it may lack more… presence? Having said that, it’s a different league and quality is high, as expected. Just not one that you’ll remember forever, perhaps. SGP:551 - 85 points.",85,2014-09-02,https://www.whiskyfun.com/archiveseptember14-1-Clynelish-Brora-Benrinnes-Karuizawa-Glenlivet.html,53e6edb2953f9509b25f4f3402a10e48dee61b3dd5ada520569eaf667aff8c17
"Glenlivet 38 yo 1973/2012 (48.6%, John Milroy, Frisky Whisky, sherry wood, cask #1005)","Glenlivet 38 yo 1973/2012 (48.6%, John Milroy, Frisky Whisky, sherry wood, cask #1005) I feel I should apologise because of the blitz on the picture. These golden labels are just very hard to photograph (right, to iPhonise.) Colour: gold. Nose: we’re very close to the BBR, although this one also has a welcome tropicalness, around mangos and maybe papayas. Add those notes to the expected honey and ripe apples and you get the kind of very beehive-y profile that we all loved so much in… Caperdonich 1972. So, all great so far, in spite of the very, and I mean very unlikely label. Mouth: just excellent. Oranges, honey, wax, mangos, more oranges, more honey and a touch of warm croissant. Just excellent indeed. Finish: quite long, zestier, without any obvious oakiness, candied… This is almost like orange blossom honey and it’s only in the aftertaste that more oak spices do show up, around cinnamon and white pepper. A touch of earth. Comments: okay, not mindbogglingly great (what?), but I find this baby just excellent. Drinks very very well. SGP:651 - 88 points.",88,2014-09-02,https://www.whiskyfun.com/archiveseptember14-1-Clynelish-Brora-Benrinnes-Karuizawa-Glenlivet.html,c04fac3901eda5db1294574fca9927f85b069fb93c46ce1d7e8456eaa913de5d
"Glenlivet 21 yo 1963/1984 'For the Chairman' (43%, OB)","Glenlivet 21 yo 1963/1984 'For the Chairman' (43%, OB) I won’t explain to you how rare this bottle is, but after all, this is Whisky ‘fun’. I’ll just add that apparently, the Chairman had it good, as this is bottle #837. Eight hundred and thirty seven - or more – bottles, only for the Chairman? Anyway, a superb label, can we have more of those please? Colour: amber. Nose: now I understand why this isn’t a bottle ‘For the Gardener’, or ‘For the Brewer’, or even ‘For the Stillman’. Indeed, this nose is extraordinarily Chairmanly (is that a word?) and extremely complex. You have to ‘deep-nose’ a bit because it’s well a whole, but then you’ll find Corinthian raisins, old cigars, manuka honey (I swear), all kinds of nuts, genuine artisan maple syrup, a touch of leather polish and many tinier elements, including old teas and whiffs of barbecue smoke. Old Glenlivet’s smokiness is back. Mouth: less emphatic, I’d say. Maybe it’s the old bottle, but I find it flattish, tea-ish and tired. It must be the old bottle. Come on, The Chairman! Finish: a little short, cardboardy. The maddening thing about it is that one can feel that it used to be great. Nicer nutty aftertaste, though. Comments: old bottles are always a gamble. This oldie had superb afterglows in the nose, but the palate was tired. Hard to score, let’s remain diplomatic – because you know, he was The Chairman. Disclaimer: other bottles may be fantastic, as always with old bottlings. SGP:351 - 78 points.",78,2014-09-02,https://www.whiskyfun.com/archiveseptember14-1-Clynelish-Brora-Benrinnes-Karuizawa-Glenlivet.html,01cfbe5621b66ef56e39c73421484b25c24b895c194866ff3376f08e629e114c
"Glenlivet 1961 (57%, Gordon & MacPhail, licensed bottling, 75cl, +/-1990)","Glenlivet 1961 (57%, Gordon & MacPhail, licensed bottling, 75cl, +/-1990) A big phat classic G&M, this should work. Sadly, no year of bottling tag on the neck or anywhere else on the label. Colour: red amber. Nose: isn’t this rather an old Demerara rum? Port Morant? Instant chocolaty pleasure, with exactly the right amount of tiny phenolic things that add so much depth, I’d even say relief. Liquorice, tar, pitch, lovage… But all those remains tiny, while both the chocolate and the prunes keep ruling this nose. Immediate and implacable. With water: yess! Engine oil and all that… So even more depth. Mouth (neat): s.u.p.e.r.b. Bags of prunes and buckets of liquid chocolate, plus quite a lot of Corinthian raisins (I’m often quoting those because in my experience, they’re very different, deeper and more flavourful than other, smoother ones.) Immediate, obvious, instant sherried pleasure. Well done again, G&M. With water: yess! Someone may have thrown a few litres of old Ardbeg into, the casks. Unless the filters… you know, the filters… Finish: long, on smoked prunes. And an superb touch of salt in the aftertaste. Salt in a Glenlivet? Comments: I know some chocolatiers who are adding a little salt to their blackest productions. We’re in similar territories here. SGP:462 - 91 points.",91,2014-09-02,https://www.whiskyfun.com/archiveseptember14-1-Clynelish-Brora-Benrinnes-Karuizawa-Glenlivet.html,c8506764a8109c805cec4adb2c2a322e147f28f5c7b398a7b49f529c9fe49925
"Haig 'Club' (40%, OB, single grain, 2014)","Haig 'Club' (40%, OB, single grain, 2014) A combination of three various cask types of undisclosed ages packaged in a clever Chanel-like blue bottle that should appeal to people (women?) who are not into whisky. For FZ’s Suzy Creamcheese? Colour: pale gold. Nose: very, very mild, reminding me of some aged vodka that I could try a few years ago. A little sawdust, a little vanilla, not much coconut (hurray!) and very little bready/cerealy character. A little green tea, perhaps? It’s all extremely harmless, which, in a sense, means that there aren’t any flaws – because there just cannot be any. Touches of marshmallows arising after two minutes, which makes it a little girly, if I may. Mouth: very sweet, very light, extremely easy, the exact opposite of malt whisky. Thin body, a little vanilla, liquorice allsorts, marshmallows and a little grass that imparts a welcome bitterness (or it would taste like vodka-Red Bull, without the effects.) Finish: almost none. Comments: a very light spirit, I can well imagine that youngsters who are coming from vodka would find this to their liking. And then put the bottle on the telly. SGP:530 - 72 points (just like its brother the well-known, and very under packaged Cameron Brig, that’s what I just noticed.)",72,2014-09-01,https://www.whiskyfun.com/archiveseptember14-1-Clynelish-Brora-Benrinnes-Karuizawa-Glenlivet.html,8ca03ded7f018eea0f72c7c1c9e51590ae48dae321005721200ed14ce393923c
"Cameronbridge 29 yo 1979/2008 (50.3%, Duncan Taylor, cask #46, 258 bottles)","Cameronbridge 29 yo 1979/2008 (50.3%, Duncan Taylor, cask #46, 258 bottles) Colour: pale gold. Nose: same profile as the Haig, light and innocuous, but of course the higher age and strength do add oomph and even complexity. A typical oak-driven spirit, with vanilla aplenty, then marshmallows and coconut, then a welcome oiliness. Sunflower seeds? A little fudge as well, Werther’s Originals, butterscotch... Uncomplicated but balanced. Needs no water, for sure. Mouth: typical again. Sweet, vanilla-ed and extremely marshmallowy, with first a good mouth feel but then the body gets thinner and thinner, which often happens with grain in my experience. Notes of orange drops. Finish: short, all on bubblegum. Nice notes of tinned pineapples in the aftertaste, and very little spiciness. Comments: very fine, just a little boring. Not that I was expecting more, really… SGP:540 - 79 points.",79,2014-09-01,https://www.whiskyfun.com/archiveseptember14-1-Clynelish-Brora-Benrinnes-Karuizawa-Glenlivet.html,fc2542ff66cfa1d7b11f22af0da52003955fed4f63192886db47a69ffbeed58f
"Cameronbridge 30 yo 1978/2008 (56.6%, Adelphi, cask #5, 238 bottles)","Cameronbridge 30 yo 1978/2008 (56.6%, Adelphi, cask #5, 238 bottles) Colour: light gold. Nose: styles are obviously similar, this one’s just bigger and, I have to say, perhaps a little solventy, but that may be the strength. Marshmallows and vanilla, orange drops, new oak. With water: ah, some pleasant oak. Visiting a carpenter’s workshop, while wolfing a large pack of marshmallows and drinking coconut milk. Or a piña colada. Mouth (neat): good, powerful, rather fruitier, but we’re always on sweets and drops rather than on fresh or dried fruits. Always this feeling of chewing bubblegum. With water: more of all that, but we’re more on the citrusy side. Orange drops. Finish: rather short, but with even more orange drops. Comments: very fine, but three are enough for one man. One of the better bottlings for sure. SGP:530 - 82 points.",82,2014-09-01,https://www.whiskyfun.com/archiveseptember14-1-Clynelish-Brora-Benrinnes-Karuizawa-Glenlivet.html,aaf3e7bb4921315b7e9c36577c4deb7b435c73bce6817cc5f222432c328ea812
"Glenglassaugh 20 yo 1986/2006 (46%, Bristol Spirits for The Collection of Whiskies, Russia)","Glenglassaugh 20 yo 1986/2006 (46%, Bristol Spirits for The Collection of Whiskies, Russia) Thanks to some Russian friends on Facebook, I could learn that this series was made for Kollektsia Vin, a chain of wine shops in Moscow that was later bought by supermarket company Azbuka Vkusa, in 2010. So the range doesn’t exist anymore. How this bottle ended up in a nice little Breton wine shop, I don’t know. Colour: straw. Nose: typical. There’s a slight feeling of warm paraffin at first nosing, maybe touches of printing ink, then more moss and grass, as well as green apples. All that is rather fresh, and gets maltier after one minute or two. Porridge. Mouth: it’s good, solid malt whisky, with an orangey freshness, apples, always this slight waxy feeling, grass and then a few fresh walnuts. There isn’t much happening, but the feeling is pleasant. Finish: of medium length, always on oranges, walnuts and light wax. Rather cider in the aftertaste, with a sourness. Comments: maybe not a malt I’ll remember forever, but it went down well. SGP:451 - 82 points.",82,2014-09-30,https://www.whiskyfun.com/archiveseptember14-2-Glenglassaugh-Glenlivet-Glenfarclas-Macallan-Port-Ellen-Ardbeg.html,563008b66327da3d271241940df776afe8d8817c6998b8c9ab6fad8bf3cb3691
