whisky_name_raw,review_text,score,review_date,source_url,dedupe_hash
"Secret Lowland 42 yo 1976/2019 (46.2%, The Nectar and The Whisky Agency, bourbon)","Secret Lowland 42 yo 1976/2019 (46.2%, The Nectar and The Whisky Agency, bourbon) Oh no, looks like this is only a grain whisky, while I had expected Rosebank! My mistake, I haven’t been careful enough, but who knows, with good age some grains can be pretty good (while the young ones are just… terrible). But why would anyone ever mention a region when characterizing a humble grain? Colour: pale gold. Nose: okay, this is rather nice. A little thin, but nice. Sweet maize, popcorn, croissants and a little custard. Meringue. Mouth: fine butterscotch, buttered popcorn, notes of lemon curd, herbal tea (chamomile)… But it’s rather thin, as most grain whiskies are, unless aged for a very long time in stupendous sherry casks. Finish: short, on marshmallows and coconut balls. Comments: a little disappointed. It’s true that I had expected Rosebank or St. Magdalene (get your head out of the clouds, S.!) SGP:531 - 79 points.",79,2020-01-28,https://www.whiskyfun.com/archivejanuary20-2-Caol-Ila-Springbank.html,24500bb25ba7924727026cda900501b4fb013badedcae970e4e935b216319704
"Speyside Single Malt 45 yo 1973/2019 (45.1%, The Whisky Show 2019, sherry butt)","Speyside Single Malt 45 yo 1973/2019 (45.1%, The Whisky Show 2019, sherry butt) You know, these crazy bottles that need ultraviolets… It was about time I tried this baby, we’re having deep hopes here. Colour: gold. Nose: we know these. Nectar, pollen, honeys, figs, dates, buttercups and gorse, blood oranges, mead… You can’t have much better ones within this style. The freshness is very impressive; mind you, this baby’s older than me (sadly not). Mouth: the oak’s already a little loud, and drying, and a tad too mentholy and sappy, but all the rest is brilliant, led by fearless figs and the strongest honeys there is (chestnut, manuka, fir). Some bitter oranges, some salty touches (say crayfish quenelles – whatever) and some cocoa. Finish: long, a tad less fresh, and a little oaky. Comments: I suppose this should have been bottled five or ten years ago, but it remains very brilliant whisky. SGP:461 - 89 points.",89,2020-01-28,https://www.whiskyfun.com/archivejanuary20-2-Caol-Ila-Springbank.html,4c9950afad0ee4733ff28142c406573800f0475d08cd18faa0ac93c6eabd2051
"Blended Malt 25 yo 1993/2018 (47.1%, The Whisky Fair, sherry wood)","Blended Malt 25 yo 1993/2018 (47.1%, The Whisky Fair, sherry wood) This baby was bottled to celebrate Limburg’s famous Whisky Fair. Indeed, we’re late again. Colour: amber. Nose: starts both dry – as far as sherry’s concerned – and pretty waxy, gets then even ‘blacker’, tobacco-y, nutty, tea-ish, with just hints of old ointments and perhaps a little rancio. You would be forgiven for thinking this is an old bottle. No, 2018 is not ‘old’, let’s not exaggerate. Mouth: really very good, very nutty (walnuts), with notes of raw house jams, black tea, fruitcake, Stolle, and hints of four-spice blend (quatre-épices). That would include cloves and cinnamon. Very good. Finish: of good length, more on homemade fruitcake, with perhaps hints of masala and an even spicier aftertaste. Comments: no complains, only praise. I’d only add that it would rather be for your (silver) hipflask than for your authentic vintage Eames lounge chair. SGP:561 - 87 points.",87,2020-01-27,https://www.whiskyfun.com/archivejanuary20-2-Caol-Ila-Springbank.html,9f0469c405356e63d83864ec2d476d274a012056627b3f52b7f222519ac4135d
"Secret Highland 31 yo 1987/2019 (49.6%, Whisky Nerds, hogshead, cask #27, 167 bottles)","Secret Highland 31 yo 1987/2019 (49.6%, Whisky Nerds, hogshead, cask #27, 167 bottles) This one is a single. Macallan, obviously – just joking. Colour: amber. Nose: just lovely, on raisins, figs, dates, some fresh fruitcake, pollen and honey, mint cordial, some young pu-erh (earthy tea), an awesome earthiness (anything around mushrooms, really), and a lovely mustiness. Refill sherry hogshead? Tends to get a little dusty, but that’s just nothing. Mouth: some smoke, some mint, some pine-y liqueurs, some cracked pepper, something mineral, all things oranges, mosses, liquorice… It really is some firm whisky, not easy to pin down because each and every time you’re having an idea (could this be Pulteney? HP?) you’re finding other flavours that would rather discard those options. Perhaps a special brew from Loch Lomond’s? Plus, the sherry’s still rather active here. It’s a sherry hogshead, right? Finish: rather long, perhaps a touch too oaky now, but altitude remains high. Comments: frankly, it’s highly frustrating not to know about the distillery, in no small measure because you just cannot generate images in your mind. Imagine, it’s as if Led Zeppelin had only done records and just never revealed who was their singer. Yeah of course I know that wasn’t Clapton. SGP:551 - 88 points.",88,2020-01-27,https://www.whiskyfun.com/archivejanuary20-2-Caol-Ila-Springbank.html,ed4959dd474117dad2fa9af72286fc7116b98c4409998f841406d1032d24786d
"Vega 22 yo (43.9%, North Star Spirits, blended malt, 1205 bottles, 2019)","Vega 22 yo (43.9%, North Star Spirits, blended malt, 1205 bottles, 2019) Colour: deep gold. Nose: starts with brown toasts and some pretty earthy black tea, as well as some bitter chocolate and some kind of old mint cordial from and old bottle from an old European country. Mushrooms and autumn leaves tend to win it after a few minutes, while the whole would get even more mentholy. Sauna oils. Finnish malt? No, looks like this is rather Scottish… Mouth: very good! Many pine-y elements, needles, sap, some black raisins and some prunes, certainly some heavy pipe tobacco, marzipan-filled dates, chestnut honey, some thicker herbal liqueurs (ever tried Unicum?), all that with a solid body and a perfect, slightly oily mouth feel. Drops of caraway liqueur, perhaps. Try the Alsatians’! Finish: pretty long and balanced, not something that’s that common. Dried figs and a wee touch of curry in the aftertaste. Comments: I’ve heard they’ll have a bottle of this in the glove compartment of James Bond’s next Aston Martin. No, really. Anyway, whether this is a proper blend or a single malt in disguise (the industry is losing us these days, isn’t it?) this middle-aged Vega is very, very good. SGP:641 - 88 points.",88,2020-01-27,https://www.whiskyfun.com/archivejanuary20-2-Caol-Ila-Springbank.html,4f1532d678d1bebc7882d424acef7674b7cb7eaddc8089bbeb24dcb0db80bbcc
"Sirius 31 yo (43.1%, North Star Spirits, blended malt, first fill bourbon barrel, 3582 bottles, 2019)","Sirius 31 yo (43.1%, North Star Spirits, blended malt, first fill bourbon barrel, 3582 bottles, 2019) A large small batch here, I’m really glad they manage to fork out this many bottles. Great work, no doubt, what’s more, the price is very fair. Colour: deep gold. Nose: fun stuff, full of fresh paint, bitter almonds, putty and Jamaican-rum-like esters. Then black olives, linoleum, and whiffs of rotting bananas. Funky rum-like indeed, looks like quite some bacterial fermentation has taken place here, somewhere, sometime… Having said that, the background remains classically malty and honeyed. Mouth: vive la difference! Indeed, this is totally unlike any other blend that I could try – while it’s not untrue that I’ve tried a few of them (don't let it go to your head, S.). Resins, varnishes, embrocations, coconut balls, barbecued marshmallows, Jäger, nori, Japanese caramel sauce for ramen… well, stuff like that. It is extremely unusual indeed, but that’s not this baby’s main asset. What’s sure is that the blender is a freethinker, and that he won’t ever work for Johnnie Walker. Finish: long, still a little varnishy, almondy, with a saltier aftertaste. Comments: you cannot not wonder if one of the casks wasn’t ‘something else’, perhaps something shipped by those fine distillers up there on Sirius. Seriously, this is not a blend for The House of Lords, but I doubt that was the goal in the first place. You have to be a little loco to be a fan – well, I’m very loco then. SGP:562 - 89 points.",89,2020-01-27,https://www.whiskyfun.com/archivejanuary20-2-Caol-Ila-Springbank.html,b035a05f2b2b6bdd7a2853abd1ac6a5fd87cfac1412d4a5862b006e270486533
"Prime Malt 15 yo ‘Selection No.1’ (45.7%, Munro Watson & Co., 75cl, +/-1980)","Prime Malt 15 yo ‘Selection No.1’ (45.7%, Munro Watson & Co., 75cl, +/-1980) This old bottle’s a single Islay malt, but the lovely white label does not obligatorily suggest this is Laphroaig. Let’s see… Colour: gold. Nose: I’m rather lost, once again. It is a tad medicinal (mercurochrome) but it’s also rather more herbal than any Islay malts that I know of, that is to say more on fern, mowed lawn, and just pine extracts and oils. While the smoke remains quite infinitesimal, if I may say so. It realty is very difficult to identify malt whiskies as soon as they’re a little ‘deviant’. Which reminds me of a very famous blender who, around twenty years ago and when asked – by this humble whisky enthusiast - to identify a very peaty Islayer that he had composed himself, had answered that it was a Lowlander. It was Laphroaig. Did I mention raisins? Mouth: good but not stellar. I’m thinking some deviant Lagavulin, perhaps. Salty soups, raisins, stout and ale, and even hops. Either too sweet, or too dry. Finish: rather long but a little sour, and sweet, and salty. Pine resin in the aftertaste. Comments: I don’t know what to say (yes, do us all a favor, S.) except that this could actually be Laphroaig from some kind of sweetened cask (PX, paxarette, weird mosto…) SGP:555 - 83 points.",83,2020-01-27,https://www.whiskyfun.com/archivejanuary20-2-Caol-Ila-Springbank.html,17b59c0d3573cfed30854a96f9fbd1a216b92eb0fd64d83c204e349e29f79d93
"Secret Blended Malt 18 yo 2001/2019 (46.4%, The Nectar and The Whisky Agency, sherry butt)","Secret Blended Malt 18 yo 2001/2019 (46.4%, The Nectar and The Whisky Agency, sherry butt) Looks like this would be the natural strength. We’ve often found the malts that were displaying natural low strengths pretty special, let’s see… Colour: deep gold. Nose: some chocolaty sherry, with dark raisins, some coffee, the expected walnut wine, black tea, and just hints of chives, perhaps. Mouth: we’ve known both Glenfarclasses and Macallans that were like this. Prunes, marmalade, espresso, chocolate, tobacco, bit of ham, a dollop of raspberry cream, leather, old Maury wine, a touch of flint, a drop of soy sauce… Finish: rather long, even more on cocoa and tobacco. Comments: this chocolaty malt just works, it’s a very classic so-called ‘sherry monster’. Some A’bunadhs were a bit like this as well, but enough with guessing games. GP:561 - 86 points.",,2020-01-27,https://www.whiskyfun.com/archivejanuary20-2-Caol-Ila-Springbank.html,0939d534af6ce92bba225a78aca57b9f263b8cf36ef332cd8aa818a7ce6eddc2
"Opthimus 25 yo ‘finished in Malt Whisky’ (43%, OB, Oliver & Oliver, Dominican Republic, 2014)","Opthimus 25 yo ‘finished in Malt Whisky’ (43%, OB, Oliver & Oliver, Dominican Republic, 2014) It seems that this one was finished in Tomatin casks – why would anyone do that, I don’t know. And no one believes this is truly 25 years old, in the sense that the younger component would be at least 25, but who knows? Having said that I had tried an earlier 25 yo in 2010 that I really enjoyed despite a very low strength of 38% vol. Colour: office coffee. Nose: it is not too heady, it is not too malty either, what I’m finding rather consists in bananas and pineapples, plus soft molasses, honey, liquid caramel, and some nice notes of cane juice, cigars and liquorice. All classic stuff. I have to say this is perfectly fine, probably one of my favourite Dominicans. But I’m no sucker for Dominican rums in general… Mouth: sadly way too sweet for me, but what’s behind that sweetness works well, with liquorice leading the pack, molasses, corn and maple syrups, and some candied cherries. Sadly, it tends to become both sticky and thin, which is bizarre, I agree. Starbucks’s latte with fifteen teaspoons of sugar per medium-sized cup (Grande). Finish: very short, so not exactly cloying. Caramel. Comments: I’m disappointed because I had had a much better Ophtimus 25 a long time ago, but all things considered, this could have been much worse. SGP:830 - 77 points.",77,2020-01-26,https://www.whiskyfun.com/archivejanuary20-2-Caol-Ila-Springbank.html,5e3227bf4b4ed90bb00959b71918eec3ebb3fea8b8ff9c22ec9b58bd02bdb346
"Long Pond 2009/2019 ‘CRV’ (42.6%, Plantation for The Whisky Exchange, Jamaica, Tokaji finish, cask #2, 198 bottles)","Long Pond 2009/2019 ‘CRV’ (42.6%, Plantation for The Whisky Exchange, Jamaica, Tokaji finish, cask #2, 198 bottles) This baby was shipped to France and finished in Tokaji for one year. A very strange idea, but since Tokaji is usually very sweet, could be that they subsequently cancelled any plans to add any unnecessary syrups prior to bottling. In other words, one of the very rare cases where a Tokaji finish could have been a good idea ;-). Colour: gold. Nose: sour fruits. A very mild funkiness under pears, mead, and apricot and pineapple jams. Quite light and so a little un-Jamaican in that respect, but it’s not unpleasant to find an ultra-soft Long Pond. The jury’s still out. Mouth: not as much a sugar bomb as the Ophtimus, of course, but we’re still doing sweet and pretty sugary, syrupy and light. You do feel the sweet Tokaji, which would have added notes of sugared herbal tea. There’s even a feeling of Aperol spritz, mind you. Finish: rather short, with some cinchona and more Aperol. Comments: I don’t like my rums this sweet, but other than that, I won’t cry foul play here. It’s just a little un-TWE. Did someone lose a bet? SGP:740 - 78 points.",78,2020-01-26,https://www.whiskyfun.com/archivejanuary20-2-Caol-Ila-Springbank.html,ac6833e377d2095df157bd91492312b8569d7711920741c2f7ee2bf3509f3c3c
"Chairman’s Reserve 13 yo 2006/2019 (56.3%, OB for The Whisky Exchange, St. Lucia, bourbon, 286 bottles)","Chairman’s Reserve 13 yo 2006/2019 (56.3%, OB for The Whisky Exchange, St. Lucia, bourbon, 286 bottles) Colour: amber. Nose: now we’re talking! Great notes of cane juice, cakes, a touch of wood smoke, ripe bananas, menthol, liquorice, then a little cedar wood, touches of incense, ylang-ylang, a little earth… Hold on, are we dead sure this cask didn’t stem from La Martinique? Feels pretty agricole if you ask me. With water: damp earth, moss, and once again that wee smokiness that just works here. Pu-erh tea, cigars… That’s all for the better. This little St. Lucian really talks. Mouth (neat): really very lovely, tight and dense, with some spicy cake, sugar cane juice, pineapples and bananas in moderate quantities, quite a lot of liquorice once again, and rather a good deal of oak extracts (black tea). Works a treat indeed. With water: pretty perfect. Ripe bananas and liquorice tangoing to perfection. Finish: rather long, dry, with some coffee now, and always quite some liquorice. Comments: just tops, Mr. Chairman. SGP:652 - 89 points.",89,2020-01-26,https://www.whiskyfun.com/archivejanuary20-2-Caol-Ila-Springbank.html,3fba41bc8ca4d1ccd81e273e839c3889f0a473de7e21b3520f54f5d1fa16597f
"Foursquare 13 yo 2005/2019 ‘MBFS’ (62%, Cadenhead, Barbados)","Foursquare 13 yo 2005/2019 ‘MBFS’ (62%, Cadenhead, Barbados) This is, I believe, the distillery’s usual ‘single blend’ of pot and column rums. This could work very well after the very lovely St. Lucian which was, I think, a kind of single blend as well. Colour: amber. Nose: it is a little rounder and lighter, as if the ex-column part was larger in the mix. There are also more soft oaky tones, vanilla, cakes, or chocolate, but at 62% vol., it’s distorted anyway, you can’t quite get the real profile. So… With water: it’s pretty complex and rather on many different herbal teas, which is very Foursquare in my book. Wormwood, fennel, verbena, sandalwood… Mouth (neat): real punchy, with what could be coconut wine and other savage drinks. Let’s not take any more chances… With water: no savage drink, it’s even rather civilised, with a little sweetness (was it a tad ‘enhanced’ when it reached Europe?) and some cinnamon, a drop of muscat wine, candied oranges, dried pears, quinces… Finish: rather long, with some pepper beyond the sweetness. Schweppes at a proper strength ;-). Comments: wondering if the proportion of ex-column wasn’t a little higher than in most OBs, but other than that, it is an extremely fine Foursquare in my book. Well done Cadenhead. SGP:641 - 85 points.",85,2020-01-26,https://www.whiskyfun.com/archivejanuary20-2-Caol-Ila-Springbank.html,cc45852e02bfc7e507b0c84921f67f6bbc7f76b387c22dbae86bb3d2406802c6
"Caroni 21 yo 1998/2019 ‘TMCG’ (61.5%, Cadenhead, Trinidad)","Caroni 21 yo 1998/2019 ‘TMCG’ (61.5%, Cadenhead, Trinidad) This mark may suggest this is ‘light’ Caroni (Main Caroni). Colour: amber. Nose: not very aromatic, rather a little metallic and herbal, with notes of old copper coins, some sour wine, and then really a whole humidor. It’s not unseen that we would find cigars in rums (or whiskies) but in this very case, you would believe they’ve thrown ten boxes of Partagas into the cask. Or rather Dutch Masters for that matter. That’s rather lovely. With water: same, plus pot-pourri and, maybe, half a mothball. Love love love all this tobacco. Mouth (neat): excellent, raw, tense, herbal, slightly acidic and fermentary (feels pot still, but it is column), wonderfully grassy and limey. Not an ounce of sweetness or fatness in there, which makes this sharp baby rather spectacular. With water: I find this excellent. Granted, it does not showcase 1000g esters/hlpa, but these cigars combine to perfection with the limes and the cane juice. In short, it is very tobacco-y. Finish: long, on just the same flavours. Even more lime and a little brine in the aftertaste. A feeling of salt remaining on your lips. Comments: not that this was a surprise, but… oh hell, it was. And I don’t think it is expensive. SGP:562 - 89 points.",89,2020-01-26,https://www.whiskyfun.com/archivejanuary20-2-Caol-Ila-Springbank.html,764981712dbd8be35421f8b347a25b14dc29a17410d3d0bb36d88c825a4cfe70
"Laphroaig 12 yo 1993/2006 (46%, Chieftain’s, casks #8026/8028, hogsheads, 1218 bottles)","Laphroaig 12 yo 1993/2006 (46%, Chieftain’s, casks #8026/8028, hogsheads, 1218 bottles) Colour: straw. Nose: soft and rather effortlessly coastal. This softness may or may not come from the bottling strength but it certainly reveals many beautiful notes of white flowers, crushed seashells, chalk, mineral salts and wee notes of petrol and citrus fruits. I wouldn’t say it’s necessarily a departure from other 1990s Laphroaig, but it is an elegant and very beautiful example. If a tad humble perhaps. Mouth: wait a moment… there is indeed something slightly tropical going on here. Dried mango, banana chips and papaya with more typical lemon peel and plainer notes of smoked barley and medicines. You could be forgiven for thinking this was a 10yo bottled a couple of years before this was distilled. Finish: long, lemony, fragrantly smoky, sandalwood, pink sea salt and more floral notes. A kind of wispy peat in the aftertaste. Comments: Don’t let this one fool you, it’s deft and almost shy at times, but there’s real beauty if you pay close attention. SGP: 555 - 90 points.",90,2020-01-25,https://www.whiskyfun.com/archivejanuary20-2-Caol-Ila-Springbank.html,797c47730a79aa67030bec87940bc08518d7423901a74b679addd765816438ec
"Laphroaig 15 yo 1993/2008 (46%, Douglas Of Drumlanrig, cask #4598, refill hogshead, 150 bottles)","Laphroaig 15 yo 1993/2008 (46%, Douglas Of Drumlanrig, cask #4598, refill hogshead, 150 bottles) Colour: pale straw. Nose: super clean, mineral, precise, lemony, salty and full of this coastal jostle of seaweed, ink, fresh oysters and beach foam. The nose is more simplistic than the Chieftains but no less fragrant and elegant. There’s even a wee lick of mango mixed in with the very gentle smokiness. Again we’re harking back to old official 10 year olds bottled around 1990. Mouth: superbly fruity, salty and lightly oily in texture. Like rubbed lemon peel with flints, soft briny touches, squid ink and umami broths. Also more background exotic fruity notes. Finish: long, saline and with quite a bit of antiseptic, Witch Hazel, herbal teas and medical toothpaste. Comments: Rather straightforward but the flavours are so precise and elegantly structured it’s impossible not to think of older style Laphroaigs - especially with these wee exotic fruity elements. SGP: 644 - 90 points.",90,2020-01-25,https://www.whiskyfun.com/archivejanuary20-2-Caol-Ila-Springbank.html,fbc47f5c62af4acd604f9c16a852cdc4c1c0a34bf95e33a029e63b0622b1426b
"Laphroaig 12 yo 1993/2005 (54.7%, Queen Of The Moorlands, 94 bottles)","Laphroaig 12 yo 1993/2005 (54.7%, Queen Of The Moorlands, 94 bottles) The Queen Of The Moorlands series was the work of David Wood when he owned managed the excellent Wine Shop in Leek and who would later go on to manage Caol Ila distillery. He bottled some beautiful whiskies during these years, quite a few of which are now very hard to find. Colour: white wine. Nose: what’s remarkable is how different it is. This is really all about total purity and precision. Crushed seashells, petrol, mineral salts, seawater, lemon juice and ink. But also, underneath, some sparing and almost brittle notes of passion fruit, lime and mango. The smoke is there but it is ethereal, vaporous and drawn across everything like a silk curtain. I find it extremely beautiful. With water: pow! Bath salts, crystallised exotic fruits, crushed nettles, rapeseed oil and a little mango puree. Still generally very sharp, crystalline and superbly fresh though. Mouth: hyper saline and lightly ashy on arrival; yielding to more fleshy citrus fruits, some sooty cereal notes, TCP, medical balms, metal polish and many embrocations and petrol notes. This fruitiness seems to fade in an out like background noise. With water: again the fruits soften, fatten and come to the fore. Everything is more fleshy, more rounded, more oily in texture and there’s a more weighty sense of cohesion about it. Finish: long, with this wonderfully lemon-scented smokiness, brine and olive oil mixed, green olives, some dried herbs and salty liquorice. Comments: In truth, it was this bottling which had given me cause for suspicion about 93 Laphroaigs when I tried it way back in 2006 when it was first released. I’ve not tasted it for at least 12 years and I always wanted to try it again. I have to say, I was sceptical about how my palate may have changed in that time, but it absolutely does not disappoint. Beautiful, fresh, complex, lightly fruity and stunningly well structured Laphroaig. Ironically enough I was very close to 93… SGP: 656 - 92 points.",92,2020-01-25,https://www.whiskyfun.com/archivejanuary20-2-Caol-Ila-Springbank.html,919f9fd3d0a9153e601cae5280b7afb5ed0bb6333cec8614aa9b559baced7c04
"Laphroaig 12 yo 1993/2006 (57.4%, Signatory Vintage Cask Strength Collection, cask #3473, bourbon barrel, 199 bottles)","Laphroaig 12 yo 1993/2006 (57.4%, Signatory Vintage Cask Strength Collection, cask #3473, bourbon barrel, 199 bottles) Colour: straw. Nose: what unifies all of these so far is freshness. This one has it in spades but there is a more definite lean towards minerality, pebbles, chalk, bath salts and even smelling salts. Some kind of collision of malt vinegar and petrol. Powerful yet restrained. Not to mention totally excellent I should add. With water: almost farmy now. Notes of carbolic acid, fermenting wash, oily sheep wool, tar and old toolboxes. Mouth: we’re not far from the QOTM bottling, but this is slightly more citric, less tropical and more powerfully medicinal. All manner of antiseptics, ointments, bandages, mercurochrome and then seawater, lemon juice, tar and iodine. Some beautifully wispy kiln smoke underneath, along with squid ink, dried seaweed and a super clean citric acidity. With water: magnificently sooty, salty, mineral, peppery, earthy and smoky. Bone dry and almost waxy - like some rather old dry Loire chenin. Finish: long, oily, fishy, tarry and with the smoke taking on an almost greasy and bloated quality. Comments: Another hugely impressive Laphroaig. What I love about these 1993s is that they wear their distillery character with screaming obviousness, yet they still manage to represent something of a departure in style from other 1990s Laphroaigs. Even the earlier 90s and 91s - of which you can find many more examples than 1993. SGP: 466 - 91 points.",91,2020-01-25,https://www.whiskyfun.com/archivejanuary20-2-Caol-Ila-Springbank.html,fa9f5123cd920f2e52184e37a76385e74ccfa274cd75148ac0d65ae63ee321f2
