whisky_name_raw,review_text,score,review_date,source_url,dedupe_hash
"Mars Tsunuki 6 yo 2017/2024 ‘Yakushima Aging’ (58%, OB, Japan, for Tiffany’s New York Bar and AF Trade, sherry hogshead, cask #2094, 252 bottles)","Mars Tsunuki 6 yo 2017/2024 ‘Yakushima Aging’ (58%, OB, Japan, for Tiffany’s New York Bar and AF Trade, sherry hogshead, cask #2094, 252 bottles) Ah, here we have the renowned maturation on Yakushima Island, where the climate is decidedly warmer. The whisky itself utilises barley peated to 50ppm. Colour: amber. Nose: I daresay the notion of umami was conceived for this whisky. Exhaust fumes, soy sauce, fine chocolate, tar, glutamate, sauna oils, overripe raspberries, miso, black and white truffles... It veers off in multiple directions yet maintains a certain ‘oneness’, akin to a fine old Pomerol, if you will. With water: aged balsamic from Modena, black earth (basalt), pumpernickel, and virgin wool... Mouth (neat): a whisky that delivers three slaps before politely asking you to add water. And we comply. With water: an astounding arrival of bergamots and kumquats cloaked in honey and liquid caramel. An indulgence. Finish: not eternal, but splendidly on prunes and large raisins, even a touch of rustic Armagnac. Though, are not all Armagnacs rustic? Comments: dare I say, we prefer the bourbon or refill versions, yet this one comes very, very close. A rather mad Tsunuki, overall. SGP:641 - 88 points.",88,2024-08-08,https://www.whiskyfun.com/archiveaugust24-1-Caroni-Chichibu.html,29da914cac9ee7f3c259079bff3aa8c84bee72600812e8fa9979b6b21c286b3a
"Kavalan 2014/2024 (61%, OB for Malt, Grain & Cane, Port, cask #O140201019A, 186 bottles)","Kavalan 2014/2024 (61%, OB for Malt, Grain & Cane, Port, cask #O140201019A, 186 bottles) We’re in Singapore this time. Bad news, this is Port. Good news, Kavalan usually manage to make Port not too Porty (no dull red berry liqueurs in our whiskies!) Colour: red amber. Nose: bags of roasted nuts, some cigars, some charcoal, deep-charred hamburgers, prunes, black raisins, black nougat, miso and… a lot of alcohol. So: with water: potting soil, leather polish, pumpernickel, tamarind jam… Mouth (neat): heavy rums and cognacs, heavier brandies de Jerez (without the sugar they usually add) and fifty tons of bitter chocolate. Corinth raisins as the foundation. With water: we’ve almost recreated some lovely heavy/deep sweet wine. You can reduce it a lot while it wouldn’t falter and wouldn’t give up. Finish: long, sweet, liqueury and extremely chocolaty. Comments: some kind of chocolate-and-raisins concentrate, not sure the base distillate is of any importance (whisky, rum, brandy…) All the sliders are almost at max, Nigel. SGP:762- 87 points.",87,2024-08-08,https://www.whiskyfun.com/archiveaugust24-1-Caroni-Chichibu.html,d7ac6f4ee68f20142cb1adca887791e816b3ac3fd1e246cbddb1adc494d003cf
"Le Breuil 2020 (50.8%, Version Française, LMDW, golden promise, 270 bottles)","Le Breuil 2020 (50.8%, Version Française, LMDW, golden promise, 270 bottles) Glad to see some proper Golden Promise, the variety of barley that earned Macallan its reputation. They certainly emphasised its use (along with sherry casks, of course). Le Breuil/Château du Breuil aka La Spiriterie Française are primarily Calvados distillers from Pays d’Auge. They appear to have a strong commitment towards other spirits, whisky included. Colour: white wine. Nose: naturally, it’s hard to miss the sliced apple and pear, but what really stands out is the freshly cut hay, which we absolutely adore, followed by blue-green tea (super oolong), and a hint of quince and candle wax. It’s fresh, lovely, and quite close to nature. With water: lots of wheat flour and sourdough. Mouth: peat emerges, with seaweed and lemon. It’s an entirely different whisky than on the nose, though the apple remains present. Some slightly bitter green spices, cardamom, green pepper… With water: lovely peat, chiselled, precise, simple. Nothing to fault. Green lemon juice. Finish: fairly long, just tense enough, with a salty aftertaste. Vive la Normandie! Comments: significantly superior to a previous Version Française, a 2017. But that’s just a personal opinion, as always. Very charming little whisky, with a distinct identity, though not easy to define. SGP:464 - 85 points.",85,2024-08-07,https://www.whiskyfun.com/archiveaugust24-1-Caroni-Chichibu.html,4f2acf73375878bf0a5b84ee98042261fad2ce362e176692823c9f54d0b12366
"Fary Lochan 2017/2022 ‘Rum Edition #03’ (48.5%, OB, Denmark, 333 bottles)","Fary Lochan 2017/2022 ‘Rum Edition #03’ (48.5%, OB, Denmark, 333 bottles) From some rum barrel. Colour: pale white wine. Nose: there’s that amusing ‘dirty’, chalky, and fermentative side, with thick cream, mashed potatoes, then baker’s yeast and a good Belgian beer, white but vigorous. The usual vanilla and some citrus candies come to complete the profile before more rum shows up without becoming a troublemaker. Mouth: I really like this blend of ink, very artisanal beer, plaster, sourdough bread, lemon, and perhaps sugar cane. It’s all melded together, you won’t say ‘oh, rum!’ Some bitter almonds and fresh wood add a slightly rough edge in the mouth. Finish: long, fermenting, lemony, with pleasant bitter notes quite present. It’s closer to fresh barley. Comments: there’s an artisanal quality I quite like, and above all, some personality. SGP:561 - 84 points.",84,2024-08-07,https://www.whiskyfun.com/archiveaugust24-1-Caroni-Chichibu.html,94a0316de891b5e7e516f78947311204c6f57c30d0aa922a631675e879ee7898
"Beverbach ‘Mizunara Cask Finish’ (43%, OB, Germany, +/-2023)","Beverbach ‘Mizunara Cask Finish’ (43%, OB, Germany, +/-2023) From Hardenberg Distillery – established 1700, mind you! Even our German friends are getting into mizunara. You might say it's about the only way to impart a hint of Japanness to your whisky, apart from perhaps paying homage to artists like Kurosawa, Mishima, Sakamoto, Yamash’ta, Fujita, etc. I’d go for that. Colour: white wine. Nose: it's direct, simple but pretty, with cereals, bread, pastries, apples, and a hint of pine resin. Works. Mouth: perhaps more unusual, sweet and spicy, leaning a bit towards pine bud liqueur at times, the rest being more about orange peel and marmalade. Not bad at all, despite the low alcohol content. Finish: of medium length, still a bit sweet (like the apple liqueur they make in Spain) but not excessively so. Comments: not bad at all, this little samurai crafted near Göttingen, not far from Kassel. A form of contemporary art, in a way. We’ll be tasting more Beverbach, I believe... SGP:651 - 82 points.",82,2024-08-07,https://www.whiskyfun.com/archiveaugust24-1-Caroni-Chichibu.html,b67455219faef7d3100bf90da01a71221304cab172e23b9bbee0c1cb4ee88fc3
"Bikkun (46%, OB, Spain, blended malt, +/-2022)","Bikkun (46%, OB, Spain, blended malt, +/-2022) Best Spanish Blended Malt at the World Whisky Awards, how fantastic! I love these categories... There's malt from Basque Moonshiners in it, aged in Rioja casks (naturally). They seem to be steering a bit this blended malt, it appears. Colour: white wine. Nose: not bad! There's a lovely peat, which internationalises any whisky. Damp earth, porridge, peat, sourdough, green clay, bread dough, drops of mint and eucalyptus essence... All is well. Mouth: but yes, it's not bad at all, Scottish in style, very smoky, savoury, then with raisins and a bit of mead. Nice balance, nothing to fault, it's well constructed. Finish: medium length, very pleasant, mint, ashes, and honey, which works very well. A drop of anisette and wild strawberry in the aftertaste. Comments: and I, who hesitated for a long time to taste this seemingly odd baby. But it's well done, viva the Basque Country! Not sure it's truly fully Spanish though. SGP:564 - 84 points.",84,2024-08-07,https://www.whiskyfun.com/archiveaugust24-1-Caroni-Chichibu.html,f8f35e1be07fff5635e1fec064ed49e776c5e88b0bb0ccd4c269f3b99d77be34
"Bushmills 10 yo ‘Vino Dulce Reserve’ (43%, OB, Ireland, single malt, +/-2024)","Bushmills 10 yo ‘Vino Dulce Reserve’ (43%, OB, Ireland, single malt, +/-2024) A brand new expression of Bushmills, aged in bourbon and sherry, then finished in vino dulce. Now which vino dulce? They make some almost everywhere in Spain, from Catalunya to Malaga and indeed, Jerez. Should be PX… And we love Bushmills. Colour: pale gold. Nose: it’s more austere at the beginning than I would have thought, which is not bad news at all. Let’s not exaggerate, there’s still the traditional combination of tropical fruits, bananas at the forefront, and ripe apples covered in wildflower honey. Caramel and nougat follow, and finally, the raisins we were expecting: currants, muscat, sultanas... We’re definitely leaning towards Malaga. Mouth: this time the sweet wine takes the lead and doesn’t seem to let go. Consequently, it’s a bit like fortified wine, such as Pineau des Charentes or a splash of Champagne ratafia. And between us, it’s very good, rich but balanced... Finish: medium length, very sweet, honeyed, muscaty. Comments: if you fancy a wine with your dessert but prefer whisky, here’s the solution. It should be splendid over good vanilla ice cream. What’s also amusing is the exotic fruits of Bushmills singing in the background, a bit like Roxy Music’s backing singers (what?) I rather like that slightly decadent touch. SGP:740 - 85 points.",85,2024-08-07,https://www.whiskyfun.com/archiveaugust24-1-Caroni-Chichibu.html,04f021572b1baf2b6ba50b3510595cbec263d2cc2cba575c72d9d9122edf8116
"Wild Turkey ‘101’ (50.5%, OB, USA, OB, Kentucky straight bourbon, +/-2024)","Wild Turkey ‘101’ (50.5%, OB, USA, OB, Kentucky straight bourbon, +/-2024) The last time we sampled this expression was in 2013, and it still had the old label. It was a bit ‘plankish’ (overoaked), but things might have changed a lot since then. Colour: deep gold. Nose: there’s still that cedar and balsa wood side, but the fruity varnish and encaustic touches smooth things out, while a bit of ripe apricot and bruised apples add some more fruitiness. A hint of overripe fruits that I like, bringing a slight tropical aspect to the whole. In short, it’s simple but solid. Vanilla and popcorn join in later. With water: heading towards the classic, pancakes, maple syrup, cinnamon cake, coriander seeds… Mouth (neat): full-on lavender, rye, violet, liquorice, geranium, and even juniper. Plenty of honey and vanilla follow. With water: frankly, it’s very good. Even the water, which should bring out the ‘nasty tannins’, doesn’t. Finish: same. Comments: they must have tweaked the recipe a bit. Or perhaps they realised that, like in wine, ‘less wood is the way’. Very good bourbon at a very good price (especially when compared to an equivalent malt whisky). SGP:641 - 86 points.",86,2024-08-07,https://www.whiskyfun.com/archiveaugust24-1-Caroni-Chichibu.html,a98e5ff6d915246446fa19b128390ec0e3389154177831bdc5b6d6f4948b0496
"Alfred Giraud ‘Une Odyssée’ (52.9%, OB, France, Collection Singulière, cognac cask, 459 bottles)","Alfred Giraud ‘Une Odyssée’ (52.9%, OB, France, Collection Singulière, cognac cask, 459 bottles) Alfred Giraud’s ‘Horizon’ was very good the other day. This one’s meant to be a crown jewel, aged in an old cognac cask. Let’s see if the crow lives up to its plumage… Colour: gold. Nose: we find the relative softness of a fine cognac, very ripe peaches, whiffs of honeysuckle and orange blossom, brioche and croissants, some notes of damp earth, chestnut honey... Between us, it can only be young whisky, but the maturation seems to have been done with taste. With water: orange cake straight from the oven, just cooled. Mouth (neat): powerful and honeyed. Mead, old triple sec, old Pineau des Charentes, ‘pommes tapées’ (a thing they make in the Loire, dealing with apples as our Austrian friends deal with their schnitzels – ha). With water: it’s really very good, with a clear impact from the cask but entirely balanced, leading towards orange blossom honey. There must be some sorcery in all this. Finish: of medium length, soft, while the citrus and marmalades have taken over. That’s always good news. Comments: a NAS bottle but an extremely high price, especially for a ‘rest of the world’ whisky, so the contents had to be top-notch. They are – and it’s a mystery. Seriously, it looks like a Glenmorangie from the 1970s or 1980s. SGP: 641 - 89 points.",89,2024-08-06,https://www.whiskyfun.com/archiveaugust24-1-Caroni-Chichibu.html,83ef8ad6b88f8721682ef60266a1091aae71bdc64994a009a481bd568e6ed286
"Spirit Thief ‘American Oak Cabernet and Bourbon’ (48.3%, OB, Australia, Curated Wine Barrel Collection, +/-2023)","Spirit Thief ‘American Oak Cabernet and Bourbon’ (48.3%, OB, Australia, Curated Wine Barrel Collection, +/-2023) We’re in Tasmania again. Worldwide, distillers are aligning or building their ranges according to the wines previously contained in the casks they use (or with which the casks were seasoned), which is quite a strong trend. PX, cabernet, merlot, sauternes, shiraz, Bordeaux, sangiovese, champagne, whatever. Right, not champagne. We’re not big fans, as you might know, but there can be some pleasant surprises. Colour: gold. Nose: it’s not bad! Soft beer, crepes, very ripe apples, and vanilla cake, without any major cabernet impact (they don’t say, but I imagine it was cabernet sauvignon, and not cabernet franc?) Mouth: really, it’s not bad at all, in any case much better than Spirit Thief’s ‘Distiller's Cabernet Select’ in my humble opinion (WF 76). Herbal teas, cherries, clafoutis, candied bell pepper, tobacco… The green tea and peppery wood notes then take more prominence, but it stays balanced. Finish: medium length, woody spices, plus some honey. Do they have manuka in Tasmania? Tasmanian pepper honey? The aftertaste leans more towards bell pepper and green pepper. Comments: very nice for a wine-like whisky! SGP: 551 - 83 points.",83,2024-08-06,https://www.whiskyfun.com/archiveaugust24-1-Caroni-Chichibu.html,d1df1a537bb6259cd906538b37878fb980ce21c442841a74e0fa0bd41ecc70df
"The Westfalian ‘Masterpiece Peated’ (64.1%, OB, Germany, ex-Macallan sherry hogshead, cask #TW74, 238 bottles)","The Westfalian ‘Masterpiece Peated’ (64.1%, OB, Germany, ex-Macallan sherry hogshead, cask #TW74, 238 bottles) Imagine owning your own distillery whilst practising for many years the venerable profession of independent bottler of grand Scotch whiskies. What would you do with all your empty casks? Probably exactly what we’re about to taste now. Colour: dark honey. Nose: to be honest, we haven’t tasted the peat + Macallan combination since the last vintages from the 1940s we had in our glasses. But to be even more honest (it’s getting fishy, S.), this is closer to a kind of young Laphroaig super-sherry for Italy, circa 1985. Basalt, soot, coal dust, mushrooms, old paint pots, linoleum, leather, roasted chestnuts, cigars, etc. It’s already quite expressive at 64% vol.! With water: putty and anti-rust paint, plus burnt cake straight from the oven. Mouth (neat): it’s a bit of a head-ripper, but all that leather and pepper mixed with tobacco works well. Even if it’s a bit extreme. With water: much fruitier, with loads of sour cherries and plenty of bell pepper. Lots of smoked meats and juniper, à la Steinhäger (big in old Alsace). And Schinkenhäger while we’re at it, as it also hails from Westphalia. Finish: long. Bitter oranges and dark chocolate. Comments: you probably shouldn’t taste this little monster near an open flame. It’s extreme and above all, anti-boring in these times when so many whiskies are looking and tasting more and more alike. SGP: 375 - 87 points.",87,2024-08-06,https://www.whiskyfun.com/archiveaugust24-1-Caroni-Chichibu.html,7708ca2a4f0d17dd48b895554949aebec378d9b4ae470eb5ef1f917434d55b4f
"Westward ‘Belgian Ardennes Trappist Ale’ (45%vol, OB, USA, Trappist ale cask, Westward Club, 2021)","Westward ‘Belgian Ardennes Trappist Ale’ (45%vol, OB, USA, Trappist ale cask, Westward Club, 2021) Here we are in Portland, Oregon. This bottle appears extremely improbable and certainly not planet-compatible (Belgium <-> Oregon), but we’ve already tasted some excellent Starward. And we adore that headline on their website: ‘A Legacy that Spans Two Decades’. Wow! Colour: rich gold. Nose: crikey, but it works! Autumn leaves, patchouli, dried flowers, mushrooms (morels), Bolognese sauce, mead, gingerbread, and indeed, slightly oily Belgian beers. Mouth: starts on bitter oranges, marmalade, then gentle curries, Indonesian sauces (kecap manis, satay), even peanut butter. It’s almost sweet, could that come from the famous Trappist beer? Finish: quite long, spicy, you might think you could pour this over your wok like soy sauce. I know, we’re far from Belgium. Chocolate, mole sauce, gingerbread... Comments: lots of fun, even if it’s a bit ‘too much’ for me. Amen. SGP:661 - 82 points.",82,2024-08-06,https://www.whiskyfun.com/archiveaugust24-1-Caroni-Chichibu.html,5d89518b037487273cc846ecd6352278c96a9d73a40bf56e95f328114c26f1e5
"Copperworks 3 yo 2018/2022 (56.8%, Whisky-Facile, USA, Black Cat Series, virgin oak, cask #287, 239 bottles)","Copperworks 3 yo 2018/2022 (56.8%, Whisky-Facile, USA, Black Cat Series, virgin oak, cask #287, 239 bottles) Black cat series? One of WF’s mousers, P’tit Noir, is all black, so we applaud! Having only sampled one Copperworks thus far (Boutique-y), let’s proceed with caution. But kudos for not going the NAS route. And for the lovely label that reminds me of a Mahavishnu Orchestra album cover. Or was it Weather Report... Colour: full gold. Nose: delightful nougat, honey, maple syrup, pancake sauce, white chocolate… With water: honey upon honey upon honey. Save the bees! Mouth (neat): excellent, with mango from the virgin oak (yes indeed), vanilla, passion fruit jam, wildflower honey, tutti-frutti eau-de-vie… With water: by Jove, it’s perfect. Passion fruit ice cream, mango syrup, guava juice, acacia honey… Finish: medium length, very smooth, creamy, fruity, with sorbets. Comments: a sin. Yes, it’s probably a sin, but we’re careful about what we say in France these days, no more mentioning any imaginary friends of our dear comrades from around the world. Even Dionysus, shh. SGP:741 - 88 points.",88,2024-08-06,https://www.whiskyfun.com/archiveaugust24-1-Caroni-Chichibu.html,4297deea6cd6d54bc2561d611c5b4b526e6ae14befe3113cd627ae7260778df6
"Sweden Rock Spirits (44.7%, OB, USA, Kentucky bourbon, +/-2023)","Sweden Rock Spirits (44.7%, OB, USA, Kentucky bourbon, +/-2023) I haven't the foggiest what this exactly is, apart from the fact that it's not Swedish. Not even remotely. The label says 'Fill Your Head With Rock'. All right. Colour: gold. Nose: not much going on. Some sawdust, some vanilla. Not Swedish in the slightest. Mouth: a bit better but still weak, overly influenced by woody spices, becoming quite bitter. Not very good. Finish: medium length, drying, simple. Powdered clove. Comments: if I were a Swedish distiller, I'd sue these people immediately. Especially if I were a Swedish distiller who also happened to be a lawyer. Well, it's not entirely dreadful, but it remains a rather poor plank juice. Kentucky bourbon, really? SGP:231 – 49 points. PS: I know Sweden Rock is probably an existing place somewhere in Kentucky, I was just trying to joke a bit to make up for the weakness of this very small bourbon.",49,2024-08-06,https://www.whiskyfun.com/archiveaugust24-1-Caroni-Chichibu.html,9b7a2e7b6df62d3c982df1803415a3e3e137c47326fa865d81e2e22b686de500
"Wambrechies 2016 'Brut de Fût' (54.3%, OB, France, +/-2024)","Wambrechies 2016 'Brut de Fût' (54.3%, OB, France, +/-2024) We tasted a very good Wambrechies aka Claeyssens a few weeks ago. They were one of the pioneers of whisky in France (1998) but are also famous for their French genièvre, somewhat like the excellent Zuidam in the Netherlands. They are located near Lille. Colour: white wine. Nose: very precise, with strong notes of fresh bread and beer, accompanied by subtle hints of anise and mustard, and the unavoidable crème anglaise. It's pure and delightful, doing the job splendidly. With water: add apple tarte topped with a touch of honey and cinnamon. Mouth (neat): similar profile, pure and focused on cereals, with a few lemony notes and a hint of grass (grass juice, as was the trend in the 1980s, believed to be very healthy). A few notes of pear eau-de-vie. With water: a bit tighter, which is excellent. Of course, there's a touch of juniper spirit, but that's likely our minds playing tricks on us. Finish: medium length, still on bread, spices, apples, and pears. Comments: for me, it's nearly on par with the excellent Wambrechies 'Madeira'. SGP:551 - 86 points.",86,2024-08-05,https://www.whiskyfun.com/archiveaugust24-1-Caroni-Chichibu.html,c1d705b10fd252e8c89b87e814179b62b9932d8ff88c010a347cb7e81cffb553
"Filey Bay 'Port Finish – Batch 1' (46%, OB, England, ex-bourbon + ruby Port, 3,300 bottles, 2022)","Filey Bay 'Port Finish – Batch 1' (46%, OB, England, ex-bourbon + ruby Port, 3,300 bottles, 2022) One might wonder what would become of whiskies from Great Britain, including Scotland, without the PX and the Port, wouldn't they? We are in Yorkshire. We had a very amusing – and good – 'Porter cask' in May (WF 85). Grain & grain, logically. This has spent 22 months in Port casks. Colour: gold. Nose: good news, the Port is discreet, you don't find bags of blackcurrants and raspberries, rather some touches of raisins and goji berries atop an orange cake. Or something like that. Mouth: a bit more 'Port', crushed strawberries and pepper, blueberry liqueur, grenadine... Entering the world of whisky + wine blending, but it's not unpleasant at all, just slightly offbeat, for me. Finish: medium length, similar flavours, plus some bud notes. Comments: thanks to these whiskies, at the end of a meal, you can ask your guests ""whisky, port, or both at the same time?"" We'll soon have a much greater Filey Bay, having said that. SGP: 741 - 80 points.",80,2024-08-05,https://www.whiskyfun.com/archiveaugust24-1-Caroni-Chichibu.html,34c47814d7f9fa2ed40bdc6f9cf6bdce78467a3da9e0e9eb61bd88d6288cc8d6
"Kyrö 'Malt Rye' (47.2%, OB, Finland, +/-2023)","Kyrö 'Malt Rye' (47.2%, OB, Finland, +/-2023) This is 100% malted rye. It's becoming at tad more common in Europe, or rather it’s getting less rare and at Château WF, we're delighted. With few exceptions, we love it. Colour: gold. Nose: admirably floral, with essences of barks and fruits of all kinds. There's a touch of lavender and juniper, followed by apricot and smoked sesame seeds. Not to mention a 10-kilo bag of speculoos. Okay, 5 kilos... I love this nose, let's hope the palate... Mouth: well yes. It's certainly a bit extreme on the spices and barks, but I think that's exactly what we love in these ‘deviant’ drams. Plenty of small citrus fruits, lavender again, lots of thyme and rosemary, and even a bit of coriander (ground seeds). Yet, it remains unmistakably whisky. Finish: very long and spicy, with the usual soapy touches of this kind, which we quite like, then a lavender + juniper duo. Comments: we had tasted an oloroso version which was excellent (WF 85) but this one is more precise, purer. And probably a bit mad. SGP:562 - 87 points.",87,2024-08-05,https://www.whiskyfun.com/archiveaugust24-1-Caroni-Chichibu.html,0aef4c3311a2d2d152dbf72f803b2262ac2de9214bee5fbe1552cad874bc51dd
"InQuota ‘Passito de Pantelleria Cask Finish’ (43.3%, OB, Italy, Villa de Varda, 1975 bottles, +/-2023)","InQuota ‘Passito de Pantelleria Cask Finish’ (43.3%, OB, Italy, Villa de Varda, 1975 bottles, +/-2023) This is distilled in Trentino Alto Adige, in the Italian Alps, but the finishing casks hail from the volcanic island of Pantelleria (right between Sicily and Tunisia), where actress Carole Bouquet owns a wine estate. Her wines are very good in our opinion, but you must like them extremely sweet. Colour: white wine. Nose: chalk and ripe orchard fruits. Whiffs of flour, tapioca, I’m even about to add ‘semolina’ or ‘polenta’. What’s sure is that it is not bursting with raisins, perhaps just one or two small dried figs and a spoonful of honey. Mouth: the wine feels now, this is very sweet, you cannot help but think of ice wine over some pastries. Some fresh oak, some vanilla, some honey. Too bad the structure is so light. Finish: rather on sweet wine indeed, but short. More honeyed yet. Some new oak in the background. Comments: rather a wine-like whisky on the palate, especially as the low alcohol content doesn’t really help. I think their Dolomiti Spruce Cask Finish was much better; in any case, more to my taste (WF 84). SGP: 630 - 75 points.",75,2024-08-05,https://www.whiskyfun.com/archiveaugust24-1-Caroni-Chichibu.html,d595174de0306024e5c7017ae6d9075a6d2a531e7e3d0d6531f90ae41b45884c
