whisky_name_raw,review_text,score,review_date,source_url,dedupe_hash
"Penderyn 11 yo 2008/2019 (57.2%, OB for 20th Anniversary of The Whisky Exchange, Wales, bourbon)","Penderyn 11 yo 2008/2019 (57.2%, OB for 20th Anniversary of The Whisky Exchange, Wales, bourbon) Colour: straw. Nose: starts a little ethanoly and vanilla-ed, and develops with these tropical fruits that sometimes come with well-charred American oak, such as bananas and passion fruits. I would say it’s got something ‘North-Irish’, quite funnily. I know, not funny at all. Something a little steely in the background, not something we’ve never found in Penderyn. With water: indeed, iron and maracuja, perhaps even sorrel and spinach, plus a little putty. Mouth (neat): really very Irish, we’re almost at Bushmills, except that this is hotter and rougher. So tropical fruits in abundance, vanilla, and pepper. With water: same as on the nose, goes towards acidulated notes, leaves, iron… Now it remains thinner than Bushmills. Finish: rather medium. Green bananas and coconut. Comments: I believe this is my favourite Penderyn so far. Indeed we’re far from the earlier ‘all-Madeira’ bottlings that used to be a little unbalanced in my book. A understatement. SGP:641 - 84 points.",84,2020-01-31,https://www.whiskyfun.com/archivejanuary20-2-Caol-Ila-Springbank.html,230295533b69a47b789232d77e6de3f0887144d3536729edb2920b98581f4029
"Penderyn 2007/2019 (58.6%, OB for La Maison Du Whisky, first fill bourbon, cask #71)","Penderyn 2007/2019 (58.6%, OB for La Maison Du Whisky, first fill bourbon, cask #71) Let’s remember that these early distillates were all ex-column, and yet they were not classified as grain whiskies since the column was fitted on a pot. Well, that’s my interpretation. And possibly for additional reasons… Colour: straw. Nose: fresh putty and bananas, some varnish, acetone, new plastic… Quite a punk of a whisky, the fresh bourbon barrel couldn’t hide everything. With water: same as the 2008, only with a little les vanilla, and consequently, more brightness. Mouth (neat): more varnish, bananas, pineapples, mango eau-de-vie (never, ever try to distil mangos – I tried), fruity glue and pear (amyl acetate)… With water: same, tropical fruits, iron, pepper, rhubarb, sorrel… Finish: medium, with more sour fruits. Bananas and cider apples. Pepper in the aftertaste. Comments: really to my liking, but very cask-driven yet again. Rather the style of a start-up distillery, or of a young, not totally matured yet Bushmills. SGP:641 - 84 points.",84,2020-01-31,https://www.whiskyfun.com/archivejanuary20-2-Caol-Ila-Springbank.html,5d946a60a1c4489af5fa768f70f5b17aeffeaf5933f8dd1dcd824bfcbc0c1f88
"Penderyn 'Myth' (41%, OB, Wales, +/-2017)","Penderyn 'Myth' (41%, OB, Wales, +/-2017) Not the first time we’re trying this entry-level NAS. Hope they improved it a bit… Colour: straw. Nose: difficult, acidic and full of iron and concrete. Milk, yoghurt, mud, cow stable… Not too sure here… Mouth: better on the palate, with some tropical fruits yet again (much fewer than in the 2007 and 2008 though), probably from fresh bourbon, then some lighter vanilla and touches of barley water. Feels like a blend, with this lightness. Quite some sawdust, not the best part. Finish: medium but a little planky. Flour, tapioca, sawdust… Comments: I had hoped this baby would make it to 80 but the sawdust handicapped it in the end. Good but not quite mythical, I would say. SGP:531 - 78 points.",78,2020-01-31,https://www.whiskyfun.com/archivejanuary20-2-Caol-Ila-Springbank.html,ee4f2049c347afc4478df5a08391d84542fef5aeed5e80ee3f39ed55e95f8a0b
"Penderyn ‘PortWood’ (46%, OB, Wales, +/-2017)","Penderyn ‘PortWood’ (46%, OB, Wales, +/-2017) Ouch, Port, and some poor ruby at that! Be prepared, S…. Colour: apricotty. Nose: not too much Port, rather dairy cream, sawdust, yoghurt, tapioca, curry, porridge, and a dirty-ish iron-ness. No raspberries in sight, that’s a relief for sure. Mouth: not really. Pepper, bitter leaves, ginger cookies, blackcurrant jelly, bitterish chocolate… Finish: rather long but very leafy and bitter. Too much pepper in the aftertaste. Comments: Chinese prickly oil, or there, spicy oil to sprinkle your pizza with. What's more, the bottle's not for your average shop or private shelves, it's as high as Jacob Rees-Mogg. SGP:371 - 70 points.",70,2020-01-31,https://www.whiskyfun.com/archivejanuary20-2-Caol-Ila-Springbank.html,78253bedf11843cfd19b6a67c47a78b50edd8b9e682044636a6266e15632bba7
"Penderyn 2013/2016 ‘Rich Oak’ (50%, OB, Wales, 2248 bottles)","Penderyn 2013/2016 ‘Rich Oak’ (50%, OB, Wales, 2248 bottles) Rich oak may mean deeply shaven, heavily toasted, and severely charred. Or something like that. Colour: gold. Nose: yep, butterscotch, shortbread, warm brioche, vanillin, praline or halva, and café latte. Modern whisky in action, with not much surviving distillate character. With water: sawdust popping out. No big surprise. Mouth (neat): oranges, bananas, white chocolate, honey pops, maple syrup, butterscotch, and a little eau-de-vie. That’s the very young spirit managing to come through. With water: real good, a little fruitier (mangos, fruity honey), with hints of assorted jelly babies. Finish: rather long, good, modern, always on butterscotch. Comments: in heavy STR, Lagavulin and Glenkinchie may start to taste the same. Almost. Now, good Penderyn methinks, perhaps my favourite today, we’ll see. SGP:551 - 85 points.",85,2020-01-31,https://www.whiskyfun.com/archivejanuary20-2-Caol-Ila-Springbank.html,e88d2805905451bcfa4a4b810c2ad8e7270ad06a91bba819dc8b36ed638f7097
"Penderyn ‘Rich Oak’ (59.8%, OB, Wales, cask #D161, 289 bottles, +/-2018)","Penderyn ‘Rich Oak’ (59.8%, OB, Wales, cask #D161, 289 bottles, +/-2018) Looks like this one is NAS. Never mind! Colour: full gold. Nose: some style as that of the larger batch, only with more power. With water: there, fresh baguette, butterscotch, café latte, bananas and mangos, touch of menthol… Mouth (neat): vanilla, coconut, ripe bananas, mangos, passion fruits, touch of Swiss cheese (or fruity Comté)… Well, looks like this is excellent, let’s see. With water: indeed it is. Weren’t these batches pure pot still? I wouldn’t be surprised… Finish: medium, clean, fruity, very well balanced. Comments: well, looks like we’ve already got a new favourite Penderyn. Ha. SGP:651 - 86 points.",86,2020-01-31,https://www.whiskyfun.com/archivejanuary20-2-Caol-Ila-Springbank.html,728c91aa4e59fcc44b3e2319c4737464931ba7a098cafbd124a647c559c3ff3b
"Penderyn ‘Port Wood’ (60.6%, OB, Wales, cask #PT13, 207 bottles)","Penderyn ‘Port Wood’ (60.6%, OB, Wales, cask #PT13, 207 bottles) Some kind of dark NAS that some kind of English writer kind of awarded with something, according to a few gazettes. Colour: cognac. Nose: I shall not deny that this is pretty brilliant, even if we’re rather in the same territories as those of those fine people at Lost Spirits in America. Heavy extraction, molassesness, coffee liqueur, extreme Demerara, prune juice, paxarette or mosto, and ‘stuff’. See what I mean? With water: Macallan 10 Cask Strength, circa the year 2000. Huge raisins (don’t be afraid). Mouth (neat): does not taste Porty, rather oloroso-y. Walnut wine, cigars, fruitcake, clove cake, more molasses, then more sweetness, Zacapa (I’m sorry), heavy tea, liquorice, Italian black cigars (you could break a tooth with them)… With water: like this a lot, even if it’s hyper-extractive. Huge bitter oranges, menthol, liquorice, cough drops, prunes, muscovado sugar, liquid caramel… Finish: extremely long, perhaps a bit sticky and mildly cloying, but still utterly demonstrative. I think we’ll have to rinse our mouth. Thoroughly … Comments: there, a new favourite Penderyn already. Very cool, even if, let’s be honest, the casks have been doing the jobs. SGP:662 - 87 points.",87,2020-01-31,https://www.whiskyfun.com/archivejanuary20-2-Caol-Ila-Springbank.html,22216f464ce4ba18fd6dc07256b564d92c77f3105388b8f002bed06400caeb94
"Penderyn ‘Bryn Terfel’ (41%, OB, Wales, +/-2018)","Penderyn ‘Bryn Terfel’ (41%, OB, Wales, +/-2018) Ex-bourbon wood, packaged in one of the ugliest bottles I’ve ever seen – now it looks like all this is related to Verdi (don’t ask) in some way, so that’s better. Promising, at least. No, Verdi, really? Giuseppe Verdi? Colour: white wine. Nose: wee whiffs of hardboiled eggs and truffles at very first nosing (no we won’t use the S word), then a lovely development on biscuits, barley, bananas, and Jaffa cakes. Rather luminous and refreshing. Mouth: good, really, only a tad too plankish. A little too much sawdust, in other words, but all the rest works pretty well. Cakes, bread, bananas, barley, oats… Finish: medium, pleasant, sadly a little plankish again. Comments: not quite La Traviata’s Overture, but there, it’s a fine drop. Too bad there was so much sawdust, I suppose heavy reduction shouldn’t have been done on these casks. But who am I? SGP:451 - 80 points.",80,2020-01-31,https://www.whiskyfun.com/archivejanuary20-2-Caol-Ila-Springbank.html,85e2aa6ef352bdbeb282f0b5663e05be2fea5efea3a90024fd113471f10d3551
"English Whisky Company 8 yo 2009/2017 (52.3%, That Boutique-y Whisky Company, batch 2, Sauternes and bourbon, cask #800/424, 845 bottles)","English Whisky Company 8 yo 2009/2017 (52.3%, That Boutique-y Whisky Company, batch 2, Sauternes and bourbon, cask #800/424, 845 bottles) Just one question, will French wine casks still be allowed after Brexit? I mean, won’t all this madness start to feel pretty unnatural? I mean, even more unnatural than it already is? Colour: gold. Nose: smoke and ointments all over the place. Bandages, tiger balm, foie gras (I am not joking, and that’s got nothing to do with Sauternes). Then earth and vegetable bouillon. Very, very singular, while the Sauternes remained well-mannered and rather unobtrusive. Not for Mr Farage. With water: fine. Wondering if these batches were still conducted by Iain Henderson (ex-Laphroaig, remember?) Mouth (neat): huge, aggressive, extremely peppery. This is almost chilli sauce, rather of the XXX-End-of-The-World-De-La-Muerte kind. With water: ci-vi-li-sa-tion. Definitely not for Mr Farage. But it does remain very peppery, and that’s the oak. Sauternes is good, but if it was a proper ‘château’ cask (not a cask done in the U.K. with two litres of cheap Sauternes from Tesco’s) that was freshish French oak. They work greatly with wine, but spirits tend to extract many more spices and peppers. Finish: long and easier. Something of Ci this time. Comments: Cheers and peace, friend. And screw Nigel Farage, even if my friends who own bars in Strasbourg all say ‘good riddance’. SGP:475 - 84 points.",84,2020-01-31,https://www.whiskyfun.com/archivejanuary20-2-Caol-Ila-Springbank.html,c1125e909d44cc80720c5ac9596ee3d56d2af95d5de79e92df6bb966979bfed1
"Scallywag 10 yo (46%, Douglas Laing, Speyside, blended malt, 4,500 bottles, 2018)","Scallywag 10 yo (46%, Douglas Laing, Speyside, blended malt, 4,500 bottles, 2018) Snowy is back. We’ve had some NAS and some 13, but never this 10, aarff. Colour: gold. Nose: there’s a rather roughish, leafy sherry at first, notes of cheapish PX, then better cakes, butterscotch and herbal teas. Vanilla cream. Mouth: a little rough indeed, leathery, gingery, with a grittiness that does not suggest this baby’s obligatorily spent its own life in first-class sherry casks. Finish: medium, very leafy, sour, spicy and gingery. Comments: the 13 yo just anytime. As they used to say in old ads for washing powders, I would not trade one bottle of 13 (WF 86) for one case of this 10. SGP:461 - 78 points.",78,2020-01-30,https://www.whiskyfun.com/archivejanuary20-2-Caol-Ila-Springbank.html,0a16c39959cafee88253c276f8e0d5e8788e0b101d1f988597e6e15fdc4990ab
"Double Single (46%, Compass Box, blend, bourbon, 5,838 bottles, +/-2017)","Double Single (46%, Compass Box, blend, bourbon, 5,838 bottles, +/-2017) This should harbour around three quarters Glen Elgin, and one quarter Girvan. Girvan grain, if you really must… Colour: straw. Nose: all on pear juice at first nosing, then apple pie and a little bubblegum and popcorn from the grain (I suppose). Nice, fresh and fruity, a little undemanding. Mouth: Glen Elgin is a great distillate, so this is obviously pretty fine, on the other hand I find it a little rough and uncomplex. Sweet beers, malt, ripe kiwis, preserved peaches and cherries. Some almond syrup coating the whole, as well as a little custard. Finish: medium; fruity and fresh. Fruit loops and a little cinnamon and ginger. Comments: a very good blend that’s very malty. Seriously, it’s a quasi-single, don’t present anyone who only knows of Passport and Vat69 with this. It’s true that prices have nothing to do (190€, is that a typo?) SGP:551 - 83 points.",83,2020-01-30,https://www.whiskyfun.com/archivejanuary20-2-Caol-Ila-Springbank.html,3b743a683c1c670c606fe96e390861170891b90aa008504d6a4cb1ee10469bb6
"Chieftain’s Speyside 16 yo 1998/2014 (54.1%, Chieftain’s, 1st fill sherry butt, cask #8048, 670 bottles)","Chieftain’s Speyside 16 yo 1998/2014 (54.1%, Chieftain’s, 1st fill sherry butt, cask #8048, 670 bottles) These ones have got a good reputation. Colour: amber. Nose: starts with a little acetone and varnish remover, or even very young sauvignon blanc, or even old cask in an old Burgundian cellar, but it’s soon to gather its forces, getting very pinot-noiry, in a beautiful manner. Exactly not what you would get should you dump this whisky into a casks of pinot noir. Menthol, cherry cake… With water: rather love this dirtiness. Civet cat, good sister, vinegar, pinot noir, old floor cloth… Mouth (neat): perfect if you’re up for a middle-aged sherry monster full of cherries and chocolate. With water: takes water extremely well. Do you know Mon Chéri? That would be cherries in eau-de-vie, coated with black chocolate. Mon Chéri, quoi. Finish: long and very much on cherries again. Comments: next time I fly to Jerez (very soon), I’ll check those cherry trees. In the meantime, I may quaff more of this very excellent undisclosed Speysider. SGP:651 - 88 points.",88,2020-01-30,https://www.whiskyfun.com/archivejanuary20-2-Caol-Ila-Springbank.html,b82e37c1c81658ca814fa95b1d01ae6bff3b3c06ec4cbe57b597859728e5f8bc
"Chieftain’s Speyside 22 yo 1993/2015 (52.7%, Chieftain’s, 1st fill sherry butt, cask #3612, 579 bottles)","Chieftain’s Speyside 22 yo 1993/2015 (52.7%, Chieftain’s, 1st fill sherry butt, cask #3612, 579 bottles) Colour: office coffee. Nose: no doubt Ian Macleod do these very well. This one’s rather flintier, almost metallic, rich yet rather elegant, with notes of Armagnac, that is to say prunes and raisins in this case. Also honey sauce and orange liqueur, all that just works beautifully. With water: once again a feeling of PN, this time Nuits-St-Georges (utterly love good Nuits-St-Georges, they are less chicky-micky than most others!) Mouth (neat): very good. You cannot not think of some of the middle-aged Family Casks by that Ballindalloch distillery, this time rather with touches of varnish and cherries again, just like in the lovely 1998. With water: yeaaaahhh (you didn’t rack your brain here, S.) Finish: long, guignolety (and yet another barbarism that may get you jailed on day, S.) Comments: similar high quality, perhaps a little softer. Time makes whiskies softer, and people harder, some say. SGP:551 - 88 points.",88,2020-01-30,https://www.whiskyfun.com/archivejanuary20-2-Caol-Ila-Springbank.html,4f4750090f5a1b000ce9e81fa74d3d7fb00a12b2cd4dc0498bcb0ad359ffd179
"Chieftain’s Speyside 25 yo 1990/2015 (53%, Chieftain’s, 1st fill sherry butt, cask #5181, 606 bottles)","Chieftain’s Speyside 25 yo 1990/2015 (53%, Chieftain’s, 1st fill sherry butt, cask #5181, 606 bottles) I believe these were all bottled for Taiwan. Colour: office coffee. Nose: frankly, these are all very good. Wonderful maltiness, Mars bars, café latte, butterscotch, orange cake, marmalade, and rather less cherries this time. And no pinot noir, sob sob… With water: liquid caramel, raki, proper old sweet Malaga, and a very wonderful mentholy side. Old mint cordials, Ricqlès.. Mouth (neat): raspberry eau-de-vie, raisins, rancio, redcurrant wine, old Port, manuka honey, cracked pepper… That’s all pretty perfect, well done. With water: careful, sherry monsters are very sensitive to water (they may get too drying), so two drops are enough. Alternatively, you may just spray to surface with water – ever tried that? Figs and ginger coming out – looks like that cask had been kind of rejuvenated at some point (ginger always sell it). Finish: medium, ridden with chocolate and raspberry liqueur. Comments: whether you prefer cherries or raspberries is up to you. No, really. Loved this one. SGP:561 - 90 points.",90,2020-01-30,https://www.whiskyfun.com/archivejanuary20-2-Caol-Ila-Springbank.html,765ef44bf9f28c03c880c7fbc31e2e85acb55693b2b127e0d358bd7677353639
"Black Snake ‘3rd Venom’ (59.7%, Blackadder, oloroso sherry, 480 bottles, 2017)","Black Snake ‘3rd Venom’ (59.7%, Blackadder, oloroso sherry, 480 bottles, 2017) This is a single malt! Hope it won’t be as deadly as a, well, as a black mamba. Colour: straw. Nose: this is an all-natural malt whisky, without any obvious sherry (only in the distance), rather with breads, cakes, grist and hazelnuts. Half a pint of lager too. With water: malt and fudge and pumpernickel and sawn branches. Perhaps not the Mona Lisa of whisky. Mouth (neat): raw, young, very punchy, on pear eau-de-vie and slivovitz. Rather stuff for gangsters, so far. With water: does the job, as they would never say in the French administration. Beers, fudges, all-spice. Finish: medium, on spicy breads and the next town’s craft ale. Pepper and citrus in the aftertaste. Comments: fine malt whisky, not too venomous apparently, since I’m still here, alive and (hopefully) kicking. SGP:451 - 82 points.",82,2020-01-30,https://www.whiskyfun.com/archivejanuary20-2-Caol-Ila-Springbank.html,61b880f1954e550504b6a7643d2b49279cf1fa8dd638279f7177a1be32d38e5e
"Highland Malt 26 yo 1993/2019 (48.3%, Maltbarn, bourbon, 141 bottles)","Highland Malt 26 yo 1993/2019 (48.3%, Maltbarn, bourbon, 141 bottles) Colour: pale gold. Nose: bread and barley, brioche and overripe apples, cereals, with touches of honey and a few yellow flowers (dandelions). Nice maltiness, a bit in the style of Glenmorangie, perhaps. Mouth: good malty, brioche-y arrival, then more cereals and a few earthy tones. A little sawdust, ale, and cinnamon plus a little cardboard. Finish: medium, a little gristy, with orange drops. Rather a little sawdust in the aftertaste. Comments: very good, like anything from Maltbarn’s, but looks like I’m not very inspired. Must be me… SGP:451 - 82 points.",82,2020-01-28,https://www.whiskyfun.com/archivejanuary20-2-Caol-Ila-Springbank.html,42e3b77dcf6046fca8b92c84cc1eebbb91463ca610edcd8b54f349744a5dd349
"Speyside Malt 14 yo 2005/2019 (50.4%, Maltbarn, sherry cask, 175 bottles)","Speyside Malt 14 yo 2005/2019 (50.4%, Maltbarn, sherry cask, 175 bottles) Colour: gold. Nose: this one’s much cakier, more on raisin rolls, milk chocolate, praline, caramel cream, mirabelle tarte, tarte tatin, custard… All that being very fine, naturally, if a little modern (hi-char?) With water: menthol and eucalyptus, a lot of sap. Lovely maltiness behind that. Mouth (neat): unusually leathery at first, malty, a tad sour and resinous, then relatively mellower and rather on raisin rolls again, chocolate, and mead. The cask was relatively new or renewed (ginger, nutmeg). With water: gets really gingery. Quite some raisins too. Finish: rather long, spicy, with some caraway and more ginger. Comments: the cask wasn’t lazy. Modern-times malt whisky, rather oak-driven and rather of upper-middle quality, I would say. SGP:451 - 83 points.",83,2020-01-28,https://www.whiskyfun.com/archivejanuary20-2-Caol-Ila-Springbank.html,c45eaddffee32730d0f5538802ca45f26b36b755ecf10ddffa43c984ed548e52
"Speyside Region 26 yo 1992/2019 (51.5%, Archives for ARen Trading Co. Taiwan, barrel, cask #1408809, 269 bottles)","Speyside Region 26 yo 1992/2019 (51.5%, Archives for ARen Trading Co. Taiwan, barrel, cask #1408809, 269 bottles) Colour: straw. Nose: an awesome oily start, on proper sunflower oil, also pollen and acacia honey, then brioche and custard, dandelions, white chocolate, and a touch of almonds and earth. Impeccably fresh and deep at the same time. Got to love good barrels. With water: angelica and woodruff, who could be against that? Mouth (neat): banana pie, mangos, honeydew, oranges and citrons, vanilla and honey. I have to say you could almost mistake it for one of those superb indie Bushmills that have recently amazed whiskydom, seriously. With water: more citrus and mirabelles, all for the better. We’ve known Balvenies… Finish: medium, wonderful, with apricots this time, papayas, and just honey. Pink grapefruits as the signature. Comments: some high-echelon malt whisky, pretty sexy and without the tiniest flaws. And that wee Irishness… SGP:651 - 90 points.",90,2020-01-28,https://www.whiskyfun.com/archivejanuary20-2-Caol-Ila-Springbank.html,27bd57f7e8c8f9a508583d0b08c7e3a388854e65268016c0f05fc69e0c837aaf
"A Speyside Distillery 26 yo 1992/2018 (51.5%, Archives, barrel, cask #1408806, 250 bottles)","A Speyside Distillery 26 yo 1992/2018 (51.5%, Archives, barrel, cask #1408806, 250 bottles) This one comes with an American butterfly on the label. Sounds like the name of a prog-rock band, circa 1971. Colour: straw. Nose: same batch, same distillery, almost same whisky. Perhaps a tad rounder and a little less tart? First class stuff. Mouth: same comments. Finish: same. Comments: same. Well, this one was a wee-tad fatter indeed. Quality’s extremely high. SGP:651 – 90 points.",90,2020-01-28,https://www.whiskyfun.com/archivejanuary20-2-Caol-Ila-Springbank.html,aec91a1e73a088a31902417df61551e6067eda0d7bc983c27de97139dddd71b8
"Blended Malt 9 yo 2009/2019 (65.4%, Single Cask Nation, sherry butt, cask #417, 654 bottles)","Blended Malt 9 yo 2009/2019 (65.4%, Single Cask Nation, sherry butt, cask #417, 654 bottles) Holy smokes, isn’t this pure rocket fuel? Just another assassination attempt? Colour: straw. Nose: sour cream, sour wood, lemon marmalade, leaven, butter cream, and some kind of crazy Californian double-hops IPA for jaded hippies. Well, I suppose you get the idea. With water: some kind of exhaust smoke, then more creams, white chocolates, butterscotch, halva and such things. Mouth (neat): great wood was involved. Other than that, it would kill you. With water: butterscotch everywhere, touch of varnish, custard, small berries, and just some creamy flavours. If this was a sherry butt, someone must have shaved it and then charred it to the max. With excellent results, I would add. Finish: long, malty, chocolaty, and with bags of shortbread. Something from Starbucks’ in the aftertaste. Café latte with toasted hazelnuts? And, wait, strawberries? Comments: what I find very cool with the Single Cask Army… I mean Nation, is that unlike many other indie bottlers, they would not just have the same whiskies (or rums) that everyone else are having at the same time. Smart. This youngster, even if very modern, is beyond reproach. SGP:551 - 87 points.",87,2020-01-28,https://www.whiskyfun.com/archivejanuary20-2-Caol-Ila-Springbank.html,028c3ee93c984836599981e91552410c3b33c7a763b3302b5a19ebefc9c36974
"Secret Lowland 7 yo 2011/2019 (59.8%, Liquid Treasures, 10th Anniversary, sherry hogshead, 176 bottles)","Secret Lowland 7 yo 2011/2019 (59.8%, Liquid Treasures, 10th Anniversary, sherry hogshead, 176 bottles) Yet more pinups, can we have Betty Grable next time? What’s more, a secret Lowlander is intriguing, who would want to keep a Lowlander secret? Colour: gold. Nose: yet another activated cask in, well, in action, with some fudge, butterscotch, shortbread, strawberry pie, and a feeling of Cuban rum. Havana Club cask strength – do they do cask strength? With water: thin mints and chocolate stout, that’s cool! Mouth (neat): seemingly pretty good, just a tad strong. But I rather love these hints of chicory coffee, Nescafé, and Ovaltine. Almost works like Proust’s madeleine to me. With water: mint cream and cloves in coffee. Sounds weird, I know. Crude chocolate. Finish: long and very Guinnessy, if I may. Malt and coffee in the aftertaste. Comments: I’m all for these modern younger warriors, as long as nobody drowns them into wine (what, what PX?) Which was not the case here. As for the ‘Lowland’ part, well, anyone who would have been able to detect the region here would have won my utmost and most eternal consideration. SGP:551 - 86 points.",86,2020-01-28,https://www.whiskyfun.com/archivejanuary20-2-Caol-Ila-Springbank.html,bee59fd76c132377b0d4d6b4754f239eb5f9b3e320dfbfb6ed6b82b779e7cff9
