whisky_name_raw,review_text,score,review_date,source_url,dedupe_hash
"Paul John 7 yo ‘Kanya’ (50%, OB, India, 2018, 1,500 bottles)","Paul John 7 yo ‘Kanya’ (50%, OB, India, 2018, 1,500 bottles) Looks like this one’s very expensive, what happened? Yeah, more than 200€, apparently. Colour: deep gold. Nose: oh, this is very luscious, almost decadent malt whisky. Wood technology was in action here as well, and we do get bourbon once again, or at least some boisterous American oak, with coconuts and vanilla this time. Planks ‘in a good way’, vanillin ‘in a good way’, corn syrup ‘in a good way’, and coconut water ‘in a good way’. With water: barley, oak, vanilla, bread. Mouth (neat): Indian bourbon, really. Comes complete with touches of violets and lavender, over a sea of vanilla custard, butterscotch and grated coconut. Oranges and touches of earth as well. With water: a little easier, but once again I find this more ‘bourbony’ than malty. Not that there’s anything wrong with that. Finish: medium, sweet and sour, easy. Some syrup. Comments: in case you haven’t noticed, I find this very good. Indian whisky for bourbon freaks? SGP:640 - 85 points.",85,2020-01-21,https://www.whiskyfun.com/archivejanuary20-2-Caol-Ila-Springbank.html,95018b4da48cc61ac73a850a43706089996bc56e2cc8474db5644b3924368491
"Amrut ‘Madeira Finish’ (50%, OB, India, 2018)","Amrut ‘Madeira Finish’ (50%, OB, India, 2018) NAS, Madeira, why not? We’ll do this quick… Colour: apricot. Nose: no quibbling, this works. Walnuts, raisins, blood oranges, struck matches, figs. With water: some drier notes, perhaps a little mustard, ink, books… Mouth (neat): Madeira often works, I just do not know why. The powers of malvasia? Lovely mentholness, figs, tobacco, chestnuts or something… All is fine here. With water: drier. Walnuts. Finish: medium, dry, certainly on walnuts. A little white pepper and some sourer fruits. Sorb? Other smaller berries? Comments: pretty dry. I like it, it’s pretty austere, more austere than most Amruts, in fact. SGP:451 - 84 points.",84,2020-01-21,https://www.whiskyfun.com/archivejanuary20-2-Caol-Ila-Springbank.html,7552386cb1769f21251df13e2a33b64d10b2c5841d57a6344f49905eb767db24
"Rampur ‘Vintage Select Casks’ (43%, OB, India, 2019)","Rampur ‘Vintage Select Casks’ (43%, OB, India, 2019) I’m not sure we could call Rampur ‘the third top Indian’ but I suppose we wouldn’t be too far off. Colour: gold. Nose: very fine and rather aromatic, and rather on notes of rum and overripe bananas and pineapples at first, then more on Cognac (peaches, honey, raisins). Stays on Cognac for a long time. That’s funny! More orange blossom water and tinned litchis after a good few minutes, which could be seen as even funnier. Mouth: young Cognac really. More peach syrup, orange blossom water, Turkish delights, acacia honey, also bananas again. Finish: medium, rather drier, and rather more on… malt whisky. Comments: it’s really fine, not sure it’ll win the Nobel Prize of whisky but it’s good stuff for blind tasting. So you say Cognac? SGP:641 - 81 points.",81,2020-01-21,https://www.whiskyfun.com/archivejanuary20-2-Caol-Ila-Springbank.html,2025dba21749442e9d4000ef3d54c65f0a2c9a438c87b9a82d12b1ad91c092bc
"Espero ‘Reserva Especial’ (40%, OB, Dominican Republic, +/-2019)","Espero ‘Reserva Especial’ (40%, OB, Dominican Republic, +/-2019) Apparently, this one was aged in a 7 to 12 year solera. Please make up your mind! Having said, that, espero means ‘I hope’ in Spanish, so, we have… hope. Colour: pale gold. Good news, caramel’s been used sparingly. Nose: it’s very light, with notes of ethanol and even antifreeze at very first nosing, then some kind of hay juice, sour fruits, and of course, vanilla. Some aspects are pretty pleasant though (cane juice), so there’s still… hope. Mouth: extremely light and pretty sweet, but not quite cloyingly so. More sour fruits, this feeling of hay juice once again, liquorice wood, dried herbs (woodruff?), sawdust, and then more and more sugar. That rather kills the whole, sadly. Some burnt caramel that would also leave a bitter taste in your mouth. Finish: short, a little dry and dirty, cardboardy, dusty… Some unexpected aniseed in the aftertaste. Comments: dashed hope, I would say, but that was to be expected. Low-to-average quality rum, not totally terrible, probably for cocktails only. Lo espero! SGP:630 - 67 points.",67,2020-01-21,https://www.whiskyfun.com/archivejanuary20-2-Caol-Ila-Springbank.html,1ede0ab347d175aa930fa9f52041c14ba82ddd065f8cc64d9e93e438878579aa
"Barbancourt 8 yo ***** (43%, OB, Haiti, +/-2018)","Barbancourt 8 yo ***** (43%, OB, Haiti, +/-2018) Yep that would be 5 stars. This is ‘new Barbancourt’, so all ex-columns I believe, but we’ve already tried some pretty good ones, even if older Barbancourts were in a different league. Well, as far as I can tell. Colour: gold. Nose: this nose is a bit similar to that of the Espero, so very light, a tad metallic, with some hay, vanilla and touches of cracked pepper. Nice-ish, nothing to write home about. Very ‘columny’, similar to some young Scotch grain whisky. I know, not obligatorily good news. Mouth: a good two steps over the Dominican, but it’s still too ethanoly to me, thin, grassy, almost dusty. Coffee dregs, and no sugar whatsoever. This is where you start to understand why some makers are adding sugar when a make’s a little bland. Finish: medium, with touches bananas and pears, and alcohol again in the aftertaste. Say Smirnoff. Blakc pepper in the aftertaste. Comments: very disappointing. One extra-point because of the absence of added sugar. SGP:330 - 68 points.",68,2020-01-21,https://www.whiskyfun.com/archivejanuary20-2-Caol-Ila-Springbank.html,e1a88be6a0d97fbfa3f6cf97109bc472d5210bbc702dec84d3f45e09542f7ab4
"Kirk & Sweeney 18 yo (40%, OB, Dominican Republic, +/-2019)","Kirk & Sweeney 18 yo (40%, OB, Dominican Republic, +/-2019) Overpackaged given the pedigree and the price, bad sign. And not sure we should believe the age statement here, that’s probably the age of the oldest drop that’s ever been in the vatting tank, although we’d love to be proven wrong. Colour: amber. Nose: molasses, corn syrup, maple syrup, sultanas, vanilla and café latte. This won’t displease anyone, I’m sure. Perfect restaurant rum, shall we say. Mouth: syrup, jam, molasses honey, raisins, rubber. It’s neither Bumbu nor Don Papa, but the sugar level remains high and makes this baby had to enjoy without a pile of ice. Finish: medium, rather on coffee and chocolate, which is nicer. Quite a lot of bitter caramel in the aftertaste. Comments: for good people who cannot have an espresso without at least three sugar cubes. I do not like it much, but as they used to say after Vietnam, we’ve seen worse. With apologies to all the French and American vets. SGP:730 - 70 points.",70,2020-01-21,https://www.whiskyfun.com/archivejanuary20-2-Caol-Ila-Springbank.html,8408db17d3697004edebd3b7e50de3e61d6e098dbe9774768f705ac075cd1000
"Reimonenq 6 yo 2012/2018 (54%, Cave Guildive, Guadeloupe, 268 bottles)","Reimonenq 6 yo 2012/2018 (54%, Cave Guildive, Guadeloupe, 268 bottles) Reimonenq isn’t very well-known (to me, at least, even if I’ve tried a wee bunch already), even less so at the indies. Well done, Swiss friends! Colour: deep gold. Nose: burst with fresh oranges, cane juice, and rather more diesel oil, rubber and tar than usual. Wonderful whiffs of ylang-ylang. It’s an unusual Guadeloupian indeed! One with a view of Jamaica or Trinidad, I would say. With water: the honeyed firmness of a proper agricole, with a little almond oil in the background. Certainly not a light rhum! Mouth (neat): wonderful, still very unusual, both rich, fruity and silky on the one side, and tarry and estery on the other side. Big pineapples, liquorice allsorts, and engine oil. Not that we quaff engine oil every morning mind you, as we haven’t driven an old British car since… the 1980s. Ha. With water: the fruits win (pineapples, mangos, oranges) but the faint estery, tarry side remains there. Works very well. Finish: medium to long, rather more on antique herbs and fruits cordials, or Mandarine Impériale, old Cointreau and stuff... A little sugar (or litchi syrup) in the aftertaste, where does that come from? Comments: we shall call this a very good surprise. SGP:642 - 88 points.",88,2020-01-21,https://www.whiskyfun.com/archivejanuary20-2-Caol-Ila-Springbank.html,e05250107e24e3a4d2623ab01715d4a9a8615e47fd9a28c21863105fbfb3b173
"Port Mourant 13 yo 2005/2018 (48.5%, The Rum Mercenary)","Port Mourant 13 yo 2005/2018 (48.5%, The Rum Mercenary) I suppose this will be very good. Love the strength too, we’ll give our pipette a rest. Colour: white wine. Nose: immaculate, on seawater, olive brine, and diesel oil. Do you really need more litterature? Of course you don’t, let’s move on… Mouth: classic fresh un-fiddled-with Port Mourant, but with something extra. We’re virtually having oysters with some olive oil, lemon juice, liquid tar, tabasco, and a good glass of bone-dry chenin from the Loire Valley. It’s getting drier and drier over time – but time is short since you cannot not down this at a good speed. Finish: long and lime-y. Green pepper in the aftertaste. Comments: unquestionably one of the greatest distillates out there. Why don’t DDL rather issue this kind of un-stuffy expression? I know, because only die-hard spirit freaks like this style. Fair enough. SGP:463 - 90 points.",90,2020-01-21,https://www.whiskyfun.com/archivejanuary20-2-Caol-Ila-Springbank.html,bcbcc30af6690190dd8c6ed9e707192f1a53c648a41d9890c52035d0e95a87be
"The Scalasaig ‘Island Hopper’ (43%, 3000 bottles, 2019)","The Scalasaig ‘Island Hopper’ (43%, 3000 bottles, 2019) A new blended malt from the folk behind the Whisky Illuminati bottlings, designed to showcase west coast and island style malts. Married together in first fill Spanish oak sherry casks. Colour: amber. Nose: the sherry strikes first with these rather nice notes of mixed nuts, leather and chocolate. Rather christmassy in fact; ideal for January. This quickly shifts towards more vigorous salty and slightly peaty tones though. Typically meaty, leafy and sooty in this modern sherried fashion. Mouth: gun flints, damp leaves, cellar earth, café latte and a rather herbal and earthy peat, which does indeed allude to some more traditional Orcadian flavours I think. Gets nicely chocolatey with salted caramel and a rather chewy texture. Quite figgy as well. Finish: medium and still on lots of chocolate, roasted nuts, earth and very light sooty peat. Comments: A good surprise this. The sherry isn’t always totally integrated, but it’s fresh and makes space for the more peaty and coastal aspects in a rather pleasing way. One for healthy sized tumblers on winter nights. And I think the 43% actually works well here. SGP: 663 - 85 points.",85,2020-01-21,https://www.whiskyfun.com/archivejanuary20-2-Caol-Ila-Springbank.html,3d2e125a17706e459e5ac947bf2182c0d58bb952f9dab23d83af66f77fb05f75
"Blended Malt #1 18 yo batch #3 (47.3%, That Boutique-y Whisky Company, 1049 bottles)","Blended Malt #1 18 yo batch #3 (47.3%, That Boutique-y Whisky Company, 1049 bottles) A teaspooned blended malt, so pretty much a single malt really. Not sure which distillery this could be from, although we do know it is a Speyside, so… Colour: straw. Nose: starts out typically green, leafy and fruity. Classic, modern, mature, easy Speyside malt. I’m guessing Burnside (teaspooned Balvenie). Goes on with grass, sunflower oil, cereals, buttery toast and a little ripe green melon. Mouth: a little richer on arrival in the mouth than the nose would suggest. More brioche, honey, sweetened butter, runny honey and stem ginger in syrup. Very good texture and fatness with this all-pervading natural sweetness. Finish: good length, still rather sweet and syrupy with lemon curd, barley water and stone fruits. Comments: Forget about the nose, this is a pour it and swig type of whisky. You just have to have a bit of a sweet tooth I think. The kind of easy, hyper-inoffensive Speysider that almost no one could be against. SGP: 741 - 87 points.",87,2020-01-21,https://www.whiskyfun.com/archivejanuary20-2-Caol-Ila-Springbank.html,29ebd04503abdcbe0695d97b51b2da237b36c191b6f5bfe32ad83d58512daca9
"Vega 22 yo 1996/2019 (43.9%, North Star Spirits, Blended Malt, European and American oak, 1205 bottles)","Vega 22 yo 1996/2019 (43.9%, North Star Spirits, Blended Malt, European and American oak, 1205 bottles) The 6th edition in this rather cool and very fairly priced wee series from the excellent folk at North Star. Colour: deep gold. Nose: very savoury at first. Notes of pastry, sultanas, fruit scones, melon, apple pie and some more fresh green and garden fruits. Goes on with various honeys, nectars and pollens. Light, complex and very inviting. Mouth: an extremely easy and almost soothing delivery. All on muscovado sugar, dark fruits, toasty cereals, glazed pastry, honey, pecan nuts and wee touches of dried mint and tobacco. Rather syrupy in texture despite the lighter strength, lots of fruit cordials and jams. Finish: good length, more towards earthy tones, milk chocolate, tobaccos and dried flowers. Comments: Quite simply an excellent wee blended malt. Superbly sippable with a nice complexity and easy fruitiness. SGP: 641 - 87 points.",87,2020-01-21,https://www.whiskyfun.com/archivejanuary20-2-Caol-Ila-Springbank.html,40d07dc26829add3db77b547bfcbc4ad3ed5bc21ac3f1be959bd03df6fe119e6
"Blended Scotch 38 yo 1980/2019 (44.9%, Thompson Bros, sherry cask, 490 bottles)","Blended Scotch 38 yo 1980/2019 (44.9%, Thompson Bros, sherry cask, 490 bottles) Labelled as a blend but I have it on pretty good authority that this is in fact a blended malt. Colour: ruby amber. Nose: superbly leafy and mulchy sherry at first, strewn with blood oranges, mint tea, marmalade, kumquat and sultana. Hints of mead, chocolate, praline and well balanced earthiness that adds a little sinew alongside the rather brittle and nervous sherry. In time these notes of freshly brewed coffee get quite profound and direct. Mouth: bam! Bitter chocolate, coffee cake, walnut liqueur, pine resin, pipe tobacco and strawberry wine. Superbly leafy, mineral and fruity sherry. Extremely enjoyable. You don’t need anything further from me. Finish: long, leather, chocolatey, lightly meaty, slightly saline and rather mineral and earthy. Some cherries and other red fruits bobbing about in the aftertaste. Comments: Top notch old malt whisky from an excellent and very old school sherry cask. SGP: 561 - 90 points.",90,2020-01-21,https://www.whiskyfun.com/archivejanuary20-2-Caol-Ila-Springbank.html,e4c229cc98e05243a320b83616a960d532fc8fde2f1894b3eca0e8de7bb7604e
"Elements Of Islay Peat & Sherry (56.8%, Elixir Distillers for The Whisky Exchange 20th Anniversary, sherry butt, 402 bottles)","Elements Of Islay Peat & Sherry (56.8%, Elixir Distillers for The Whisky Exchange 20th Anniversary, sherry butt, 402 bottles) This just in this afternoon. It seems remiss not to include it in this wee session. Colour: light amber. Nose: peat and sherry indeed. Bonfire smoke, smouldering wet leaves, hot beef stock, charred leather and cracked black pepper. Very direct, straightforward and pretty boisterous. Modern peat and sherry don’t often tango too well but they just about manage to avoid stepping on each other’s toes here. With water: more laid back and nicely smoky now. Kippers, tarry rope and wee nip of hot sauce. Mouth: It’s quite sweet with a rather jammy kind of peat at first sipping. Lots of hot smoke, charred wood, dry earthiness and some very salty cured meats. A rather satisfyingly syrupy texture. With water: smoky, sooty, a rather rooty and hot kind of peatiness. The sherry is perhaps a bit subservient to the peat now. Finish: pretty long, very smoky, tarry, briny and the sherry still kicking with a little dark fruit and leaf mulch. Comments: Not particularly complex, but does what it says on the tin with aplomb. If you like this kind of boisterous, clattering flavour profile I can’t really see how you would fail to be satisfied. SGP: 477 - 84 points.",84,2020-01-21,https://www.whiskyfun.com/archivejanuary20-2-Caol-Ila-Springbank.html,3bd70f084a056656a9fbaa308a9bdb7224051fd6434329ed890593b2bc6bb101
"Teeling 27 yo 1991/2019 (44.1%, OB for The Whisky Exchange, cask #10678, rum cask, 160 bottles)","Teeling 27 yo 1991/2019 (44.1%, OB for The Whisky Exchange, cask #10678, rum cask, 160 bottles) Colour: gold. Nose: Kersplat! As they say in Alsace. The word for tropical fruits falling from a great height onto a hot garden patio. Some kind of New Zealand sauvignon blanc with all these crisp notes of nettles, passion fruit, lemon peel, citric acidity and tart gooseberry. Extremely sharp, precise and exuberantly fruity. Just as we have come to expect from these old Irish. And no rum in sight thankfully enough - unless of course you include that as part of the general ‘pina colada-ness’ of the whole thing. Mouth: consistently fruity as on the nose, but also nicely bready now as well. Grapefruit, pineapple, soda bread, cereals, toast, banana chips, more gooseberry. Still extremely fresh, crisp, lively and fruity. A little honeyed sweetness and nectar easing its way in over time. Finish: long but rather light and focussed on fruit syrups, herbal teas, more banana notes and a touch of pine. Comments: Unsurprisingly excellent. SGP: 641 - 90 points.",90,2020-01-21,https://www.whiskyfun.com/archivejanuary20-2-Caol-Ila-Springbank.html,1a879b94978541b8f9a4607fbb4d9cf4bb1804d6dd7dc95d791a7f73f7faed8c
"Willowbank 29 yo 1988/2017 (55.3%, OB for The Whisky Exchange, New Zealand, cask #47, 206 bottles)","Willowbank 29 yo 1988/2017 (55.3%, OB for The Whisky Exchange, New Zealand, cask #47, 206 bottles) Willowbank was sadly closed around the year 2000. Colour: gold. Nose: fruity indeed, with a definite Scottish accent. It’s not quite as exotic or overt as some Irish of similar vintage, rather this is grassy, lean, citric and full of grapefruit, cedar and even hints of white truffle. It’s probably the power of suggestion, but there are elements that nod towards NZ sauvignon blanc. Although, ironically not as much as in the Teeling. With water: all on lemons and limes with touches of canvas, soft earth, dried flowers and things like putty and sackcloth. Mouth: a tad hot at first, with white pepper, aspirin, caraway and even some more unusual notes of hairspray and icing sugar. A tad rough and jagged perhaps. With water: works much better with water, there’s a rather fleshy fruitiness now with more clean grassy qualities, more aspirin, lemon peel, quinine and tart grapefruit. Finish: rather long, grassy, drying and getting surprisingly herbal with more nettles, vase water, dry cereals and even a little chilli heat. Comments: Very curious whisky that nods to several other styles; which you might also say makes it its own thing. I like it, although it is maybe more of historical interest than outright pleasure. SGP: 561 - 86 points.",86,2020-01-21,https://www.whiskyfun.com/archivejanuary20-2-Caol-Ila-Springbank.html,b231311b0de9d18d9463719d5c3d61f0dfd80d578543b1c5ea540ade4b522d51
"Girvan 1989/2019 (51.5%, Whisky Illuminati ‘The Alba Series’, cask #167849, hogshead, 233 bottles)","Girvan 1989/2019 (51.5%, Whisky Illuminati ‘The Alba Series’, cask #167849, hogshead, 233 bottles) Colour: gold. Nose: creamy coconut, buttered toast and a nicely natural cereal profile. Some high, floaty esters and an undeniably elegant sweetness with wee notes of bubblegum. Pretty pleasant I must say. With water: gets almost playfully fruity and doubles down on these kind of juicy fruit and bubblegum notes. Surprisingly good. Mouth: again this creaminess upon delivery which we shall not complain about. More coconut, gorse, creme brulee, foam banana sweets and lemon curd. Some icing sugar sweetness too. With water: butterscotch, heather, sweet coconut and some slightly artificial vanilla notes. Finish: good length and showing notes of marzipan, caramel and shortbread. Still a few confectionary notes as well. Comments: A surprisingly elegant and playful wee Girvan. Evidently from an excellent cask. Well selected! SGP: 640 - 85 points.",85,2020-01-21,https://www.whiskyfun.com/archivejanuary20-2-Caol-Ila-Springbank.html,63029b42e4984ef01391e037b6d23594ff16fc6d492c9afbad99276c67a4c578
"Invergordon 1990/2019 (52.9%, Whisky Illuminati ‘The Alba Series’, cask #906322, barrel, 134 bottles)","Invergordon 1990/2019 (52.9%, Whisky Illuminati ‘The Alba Series’, cask #906322, barrel, 134 bottles) Colour: pale gold. Nose: fuller but also slightly more grubby and greasy. Lacks the easy sweetness and confected fruits of the Girvan. Some dusty cereals, dry toast, cornflakes and a little sunflower oil. With water: gets a kind of jagged grassy note, like an eviscerated cactus (sorry Stefan) and also some sooty notes. Mouth: indeed this is drier, more direct, more punchy and more gravelly. There’s also a curious vegetal character underneath. Notes of cement, wood char and cooking oils. With water: more wood spice now, some caraway, cinnamon powder and more of these mixed cooking oils. Finish: surprisingly length but also rather hot, peppery and slightly aggressive. Comments: Very interesting and suggests a degree of distillate character normally absent from grains. Although, that being said, it’s a tougher customer than the Girvan. SGP: 450 - 78 points.",78,2020-01-21,https://www.whiskyfun.com/archivejanuary20-2-Caol-Ila-Springbank.html,d6a31bceea00b71fe51033bae897de61ec68e6846794a81bb1e6d6a0894a6d5a
"Cambus 28 yo Batch 11 (47%, That Boutique-y Whisky Co, 435 bottles)","Cambus 28 yo Batch 11 (47%, That Boutique-y Whisky Co, 435 bottles) Colour: pale gold. Nose: old custard creams that your Granny might be hiding. In fact, this is largely dominated by a rather nice, dusty biscuity quality. Notes of digestive and rich tea varieties as well. Some sweet cereals, dried leaves, coconut wafer bars and a little mint tea. Pretty nice I have to say. Mouth: nice sweetness on delivery but this one also doesn’t let you forget this is a pretty industrial spirit. It’s rather greasy, slightly fatty and with quite a few artificial sweetener flavours like quinine and foam sweets. Finish: a bit short but nicely sweet and coconutty. Comments: Easy and pleasurable grain, which you may drink without noticing so be careful. SGP: 540 - 81 points.",81,2020-01-21,https://www.whiskyfun.com/archivejanuary20-2-Caol-Ila-Springbank.html,cee9a89cfaf413d517496116852c735ad41a1ddf80db3cc7408439624f61987f
"Cameronbridge 39 yo Batch 7 (44.6%, That Boutique-y Whisky Co, 278 bottles)","Cameronbridge 39 yo Batch 7 (44.6%, That Boutique-y Whisky Co, 278 bottles) Colour: gold. Nose: altogether richer, creamier, fatter and smoother. Grain really does need age. And what’s this! Excuse me but are these tropical fruits?! Some rather lovely fruit salad juices and modest notes of guava, papaya and pineapple. The usual banana notes as well but they’re rather more natural here, banana liqueur perhaps. Some further wee notes of caraway and old Cointreau. Mouth: like most good old grains, they leave the cask itself nowhere to hide, and this was certainly a top notch cask. Creamy, exotic, fruity, slightly fat and textural with an extremely easy sweetness. Danger juice! Finish: medium and still on things like tinned fruity syrups, runny honey and coconut cream. Comments: I feel a little dirty whenever I enjoy a grain whisky this much. SGP: 640 - 87 points.",87,2020-01-21,https://www.whiskyfun.com/archivejanuary20-2-Caol-Ila-Springbank.html,f3d32e341e1d8a31137d812c625ee48f0350fdc832a1d883f70731a810eeef85
"Springbank 21 yo (47.5%, OB, Taiwan Edition, single cask, oloroso, 2016)","Springbank 21 yo (47.5%, OB, Taiwan Edition, single cask, oloroso, 2016) From a set of single casks that had been issued that year for several markets, including this one for Taiwan. They get a lot of good juice in Taiwan! Colour: deep gold. Nose: flints in abundance, also walnuts (naturally) and this feeling of brake fluid, but it’s a bit closed and may need some oxygen. Let’s give this baby a little time… (… you may play some stuff by Frank Zappa in your head while you wait…) Right, more walnuts, also autumn leaves and metal polish, dried porcini, some kind of grassy soot, bitter oranges… It is very Springbank, but perhaps a tad shy? Or is it me? The palate will tell. Mouth: it was me. It’s a mustardy Springbank, pretty fino-y (or is that bone dry Madeira?), peppery, with even more green walnuts now, old chardonnay, pecans, a drop of Worcester sauce maybe, more bitter oranges, bitter herbs, rather a lot of leather, cloves, caraway… I have to say I tend to prefer either bourbon, or rounder sherry, but of course, we’re still flying pretty high. So perhaps not a stratospheric Springbank in my book, but there… Oh and could be that reduction did it a little harm, I don’t think that’s impossible. Finish: long, salty on leather, walnuts and bitter oranges. Peppery aftertaste, with some amontillado? Comments: I tried very hard but I didn’t manage to push it towards the 90-mark. But it remains brilliant whisky, no question about that. SGP:362 - 89 points.",89,2020-01-21,https://www.whiskyfun.com/archivejanuary20-2-Caol-Ila-Springbank.html,0d987d6a87b89c4dd54b8307e7676c83e2a3b339c995cd80534f8807ef25ab31
