whisky_name_raw,review_text,score,review_date,source_url,dedupe_hash
"Isperitus (43%, OB, Bulgaria, single malt, rum barrel finish, 1,800 bottles, 2024)","Isperitus (43%, OB, Bulgaria, single malt, rum barrel finish, 1,800 bottles, 2024) Our first Bulgarian whisky, and indeed, our first Bulgarian single malt. And no, we’ve never tried ‘Black Ram’ – quite the oversight, we must admit. The distillery resides in Isperih, a quaint town in the northeast of Bulgaria, some 150 km from Varna. Colour: gold. Nose: rather pleasant, I must say, with a delicate fragrance. You get those gentle notes of sweet beer typical of very young whiskies, some juicy pear slices, well-balanced vanilla, and oak, and perhaps a hint of rum – but nothing overdone, mind you, so it doesn’t overwhelm the whisky’s character, as can happen elsewhere. Well done, Bulgarian friends. Mouth: indeed, not bad at all, quite in line with the nose. There’s pear again, and prickly pear too, touches of orange, a whisper of baker’s yeast, followed by toasted wood and a touch of toffee. The fruitiness is enough to carry it through and avoids the ‘new plank’ note often found in other very young whiskies. Rather clever to have done a rum finish (and I don’t often say that!). Finish: not even too short. The usual notes of white pepper and cinnamon linger in the aftertaste. Comments: This is rather serious stuff! SGP:641 – 83 points.",83,2024-08-14,https://www.whiskyfun.com/archiveaugust24-1-Caroni-Chichibu.html,5416d420a3bf1707f7d7424ff0b09a98b9a7309c83b29e277284d102dd7397a8
"Milk & Honey ‘Elements Sherry Cask’ (46%, OB, Israel, +/-2024)","Milk & Honey ‘Elements Sherry Cask’ (46%, OB, Israel, +/-2024) Colour: gold. Nose: leaning towards the sweet side, with notes of jelly babies, grenadine, and figs, giving the impression of a sweeter style of sherry. Pralines follow, along with a mix of triple-sec (Cointreau and Grand Marnier, 50/50), and a hint of very fresh panettone, packed with raisins and a touch of orange blossom. I had tasted this ‘Element’ a few years ago, and it seems to have improved mucho since then. Mouth: indeed, it’s harmonious, sweet, very fruity, almost a tad liqueur-like, but pleasantly so. There are small red fruits, cranberries, and blood orange... Finish: follows the same profile, very fruity, without major spices along the way, though there’s a hint of Timut pepper. Comments: it’s not the most ‘prestigious’ of the latest M&H releases, but there will certainly be more to come here on little WF. Peace. SGP:631 – 84 points.",84,2024-08-14,https://www.whiskyfun.com/archiveaugust24-1-Caroni-Chichibu.html,71a5f55b7f6b011e62c658586b18006862a399e23d939d8851af3a9ce1851739
"Milk & Honey 4 yo 2018/2023 (65.8%, Whisky Concerto, Israel, STR, cask #0505, 175 bottles)","Milk & Honey 4 yo 2018/2023 (65.8%, Whisky Concerto, Israel, STR, cask #0505, 175 bottles) I fear that in general, we may never escape the clutches of STR casks again. Nor PX, nor Cabernet-Sauvignon. What can you do, that’s life. Colour: light amber. Nose: rather surprisingly, we find ourselves leaning towards the profile of a young, slightly artisanal bourbon, with liquid caramel, though this likely stems from the very high ABV. Beyond that, it seems rather lovely, rich yet balanced, not vinous as such (but many STR casks aren’t). Quickly, with water: a hint of gin, sweet woodruff, coriander seeds, fresh wood... Mouth (neat): once more, that amusing bourbon-like quality, with even a touch of rye, then dark nougat, juniper, capsicum, and increasingly prominent pepper. Quickly, with water: its better side emerges, with soft pepper, malt, Szechuan pepper, touches of turmeric, and cinchona… Finish: we find a bit of the fruitier side reminiscent of the official version we just sampled, but always with a very marked spicy edge. Comments: very good for its age, but you'll need a pipette worthy of an international competition. Peace. SGP:562 - 84 points.",84,2024-08-14,https://www.whiskyfun.com/archiveaugust24-1-Caroni-Chichibu.html,be39970dfac7dcb12d7567f3fabb47244017333b978271c5352f08ed3caa6219
"Wild Turkey ‘Rare Breed’ (58.4%, OB, USA, Kentucky Straight Bourbon Whiskey, +/-2024)","Wild Turkey ‘Rare Breed’ (58.4%, OB, USA, Kentucky Straight Bourbon Whiskey, +/-2024) We tried a newer expression of WT ‘101’ the other day and were quite taken with it (WF 86). This Rare Breed small batch is reputed to be very ‘maizy’ (75% maize) and is pleasantly affordable. Colour: full gold. Nose: strong yet soft if you will. A slight note of nail polish and hairspray, then orange-infused vanilla and a hint of Earl Grey. Quite charming. With water: rather similar, soft, fruity, with curious but delightful touches of lemon basil. The hairspray notes fade away, thankfully shall we add. Mouth (neat): lovely! There may not be much rye, but its presence remains unmistakable, with orange and cumin, lemon balm, sweet woodruff, and even tiny hints of genepy. I’m quite fond of it. With water: cinnamon and honey step forward, still with that orange note. Finish: much the same. The balance is quite perfect, and the oranges play their role as the ‘uplifters’, if you see what I mean. Comments: let’s not forget that Pernod Ricard sold Wild Turkey to Campari for €430M back in 2009. Well, I’m not sure why that’s relevant here, but there you have it. Solid bronze medal! SGP:631 - 87 points.",87,2024-08-14,https://www.whiskyfun.com/archiveaugust24-1-Caroni-Chichibu.html,5df4c81ce82822284fea819ff667468a2b5d2337fb84db079c773c60cf97b935
"Nantou 5 yo ‘Batch 2’ (52%, That Boutique-y Whisky Company, Taiwan, 10th Anniversary, 281 bottles, 2022)","Nantou 5 yo ‘Batch 2’ (52%, That Boutique-y Whisky Company, Taiwan, 10th Anniversary, 281 bottles, 2022) Colour: white wine. Nose: brilliant! Iodine tincture, drawing gum, paraffin, cloves, camphor, bandages, beech smoke… Was there a reracking in a Laphroaig cask, by chance? I wasn’t aware – or perhaps I’ve missed the memo – that Nantou produced this style. With water: beautiful purity this time. A glass of Verdejo and some fresh wool (a new cashmere jumper – woof). Mouth (neat): again, this rather unique peatiness, this time giving the impression of smoked mussels with lemonwood or something along those lines. With water: it starts to go slightly off the rails, with plastic and rubber showing up a tad too prominently, but overall, it remains very good. Finish: long, with ashes and lemon zest. And that famous new cashmere jumper. Comments: a bit unusual and even deviant, but we’re French, so we’re supposed to like that, according to the world’s press, ha. SGP:465 - 85 points.",85,2024-08-14,https://www.whiskyfun.com/archiveaugust24-1-Caroni-Chichibu.html,ce61a93ca86afef4600ae0f3adee1637e276504a71e81062b7ae54939b8247fd
"Chichibu 8 yo 2014/2024 (56.4%, Adelphi, Japan, cask #3822, 215 bottles)","Chichibu 8 yo 2014/2024 (56.4%, Adelphi, Japan, cask #3822, 215 bottles) Ah, there we have it, brilliant! It seems they’ve finally upped the font size on their labels at Adelphi, but now it's all in Japanese! Provocative, isn’t it? Not that we don’t admire Japanese characters, mind you… Colour: straw. Nose: razor-sharp precision, pure barley, lemon, and that’s all, basta cosi. With water: even more pinpoint, almost Malevich-esque. A white square on a white background. Mouth (neat): pure Chichibu, thick yet nervous, tense, with barley, lemon, and a hint of hay. Tiny notes of gentian and absinthe peeking through. With water: sublime purity, with that barley nudging its way back in. Finish: long, lemony, slightly waxy, a tad thick, with a whisper of tar. Comments: simply our preferred style. And it’s hardly surprising that the folks at Ardnamurchan/Adelphi chose this cask. Great minds think alike, and all that. However, there’s still the matter of sorting out that label issue. When’s the head designer retiring, again? Anyway, gold. SGP:551 - 91 points.",91,2024-08-14,https://www.whiskyfun.com/archiveaugust24-1-Caroni-Chichibu.html,10a0362cdd7f34281731f802cdc54a9143bbf4b90c26953b282124390ae3df52
"Bimber 2018/2023 (58.9%, OB, England, LMDW, cognac cask finish, cask #327/05)","Bimber 2018/2023 (58.9%, OB, England, LMDW, cognac cask finish, cask #327/05) Between us, it's quite an achievement to manage to sneak a finishing in the production of such a young whisky, isn't it? But we do love Bimber... Colour: gold. Nose: sweet and gentle, with vanilla and a few raisins, then banana and the usual hint of mango. Tinned peaches do indeed evoke cognac, though we remain quite soft here, with a medium-sized panettone making an appearance thereafter. With water: pure cassata, with plenty of dried fruits. Mouth (neat): slightly creamy and sweet, with citron and bitter orange, a drop of banana liqueur, ultra-ripe apricots, and honey... With water: that slightly liqueur-like side of Bimber, quince jelly, mango liqueur... It works perfectly. And of course, peach jam, probably from the cognac (not entirely sure, S.). Finish: medium length, liqueur-like fruitiness, sweet pastries, crossing into almonds. Comments: it's extremely good and certainly not a 'cognacsky.' SGP:741 - 87 points.",87,2024-08-13,https://www.whiskyfun.com/archiveaugust24-1-Caroni-Chichibu.html,10b93e43707ede37f629927f5b99811d635518171971cf54cb0174345b02d9ee
"Bimber 'Oval' (57.56%, OB, England, The Spirit of the Underground, Moscatel cask, cask #282/22, 307 bottles, 2024)","Bimber 'Oval' (57.56%, OB, England, The Spirit of the Underground, Moscatel cask, cask #282/22, 307 bottles, 2024) We know ‘Oval’, but we know ‘Orval’ better. Sorry, we couldn’t help ourselves. That said, the connection between the London Underground and Spanish Moscatel seems a bit far-fetched, doesn’t it? Colour: deep gold. Nose: good news, it’s not an overwhelming muscat explosion that makes you want to immediately chug a magnum of Perrier. Instead, it offers a pastry-like aroma, reminiscent of galette des rois, frangipane (a bit off-season, aren’t we?), and orange blossom water. Lebanese pastries (poor Lebanon!) With water: notes of sesame oil. Mouth (neat): the woodiness is quite present, with a pronounced white pepper at the forefront, followed by ginger and dark chocolate. Lots of pepper. With water: it becomes more floral, with also Demerara sugar and a hint of beetroot. Yes, really. Finish: quite long, quite spicy, quite vegetal. Herbal. Comments: it lacks a bit the ‘clear line’ of Bimber, in my opinion. In any case, I have the impression that muscat is very difficult to handle generally, but it remains an excellent whisky of course. SGP:651 - 84 points.",84,2024-08-13,https://www.whiskyfun.com/archiveaugust24-1-Caroni-Chichibu.html,20fa56f87dae8a02ab894fb17e13591c0dd9bc3153956afe916beead6327f795
"Willett 'Pot Still Reserve' (47%, OB, USA, Straight Bourbon, +/-2023)","Willett 'Pot Still Reserve' (47%, OB, USA, Straight Bourbon, +/-2023) I must admit, I haven’t yet totally found in recent Willets the magnificence of some older versions. Apparently, this is a batch-distilled bourbon rather than ex-continuous column, unless I’m mistaken (which wouldn’t surprise us, S.). Colour: gold. Nose: sweet, fruity, with cedarwood, vanilla, apricot liqueur, a touch of coconut, a very light varnish, and that ‘liquid patisserie’ note—admittedly a bit nonsensical, we agree. Mouth: no, it’s good, very bourbon, with initial notes of juniper and lavender, followed by vanilla, ripe apple, and white pepper, then a hint of maple syrup. Finish: quite long, easy, honeyed, delicately spiced, with a gin-like quality. Yes, it’s me who wrote that. More wood in the aftertaste. Comments: very good, not taking many risks, for our benefit. SGP:551 - 86 points.",86,2024-08-13,https://www.whiskyfun.com/archiveaugust24-1-Caroni-Chichibu.html,d6c5bb6aea442daf52504ac839e38e87b61057fe9dc4f3591ebcc28a5eeb26cd
"Knob Creek 9 yo 'Small Batch' (50%, OB, USA, Kentucky Straight Bourbon, +/-2023)","Knob Creek 9 yo 'Small Batch' (50%, OB, USA, Kentucky Straight Bourbon, +/-2023) We’ve only sampled Knob Creek once before, and it wasn’t bad at all (WF 83 in 2014). Colour: full gold. Nose: yes, lovely, light, vanilla with hints of sandalwood and incense, juniper, ginger, cedar... Who could object to that? Mouth: but of course, it’s very good, almost perfect, spiced just right, perhaps a tad too oaky, but otherwise, on apples and oranges. An increasingly pronounced rye character – is there a lot of rye in Knob Creek? Finish: of medium length, perhaps just a bit drying. Comments: I like it rather a lot. SGP:651 - 85 points.",85,2024-08-13,https://www.whiskyfun.com/archiveaugust24-1-Caroni-Chichibu.html,7c69753787373b4944a9bc55ea36b84b7fdebcfd1761fc186d0eddb2658c33d5
"Nantou 4 yo 2014/2018 'Omar' (56%, OB, for Hot Malt, Taiwan, Keeper Richard's Choice 2, bourbon cask, cask #11140817, 210 bottles)","Nantou 4 yo 2014/2018 'Omar' (56%, OB, for Hot Malt, Taiwan, Keeper Richard's Choice 2, bourbon cask, cask #11140817, 210 bottles) A compadre Keeper! One gets the feeling this will go well... A quick reminder that Omar/Nantou is part of a state monopoly in Taiwan. Try this here and within a year, they'd all be round as barrels and not a single bottle would hit the market. Quite. Colour: white wine. Nose: oh, ashes, seaweed smoke, oysters, wet limestone, white pepper... It's magnificent. With water: new plastic, engine oil, nylon, polystyrene... Mouth (neat): superb. Young Lagavulin meets young Ardbeg, 50/50. A bit rough, though. With water: good, but still a tad aggressive. Vegetation smoked with beechwood. Finish: very long, saline, very smoky, arguably a touch extreme. A hint of mercurochrome. Comments: not subtle, but then again, only 4 years old. SGP: 367 - 86 points.",86,2024-08-13,https://www.whiskyfun.com/archiveaugust24-1-Caroni-Chichibu.html,82b5d546b6fba4a3d873a66949b99f85c2012624b55a49370eec2651ecdde1b8
"Kavalan 9 yo 2014/2024 ‘9 years + 363 Days’ (60.2%, Tiffany’s New York Bar Hong Kong, Taiwan, Port cask, cask #O140311068A, 147 bottles)","Kavalan 9 yo 2014/2024 ‘9 years + 363 Days’ (60.2%, Tiffany’s New York Bar Hong Kong, Taiwan, Port cask, cask #O140311068A, 147 bottles) This baby offers an abundance of fun, and we adore that they didn’t wait the extra three days to make it a ‘ten’ (remember, ten = deal). A sublime bit of coquetry from our friends at the InterContinental Grand Stanford Hong Kong on this Taiwanese malt! Colour: mahogany. Nose: a carpenter’s workshop, cherry wood, teak, thuja, tomato sauce, cellulose varnish, then blackcurrant buds. A slight hint of young Pommard. With water: incense and pepper, mushrooms, brown tobacco (Gauloise), pine bark, humus. Mouth (neat): it’s really quite excellent, though perhaps a tad over-wooded. Cherry stem tea, cherry liqueur, bitter almonds, Italian cigars (Toscani), cloves… With water: gentler, chocolatey, with kirsch. Don’t add too much water, though, despite the 60.2% ABV. Finish: another whisky that leans slightly towards rum. I’d say a Port Mourant from Guyana. Comments: no, it’s quite superb, very fine cask aging technology, although for me, nothing can surpass the best ex-bourbons from Kavalan. SGP:461 - 88 points.",88,2024-08-13,https://www.whiskyfun.com/archiveaugust24-1-Caroni-Chichibu.html,87053dccbde6843e0fba08ddb2a38cb2855682d3c897b7f02ab61ef83eb2286b
"Alfred Giraud ‘Intrigue #2’ (51.5%, OB, France, +/-2024)","Alfred Giraud ‘Intrigue #2’ (51.5%, OB, France, +/-2024) We genuinely enjoyed the first version of this Intrigue, offered by the whisky growers/breeders Alfred Giraud. Young whisky sourced from France, then aged in top-tier casks and bottled in a luxurious fashion, reminiscent of the great Cognac houses with their ‘super-premium’ expressions. Colour: gold. Nose: very fine delicacy, with ripe yellow peaches and a hint of Sémillon, meadow honey, a bit of alpine muesli (what?), and a complex, rather fruity curry, followed by notes of almond croissant. It’s quite unimpeachable , shall we say. With water: as often with young whiskies, it leans towards cake dough, baker’s yeast, and white flowers. A slight chalky touch, as is often the case. Mouth (neat): juicy, still on ripe peach, but with more prominent wood (ginger, cinnamon) and strongly infused green tea. A pronounced French oak character. With water: it falls into place, with a return of fruits, apricot and peach, plus honey and herbal teas, chamomile, cinnamon... Finish: long, with casks playing the leading role. Plenty of tea. White clover in the aftertaste. Comments: very good, as expected. Truly a very good cask-driven work. SGP:551 - 87 points.",87,2024-08-12,https://www.whiskyfun.com/archiveaugust24-1-Caroni-Chichibu.html,75b0f787e0cae0b192d659044f2ab760d830ed76a2476fe8fa650eb8c4d6603e
"Morris of Rutherglen ‘Muscat Barrels’ (46%, OB, Australia, +/-2023)","Morris of Rutherglen ‘Muscat Barrels’ (46%, OB, Australia, +/-2023) Back to Victoria we go, to visit these winemakers/distillers. This is a finishing in their own Australian muscat casks (Morris), which I find rather cool. Hooray for self-finishing! Colour: deep gold. Nose: the sweet wine is noticeable but works well, being balanced, delightful, soft, fruity, and not excessively muscated. A very lovely floral note, ylang-ylang, a hint of jasmine, and a touch of small-berried muscat blanc. Then, quite a bit of buttercream, pastries... Mouth: undoubtedly a bit too much on the palate, with a very pronounced sugary vinosity accompanied by notes of old cask. That said, the orange liqueur sensation comes to the rescue; I reckon it's the orange liqueur or the triple sec that truly deserve medals in San Francisco, at the IWSC, WWA, etc. At least an honorary medal for the entirety of their work as descriptors. Finish: medium length, sweet, on muscat raisins. Comments: not bad at all, but a tad excessive in the whisky/wine mix for me. SGP:741 - 81 points.",81,2024-08-12,https://www.whiskyfun.com/archiveaugust24-1-Caroni-Chichibu.html,06779308d7a0be626863e656dbd3e9032e47142f0fe6c5029c0edf0682635b9d
"Amrut 5 yo 2017/2022 'Ex-Sauternes Cask' (60%, OB, La Maison du Whisky, cask #8038, 2198 bottles)","Amrut 5 yo 2017/2022 'Ex-Sauternes Cask' (60%, OB, La Maison du Whisky, cask #8038, 2198 bottles) I've often noticed that the somewhat exuberant nature of Amrut's malt allows it to hold its own with powerfully expressive wines. Like Sauternes, let's see how this goes... Colour: dark gold. Nose: the Australian Morris serves as a real springboard here, with more mango and orange at the forefront in this Amrut, followed by sémillon and honey-glazed ham. This ham is quite amusing and lovely - and unusual. But that might change with the first drop of water... With water: hints of clay and gunpowder, a tiny bit of hard-boiled egg, then aubergine and mead. Mouth (neat): utterly sinful, peach sorbet, pink banana, lemon fudge, cassata, oranges, and a slight sulphur touch that's not off-putting, almost the opposite. With water: orange blossom, cream eggs, peach liqueur. Finish: fairly long, with pink grapefruit taking charge. Honeyed aftertaste, without any sulphur at all. Comments: the problem with ex-sweet wine casks is that they are very fragile and thus require quite a bit of sulphur unless you refill them very quickly. Otherwise, they can start to spoil. This very, very lovely Amrut stayed in the safe zone, fortunately. SGP:751 - 85 points.",85,2024-08-12,https://www.whiskyfun.com/archiveaugust24-1-Caroni-Chichibu.html,4e55ca236303b6cab6324e0a3a4ce2cfcd12b63d8665b52cbf2bb2a571ba7bed
"Kilian 2019/2024 ‘Unpeated’ (59.4%, OB, Germany, single cask, ex Four Roses bourbon barrel)","Kilian 2019/2024 ‘Unpeated’ (59.4%, OB, Germany, single cask, ex Four Roses bourbon barrel) Colour: very white white wine. Nose: I’m not sure I get the Four Roses but I really enjoy these fresh pastries, croissants, cakes, scones, shortbread, and then the heaps of apples and pears of various sorts that pour into your glass. Fresh and impeccable. With water: lemon macarons, amaretti, linden blossom tea. Nothing to discard. Mouth (neat): brilliant, Williams pear eau-de-vie, apple juice, acacia honey, a touch of lime. It's akin to an excellent cocktail, invigorating and refreshing. With water: still on quality eaux-de-vie, you’d even find some service tree berry and wild cherry. A hint of liquorice and gentian in the background. Finish: fairly long, fresh and lively, with apples reigning supreme. Comments: this is really good. Off you go, a lovely bronze at the WF Olympics! SGP:551 - 87 points.",87,2024-08-12,https://www.whiskyfun.com/archiveaugust24-1-Caroni-Chichibu.html,4c47f5ff1b0c9e9c7a68e470c3a1278482dc8b4ac001ee99c9799149cb901400
"Brigantia 12 yo ‘Edition Constantia’ (45%, OB, Germany, 2022)","Brigantia 12 yo ‘Edition Constantia’ (45%, OB, Germany, 2022) A barley malt whisky from Lake Constance! Even if their ‘Classic’ was a bit tricky last year (WF 76), let’s go in with an open mind. Colour: gold. Nose: incredible, it’s ultra-floral, with geranium, rose, and acacia flower at first sniff. Once your olfactory bulb filters all that, we arrive at traditional pastries, streusels, kougelhopf, and then sourdough. Mouth: it’s a bit odd, with double cream, rennet, and unleavened bread at the start, then powdered pepper and 7Up. We almost ventured into Red Bull territory. Finish: medium, a bit dusty. Some good aspects (old apples) nonetheless. Comments: I’m not quite sure what to make of this baby. Maybe nothing, it has its good sides, others are a bit more problematic – but remember, it’s just one man’s opinion. SGP:542 - 75 points.",75,2024-08-12,https://www.whiskyfun.com/archiveaugust24-1-Caroni-Chichibu.html,a68245d70c26efdad9d060203d143c15f38732cc728e0b803f94fc97806f3949
"Tennessee 10 yo 2011/2022 'Just Dram It' (47.9%, Whisky Picnic Bar Taiwan, USA, barrel, 102 bottles)","Tennessee 10 yo 2011/2022 'Just Dram It' (47.9%, Whisky Picnic Bar Taiwan, USA, barrel, 102 bottles) Generally speaking, these little darlings are George Dickel. Not bad news, if you ask me. Colour: gold. Nose: once again, one of those bourbons that flirts a bit with the world of sweet rum, thanks to the use of columns that somewhat soften the impact of the distillate and, by contrast, give more prominence to the casks. You know what I mean. It's beautifully vanilla-y, with a hint of nail polish, cherry, macadamia nuts, touches of pineapple and perhaps a bit of sesame. Mouth: ah, very good, more on the citrus side, although the wood is a tad too pronounced for me. The sweet woodruff shines here (have you ever tried woodruff syrup or liqueur?) Very nice balance, leaning slightly towards a hazelnut coffee akin to some of Starbucks. Finish: medium length, with notes of ripe banana and cinnamon. The woodruff lingers in the aftertaste. Comments: I find it really good. SGP:551 - 85 points.",85,2024-08-12,https://www.whiskyfun.com/archiveaugust24-1-Caroni-Chichibu.html,154e1642a9b26258614f38ccdc5c497631053a294044ed10a191bc8f8901ef47
"The Arcane 'Extraroma' (40%, OB, Mauritius, +/-2022)","The Arcane 'Extraroma' (40%, OB, Mauritius, +/-2022) Every time a brand adds a ‘The’ to their name, it gives us a good chuckle. Last year, we tried an Arcane 'Délicatissime' which turned out to be far too sweet for me (WF 64). Let's see if, at 40%, there truly is an extra aroma here, though we're not dreaming of anything extraordinary. Colour: gold. Nose: a pure blend of acacia honey, maple syrup, and cane syrup, with a hint of pineapple liqueur and young sweet muscat (like Frontignan). On paper and on the nose, it seems pleasant and, indeed, very aromatic. But we all know where the devil hides... Mouth: glycerine texture. A mix of the aforementioned syrups and liqueurs, with a slightly bitter caramel and vanillin base. Very sweet. Finish: short, sweet. Comments: to think this is pure cane juice at its core. Truth be told, it's not too bad, just far too sweet for my liking. Pass the ice bucket, please. SGP: 730 - 70 points.",70,2024-08-11,https://www.whiskyfun.com/archiveaugust24-1-Caroni-Chichibu.html,efee3b751d622b7175800a9d076ec2924d02da7d5bc024954fba555f09b29f62
"Sodade 'Cana Rocca Ouro Blanco' (43.1%, OB, Cape Verde, grogue, +/-2023)","Sodade 'Cana Rocca Ouro Blanco' (43.1%, OB, Cape Verde, grogue, +/-2023) Pure red cane juice, wild yeasts, very long fermentations, local pot still... We tried a Sodade 'Botanic Joao' last summer and it was fantastic (WF 88). This Ouro Blanco, which means white gold, has only aged for 6 months in barrels. Colour: pale gold (not white at all!). Nose: superb distillate, somewhat straddling the line between a fine light mezcal and a true rhum agricole. Plenty of dried leaves, a fair bit of tobacco, light earth, some little pink olives, a bit of seaweed, tiny citrus fruits (finger lemons), sea water. Superb nose, superb distillate. When’s the next boat to Cape Verde? Mouth: excuse me, but this is delicious! Lively yet civilised, salty, slightly smoky, mezcal-like again (there must be agaves in Cape Verde) and still with plenty of citrus, a touch of cucumber and gherkin, very light hints of compost and even peat. A bit like a light Talisker from the South if you will. Finish: not very long, ashier, slightly drying but not at all unpleasant. Comments: you don't see these grogues often, which is all the more reason to pounce when you do. I love this one as much as the 'Botanic', even though it's very different. Bang, a medal for Cape Verde. SGP:552 - 88 points.",88,2024-08-11,https://www.whiskyfun.com/archiveaugust24-1-Caroni-Chichibu.html,9ffa7cd88f006488b40264edae3e7fc40867c6101e13b2c4953f6878fc3a5ad8
