whisky_name_raw,review_text,score,review_date,source_url,dedupe_hash
"Ichiro’s Malt ‘Double Distilleries’ (61.3%, OB, Whisky Rising, Japanese blended malt, vatted at Chichibu, 2018)","Ichiro’s Malt ‘Double Distilleries’ (61.3%, OB, Whisky Rising, Japanese blended malt, vatted at Chichibu, 2018) So, this is meant to be a vatting of Chichibu and some of the last drops of Hanyu. It was selected by Stefan Van Eycken and our good friend Hideo Yamaoka. Not that Stefan isn’t our friend min you. As for the proportions, it’s all written in Japanese anyway, so I couldn’t tell you. Let’s say ‘certain proportions’ (well done, Einstein). Colour: gold. Nose: probably young Hanyu, because this is as fresh as a baby’s mouth, yet rather wood-driven but not in bad way at all. A walk in the woods, some custard for sure, béchamel sauce, some cardamom and nutmeg, mint and camphor, pine needles and caraway, cloves and orange peel… It takes its time but it’s really becoming complex over time. With water: nicely medicinal, but not any more complex. Not sure it needed water… on the nose! Mouth (neat): extremely powerful, sappy, resinous, citrusy, peely, pretty sharp but full of promises… With water: exactly the opposite of what happened on the nose, this time water makes it super fresh, on tangerines, touch of brine, a light smokiness perhaps, olives, raw zucchini, and actually more than a touch of brine. Finish: long, fresh, on all kinds of raw vegetable ad some perfect citrus. Comments: very lovely indeed. Careful with your pipette, as always with these very strong whiskies, it’s never easy to bring them down properly. SGP:463 - 89 points.",89,2020-04-14,https://www.whiskyfun.com/archiveapril20-1-Chichibu-Lagavulin.html,56e10ac510bf6213a125799a6dffb8cf9aa3ff515fb1a3e4a8136475dce952e9
"Chichibu 2011/2019 (59.2%, OB for the Whisky Exchange, 20th Anniversary, Coedonado beer cask, cask #3301, 224 bottles)","Chichibu 2011/2019 (59.2%, OB for the Whisky Exchange, 20th Anniversary, Coedonado beer cask, cask #3301, 224 bottles) I shan’t try to find out about that ‘Coedonado’ beer. We do love mysteries here… Colour: deep gold. Nose: I don’t know. Imagine that someone would have poured a drop of crème de menthe into a glass of Mackeson Stout, shaken the stuff (taken the foam away and) then mixed the result with Fanta, 50/50. It’s very bizarre, but not unpleasant at all. A lot of chocolate too! With water: ginseng all over the place! And other stuff that we’ve never ever found in any whiskies, all around the idea of… fermentation. Manure? Mouth (neat): right, Colgate’s best, cocoa powder, cranberry juice, more stout, and smaller sour notes. Young Munster cheese, chitterlings, and even more stout. And more Fanta. I’m really not sure, this beverage is highly unusual, incredibly unlikely, and just pretty challenging to me. With water: funny. Pink pepper, regular pepper, pomegranate juice, raw chocolate, a drop of soy sauce, some plaster, whacky sausages… Wild boar charcuterie? What a… a thing! Finish: spices this time, none known to man. And salted orange juice, whicj, in itself, is pretty challenging already. Comments: there, a new concept: abstract whisky. How do you score this? More or less at random… SGP:462 - 80 points.",80,2020-04-14,https://www.whiskyfun.com/archiveapril20-1-Chichibu-Lagavulin.html,0fcb4c5a822baa36a2070a840ddf494c210e56a4a7a66d12a2968721609bf0dd
"Chichibu 10 yo 2008/2019 (59.9%, OB, TMC 10th Anniversary, bourbon barrel)","Chichibu 10 yo 2008/2019 (59.9%, OB, TMC 10th Anniversary, bourbon barrel) As the back label of this rather mysterious bottle reminds us, 2008 was Chichibu’s very first year. Colour: gold. Nose: what we love in a fairly young malt whisky, that it to say barley, brioche dough, porridge, custard, very fresh baguette and a touch of cappuccino, all that in perfect sync. We do not need more, adding flavours from the outside would only be… superfluous in this case. With water: touches of tiny herbs, white asparagus (they have arrived!) broken branches, some fresh earth, a little humus… Mouth (neat): pungent at this strength, a tad buttery (not butyric), with some freshish oak that the humble taster still needs to tame… with water, I guess. With water: indeed. Lovely citrusy/herbal combination now, I cannot not think of Japanese green tea – but sadly, I do not know much about those. Have to do my homework! Finish: long, fresh, clean, on barley, citrons and muesli. Touches of orange peel in the aftertaste. Comments: when the distillate’s superb, the all-natural ones always destroy the ‘painted ones’ in my book. But that’s only me. SGP:461 - 90 points.",90,2020-04-14,https://www.whiskyfun.com/archiveapril20-1-Chichibu-Lagavulin.html,87185a86fea1fa2f5505c61bab2f915110323a16c6a4b0b9582dba8338b2b599
"Uisge Teine 12 yo 2007/2019 (53.5%, Svenska Eldvatten, blended Scotch, bourbon barrel, cask #SE110, 253 bottles, 2019)","Uisge Teine 12 yo 2007/2019 (53.5%, Svenska Eldvatten, blended Scotch, bourbon barrel, cask #SE110, 253 bottles, 2019) A vintage single cask blend, that’s interesting. Let’s see if we find a lot of grain whisky… Colour: white wine. Nose: I do find some grain whisky indeed, with these whiffs of varnish, popcorn and coconut water, but that could be some light malt as well. Then apple pie, tarte tatin, raw barley, and notes of ale. With water: more malt, more natural vanilla, brioche, a wee touch of aniseed… I have to say I like it more now. Mouth (neat): typical, once again. Cappuccino, café latte, jelly babies, marshmallows and cereals. Buttered popcorn and wafers. With water: and once again water really enhances it, even if that wouldn’t totally change the style. Butterscotch, carrot cake. Finish: somewhat long, with a little chocolate and coffee liqueur (Kahlua) as well as a feeling of having had sucked an orange drop. Comments: easy and firm at the same time. Very good for a blend. SGP:631 - 82 points.",82,2020-04-13,https://www.whiskyfun.com/archiveapril20-1-Chichibu-Lagavulin.html,4e329239800d7c00aa1127840e1af754f7c3c9632f92761a84b374d05a0a3f09
"Uisge Teine 16 yo 2003/2019 (56.2%, Svenska Eldvatten, blended Scotch, hogshead, cask #SE109, 196 bottles, 2019)","Uisge Teine 16 yo 2003/2019 (56.2%, Svenska Eldvatten, blended Scotch, hogshead, cask #SE109, 196 bottles, 2019) Colour: straw. Nose: a rougher, wilder style, with more smoke, earth, stone and a rather unusual combination, between lapsang souchong and pine-y essential oils. Some lovely umami-y touches as well, that always works. Also strawberry yogurt and , well even more lapsang souchong. Did anybody use juniper wood at some point? With water: gets straighter, more mineral. Lovely nose, a bit old-school now. Mouth (neat): yep! Once again a feeling of green smoke, juniper wood, thuja, smoked tea, caraway, an a good maltiness behind that. Someone must have had some fun composing this blend. With water: very good indeed. More fruits this time, peaches, papayas… While it got just a wee tad thinner. Finish: medium, creamy, with more oranges. No complains then. Comments: super well done! SGP:543 - 85 points.",85,2020-04-13,https://www.whiskyfun.com/archiveapril20-1-Chichibu-Lagavulin.html,747b587a7c5aca0fefd80bbb1054f8f6d889ad42d14d4eb48fa721c315a0274f
"Highland Malt 32 yo 1987/2019 (49.9%, Maltbarn, 159 bottles)","Highland Malt 32 yo 1987/2019 (49.9%, Maltbarn, 159 bottles) Don’t you think it is a little sad that these excellent bottlers just couldn’t tell you about the origins of this (most probably) excellent thirty-two years old malt whisky? Colour: stunning gold. Nose: honeys, marmalades, and touches of limestone and flints. Then dried figs, beeswax, maple syrup, pine needles, drop of miso and Bovril, and just a few drops of amontillado. Not even sure this is a sherry cask – well it sure should be. Mouth: very tense, rich, with a green/bitter side that balances the dried fruits, raisins, figs… As if someone would have added a drop of Chartreuse to a classic Macallan. Finish: rather long, with a tiny spoonful of cold-brewed mocha poured in. A little leather in the aftertaste. Comments: as long as they’ve got ages and vintages, we’re fine. Imagine one day post-Covid, no name, no age, no vintage, they’ll call their whiskies ‘Blah’. Seriously, I believe it’s the opposite that’ll happen, back to loyal behaviours! Oh and Maltbarn, this was excellent. SGP:561 - 89 points.",89,2020-04-13,https://www.whiskyfun.com/archiveapril20-1-Chichibu-Lagavulin.html,e93a9f24b606cc73ad09321a1d5b7dd4a6b8faace3fba625dc1091d556e3ccbb
"Elements of Islay ‘Peat & Sherry’ (56.8%, The Whisky Exchange 20th Anniversary, Islay blended malt, 2019)","Elements of Islay ‘Peat & Sherry’ (56.8%, The Whisky Exchange 20th Anniversary, Islay blended malt, 2019) Hush hush, we’re late once again… Colour: deep gold. Nose: It’s not because I’ve mentioned lapsang souchong only a few minutes ago, but this really reeks of lapsang souchong, with a few lotus flowers and peonies thrown in. Some kind of tea, really. Absolutely not your average Islayer, this is very modern, it’s even got echoes of Dutch-hipster geneever. With water: crème de menthe, more lapsang, sauna oils, dried figs. Mouth (neat): modern. Marmalade, juniper, lapsang, strawberry jam, Korean smoked oysters (not making this up, I promise), some caramel, Cointreau… Maybe was this made in a secret lab somewhere in London? At Bimber’s? With water: very good, I’m afraid. Some aspects even remind me of Lost Spirits’ best works over there in Donaldland. Finish: long. Comments: desperately modern and disappointingly excellent. I’m still calling this a guilty pleasure, but I’m sure that’s more or less just me. Old Catholics, you know… SGP:566 - 87 points.",87,2020-04-13,https://www.whiskyfun.com/archiveapril20-1-Chichibu-Lagavulin.html,eff01b04926e15a9c084ee87a549bb0b08dcbe13d974bbcab51a91be3d7ce29b
"Port Askaig 12 yo (47.8%, Elixir Distillers, 2020)","Port Askaig 12 yo (47.8%, Elixir Distillers, 2020) Still Caol Ila? Colour: white wine. Nose: you bet. Lime, crabs, oysters, seawater, ashes, sheep wool, tangerines. Let’s keep this short and sweet, if you agree. Mouth: I’ve always thought that Cao Ila was proof that large and almost ‘industrial’ facilities (no it’s not the settings that would make a production site more or less industrial) can make perfect malt whisky. With even a feeling of terroir, which takes the biscuit since the barley comes from all over the world whilst the new make leaves the island in tankers as soon as it’s been distilled. And yet, this is just a perfect whisky with a true ‘feeling of the place’. Go figure. Finish: tangerines and oysters. Have to try that one day – sounds like a perfect lockdown occupation, no? Now go find oysters in Mitteleuropa these days… I think we’ll go for a bottle of the new Port Askaig 12 instead! Comments: just impeccably zesty. SGP:556 - 88 points.",88,2020-04-13,https://www.whiskyfun.com/archiveapril20-1-Chichibu-Lagavulin.html,850008c9d0b1a9f769a212596773ba8a948b5a3d8fe7f5324e30ff20343ca523
"Port Askaig 18 yo (50.8%, Elixir Distillers, for USA, 2020)","Port Askaig 18 yo (50.8%, Elixir Distillers, for USA, 2020) This is a single cask. Early 2000s distillate, perfect, that’s when the Malt Maniacs visited and tried all the buttons in the control room while no one was watching. Colour: straw. Nose: but of course, olive brine, diesel oil, oysters, newspapers of the day, ashes, seawater. This is pristine, Christine. With water: wool, old jacket, fisherman’s nests, hessian, stuff like that. Mouth (neat): rather rounder than others, but full, rather jammy, with quite a lot of marmalade, some kind of smoky Turkish delight, a feeling of cask-strength margarita, and this lovely saltiness that just always works. But where the heavens does it come from? Only specific molecules that trigger saltiness on our palate? I never bought that theory. With water: still sweeter and fruitier. Finish: medium, on Jaffa cakes and marzipan. Comments: a rather rounder CI – if it’s well CI – but quality’s very high. Naturally. Hope no one ever going to requisition these… SGP:644- 88 points.",88,2020-04-13,https://www.whiskyfun.com/archiveapril20-1-Chichibu-Lagavulin.html,d58f0024b787d4ae1d6e0b5654c0ef9885d6f1bb1cd690b87a939bf90d4ea3c7
"Smoking Islay (58.5%, Blackadder, Raw Cask, blended malt, The Spirit of Legend, cask #2018-05, oloroso finish, 345 bottles, 2018)","Smoking Islay (58.5%, Blackadder, Raw Cask, blended malt, The Spirit of Legend, cask #2018-05, oloroso finish, 345 bottles, 2018) Sure it’s a finish, but I’m sure this will be okay. Colour: gold. Nose: it was light, nutty oloroso, which also imparted touches of Maggi and gunpowder. In moderation, that gunpowder. Other than that, smoke, seawater, iron, seashells, and asparagus velouté. And walnut wine. With water: fumes, old garage, struck matches and, err, plain s……. Mouth (neat): ooh, this is powerful! In a way it’s the opposite of Elixir’s Peat & Sherry, which seemed to be composed with maximum care and even reflexion, while this one’s just raw, rebellious, and boisterous. With water: oranges will save the world! They sure saved quite a few whiskies already. Marmalade aplenty. Finish: long, a tad leathery, marmalade-y, smoky. Comments: just wild and very good. Get your silver hipflask ready. SGP:555 - 85 points.",85,2020-04-13,https://www.whiskyfun.com/archiveapril20-1-Chichibu-Lagavulin.html,3d31f03a1e9c3768416214db8cf374de9f91c8f276348291b0958bf8f18c3f42
"La Ferme de Gagnet 1984/2001 (44%, OB, Armagnac)","La Ferme de Gagnet 1984/2001 (44%, OB, Armagnac) So an old bottle I was having in the back of the back of the bar and that I had completely forgotten about. Not too sure there’s anything to be expected here, but at least this is a real winegrower making his own Armagnac (and foie gras s’il-vous-plaît). They’re located in Mezin, in the Lot-et-Garonne, so not really a grand-cru location. Or is it Ténarèze? Colour: amber with red hues. Nose: typically rustic Armagnac, rather on chocolate, coffee and prunes, then with some black pipe tobacco and certainly some earth. Dunnage, old winery, sultanas, foie gras. No, not foie gras naturellement. Mouth: it’s good! Sure the higher ABV helped a lot along those almost twenty years in the traditional flat bottle called a ‘basquaise’ (smart people rather call them tennis rackets) but the fruitiness is well there, and so are the earths and the coffee. It’s very coffee-y actually, chocolaty as well, and, well, good. 1984 was not a good vintage in the south-west of France, but they got away with it. Finish: rather long, and all on some short espresso. Almost ristretto! Comments: a good surprise, absolutely. It’s also true that these rustic brandies are growing on you. But will authenticity and provenance actually be proper post-covid values? That’s what people say, which means that that shouldn’t happen, sadly. Anyway, very good Armagnac, sadly hard to find. But pst, Hors d’Âge, 52€, XO 42€, VSOP 34€. SGP:462 - 83 points.",83,2020-04-12,https://www.whiskyfun.com/archiveapril20-1-Chichibu-Lagavulin.html,f741539b47621f9df274a7941547cdfda873a5812473ff1c61706acafa84f336
"La Ribaude ‘Hors d’Âge’ (42%, Distillerie du Houley, Calvados Pays d’Auge, +/-2005)","La Ribaude ‘Hors d’Âge’ (42%, Distillerie du Houley, Calvados Pays d’Auge, +/-2005) Another old bottle from the back of the cabinet. No expectations, and I’m not a Calvados freak (but I adore cider!) Colour: deep gold. Nose: cider, overripe apples, touches of vanilla, hints of apple peel. That’s pretty all, I wouldn’t call this calva Mr Complex. Mouth: very rustic, gritty, a tad bitter, a little sour, and getting frankly a little unpleasant while avalanche of peelings show up. Finish: long and a little too bitter. Comments: not exactly the best use of apples and pears, I would say. But it’s still drinkable, although our ancestors would have just poured it into their coffee without blinking an eye. By the way, a ribaude in old French is a kind of… lady lecher. Strange name. SGP:561 - 55 points.",55,2020-04-12,https://www.whiskyfun.com/archiveapril20-1-Chichibu-Lagavulin.html,2bf62bd41980092898103161bdc14df755cb72a60be946e8edbb8bac7c68bb09
"Verrier ‘Hors d’Âge’ (40%, OB, Calvados Pays d’Auge, +/-2005)","Verrier ‘Hors d’Âge’ (40%, OB, Calvados Pays d’Auge, +/-2005) Colour: gold. Nose: similar to the previous one, just a tad smoother and rounder, perhaps a tad fruitier. Rather nicer in fact. Mouth: fine, easy, more perfumed, on apples and pears, touches of oranges perhaps, a very wee cologne-y side (roses?) and the expected light vanilla. Not too bad. Finish: a little short, and a tad sweetened-up. Not sure that’s natural. Comments: it’s okay, but I’m sure I won’t remember it… tomorrow. Perhaps even tonight. Remember what? SGP:641 - 70 points.",70,2020-04-12,https://www.whiskyfun.com/archiveapril20-1-Chichibu-Lagavulin.html,707dbfa70970559b5e926562e0187043721bb5c278f5d0e962d8f3020a65a693
"Daumas Gassac (40%, OB, Fine du Languedoc, +/-2010)","Daumas Gassac (40%, OB, Fine du Languedoc, +/-2010) Daumas Gassac is a very famous estate in Languedoc, they’ve been real pioneers and almost singlehandedly enhanced the reputation of Languedoc while the wines of that region were previously seen as… pure rotguts. It’s interesting to try this little fine (distilled wine, as cognac is). The estate uses many different grape varietals, some very esoteric, but I just don’t know what they use for their little fine. Colour: pale gold. Nose: we’re pretty much in cognac territories, with white and yellow fruits (peaches) and a blend of rubbers and grasses that would not impair it. Cherries and almonds. A fine fine (don’t tell me you’re proud of that one, S.) Mouth: the vanilla-y oak shows a bit too much here, and I’m not sure heavy coconut and butterscotch really fit a nice brandy. What’s okay with malt whisky is often terrible with fines and marcs. Finish: medium, too leafy. Comments: they clearly screw it up. Oak can be any aged spirit’s best friend… or its worst enemy. I wouldn’t have used the brand name ‘Daumas Gassac’ here. Perhaps Simone? Or Elizabeth? Georges or George? Marcel? Paul? Gunther? Donald? Boris? ‘Donald & Boris’, that would have style! SGP:361 - 50 points.",50,2020-04-12,https://www.whiskyfun.com/archiveapril20-1-Chichibu-Lagavulin.html,ce621a37bd94897812e37c1e02878c2590fcf3ff780fe2482bf3fe42d40b82a3
"Cuvée Rare’ (40%, OB, Cognac Grande Champagne, +/-2010)","Cuvée Rare’ (40%, OB, Cognac Grande Champagne, +/-2010) Colour: amber. Nose: very rounded, jammy, soft, with quite some caramel and corn syrup. A very discreet tarry touch, and a general feeling of Georgian or Armenian brandy. Not unpleasant but rather undemanding so far. Mouth: good, with some honey, toasted bread, roasted nuts, some tea, apricot jam, and rather a lot of caramel I’m afraid, getting a little bitter. Finish: medium, a little bitter and tea-ish. Burnt caramel. Comments: I’m rather disappointed with this oldish bottle; some Cognac that’s exactly the opposite of a proper malternative, if you ask me. I believe it’s the vintage versions that one should look for at Frapin’s. SGP:461 - 76 points.",76,2020-04-12,https://www.whiskyfun.com/archiveapril20-1-Chichibu-Lagavulin.html,b78dc3764d0faa9c90c60cbfeffbc32f7dbab78c254b98581f87381cec6b068c
"Glenrothes 1988/2004 (53.5%, James MacArthur ‘Old Masters’, cask #7022)","Glenrothes 1988/2004 (53.5%, James MacArthur ‘Old Masters’, cask #7022) Colour: bright gold. Nose: slightly dusty, sharp and strangely ‘yogurty’. A funny mix of putty, sandalwood and then foam strawberry sweeties. Indeed, the whole profile shifts rather more towards sugary sweetness and some nicely honeyed qualities. With water: bracken, damp sawdust, crushed cream crackers, plain oatcakes and a bit of soggy cardboard. Mouth: ouch! Extremely hot and sharp. And then… oh God, Millie! What are you doing to me? Soap suds, Fairy liquid, bath water and these kind of cheap ‘perfumed’ wood chunks you buy in naff Scottish tourist shops. Not great. With water: still strangely hot and very aggressive. Hot molten plastic, burnt polystyrene, acetone and more rather nasty soapiness. Finish: disappears mercifully fast but leaves behind this aftertaste riddled with floral soaps and hot plasticine. Comments: It’s said by people that have studied these kinds of things that our cats would gladly kill and eat us were it not for the issue of size difference. I think it’s fairly evident that Millie is one of the Cat scientists working covertly to overcome the conundrum of scale. This was not good. SGP: 531 - 57 points.",57,2020-04-11,https://www.whiskyfun.com/archiveapril20-1-Chichibu-Lagavulin.html,407bbdc6ccfcbcc03ee88ae7631acf9fc26fe6895422f8dca9c698ba27126f36
"Glenrothes 21 yo 1997/2019 (57.2%, Scotch Malt Whisky Society, #30.106 ‘Succulent, scintillating, substantial’, 2nd fill PX cask, 681 bottles)","Glenrothes 21 yo 1997/2019 (57.2%, Scotch Malt Whisky Society, #30.106 ‘Succulent, scintillating, substantial’, 2nd fill PX cask, 681 bottles) Most likely a re-rack into 2nd fill PX, but the Society tend to leave their finishings for a good length of time so let’s see what we’ve got here… Colour: amber. Nose: there’s this unmistakable stickiness from the PX which suggests a more modern style of seasoned cask. Rather jammy, hot, sticky and slightly sawdusty. Showing some nice notes of prune jam, some boozy dark fruit cake, marzipan and affogato. This slightly dusty sharpness of active wood remains present underneath the fruitier top notes. With water: much nicer! Soft, damp earthiness, milk chocolate, leafy pipe tobacco notes, pine resin, leaf mulch and mushroom powder. Works very nicely with H2o. Mouth: hot, sooty, slightly muddy and showing notes of pencil erasers, boot polish, red liquorice, game meats, raspberry cordial and hessian. Not 100% convinced by the integration of the sherry here. Some black tea tannins, mustard powder and paprika giving a little chilli heat. With water: again there’s a rather softer side developing now, earthiness, chocolate Brazil nuts, stem ginger in syrup and more of these unctuous, gamey qualities. Still some slight rubbery notes. Finish: medium, rather gingery, warming, prickly with red chilli and paprika and more of these meaty notes with some bitter chocolate powder. Comments: Water is obligatory here I would say. Although, you can’t shake this feeling that the cask used for re-racking displays a few too many of these more problematic, modern seasoned sherry cask qualities: sawdust, jam, heat, rubber etc. Something of a mixed bag. SGP: 561 - 78 points.",78,2020-04-11,https://www.whiskyfun.com/archiveapril20-1-Chichibu-Lagavulin.html,0aaa0405da0b670f28d1a65e514325bffaa046d91a872c6dc494fa8ac20ebf30
"Glenrothes-Glenlivet 22 yo 1996/2019 (50.1%, Cadenhead Small Batch, three bourbon hogsheads, 942 bottles)","Glenrothes-Glenlivet 22 yo 1996/2019 (50.1%, Cadenhead Small Batch, three bourbon hogsheads, 942 bottles) Colour: pale gold. Nose: there are these expected notes of pollens, yellow flowers and honey but it comes with a degree of restraint and a slightly austere side as well. Some notes of chalk, baking soda and crushed greenery. Geraniums in a potting shed etc. All very attractive and elegantly balanced. We’re comfortably in ‘Glen Safe’ territories here, but then again, in such times as these, is a big comfy Speyside hug such a terrible thing? With water: evolves towards a drier, toasty and more cereal profile. Dry toast, freshly chopped green herbs muddled with butter and some wee yellow plums. Mouth: once again this seesaw between classical, honeyed sweetness and leaner, drier, dustier aspects that bring a more chiseled, austere side. Chalky, limestone, toasted sunflower seeds, turmeric and dried wildflowers. I have to say, it’s a rather elegant and satisfying profile - if not the most obvious or easy. With water: honeyed oatmeal, canvass, dandelions, olive oil, dried sage and some very light notes of cough syrup and herbal ointments. Bitter orange and citrus pith. Finish: good length, warming but nicely dry with notes of herbal teas, citrus rinds, heather ales and some nice chalky and faintly qualities. Comments: It’s to be wondered why on earth the owners don’t issue such bottlings. It seems to me that Glenrothes is crying out for an official single cask range similar to what they did with Glendronach or Benriach. If ever there was a distillery which showed consistently better at cask strength rather than 40% or 43% it’s Glenrothes. Anyway, this was much enjoyable, loved this meandering profile between sweeter and drier aspects. SGP: 551 - 86 points.",86,2020-04-11,https://www.whiskyfun.com/archiveapril20-1-Chichibu-Lagavulin.html,a2270c5578d4a62dca435698a337ff8170c4eb6f2a6b146b13542203831e652c
