whisky_name_raw,review_text,score,review_date,source_url,dedupe_hash
"Glenglassaugh 34 yo 1976/2010 (45.9%, Art of Whisky, Artworks, bourbon, cask #2380)","Glenglassaugh 34 yo 1976/2010 (45.9%, Art of Whisky, Artworks, bourbon, cask #2380) This little German bottler has already issued quite a handful of excellent whiskies, always fairly priced if I remember well. Colour: white wine. Nose: there is this paraffin again, but otherwise it’s a finer spirit than the 1986, with more fruits although I wouldn’t call this ‘fruity’. Apples, greengages… Also touches of lemon, then whiffs of sunflower oil, unless that would rather be grape pips oil. It’s a rather delicate spirit, but it’s got character. A light character… Mouth: ah yes, this is where the differences wrt the 1986 are most obvious. Bigger, fatter, fruitier again, with several sour fruits that give it an interesting side. Grapefruits, sour apples, rhubarb perhaps… Also some melissa water, not-too-ripe grapes… It’s rather unusual, getting greener and greener minute after minute. After ten minutes it’s almost grapefruit juice. Finish: quite long, lemony, a little earthy… This could be a margarita, in a way. Fun stuff. Comments: fun stuff indeed. Rather unorthodox, but fun. SGP:551 - 85 points.",85,2014-09-30,https://www.whiskyfun.com/archiveseptember14-2-Glenglassaugh-Glenlivet-Glenfarclas-Macallan-Port-Ellen-Ardbeg.html,51f33240898bb549be8d3e72f159b979a732c6fce9a713f8e1b3a71c5469337a
"Glenlivet 50 yo 1964/2014 (42.3%, OB, 100 decanters)","Glenlivet 50 yo 1964/2014 (42.3%, OB, 100 decanters) At £18,000 a decanter, this baby may be another divorce whisky, unless the honourable buyers are committed to doing the 'marital compensation trick'. Just in case you're not in the know, that trick consists in presenting your wife of husband with some fine piece of jewellery by Cartier or Van Cleef that will cost you the same amount of money (the exact amount, that's very important). Which, rather sadly, will just double the prices of our whiskies, as you may have already found out. Oh and this Glenlivet was matured in an ex-bourbon cask. Colour: gold. Nose: the first thing that’s striking here is the fact that it’s very ‘Glenlivet’. Sounds logical but after 50 years, that’s not always the case. We’re rather around a tarte tatin that would have been made with pears and papayas instead of apples, I’d say. I also find touches of acacia honey, just a little beeswax, a light spiciness (sweet korma, perhaps, ginger cake), maybe roasted cashews and then more orange blossom or earl grey tea. It’s all subtle and, I have to say, surprisingly fresh. But with all very old whiskies, the devil’s in the… palate. Let’s see… Mouth: surprisingly fresh and vibrant, and certainly more ‘tropical’ than other Glenlivets. Lovely touches of oranges, ‘supreme’ pina colada, these baked pears again (not the kind of pear notes that you’ll find in young whiskies), touches of papayas and guavas, a light honeyness yet again, tangerines… What’s really surprising is the fact that there’s no ‘political wood’, I mean, you know, when the taster finds quite a lot of wood and writes that he had feared he would have found even more. Not so here, it’s absolutely not an oaky whisky. A wee miracle. Finish: and even in the finish the oak is kept at bay, as it’s rather the citrusy side that keeps singing. I even find mangos in the aftertaste. And, granted, more cinnamon. Comments: light, clean, fresh, complex, subtle, elegant… In short, miraculous. Yes a Rolex Lady would work as well. SGP:651 - 90 points.",90,2014-09-29,https://www.whiskyfun.com/archiveseptember14-2-Glenglassaugh-Glenlivet-Glenfarclas-Macallan-Port-Ellen-Ardbeg.html,4b25e3acf885fd1aa9536aff5f0a5ca9ae0cb1017f2d1695e4f2b88044a65917
"Glenfarclas 1966/2013 'Fino Casks' (50.5%, OB, casks #4194, 4195, 4197, 1444 bottles)","Glenfarclas 1966/2013 'Fino Casks' (50.5%, OB, casks #4194, 4195, 4197, 1444 bottles) This little baby was bottled in December last year but it’s only going to be available in the coming weeks. It should be 47 years old if I’m not mistaken. Fino was unusual at Glenfarclas, where oloroso was/is the norm as far as sherry’s concerned. Oh and the price will lie around £750-800, which sounds pretty fair these days. I mean, very fair. As for the marital compensation trick, you may not need any. In case you do, may I suggest three Hermès scarves? Colour: deep gold. Nose: for a start, marmalade. The finest marmalade. Great but a tad disappointing because of the relative narrowness of the first nose. But then… there’s an avalanche of smaller, more complex, more tertiary aromas. Those would include chartreuse, wormwood, iodine (is that the fino?), walnut liqueur, vin jaune (no wonder), old roses, patchouli, eucalyptus, tangerines, almond oil, ale… The whole remains very clean, with that marmalady structure that keeps it focused. Perfect. Mouth: exceptional arrival, spicy and zesty at the same time. Again, marmalade with a little white pepper. And then, chartreuse jaune, orange liqueur, a funny herbal zestiness (angelica? Kiwi jam?) as well as walnuts again, but less than in the nose. I find the sherry rather discrete. Finish: very long and always spicy/zesty. The oak feels a little more than in the Glenlivet, but the spirit’s structure is fatter so balance is kept. Marmalade with pepper and wasabi or horseradish. Comments: I find this absolutely superb. To tell you the truth I had lower expectations because I had already tried a bottle of 1966 fino that was excellent, but not quite as stellar in my book (88-ish). SGP:661 – 92 points.",92,2014-09-29,https://www.whiskyfun.com/archiveseptember14-2-Glenglassaugh-Glenlivet-Glenfarclas-Macallan-Port-Ellen-Ardbeg.html,cf75b6a8f194c0adb7b04ab83c97a74c7b5ce610d3db934a24cd832fc191ed47
"Glen Elgin 29 yo 1985/2014 (45.6%, Maltbarn, bourbon cask, 122 bottles)","Glen Elgin 29 yo 1985/2014 (45.6%, Maltbarn, bourbon cask, 122 bottles) In theory, Glen Elgin can be stellar, but we’ve also got duds in our glasses. Let’s see… Colour: pale gold. Nose: a pretty typical waxy honeyness that can also be found in Glen Ord if I’m not mistaken. I’m not against that. Old wardrobe, beehive, a drop of engine oil, leather, a touch of earth, half a touch of plasticine, some menthol (Vicks), a trace of tar (new tyre, in fact)… All to my liking, no dull ‘modern’ nose at all. Mouth: it’s surprisingly light – not weak at all of course – but it grows on you, with some white chocolate, banana skin, cough syrup, After Eights and always this wee waxiness that works so well and ads body and texture. Notes of hay wine, do you know that? They make it in the Vosges Mountains and it is… and acquired taste. Finish: much longer than expected, maltier as well, with notes of strong Trappist beer (the blackish ones) and again, a little mint. Comments: carbonnade flamande in a bottle. Google is your friend, my friend. SGP:461 - 87 points.",87,2014-09-26,https://www.whiskyfun.com/archiveseptember14-2-Glenglassaugh-Glenlivet-Glenfarclas-Macallan-Port-Ellen-Ardbeg.html,ae694cbd25b58fb0d9830c26a4c5603c40224ad78e5c62fdbf0fa74a1da6b460
"Glenallachie 9 yo 2004/2014 (50.7%, The Whisky Mercenary, Maltlover #1, Alex Agnew)","Glenallachie 9 yo 2004/2014 (50.7%, The Whisky Mercenary, Maltlover #1, Alex Agnew) I have to say I haven’t understood much of the stories behind this neat little bottling. Nothing to do with Spiro Agnew, I guess… Colour: gold. Nose: ho-ho, it reminds of some ultra-young Aultmores. There’s more fudge than in fudge – including the fudge they’re selling to tourists near Eilean Donan Castle. And shortbread, white chocolate, custard, Ovaltine, Mars bars, millionaire shortbread… Well I’m sure you see what I mean. And it’s really likeable. With water: a fresh spiciness coming through. Root beer and tonic water plus maple syrup and gingerbread. Unusual and pleasant. Mouth: bigger now, always all on fudge and caramel, but the wood’s spices are making up for that side, and make the whole more complex. A kind of bourbon made out of a 100% malted barley mashbill, perhaps. With water: no, there’s some rye as well. What’s this? In any case, it’s fun fun fun. Finish: long, spicy, rooty and nutty. Reminds a bit of aged potstill vodka. Comments: modern and good. I repeat, this is modern and good. SGP:462 - 82 points.",82,2014-09-26,https://www.whiskyfun.com/archiveseptember14-2-Glenglassaugh-Glenlivet-Glenfarclas-Macallan-Port-Ellen-Ardbeg.html,24d765d69f061c379d7fbf7d3ecc60645796d0994e4a269794f2e1f263b6e706
"Benrinnes 21 yo 1992/2014 (56.9%, OB, Special Release, 2892 bottles)","Benrinnes 21 yo 1992/2014 (56.9%, OB, Special Release, 2892 bottles) Benrinnes in full sherry mode, fasten your seatbelts! And get your knives ready… Colour: full gold – not that dark for 100% sherry. Nose: bang, bang, bang. Old style malty rawish roughy meaty oily malty style. Yes I’ve written ‘malty’ twice. It’s quite aggressive but two other aromas come to my mind, beef jerky and marmalade. Some would have said ‘it’s evocative’. With water: hazelnuts come out, and the liquors made thereof by the Italians. Oh, and Nutella, tar, liquorice rolls, chocolate, ‘mineral’ sulphur... Mouth (neat): really punchy, really ‘Special Release’ whatever that means, mustardy, spicy and both mineral and tarry. Fat and almost brutal, but quite surprisingly, it’s kind of elegant. Maybe that’s the chocolate and mints? With water: some spicy oak coming out, grapefruits, angelica, gingerbread, curry powder… The whisky’s lifted a bit. Finish: very long, much spicier. Another whisky that reminds me of some peppered chocolate made in Spain (not Italy this time, although I believe they make some as well.) Comments: an oh-so-Diageo bottling, both spicy/oaky and true to the original distillate. I guess when you own so many distilleries, you have to make the styles stand out! Very good stuff. SGP:462 - 88 points.",88,2014-09-25,https://www.whiskyfun.com/archiveseptember14-2-Glenglassaugh-Glenlivet-Glenfarclas-Macallan-Port-Ellen-Ardbeg.html,4703b1bbc2c8f250d33915d530788b9337ef244c39ae796c5b54e70bcfe96011
"Singleton of Glendullan 38 yo 1975/2014 (56.9%, OB, Special Release, 3,756 bottles)","Singleton of Glendullan 38 yo 1975/2014 (56.9%, OB, Special Release, 3,756 bottles) Wow, almost 4,000 bottles of 38 years old Glendullan at £750 a bottle, that sounds like quite… the Everest. But is that expensive or is that cheap? Hard to say, after all we should care about the spirit, not about the name of the distilleries. Imagine this would be Port Ellen or Brora… Colour: gold. Nose: excuse me, but ‘wow!’ This is like a well polished old Jamaican rum, with plenty of essential oils and organic/mineral notes, plus a good deal of tropical fruits, but without any vulgarity. This is Glendullan, it’s not Versace. Almond oils, pine, marzipan, guavas, orange blossom, camphor… This could well be a winner, but let’s add water. Mind you, 57% vol. at almost 40 years! With water (with a huge viscimation ;-) – we’ve awaken the serpent!) : superb, with thousands of herbal teas, oils and embrocations. Humidor, cigars, eucalyptus, more oils… And maybe touches of white asparagus. Mouth: strong, spicy and candied. The spices are in the front, in fact, and I find the whole a little too strong. So… With water: the spices remain (cinnamon, paprika and nutmeg) but the fruits start to come out. Citrons, oranges, pomegranates (maybe)… Also more honey and pollen. Finish: long, zestier (which is great) and, of course, spicy. Cloves, cumin and pepper. Comments: of course they would have composed a super-vatting, or nothing at all. I find this Glendullan very impressive, you just have to accept quite a spiciness in your (old) malt. Beastly. SGP:571 - 91 points.",91,2014-09-25,https://www.whiskyfun.com/archiveseptember14-2-Glenglassaugh-Glenlivet-Glenfarclas-Macallan-Port-Ellen-Ardbeg.html,b9d31b12bd1067f1c3378a8abe9a46a74ab9b129d446b53407288ae3526803af
"Highland Journey (46.2%, Hunter Laing, blended malt, 2014)","Highland Journey (46.2%, Hunter Laing, blended malt, 2014) A brand new blended malt composed uniquely with Highlands malts, although I'm not 100% sure that does mean that there aren't any Speysiders inside, since Speyside is a sub-region of the Highlands - isn't it? Colour: gold. Nose: some youth for sure, as I find a lot of sweet barley and sweet beer in this mix, as well as a fresh maltiness combined with overripe apples and plums. Zwetschkes, for example, or juicy ripe greengages. I really enjoy this freshness, it’s got something of a Californian IPA (says the guy who just discovered those this year.) Mouth: well in line with the nose, with good power and a zesty/nervous mouth feel. Plenty of fruits and, indeed, a bit of a firm waxiness that suggests ‘the Northeastern Highlands’. Well, there’s nothing in the Northwest anyway – as far as distilleries are concerned. And bags of fresh malted barley, white pepper and, again, sweet beer. Finish: good length, full of youth, fruity, malty and slightly yeasty. Comments: I like it. It’s young, it’s a bit raw, but it’s a very pleasant journey – yet it’s not totally trippy ;-). Close to the distillate(s). SGP:451 - 80 points.",80,2014-09-24,https://www.whiskyfun.com/archiveseptember14-2-Glenglassaugh-Glenlivet-Glenfarclas-Macallan-Port-Ellen-Ardbeg.html,a49a9b393c8ca975ef3db6c9bec92c49ba2e27f2aae86342f60980185539c1ba
"The Famous Grouse 27 yo 1986/2014 'Commonwealth Games' (46.4%, OB, Glenturret, 1800 bottles)","The Famous Grouse 27 yo 1986/2014 'Commonwealth Games' (46.4%, OB, Glenturret, 1800 bottles) This is well a single malt from Glenturret. I have to say we haven’t heard much about the Commonwealth Games in France – well, strictly nothing – but something funny may have had happened there according to some Scottish friends. Hope that’s not related to this whisky… Colour: gold. Nose: great! I mean, I like these rather steely notes that are very ‘Glenturret’, this shoe polish, the ink, the carbon paper, then the bitter oranges, the whiffs of ‘clean’ mud, the papayas… Very singular, very different. Mouth: yeah, it’s well a ‘different’ malt. Imagine a blend of calvados and coconut liqueur. I’d imagine some newish American oak has been involved at some point. Then cider, mead, sweet mustard, sweet oak, and again, this feeling of shoe polish. Finish: quite long, on marmalade and pepper. And shoe polish. Comments: certainly good stuff, pretty ‘different’ considering it’s a kind of touristic malt. Oh and it seems that it’s rather a 27 instead of the 28 years on the label. But who cares? SGP:451 - 83 points.",83,2014-09-24,https://www.whiskyfun.com/archiveseptember14-2-Glenglassaugh-Glenlivet-Glenfarclas-Macallan-Port-Ellen-Ardbeg.html,2edcb4df12373e6c8516661e5ffa31948502e9e851aadc4289b0fab509c7540d
"Strathmill 1975/2013 (42.1%, Malts of Scotland, bourbon hogshead, cask #MoS 13047, 212 bottles)","Strathmill 1975/2013 (42.1%, Malts of Scotland, bourbon hogshead, cask #MoS 13047, 212 bottles) Colour: gold. Nose: a rather beautiful nose, relatively discrete but in an ultra-classic ‘un-sherried Speysider’ manner. So we’ve got overripe apples aplenty, some wild yellow flowers, touches of banana skin, a spoonful of honeydew, some custard, and then whiffs of crushed mint leaves and maybe a little eucalyptus. A little freshly sawn pinewood too. Mouth: the oak’s more obvious, which is quite normal at this ripe old age. Quite a lot of tea, herbal teas, cinnamon, white pepper, nutmeg. Some bitter chocolate too, liquorice wood, maybe a little chewing tobacco (or rather these little bags that they have in Scandinavia.) Pear drops, perhaps? Juicy fruits? Finish: of medium length, on herbal tea plus a little honey and walnuts. More liquorice wood in the aftertaste. Comments: it’s the nose that’s quite splendid. The palate is starting to show its oaky side. Mind you, this baby’s more or less 38. SGP:361 - 85 points.",85,2014-09-23,https://www.whiskyfun.com/archiveseptember14-2-Glenglassaugh-Glenlivet-Glenfarclas-Macallan-Port-Ellen-Ardbeg.html,3a2286b499e5dacdbd276476942ee3a478154f5d3d3a716eb80be64262023fa0
"Strathmill 25 yo 1988/2014 (52.4%, OB, Special Release, 2700 bottles)","Strathmill 25 yo 1988/2014 (52.4%, OB, Special Release, 2700 bottles) At £270, it isn’t cheap, but it’s not horrendously expensive. Cough, cough, now, it’s not Port Ellen either… Funny ‘Gatsby’ design. Colour: pale gold. Nose: quite the opposite of the 1975, with much more toasted oak, Ovaltine and coffee. Maybe even a little chicory. In fact, it’s one of the maltiest whiskies I’ve ever nosed. And cornflakes! Mocha! Cappuccino! Quite a breakfast whisky, I’d say. With water: more fruits, around oranges and ripe gooseberries, but the malty side remains. Touches of menthol. I really like these pretty compact and focused noses. Mouth (neat): sweetened coffee and Mars bar (no, not deep-fried) plus more cornflakes than in a Kellog’s tri-pack bundle (buy two, get one free like.) They’re honey-coated cornflakes, I have to add. Funnily enough, I also find these notes of eucalyptus that were in the 1975’s… nose. Solid body. With water: same style, only rounder, and once again more oranges come through, together with a few Christmas spices. Gingerbread. Finish: of medium length, with a touch of spicy new oak (pencil shavings) and always a lot of malt. Ovaltine! Comments: the 1975’s nose was rather more impressive, but the 1988’s palate was way above that one. Can you deep-fry whisky? There has to be a way… SGP:451 - 88 points.",88,2014-09-23,https://www.whiskyfun.com/archiveseptember14-2-Glenglassaugh-Glenlivet-Glenfarclas-Macallan-Port-Ellen-Ardbeg.html,ac664609ab29d79262313a823406794db015b9cb0eb16bd6cb46d6df36da8d4f
"Habitation Saint Etienne 1960 (45%, OB, Martinique, +/-2013)","Habitation Saint Etienne 1960 (45%, OB, Martinique, +/-2013) This baby was distilled at the original Habitation Saint Etienne, which got closed in 1988. The brand’s still in use, and even alive and kicking, but it’s been ‘squeezed’ as HSE. There are many great bottles under that name, by the way, but the spirit can’t be exactly the same as the original, unless it was distilled before 1988. Please note that this rhum was probably poured into inert containers (demijohns or bottles?) some time in the 1980s or 1990s, so it might have aged only for around 20 years. Probably for the better if you ask me, the rhum was lying in La Martinique’s tropical climate. Colour: dark red amber. Nose: an extreme smoothness, the whole being extremely delicate, elegantly fragrant, with some sultanas, touches of ylang-ylang, some honeysuckle, oriental pastries and then whiffs of old humidor as well as hints of dried figs and dates. Keywords: elegance and mellowness. It’s not very sugarcane-y, having said that, and one could have mistaken it for some old cognac. Remember, old spirits tend to converge! Mouth: the oak feels, and it starts grittier than expected, punchier as well, with a faint grapey side (cognac again.) The good news is that that all that tends to mingle and to become smoother, with raisins again, dried papaya slices, a tiny touch of mustard or even wasabi, then more bitter chocolate. Some tannins for sure. Strong black tea. Finish: quite long, drier, oaky and chocolaty, but always with some raisins that are the guardians of smoothness in this context. I love the hints of black olives and liquorice in the aftertaste. Comments: a superb nose and a palate that tends to be a notch too oaky for me, that’s an old story as far as… old spirits are concerned. But it remains a very great old spirit for sure. SGP:562 - 89 points.",89,2014-09-20,https://www.whiskyfun.com/archiveseptember14-2-Glenglassaugh-Glenlivet-Glenfarclas-Macallan-Port-Ellen-Ardbeg.html,e264e6589cf36b4aaf8c4072a4c565b4b2febd3f0ca791398081ff4a397d9acb
"Macallan 1960 (80°proof, OB, Campbell, Hope & King, Rinaldi Italy, +/-1975)","Macallan 1960 (80°proof, OB, Campbell, Hope & King, Rinaldi Italy, +/-1975) A famous series, all whiskies being 15 years of age, although that was not always advertised. I’ve tried quite a few vintages from 1946 to 1963, all ex-sherry wood, but I had kept the 1960 for this special occasion. Now’s the time. Colour: dark amber. Nose: both the resemblance and the differences are striking. Did they use to add a bit of rum into Macallan at CH&K? Of course I’m joking, what’s similar is the ‘old humidor’ side as well as the dried fruits, while what’s obviously different is the slightly steely profile, the whiffs of roasted malt, the notes of toasted cake and the chocolate. Also the wood smoke that arises after one minute. More globally, this is obviously drier; I’d even say it’s both drier and less emphatic than many other vintages. The raisins have been burnt here. Mouth: wider, fuller and more ‘immediate’ than the rum, and without any noticeable oakiness. It’s typically old Macallan, in fact, with this sherry that does not taste like plain sherry at all, and that brings many dried fruits, from figs to raisins and from dates to prunes. No meatiness here, no gunpowder, no grapey notes, rather those fruits plus some tobacco, some fresh fruits as well (ripe bananas, perhaps) and then just one drop of cough syrup that brings even more complexity (a little wormwood, aniseed, mint, sloe, juniper…) Impeccable. Finish: long, rather round, with some chocolate, marmalade, maybe cherries in kirsch, figs… Fresh oranges in the aftertaste lift it. Comments: one of the whiskies that converted many people to malt whisky. No wonder! Even if other vintages have been even more stellar in my opinion… SGP:562 - 92 points.",92,2014-09-20,https://www.whiskyfun.com/archiveseptember14-2-Glenglassaugh-Glenlivet-Glenfarclas-Macallan-Port-Ellen-Ardbeg.html,d6fc2c68d1a89fa1040f880a95e1d220d12c6607c5f00758f5ddae2a88198032
"Yamazaki 1960/2003 (56%, OB, Japan)","Yamazaki 1960/2003 (56%, OB, Japan) I believe this baby used to be the oldest Japanese single malt when it was launched, before being dethroned by both Yamazaki 50 yo and Karuizawa 1960. Yamazaki, as you probably know, is Japan’s oldest whisky distillery (although there are rumours of even older, so pre-1923, much smaller long-gone distilleries.) Colour: dark red amber. Nose: one can feel that this one’s spent much more time in wood, because its rather varnish and even acetone that first reach your nostrils. But as usual, those notes do get mellower, leaving room for a lot of tobacco, polished wood, roasted chestnuts and then many dried fruits and chocolates. Becomes more and more chocolaty over time, and tertiary as well. Ham, mushrooms, old Bourgogne, humus… Quite superb! With water: even more superb and incredibly complex. Marzipan, old books, old oils, sesame oil, cedar wood, a touch of caraway, turmeric, earth… A fabulous nose indeed, but with old whiskies, that doesn’t say anything about the palate. Mouth (neat): again, the oak feels, but what’s really striking is this massive coconut, there’s more coconut than in a coconut! That comes from the oak again, of course, and I have to say I’ve never tasted such a profile before. Tannic coconut milk. Not too sure this time… With water: rather curious! Coconut-and-menthol flavoured black tea, I’d say. Almond oil as well, liquorice wood… Finish: long, tannic, always with a lot of coconut and some bitter chocolate. Very cocoaty (excuse me?) Comments: I found the nose totally impressive, probably one of the greatest noses ever once the varnish had vanished (good one!), but in my book, the palate was rather too oaky - even if that was high quality oak. SGP:471 - 87 points.",87,2014-09-20,https://www.whiskyfun.com/archiveseptember14-2-Glenglassaugh-Glenlivet-Glenfarclas-Macallan-Port-Ellen-Ardbeg.html,792033680f856202c3421a5f26f90fdc631dc87241c97bf43c46b3d261ebe3c0
"Port Ellen 1978/2002 (46%, Signatory Vintage, Silent Stills, for World of Whisky St Moritz, cask #5347, 302 bottles)","Port Ellen 1978/2002 (46%, Signatory Vintage, Silent Stills, for World of Whisky St Moritz, cask #5347, 302 bottles) Some sister casks haven’t been much to my liking, I had found them extremely dry and vegetal. Let’s see… Colour: white wine. Nose: well well well, it hasn’t got the immense and implacable punch that the Rare Malts 20 and 22 had, while it’s also rather un-tarry, so a bit un-PE, but on the other hand, it’s a very coastal one, with plenty of sea air, iodine, oysters and all that. Also touches of white fruits, yellow peaches, green melons, greengages, and just hints of candy sugar. A very civilised Port Ellen, fresh and clean. Too clean, perhaps? Mouth: very different. Not much Port-Ellenness either, but there is more punch, around ‘oyster juice’, pepper, ink, cardboard and then plenty of ashes. And then, once again, a little candy sugar. So I find it good, for sure, but it’s rather forgettable as a Port Ellen. Finish: rather long, a little acrid, with notes of leaves and grass. A strange touch of mustard in the aftertaste, that comes together with a little plasticine, almost plastic. Comments: indeed not all Port Ellens are/were utterly stellar. SGP:466 - 83 points.",83,2014-09-19,https://www.whiskyfun.com/archiveseptember14-2-Glenglassaugh-Glenlivet-Glenfarclas-Macallan-Port-Ellen-Ardbeg.html,6bb2db3c53b409e3b19d3284ed6feef8da795c484f1f2edf650ceefdb60291a6
