whisky_name_raw,review_text,score,review_date,source_url,dedupe_hash
"Glen Garioch 29 yo 1968/1997 (56.9%, OB, cask #623, sherry hogshead)","Glen Garioch 29 yo 1968/1997 (56.9%, OB, cask #623, sherry hogshead) From a bottle that my friend and business partner, Jonny McMillan, has just opened and which he's including in an old and rare bottle tasting in partnership with his former employers, Berry Brothers, in London next month. I believe there are still tickets available... Colour: reddish coffee. Nose: the same territory as the 1973, but this is another level. The same stunning fusion of peat and sherry, but the peat is more prominent here and it is also much more opulently on dark, luscious fruits. Raisins and sultanas soaked in very old Fins Bois cognac, fig jam, dark fruit chutneys with very old balsamic, prune molasses, date syrup and toasted fennel seed. The interplay of dark fruits, sub-divided old peat and various herbal inclusions is just utterly gorgeous. With water: saltier, more rugged, leaning slightly more towards the sherry now with these stunning earthy, salty and sherry bodega vibes. Also artichoke and green walnut liqueurs with soy sauce and Iberico ham. Mouth: immense, totally stunning, immediately call the anti-maltoporn brigade please! Not sure they can get here in this weather, we'll just have to persevere... the peat is so thick, dense, amazing dry, peppery, herbal and even vegetal; a style that reminds me of some much older 1940s Highland Park bottlings we opened on Orkney around ten years ago. Also a massive slug of very old Clacquesin tar liqueur. So many tiny subtleties and details that we could be here for hours, but really this is a whisky about immensity, controlled power and force of personality. With water: censored! We're off, lost in that zone where the whisky has taken the lead and you are left scrambling to keep up. Finish: immense, almost extreme, and comedically long. A whisky that laughs over its shoulder at you! Comments: the 40yo was stunning, but this one, captured at a younger age, is just in another galaxy. Whisky that almost physically forces you to re-examine your own ideas about quality and flavour. SGP: 566 - 94 points.",94,2025-01-25,https://www.whiskyfun.com/archivejanuary25-2-Caperdonich-Mortlach.html,7c6d7482e05acafbb6fb534b0a022569fb734cc5acd39860688d3bf5f476de6b
"Old Rhosdhu 30 yo 1994/2024 (48.6%, Gleann Mor, Rare Find, refill hogshead, cask #229, 321 bottles)","Old Rhosdhu 30 yo 1994/2024 (48.6%, Gleann Mor, Rare Find, refill hogshead, cask #229, 321 bottles) Colour: pale gold. Nose: it opens on a touch of fresh sawdust, grated coconut, and underripe banana, but all of this feels fresh and lively, especially as a lovely fruitiness quickly takes over. Oranges, mirabelles, and plums, all ripe but not overly so, if you see what I mean. Then come kiwis and fresh rhubarb, adding even more zing. Very charming. Mouth: this is truly delightful, in the style of a fine mid-aged Speysider, with those hallmark yellow and white fruits and those notes of fresh oak. It’s elegant, with a controlled tannic grip. Not hugely full-bodied, but that suits it perfectly. Finish: medium in length, with a curious salinity. Where could that have come from? Also touches of agave, aniseed, and liquorice. It’s a bit like a top-notch margarita. Comments: surprisingly excellent, especially if you remember, indeed, the humble little Old Rhosdhu NAS OB from the 1990s (€15). SGP:551 - 87 points.",87,2025-01-24,https://www.whiskyfun.com/archivejanuary25-2-Caperdonich-Mortlach.html,f441137ff972e1448df3b9e13249d9de534659509b532ba2fe18e9c2af76b083
"Old Rhosdhu 29 yo 1993/2022 (50.8%, The Roots, hogshead, 223 bottles)","Old Rhosdhu 29 yo 1993/2022 (50.8%, The Roots, hogshead, 223 bottles) Wasn’t it Debbie Harry on the label? Colour: gold. Nose: there’s more fudge, cappuccino, butterscotch, and praline… In short, the cask was more active, leaning towards ‘bourbon’. Lovely touches of sweet mint in the background, along with the expected bananas and some meadow honey, then a faintly rooty note of celeriac. A very pretty nose. With water: it gains liveliness, with fresh mint and rhubarb shining through. Mouth (neat): livelier and more taut, closer in style to the 1994. Green apples, underripe bananas, lemon, and then yellow fruits like peaches and melons. With water: careful with the water, as it brings out notes of perfume and rose syrup. Otherwise, it remains delightfully fresh and fruity, with lovely, crisp green apples of all shapes and sizes. Finish: medium in length, fresh, elegant, with a faint hint of pastis this time. Comments: very close to the 1994, with not quite enough difference to merit a separate score. SGP:551 - 87 points.",87,2025-01-24,https://www.whiskyfun.com/archivejanuary25-2-Caperdonich-Mortlach.html,82a2ee4fa0fd6511575fb48682faa1373135387cc80ca1a73d8de5dc8f676477
"Mortlach 16 yo 2007/2024 (48.5%, Decadent Drinks, Equinox & Solstice, bourbon hogshead, Summer 2024)","Mortlach 16 yo 2007/2024 (48.5%, Decadent Drinks, Equinox & Solstice, bourbon hogshead, Summer 2024) It’s worth noting that the labels for this series are much more classic—and perhaps more aesthetically pleasing—than those of other Decadent Drinks series (SpongeLand and the like). Colour: white wine. Nose: there’s that chalky, lightly yeasty fruitiness reminiscent of the best natural wines that are so fashionable these days. Apples, of course, greengages, redcurrants, rhubarb, even watermelon… A touch of wax and custard wraps it all up, though that’s purely cosmetic. A tiny hint of ham emerges at last, very subtle—it’s not really one of those meaty Mortlachs. Perhaps a small lovage leaf. Mouth: very Mortlachian, without sherry—meaning fatty, oily, fairly waxy too, then with the usual apples and plums, with a touch of natural Champagne this time again (more blanc de noirs in style). Finish: long, fruity, and still quite rich, with a slight peppery touch. Comments: very good, in the spirit of yesterday’s DL bottling. The distillate—and likely the restricted ‘copper contact’—sings in a deep voice. SGP:651 - 88 points.",88,2025-01-23,https://www.whiskyfun.com/archivejanuary25-2-Caperdonich-Mortlach.html,e992a42eece1ee4eb84f85773cc986f3986ee04c536f664341495980101303f1
"Mortlach 26 yo 1997/2023 ‘Adversum’ (52.2%, Vintage Bottlers, 1st fill Château Lafite, cask #187207, 120 bottles)","Mortlach 26 yo 1997/2023 ‘Adversum’ (52.2%, Vintage Bottlers, 1st fill Château Lafite, cask #187207, 120 bottles) One of the recurring questions with these ‘first fill’ casks from prestigious wines like Lafite is whether they’re simply first used for whisky or if they come directly from the château, where they’ve held only one vintage before usually moving on to less prestigious wineries, as is customary. Colour: amber. Nose: like a very young Bordeaux grand cru, truly, and I regret to inform you that we adore it. So, even if philosophically we might not approve of such a mix, in practice, we find the nose superb. There, I said it. Black cherry clafoutis, gentle liquorice, prunes in Armagnac. The worst part? Lafite-Rothschild indeed has its own Armagnac, a stunning ‘Vieille Réserve’ they’ve been offering for years. We’ll open one of those someday. In short, I must admit that I find this improbable nose magnificent. Perhaps does big Mortlach pair surprisingly well with big Pauillac. With water: glue notes emerge—likely from the nearly new French oak—followed by menthol toffee. Mouth (neat): we won’t deny ourselves the pleasure. While it’s slightly less immediate than the nose, it remains beautiful, with young Cabernet-like bell peppers adding a green edge that complements the meaty and oily malt. With water: a lively battle, as pepper asserts its dominance. Wild raspberry and cherry jam follow. Finish: long, very cherry-forward, with notes of roasted malt and chocolate. Comments: it’s extremely winey, but for once, we’re all for it. After all, who doesn’t love Lafite? Or Mortlach? SGP:571 - 88 points.",88,2025-01-23,https://www.whiskyfun.com/archivejanuary25-2-Caperdonich-Mortlach.html,247bf3db7a30acbe9666461c878f60b273da86dd9804791f85a03941f2a8a5e2
"Mortlach 1992/2022 (44.2%, Malts of Scotland, sherry hogshead, cask #MoS22043, 259 bottles)","Mortlach 1992/2022 (44.2%, Malts of Scotland, sherry hogshead, cask #MoS22043, 259 bottles) What a series these ‘rare casks’ are, truly remarkable. And for once, a bottler uses the word ‘rare’ with proper justification… Colour: bronze gold. Nose: great fun, this comes from a ‘deviant’ cask, meaning you feel something unusual has occurred—though that doesn’t mean it’s not delightful. Quite the opposite here, as finding rye, gingerbread, speculoos, almond milk, putty, and mint liqueur in an old Mortlach is… an excellent surprise. In short, this is an already rare Mortlach made even rarer. You do wonder what happened to it tough—perhaps a nail? A patch? A valinch or copperdog accidentally fell in? Mouth: blood oranges, earthy tones, dark tobacco, roasted pistachios, then what could very well stem from the fresh distillate—grilled bacon and beef broth. All quite mysterious, but very enjoyable. Finish: honey-glazed ham, tobacco, and dark nougat. Plenty of cloves, rosemary, and pine resin sweets in the aftertaste. Comments: oh, if only this entertaining old Mortlach could talk… SGP:562 - 88 points.",88,2025-01-23,https://www.whiskyfun.com/archivejanuary25-2-Caperdonich-Mortlach.html,b54748aed5ead0bd8d834fdefb806089cc1145060497af239105d911b3eaf9bf
"Mortlach 32 yo 1991/2023 (54.1%, Signatory Vintage, 35th Anniversary, 1st fill sherry butt, cask #4241, 580 bottles)","Mortlach 32 yo 1991/2023 (54.1%, Signatory Vintage, 35th Anniversary, 1st fill sherry butt, cask #4241, 580 bottles) I had saved this gem for a special occasion. What kind of occasion, you ask? Well, to paraphrase Hester Brown, having a Mortlach like this in one’s collection is a special occasion in itself. Colour: gold. Nose: ah, ferns, wisteria, lily of the valley, Alsatian orange biscuits (why not?), cassata, orange blossom, sultanas, then a touch of ham fat and beeswax… This is lofty, complex, and truly perfect. Whiffs of an old wine cellar. With water: amusingly, it tightens up a little with notes of furniture polish, linseed oil, plasticine, absinthe, and walnut oil. No doubt the sherry influence—this walnut oil note. Mouth (neat): magnificent, with pine and orange, buds and peels, and that signature fattiness still intact after all these years. With water: resinous elements take centre stage, yet beautifully so, in the style of an old Chartreuse. Amen. Finish: long, with more fruitiness re-emerging, shaped by the cask but in no way intrusive—on the contrary. A mentholated tobacco note lingers in the aftertaste, or as Gainsbourg might have said, ""Kool au Menthol."" Comments: what a shame—we polished off all the 1969 G&M yesterday, or we could have compared them. S., you amateur! SGP:561 - 91 points.",91,2025-01-23,https://www.whiskyfun.com/archivejanuary25-2-Caperdonich-Mortlach.html,ad690a88920fd89a645ce56a0248b5cbf833cd3b4f3bb474f29b1c49a8a39794
"Mortlach 7 yo 2016/2023 (54.7%, The Duchess, Game & Wildlife, matured in PX quarter cask, cask #216A, 189 bottles)","Mortlach 7 yo 2016/2023 (54.7%, The Duchess, Game & Wildlife, matured in PX quarter cask, cask #216A, 189 bottles) 189 bottles at C/S from a quarter cask, that’s no mean feat. Colour: gold. Nose: the fact is that all these little dried raisins suit Mortlach well, creating a profile not too far removed from the legendary Flora & Fauna series through which many enthusiasts first discovered Mortlach. A lightly earthy fruitcake, some pipe tobacco, a touch of Ovaltine, Bündnerfleisch, hints of bay leaf, and new leather… With water: the leather moves to the fore. Mouth (neat): toffee, leather, tobacco, Pepsi, chicory, chocolate, and honeyed raisins. With water: it relaxes, becoming lighter, with a touch of sulphur and bitter oranges making a gentle appearance. Finish: long, leaning more on dried fruits, pepper, and clove. Comments: a lively little beast, firmly marked by the sherry. SGP:561 - 84 points.",84,2025-01-22,https://www.whiskyfun.com/archivejanuary25-2-Caperdonich-Mortlach.html,05370cc8249406290a55c0d0c1bd729f9502b4e72f3e4ee621559ad4686f04ac
"Mortlach 9 yo 2013/2023 (58.4%, Hogshead Import, refill hogshead, 133 bottles)","Mortlach 9 yo 2013/2023 (58.4%, Hogshead Import, refill hogshead, 133 bottles) I don’t think one could get much closer to the distillate, given the colour. Colour: very pale white wine. Nose: an explosion of all sorts of redcurrants, cranberries, gooseberries, and pink grapefruit. We’re far removed from boar terrine doused in gravy and pipe tobacco (what?). With water: chalk, saltpetre, and shards of slate. It’s indeed ultra-distillate-driven. Mouth (neat): once again, a fruity explosion (two-thirds apples, one-third grapefruit) followed by pear eau-de-vie and a hint of ginger tonic. It almost tickles the tongue. With water: chalk makes a comeback, along with a few exotic fruits, especially lychees, which add a muscat-like character. Finish: fairly long, very fruity, almost like an eau-de-vie. Comments: I think this would be delightful for making sorbets (lemon, apple) with a splash. SGP:641 - 86 points.",86,2025-01-22,https://www.whiskyfun.com/archivejanuary25-2-Caperdonich-Mortlach.html,1c9f90ed52dc7b6a1f1961a8d8116f6cb12232c7dd0f07528c163ad9e071a0a4
"Mortlach 11 yo 1998/2010 (46%, Hart Bros., Finest Collection, bourbon cask)","Mortlach 11 yo 1998/2010 (46%, Hart Bros., Finest Collection, bourbon cask) You don’t see too many of these Hart Bros. bottlings around anymore, do you? Colour: white wine. Nose: we’re very close to barley, bread, porridge, oatcakes… The sulphury side of the distillate (nothing to do with the burnt sulphur used in wine casks to prevent spoilage) is quite prominent and very appealing. Lemon and damp chalk. Mouth: porridge, fizzy aspirin, a chalky sensation, and lemon juice. Perfect for a champion’s breakfast! Finish: fairly long, still very chalky, with a hint of acidity (again, lemon) and the porridge (with a splash) lingering in the aftertaste. Comments: it’s great fun to taste these whiskies without sherry or any other wine influence, especially as the bourbon barrel seems to have been rather lazy. Or tired. We’re close to the pure vibration of the distillate. SGP:451 - 86 points.",86,2025-01-22,https://www.whiskyfun.com/archivejanuary25-2-Caperdonich-Mortlach.html,1532c6d50d2d72b7a4563f16b2afaaa114aa659f354321c99916cdbbe416b816
"Mortlach 12 yo 2011/2023 (48.4%, Douglas Laing, Old Particular, refill hogshead, cask # DL 17756, 361 bottles)","Mortlach 12 yo 2011/2023 (48.4%, Douglas Laing, Old Particular, refill hogshead, cask # DL 17756, 361 bottles) Colour: pale white wine. Nose: apple juice, chalk, bread dough, lemon juice, porridge, and vanilla. I find it perfect, though it’s hardly surprising. Water isn’t necessary. Mouth: very good, perhaps not overly complex and slightly less fruity than expected, but this extremely chalky and lightly yeasty profile reminds us of great Champagnes, which is utterly delightful. White peaches then steal the show. Finish: the same. Comments: excellent class from this distillate, a perfect young Mortlach by DL, ideal to mix with sparkling water for a lovely ‘Champagne.’ Well, I suppose the Comité Interprofessionnel du Vin Champagne will have my head for this—I’d better stay away from Wine Paris in February. Just kidding, I’ll be in Andalusia hunting manzanilla añada anyway. SGP:551 - 88 points.",88,2025-01-22,https://www.whiskyfun.com/archivejanuary25-2-Caperdonich-Mortlach.html,e89885bfabf3a61e2390e74fb9540e3c7973de58a0451d7f41d5067f28cb1203
"Mortlach 15 yo 2008/2023 (52.4%, Whiskyjace, Art Edition No.6, oloroso hogshead)","Mortlach 15 yo 2008/2023 (52.4%, Whiskyjace, Art Edition No.6, oloroso hogshead) Much love for this label! As we’ve always said on Whiskyfun, ‘Art, not Ads!’ Colour: gold. Nose: everything here is about balance, perfectly poised between the sherry-soaked Mortlachs and those left entirely bare, as nature intended (what?). Lovely notes of walnuts, hay, and tobacco, joined by apples, plums, and that signature earthy, chalky side. Altogether, we’re 100% in the countryside. With water: moves more towards rustic farmhouse cider. Mouth (neat): rather lively and spicy, with a pleasant bitterness—those walnuts again, a demitasse spoonful of mustard sauce, leather, and then apples returning. The sherry-distillate balance is well maintained without straying into redcurrant territory. With water: water works beautifully; it’s an excellent swimmer, even though the sherry retains a bit of the upper hand. Finish: apples, tobacco, walnuts, and just a drop of mustard. Comments: absolutely superb. Oh, and they really should offer large-format prints of those labels—if the rights allow. SGP:551 - 87 points.",87,2025-01-22,https://www.whiskyfun.com/archivejanuary25-2-Caperdonich-Mortlach.html,502160831708150d7838fd98f93a5a427f75f642c86f484f9ee549a36141164d
"Mortlach 15 yo 2008/2023 (51.2%, The First Editions for HNWS Taiwan, oloroso quarter cask, cask #HL19853, 130 bottles)","Mortlach 15 yo 2008/2023 (51.2%, The First Editions for HNWS Taiwan, oloroso quarter cask, cask #HL19853, 130 bottles) Glad to be back in Taiwan. Colour: deep gold. Nose: this feels like a more modern Mortlach, with hints of new wood, cedar, and thuja, along with traces of glue, butterscotch, and then the expected old walnuts (no reference to any French politicians at this stage) and apples. With water: autumn leaves, mushrooms, and humus—all of this adding even more depth. It works perfectly. Mouth (neat): absolutely faultless. Earth, tobacco, dried fruits, apples, gentle spices, and walnuts, all underpinned by some assertive citrus notes that maintain the freshness of the profile. With water: massive waves of butterscotch! Typical of relatively new wood. Finish: long, with even more citrus, a touch of garam masala, and a faint Cognac-like note. Comments: what can I say, it’s clear this is no accident. Absolutely excellent—Mortlach really is a superb base. Long live the Wee Witchie! (still no connection to French politicians—well, maybe…). SGP:651 - 88 points.",88,2025-01-22,https://www.whiskyfun.com/archivejanuary25-2-Caperdonich-Mortlach.html,844d0807631cb7d479c3c7fc830acf17e0d03f4084b102574dee907ad9a914f1
"Mortlach 15 yo 2008/2024 (50.8%, The Whisky Cask, sherry)","Mortlach 15 yo 2008/2024 (50.8%, The Whisky Cask, sherry) Some rather old-school bottlings at The Whisky (or Rum) Cask, always very good as far as I can remember. Colour: amber. Nose: classic sherry—earthy, with walnuts, old apples, and butterscotch, followed by broom flowers and light notes of anise and liquorice. This is the first Mortlach we’re tasting today with a distinctly floral side. Of course, we love that. With water: much the same. Also bag of old walnuts, but also a hint of coal gas. Mouth (neat): a touch of gunpowder and quite prominent pepper at first, gradually giving way to leather and tobacco, with even slightly tangy and salty touches. Well then… With water: earth, truffles, tobacco, and artichokes. Finish: long, now firmly on cooked vegetables. Roasted aubergines, to be precise. Comments: a magical nose and a palate that’s perhaps less, let’s say, consensual. It takes all sorts to make a world. SGP:361 - 84 points.",84,2025-01-22,https://www.whiskyfun.com/archivejanuary25-2-Caperdonich-Mortlach.html,18c5d941b0174f20601c649f5420c51987f9c2e621916d79bb0ea1d8703741f4
"Mortlach 15 yo 1969 (56.3%, Gordon & MacPhail, Connoisseurs Choice, for Germany, 75cl, +/-1985)","Mortlach 15 yo 1969 (56.3%, Gordon & MacPhail, Connoisseurs Choice, for Germany, 75cl, +/-1985) Old Banner Label, as we used to call it. Connoisseurs Choice at cask strength was very rare back then and has since become much less so. That said—sugar! Mortlach stopped using its own floor maltings in 1968. Just one year off; talk about bad luck... Colour: gold. Nose: the upper echelons, as they say. Remarkably, it’s striking how much it reminds me of the glorious 32-year-old 1971 official bottling from 2004. An interstellar level of fruitiness, with baked fruits (always apple, plus honeyed mirabelle and Sauternes—pretty much the same thing), along with chutneys and jams. Fig jam, in particular, stands out prominently. With water: this must have been malted at Ord—you can genuinely smell it (honestly!). Notes of olive oil, heaps of pollen, and beeswax. Mouth (neat): exceptionally firm, fruity, and liquorice-laden. Liquorice is a common whisky flavour, but here, it’s a true diamond. Tons of various honeys, waxes, and forgotten liqueurs… With water: the texture is unbelievable—you almost need a little spoon to scoop it out of the glass. I’m only slightly exaggerating. In short, it’s oily and fruity—almost like those intensely fruity olive oils that are so trendy these days. Finish: not overly long, but long enough—you get the idea. Honey, olive oil, ripe apples, and oranges lingering in the aftertaste. Comments: what a bottle! SGP:651 - 93 points.",93,2025-01-22,https://www.whiskyfun.com/archivejanuary25-2-Caperdonich-Mortlach.html,8be8463a49dfdd3c448b1f89b8810f3cf88dd1afd2e62080c5d827defffa9c02
"Ninkasi 2018/2024 ‘LAB 007’ (51.8%, OB, France, Tokay de Hongrie, cask #101, 162 bottles)","Ninkasi 2018/2024 ‘LAB 007’ (51.8%, OB, France, Tokay de Hongrie, cask #101, 162 bottles) We are near Lyon, in Tarare, where this young whisky was fully matured in Tokay casks, therefore in sweet wine wood. They are now also experimenting with vacuum distillation, a technique that seems to be attracting more and more interest, but this whisky appears to have been distilled in Charentais alembic stills. We had enjoyed LAB 005 two years ago (WF 85). Colour: full copper. Nose: the Tokay is intensely present and even dominant, bringing to mind the universe of an ultra-fortified sweet wine. The good news is that the malt feels light and allows itself to blend in without resistance. Notes of toasted bread, butterscotch, overripe peaches, glue, and beeswax polish. With water: little changes, though faint hints of an old wine cellar emerge. Mouth (neat): somewhat ‘premix’, with the bitterness of European oak (Hungarian?) and slightly muscat-like, sweet notes of Tokay. It’s very distinctive. With water: it leans towards bitters, mustard, Greek-style pickled mushrooms, bitter beer, old walnuts, and amontillado. Finish: fairly long, prolonging the palate. Comments: some elements are reminiscent of BM. Very difficult to score—I feel LAB 005 was more approachable. Take this with a grain of salt. SGP:461 - 82 points.",82,2025-01-20,https://www.whiskyfun.com/archivejanuary25-2-Caperdonich-Mortlach.html,9065d3bc7e66f2bdeda0ec02fa0695b5faf4e1e75c9259e18c35943bebeab212
"Sherishòr 12 yo (54%, OB, Spain, ‘pure malt whisky’, 1400 bottles, +/-2024)","Sherishòr 12 yo (54%, OB, Spain, ‘pure malt whisky’, 1400 bottles, +/-2024) This is actually 3-year-old ex-bourbon Scottish malt, further matured for 9 years in Andalusia in genuine bodega oloroso sherry casks, some 50 years old. These are real solera butts, not the bespoke seasoned casks that almost everyone else uses. We had already tasted a 45% ABV version, which we liked immensely (WF 87). Colour: amber. Nose: exactly as expected, meaning absolutely brimming with roasted nuts, plump raisins, and dates coated in dark and milk chocolate. Then a touch of Mon Chéri (if I may). With water: more elegant, with English pipe tobaccos, black teas, and mocha. Mouth (neat): quite a lot of oak, suggesting these butts weren’t all that ancient, but the oloroso character is full-on. Bags of dark chocolate, old walnuts, black pepper, cloves, and pipe tobacco. It’s almost like a Jerez brandy, though without the sweetness of 99% of them. With water: it remains dry and perhaps a touch rough due to massive spices—plenty of pepper. Finish: long and very spicy. 90% dark chocolate and heavily roasted coffee beans. Comments: I wouldn’t say it’s ‘better’ than the 45% ABV version; in fact, it feels drier, but it’s still excellent. A true journey to Jerez, straight from your glass. SGP:561 - 87 points.",87,2025-01-20,https://www.whiskyfun.com/archivejanuary25-2-Caperdonich-Mortlach.html,e87f3921ceb7ec2272feb075057e47a37b0fd800cc8da84110dd8651a8e029e1
