whisky_name_raw,review_text,score,review_date,source_url,dedupe_hash
"Caol Ila 12 yo 2006/2018 (51.8%, The Whisky Mercenary, bourbon barrel)","Caol Ila 12 yo 2006/2018 (51.8%, The Whisky Mercenary, bourbon barrel) No worries, the very distinguished bottler is actually much more engaging and civilised than he looks on the labels ;-). No bandido and no hell’s angel, mind you. Colour: white wine. Nose: tense, precise, lemony, a touch syrupy, getting a little rootier, almost on mezcal and gentian. That’s the way if you ask me. With water: there, brake fluid, and engine oil for your old boat. Mouth (neat): this is immensely prefect, ueber-clean, wonderfully sweet, on peat smoke and fish oils, kippers, smoked salmon, and then citrons and tangerines that would make it pleasantly sweet indeed. Very very good and exactly what any proper malt aficionado should expect from some young yet mature Caol Ila. With water: same. Finish: rather long and rather more on smoked fish and tangerines. Let’s try that next time we’re doing some cooking (like, around 2027). More pepper in the aftertaste. Comments: young Caol Ila, unless shamelessly botoxed (yeah, finished), will always bring us a lot of joy. SGP:457 - 89 points.",89,2020-01-23,https://www.whiskyfun.com/archivejanuary20-2-Caol-Ila-Springbank.html,e08b11528300be22dbb672e3dda8820baca68babcb0d9559bbbab97dcbddb20b
"Caol Ila 2000/2019 (52.7%, Malts of Scotland, sherry hogshead, cask #MoS 19012, 220 bottles)","Caol Ila 2000/2019 (52.7%, Malts of Scotland, sherry hogshead, cask #MoS 19012, 220 bottles) Colour: gold. Nose: there, fish oils, nut oils, butter cream, fresh walnuts, seaweed, old papers (say Newsweek) and Vicks Vaporub. No big sherry on the way, let’s dance! (what-a-at? Do we have to? ) With water: that famous old fisherman’s boat, dunnage warehouse, old ropes, musty old wine cellar, old jacket, wet dogs (you’ll get medals eventually, dogs)… Mouth (neat): this is excellent. A feeling of cigarette smoke, rather a lot of menthol, leather, marmalade, salt… All that works extremely well, even if it’s a little hot. Or tabasco-y, as they would say at Netflix’s (I’m sure no one will get that joke). With water: perfect. Great smoky and slightly honeyed marmalade. Finish: long, more on citrus, which always works. Comments: the opposite of some stuffy sherry. Rather superb, MR. Malts Of Scotland. SGP:457 - 90 points.",90,2020-01-23,https://www.whiskyfun.com/archivejanuary20-2-Caol-Ila-Springbank.html,127f51e6d3c468c3455c5a9ce869e881fcaf26703e9483c96bfda1a9a9ece3e9
"Caol Ila 14 yo 2005/2019 (54.5%, Gordon & MacPhail, Connoisseurs Choice for 20th Anniversary of The Whisky Exchange, refill sherry hogshead, cask #19/51, 142 bottles)","Caol Ila 14 yo 2005/2019 (54.5%, Gordon & MacPhail, Connoisseurs Choice for 20th Anniversary of The Whisky Exchange, refill sherry hogshead, cask #19/51, 142 bottles) It’s refill, so we should be safe, but only 142 skittles from a hogshead? Colour: light gold. Nose: sharp, tense, mineral, coastal, medicinal, and not raisiny. Nice dough too, baker’s yeast, ale… With water: fumes, cigar smoke, leather, old copper kettle, chestnuts, ink… Mouth (neat): yeah, super good, even if some raisins are peeping around the corner this time. Some black olives too, which came unexpected. With water: marmalade and lapsang souchong, plus seawater and kippers. That’s both five O’clock tea and dinner sorted. Finish: long more leathery and saltier. Brine and sour teas in the aftertaste. A drop of wine vinegar, perhaps, olives for sure. Comments: as soon as olives show up, I’m in heaven. Well, more or less. SGP:367 - 90 points.",90,2020-01-23,https://www.whiskyfun.com/archivejanuary20-2-Caol-Ila-Springbank.html,97936f6bfe4ae5de4a25c53acace5f2899ae12a4868048ef58477bd1c2f5c2df
"Caol Ila 11 yo 2008/2019 ‘Reserve Cask’ (48%, Elixir Distillers, Single Malts of Scotland, hogsheads)","Caol Ila 11 yo 2008/2019 ‘Reserve Cask’ (48%, Elixir Distillers, Single Malts of Scotland, hogsheads) Let’s be very careful, this might go down a little too fast. Colour: very white white wine. Nose: it’s a little small, narrow, and elementary. Nice smoke, fumes, concrete, paraffin, polishes and bread doughs, but other than that, it is a little shy. But it may not be a nosing whisky, let’s see… Mouth: does what you were expecting. Smoke, lemons, brine, ashes, fish oil. Mind you, I love very vertical whiskies, but this might be a little too austere. Cuts you in halves, as they say in Japan (are you really sure, S.?) Finish: very long and very smoky and ashy. Ashes belong to Caol Ila, for sure. Peppery aftertaste.. Comments: super mega hyper-good, but perhaps a we tad too basic this time. SGP: 357- 84 points.",84,2020-01-23,https://www.whiskyfun.com/archivejanuary20-2-Caol-Ila-Springbank.html,bc6796df5263f638d91723bb8ba6d5f61b6894a9b9188f50a625a1d595da6d35
"Caol Ila 15 yo 2003/2019 (55.9%, La Maison du Whisky, Artist #9, hogshead, cask #302464, 290 bottles)","Caol Ila 15 yo 2003/2019 (55.9%, La Maison du Whisky, Artist #9, hogshead, cask #302464, 290 bottles) I think it’s good that those great people at LMdW would underline the fact that this is ‘peaty’. You never know what people think in Paris… Colour: white wine. Nose: fresh butter and fresh smoke for a start, then all things breads and pastries (including, oui, croissants au beurre). Sharp seawater and ashes, smokes, rocks, cough drops, menthol… No quibbles and no need to go on strike. Yeah I’m trying to do it ‘Paris’. With water: more mineral. Chalk and fresh bread. Mouth (neat): amazing lemons. Indeed it’s all on smoked lemons and limestone. In other words, a Pouilly-Fumé of the whisky world. With water: same. Hints of cucumber – really. Finish: long and perfect, fresh and moreish (which is always very dangerous). Comments: pristine CI. What a distillate! SGP:466 - 90 points.",90,2020-01-23,https://www.whiskyfun.com/archivejanuary20-2-Caol-Ila-Springbank.html,a01986055932eeab0c455804a57da4ce81fda59417a850f827e3ec18fad1e8ff
"Caol Ila 16 yo 1969 (40%, Gordon & MacPhail, Connoisseurs Choice, old brown label, +/-1985)","Caol Ila 16 yo 1969 (40%, Gordon & MacPhail, Connoisseurs Choice, old brown label, +/-1985) All right, this is ‘old’ Cao Ila from the old distillery, before it was reconstructed and expanded in the early 1970s (from two to six stills). We’ve had a similar 1969 at 40% vol. for Intertrade that had been utterly stunning, but that was in 2007 (WF 95). Colour: gold. Nose: sweet mother of Vishnu! Old Caol Ila might have been the very best whisky from Islay, it was extremely subtle, it had some kind of resinous smokiness that disappeared later on, with notes of natural rubber and castor oil that cannot not remind us of an old Bugatti. Yeah works with Austins too. It’s very specific, unlike any other peater, and just magnificent. There. Oh and I just adore tangerines. Mouth: total fabulousness. It was a little less smoky than newer distillates, and maybe Is that why old whisky writers used to claim that Caol Ila was ‘a softer Islay’. A statement that everyone’s been propagating since back then, and that’s become totally wrong since… 1972 or 1973. Well, my opinion. Anyway, this has tangerines, salty smokes, kippers, and soft natural rubbers, a profile that’s just unstoppable if you ask me. Tarmac as well, old Caol Ila is also very tarmac indeed. Finish: a little short, perhaps, but boy does it deliver. Exceptional smoked herbal teas, citrus peel, with touches of mangos, and indeed anything reminiscent of tarmac. Comments: could be that I got a little over-excited in 2007, but what’s sure is that this is pretty stunning, even if these old bottles at 40% may now be starting to lose steam… Emphasis on ‘may’. SGP:455 - 93 points.",93,2020-01-23,https://www.whiskyfun.com/archivejanuary20-2-Caol-Ila-Springbank.html,faf541329de6ea3ed8c858fd5153ec3ead1a91a0d9e92e9872442a4b3c25481d
"Caol Ila 25 yo 1975/2000 (46%, The Prestonfield, cask #466, 320 bottles)","Caol Ila 25 yo 1975/2000 (46%, The Prestonfield, cask #466, 320 bottles) A series by Signatory Vintage, as you surely know. Not sure it’s fair to have this baby after the otherworldly 1969, but there, we ought to keep the momentum… Colour: straw. Nose: it’s very delicate, and rather on white Graves (or Pessac-Léognan) and hand cream, crushed anchovies, rhubarb juice, ripe gooseberries, a little brine… It really is very different from the 1969, but I would add it’s rather… softer. Rhetoric and practice… Mouth: no, this is rather huge. Not hugely peaty, but extremely citrusy, with literally lorryloads of lemons and grapefruits, then more minimal notes of smoked fish, seashells, and our beloved crushed anchovies and sardines. Samphires too. Not sure anyone could do more coastal, I suppose this was matured at the distillery. Not too sure… Finish: rather long extremely blade-y, salty, lemony, but with these wee feeling of soapy hand cream again – already found it in the nose. Comments: I don’t know if they cranked-up the peatiness later on, what’s sure is that styles are completely different on both sides of the rebuilding. What did they lose after the reopening? Any ides? Tarmac, I would say! SGP:555 - 91 points.",91,2020-01-23,https://www.whiskyfun.com/archivejanuary20-2-Caol-Ila-Springbank.html,5c1335315064d137ea82b3dbcb5d58c7ee6d8d6cdd085775f8f1ddaf32bedfef
"Caol Ila 1991/2008 (54.8%, Scotch Single Malt Circle, bourbon, cask #8195, 270 bottles)","Caol Ila 1991/2008 (54.8%, Scotch Single Malt Circle, bourbon, cask #8195, 270 bottles) Colour: white wine. Nose: the modern style was already there, with more flints, chalk, lemons, some notes of gentian (Suze), some grassy smoke, and something more medicinal. Mercurochrome. With water: more green apples, rough ales, and bandages. This was clearly medicinal. Mouth (neat): seawater blended with limoncello, and just a touch of varnish. The smoke got more aggressive, having said that, which may suggest that CI got frankly peatier around the year 1990. Just like Bowmore, you’re right. With water: grapefruits and almonds, plus a very wee soapiness. Not something that never happens with Caol Ila. Finish: long and very salty. This one would even leave some salt on your lips, mind you! Comments: lots happening in this intermediary Caol Ila. The grassy saltiness – or salty grassiness – was rather impressive. SGP:366 - 88 points.",88,2020-01-23,https://www.whiskyfun.com/archivejanuary20-2-Caol-Ila-Springbank.html,3b7fa3ab88c8f24f84d045c970236278d8f3b01de18b9dbaf2e02d50cc009cae
"Islay 11 yo 2008/2019 (53.1%, Liquor Library)","Islay 11 yo 2008/2019 (53.1%, Liquor Library) Some whisperings from outer space suggested this would be Caol Ila. Colour: gold. Nose: it’s got all the coastal elements for sure (crabs, seawater, oysters) but it’s also got a thin layer of chocolate, beyond the litres of mercurochrome and anything iodine-y that are invading it after just ten seconds. Also a lot of massage balm, the kind that makes you cold (mint) rather than the one that makes you warm (pepper). Oh forget… With water: sour juices, seawater, oyster juice, grapefruit juice, older kelp on a beach, and quite a lot of mercurochrome yet again. Mouth (neat): it’s a very slightly fatter one, with a touch more green pepper as well, all the rest is classic coastal CI, ridden with oysters, menthol, grapefruits and, of course, smoked kippers. Some early official C/S spring to my mind. With water: did anyone ever try to smoke grapefruits and pineapples? I mean, together? Finish: long, with many brines. Caper brine, olives… Comments: as I said we’ve known some young CIs that have been even zestier and more vertical, but this marginally fatter (oak oils) one was very brilliant too. Cheers Australia, good that the fires seem to be more under control (at time of tasting). SGP:466 - 87 points.",87,2020-01-21,https://www.whiskyfun.com/archivejanuary20-2-Caol-Ila-Springbank.html,551945c4036c826e14b3b6f970c253713b97be53edabbb57bc53705c15f25c4b
"Caol Ila 12 yo (59.3%, Single Cask Nation, bourbon hogshead, cask #510, 2019)","Caol Ila 12 yo (59.3%, Single Cask Nation, bourbon hogshead, cask #510, 2019) Could well be a 2007 (well done, S.) Colour: Nose: white wine. olives, Woolite, washing powder, chalk and seawater upfront. Nothing bad to say this far. With water: gets extremely chalky. Green lemons and chalk, this would make the driest sauvignon blanc nose like young PX in comparison. Mouth (neat): exactly Caol Ila, with a little more pink grapefruit and fresh almonds, and a little less mercurochrome. But it burns a bit… With water: it’s not that it would go into subtleties, but there’s always something very satisfying with very pure spirits such as this wee CI. Menthol, lemon juice, sauvignon blanc indeed, seawater, and of course, kippers. Finish: long, sharp blade-y. The fact that there may be hundreds of thousands of similar casks won’t change anything. Comments: as I just said. SGP:366 - 88 points.",88,2020-01-21,https://www.whiskyfun.com/archivejanuary20-2-Caol-Ila-Springbank.html,c855e473cc46c149a41f1336093fc8085b01039ed057b602fc6048d9ec99971c
"Caol Ila 9 yo 2009/2019 (51.8%, North Star Spirits, PX finish, 378 bottles)","Caol Ila 9 yo 2009/2019 (51.8%, North Star Spirits, PX finish, 378 bottles) Okay, I utterly love North Star Spirits and what they do (after all they’ve shipped the latest DB11 to me last year - as a gift) but a peater that’s been PX-ed is usually extremely dissonant in my book. You know, pineapple on pizza, bacon bourbon and so on. Let’s see… Colour: straw. Nose: well, we’re more than okay, the cask was not a wham-bam first-fill PX-seasoned ‘thing’, and the Caol-Ilaness survived. Let’s say it's a slightly sweetened young CI. With water: it’s funny that the PX made this very young CI more farmyardy, but that’s actually not unseen. I’m not sure anyone could actually fine-tune PX, I rather believe it’s all more or less left to chance, usually. Mouth (neat): indeed we are okay. Some spices here and there, a handful of (rather unnecessary) raisins, and a fine CI altogether. With water: hold on, this works much better now. Seriously, this is good, cleaner, and even pretty dry. Lovely lemons coming out – and say adios to those filthy raisins! Finish: rather long, with good control of the Pedro. Lemons definitely save it in the aftertaste. Comments: In my book, PX is always a rather huge handicap (including at Glendro or at Kavalan), but the lovely young distillate handled the task just fine this time. Now I’m sure discerned PXionados will love it. SGP:556 - 84 points.",84,2020-01-21,https://www.whiskyfun.com/archivejanuary20-2-Caol-Ila-Springbank.html,1383e1e5dcd900a9b8411a7212721c991b5cf3af32cc67a33069c9d3acddaa16
"Caol Ila 12 yo 2006/2018 (51.6%, The Whisky Fair, bourbon hogshead, 322 bottles)","Caol Ila 12 yo 2006/2018 (51.6%, The Whisky Fair, bourbon hogshead, 322 bottles) Another Limburgian bottling that I have not tried yet. Mea Culpa. Colour: white wine. Nose: this one’s more on the raw ingredients, barley, porridge, grist, yeast, then seaweed, lemons, and just fish. I’m wondering if we couldn’t quaff this on sushi… With water: utterly perfect. This is what you wanna get from your whisky: a feeling of the ingredients (I think – as long as that’s not PX, ha). Jesus bleibet meine Freude! Mouth (neat): immaculate young CI. Limoncello (so sweeter lemons), oysters, bitter almonds, white pepper, angelica, green apples… This is pristine and perfect. With water: even more perfect. Finish: long and perfect, extremely well balanced, fresh… This is the kind of malt that would go well with some foods. Like kippers or bouillabaisse, just randomly. Yeah or sushi. Comments: this one was immaculate. SGP:466 - 90 points.",90,2020-01-21,https://www.whiskyfun.com/archivejanuary20-2-Caol-Ila-Springbank.html,c980ff8c6d3950cd70a1dea6b0fdd62c75bab64a20ee566b0256643114af0748
"Caol Ila 2010/2018 (58.3%, Or Sileis, Legends, oloroso hogshead, cask #HL16888, 292 bottles)","Caol Ila 2010/2018 (58.3%, Or Sileis, Legends, oloroso hogshead, cask #HL16888, 292 bottles) Looks like this was bottled by Hunter Laing for our Taiwanese friends. Colour: light gold. Nose: What’ sure is that there’s more oloroso in Jerez, Montilla-Morilles, Huelva or Malaga. Indeed this is pretty fresh and coastal, perhaps a little more citrus-driven than others, and a tad hot perhaps. Hints of flints and graphite. With water: some grass smoke, grist, floor cloth, new fabric and quite a lot of paraffin. Mouth (neat): good and fresh, salty and lemony, with just a few sourer notes, probably from the wine. Like sour cherries. Let’s say it again, I don’t think anything ‘sherry’ is really necessary with Caol Ila. With water: very good, but perhaps not as pristine as most ex-bourbon CIs. Finish: rather long, rather chalkier. Smoked and salted salmon plus lemon in the aftertaste. Comments: very good, no quibbling here, it’s just that the 2006 was really very special. SGP:456 - 86 points.",86,2020-01-21,https://www.whiskyfun.com/archivejanuary20-2-Caol-Ila-Springbank.html,74aa6253d99bd6f6fb093b87500c3bf7eed1df6fe2514173bc713708c212bf99
"Caol Ila 9 yo 2009/2019 (58.7%, Elixir Distillers ‘Magic Of The Cask’, cask #316103, refill Gonzalez Byass sherry, 308 bottles)","Caol Ila 9 yo 2009/2019 (58.7%, Elixir Distillers ‘Magic Of The Cask’, cask #316103, refill Gonzalez Byass sherry, 308 bottles) OK, another try at heavy-ish sherry. But I had thought Dalmore was getting all casks from Gonzalez Byass’s… Colour: gold. Nose: wool, butter cream, butterscotch, lemons, marzipan, praline and furniture polish. This is certainly not your average Caol Ila, looks like its coastalness has been toned down a wee bit. With water: reminds me of these pretty sour white beers they have in Germany. Lemon, yeasts, seawater, dough… Looks like the wine got almost annihilated now. Mouth (neat): balance has been found. Some metal polish, lemons, kippers, salty fudge, and a little smoked ham like they have at our neighbours in the Black Forrest. With water: was it fino? Green walnuts, touches of dry cider, chalk, kippers… Where are the raisins? Not that we’ll complain, mind you. Finish: rather long, very salty. It’s almost a little margarita-y at times, but it isn’t void of any fatness. Comments: balance was right. Like 99% distillate, 1% sherry. Almost, ha. SGP:456 - 88 points.",88,2020-01-21,https://www.whiskyfun.com/archivejanuary20-2-Caol-Ila-Springbank.html,6dfdff5232e3b394c363f975928bbc17d130f65bcbac7ecfd2b6ad7920a8ffcd
"Caol Ila 9 yo 2009/2019 (46%, James Eadie, 1100 bottles)","Caol Ila 9 yo 2009/2019 (46%, James Eadie, 1100 bottles) This baby from three casks, so supposedly better than the sum of its parts. Colour: white wine. Nose: perfect grapefruit juice, kelp, oysters, touch of vanilla, fresh almonds and chalk. Mouth: very lovely. Salty lemon juice, margarita, a drop of Cointreau (no we don’t do product placement), seawater, pink grapefruits and other softer citrus, a touch of cider. Finish: sweet peat, as some sometimes say. Comments: some very well-carved young CI at a perfect drinking strength. A tad simple, naturally, but very very very very very, and I mean very good. SGP:456 - 87 points.",87,2020-01-21,https://www.whiskyfun.com/archivejanuary20-2-Caol-Ila-Springbank.html,3702d2adcf9cf02936af5ec930511422461ce4a89ca784a2079b9456a5747c90
"Amrut ‘Amaze II’ (50%, OB for Single Malt Amateurs Club India, 240 bottles, 2019)","Amrut ‘Amaze II’ (50%, OB for Single Malt Amateurs Club India, 240 bottles, 2019) There was an earlier Amaze for S.M.A.C. in 2018, which had been excellent (WF 89). Colour: amber gold. Nose: when ripe mangos meet some light caramel and some perfect milk chocolate, as well as some nougat, orange blossom water, and just earl grey tea. The thing is, there are also tiny floral touches emerging, especially wisteria, as well a wee cologne-y side, but naturally, that’s high-class cologne made by a proper perfumer. With water: Amrut has often displays small notes of fine bourbon in the background, in my opinion, and that’s the case here. Old Fitzgerald! Mouth (neat): grand! Caraway, violets, blood oranges, tamarind, manuka honey, and just wee touches of cloves and turmeric from the oak. With water: what’s really cool is that it does kind of taste of India, or rather soft Indian spices, some kind of creamy sauce, perhaps even roasted cashews… But careful, sometimes you shouldn’t quite trust your brain. Anyway, this is absolutely excellent. Did we mention caraway? Aniseed? Finish: medium, rather on stewed tropical fruits and the same soft spices. I should ask an Indian chef about those spices, it’s all rather complex. Comments: I hope they’re all very proud. Beyond the fact that it’s great whisky, it’s the Indianness that I find rather extraordinary, in all senses of that word. And that’s not just your brain playing tricks on you. SGP:651 - 90 points.",90,2020-01-21,https://www.whiskyfun.com/archivejanuary20-2-Caol-Ila-Springbank.html,8354b8604249a5444b549d4d211a77a602e399b055cb3ca7a8e84034fb3dca20
"Paul John (OB, for Single Malt Amateurs Club India, cask #6028)","Paul John (OB, for Single Malt Amateurs Club India, cask #6028) We haven't got any picture or the bottle yet so we've put a portrait of a very fine Indian gentleman who happens to know a lot about whisky instead. Colour: straw. Nose: whether some Indian peat does make sense or not doesn’t matter, after all they serve poppadums in Inverness, don’t they. What’s particularly fine here is the way that peatiness mingles with all the tropical fruits and the green curry-like notes. Granted, this is not Laphroaig 1967, but I find no dissonances, it’s just not very coastal. Forget about kelp and oysters. So let’s say some soft-smoked curry with baked bananas and papayas. Mouth (neat): this is stranger. A little sour, with a bittersweet feeling, some mint, whacky guavas perhaps, paper, and really a lot of tarragon. That’s very uncommon, we may need a reset ;-). Finish: rather long, with notes of smoked wood that remind us of some cachaças. It’s as if this was matured in some different wood, eucalyptus or else. Must be the peat. Comments: loved the nose, the palate’s maybe not really for my, well, my very Middle-european palate. It’s also true that it was in a death seat after the fantastic Amrut. SGP:553 - 80 points.",80,2020-01-21,https://www.whiskyfun.com/archivejanuary20-2-Caol-Ila-Springbank.html,fdb19422303942109024be4f1f3a6cd84336be541a996cf5acf704a5dbe4842f
"Paul John ‘Brilliance’ (46%, OB, India, 2018)","Paul John ‘Brilliance’ (46%, OB, India, 2018) Colour: gold. Nose: there, tarte tatin, mango jam, mirabelles, apricot pie, light honey, maple syrup, and indeed a little eucalyptus once again. Do eucalyptus trees grow around Goa? Mouth: perfect, perhaps a tad uncomplicated, but indeed, perfectly on pies and stewed fruits, mirabelles and apricots again, vanilla cream, and a little custard. Some mangos too, but I wouldn’t call this very fine baby Mr. Mango. Finish: medium, clean, fruity, easy, pretty sweet. Notes of pineapples, cinnamon pies... Comments: a rather sweeter malt whisky, well made and not too complicated. You have to like them sweet. SGP:641 - 82 points.",82,2020-01-21,https://www.whiskyfun.com/archivejanuary20-2-Caol-Ila-Springbank.html,274a4b4dec325c07de49bfb5a5934628310b93621dd55d672140ed1aa0947b98
"Amrut 2011/2016 (56.5%, OB, India, for Hot Malt Taiwan, PX, cask #4122, 624 bottles)","Amrut 2011/2016 (56.5%, OB, India, for Hot Malt Taiwan, PX, cask #4122, 624 bottles) Colour: red amber, copper. Nose: quite a lot of rubber, used matches, pomegranates, cherry jam, more pomegranates, grenadine, and ‘love apples’ (toffee apples). The PX is actually huge here, as if it was some cocktail. Not un-nice, having said that. With water: less sulphur, and huge bags of sultanas. This one may have altered the prices of sultanas in the whole world. Mouth (neat): more uebefortified PX than PX-ed malt. Ultra-sweet, ultra-raisiny, and simply very spectacular. With water: it is PX. Finish: long, extremely sweet and raisiny, with a leafier aftertaste. Comments: da PX bomb. Not quite for me, but I’d understand why some friends would fall in love with it. SGP:841 - 78 points.",78,2020-01-21,https://www.whiskyfun.com/archivejanuary20-2-Caol-Ila-Springbank.html,65369266cbda5ecbd01b8c73d95dce2d5afd5fb0d15fb69a3a66a008d42a613a
"Amrut 2012/2018 ‘Chronicles’ (60%, OB, India, for La Maison du Whisky, bourbon, 660 bottles)","Amrut 2012/2018 ‘Chronicles’ (60%, OB, India, for La Maison du Whisky, bourbon, 660 bottles) Colour: amber. Nose: there, a feeling of chic bourbon (chic bourbon?) and pine wood, ink, carbon paper lapsang souchong, vanilla, then violets, white chocolate, mangos, tarte tatin and Ovaltine. All that works in sync, I find this beautiful. With water: fab. Cedar shavings, eucalyptus, earth, mushrooms, guavas, menthol… What a cask! Dr. Swan’s work? Mouth (neat): it’s very ‘Asian’, which is very positive in my words. You could put this into the same cluster as that of the best ex-bourbon Kavalans and Chichibus, if you see what I mean. Not talking about the wined follies here. With water: millimetric, perfect. Again, what a cask! Mangos, menthol, lemongrass, cedar… Finish: long, very fresh. Impressive. Comments: sure the cask did most of the job here, but what a cask! The very best of modern ‘wood technology’, shall we say. SGP:641 - 89 points.",89,2020-01-21,https://www.whiskyfun.com/archivejanuary20-2-Caol-Ila-Springbank.html,a563efc902257e2c90766b8b959dd1eac91f38c0de853f7275f2ff4746f98aaf
